section,source,title,summary,link,published_at
Geopolitics,The Diplomat,Pakistan Ups the Ante on Indus Water Dispute With India,"There is growing eagerness in Pakistan to involve China, the other upper riparian country, more directly in the issue.",https://thediplomat.com/2026/07/pakistan-ups-the-ante-on-indus-water-dispute-with-india/,"07 Jul 2026, 17:45"
Geopolitics,The Diplomat,China’s Pacific SLBM Test Signals a New Phase in Undersea Nuclear Competition,"The test, likely involving the JL-3 and coming just after the United States’ 250th Independence Day, underscored China's increasingly credible sea-based nuclear deterrent.",https://thediplomat.com/2026/07/chinas-pacific-slbm-test-signals-a-new-phase-in-undersea-nuclear-competition/,"07 Jul 2026, 21:07"
Strategic Signals,The Diplomat,Indonesia and Singapore Pledge That Malacca Strait Will Remain ‘Open to All’,The affirmations come after an Indonesian minister raised the idea of imposing a levy on vessels passing through the vital chokepoint.,https://thediplomat.com/2026/07/indonesia-and-singapore-pledge-that-malacca-strait-will-remain-open-to-all/,"07 Jul 2026, 13:45"
Geopolitics,War on the Rocks,"The Davis Wing, the B-24 Liberator, and the Self-Made Bet That Paid Off","The most produced American military aircraft of World War II was not a small fighter, a trainer, or a simple utility airplane — it was a complex four-engine heavy bomber called the B-24 Liberator. Over the course of five years, American industry produced a staggering 18,482 of these bombers, and the",https://warontherocks.com/cogs-of-war/the-davis-wing-the-b-24-liberator-and-the-self-made-bet-that-paid-off/,"08 Jul 2026, 08:00"
Energy & Infrastructure,War on the Rocks,Somali Pirates Are Back — But the Coalition That Beat Them Isn’t Coming,"Numerous recent pirate attacks, especially the hijacking of three merchant vessels off the Horn of Africa, are a stark reminder that the conditions for resurgence can return quickly.It took years of sustained, coordinated effort by multinational naval coalitions, the shipping industry, and internati",https://warontherocks.com/somali-pirates-are-back-but-the-coalition-that-beat-them-isnt-coming/,"08 Jul 2026, 07:30"
Energy & Infrastructure,War on the Rocks,Gathering Clouds: Building Digital Strategic Depth in the Compute Age,"The wars in Ukraine and the Middle East have exposed a strategic reality that military planners are only beginning to confront: In a data-centric age, digital infrastructure has become part of the battlespace. Data centers and cloud regions are now the digital backbone of military power and economic",https://warontherocks.com/cogs-of-war/gathering-clouds-building-digital-strategic-depth-in-the-compute-age/,"07 Jul 2026, 08:00"
Geopolitics,War on the Rocks,Sinews of War at Sea: The Armed Services Need a Common Watercraft Family,"To sustain future maritime operations, the U.S military will need to run supplies through an environment that spans thousands of miles of open ocean, denied ports, contested straits, and archipelagic chokepoints against adversaries that have spent decades studying how to target American logistics. T",https://warontherocks.com/sinews-of-war-at-sea-the-armed-services-need-a-common-watercraft-family/,"07 Jul 2026, 07:30"
Geopolitics,War on the Rocks,Ukrainian Writers Take Aim at Government Narratives,"Welcome to The Ukraine Compass, a weekly digest of Ukrainian commentary and analysis from across the political spectrum only for War on the Rocks members. Each Monday, we bring you a curated selection of articles from Ukrainian media offering insight into how Ukrainians themselves debate the issues ",https://warontherocks.com/ukrainian-writers-take-aim-at-government-narratives/,"06 Jul 2026, 16:35"
Strategic Signals,War on the Rocks,A Catholic Security Scholar’s Case for Responsible Military AI,What do you do when two identities that make up your deepest self find themselves on opposite sides of a moral and spiritual battlefield?I am Catholic. I have been one for over 20 years since I made the life-altering decision to join a friend for Mass one day. My faith became a spiritual and ethical,https://warontherocks.com/a-catholic-security-scholars-case-for-responsible-military-ai/,"06 Jul 2026, 07:30"
Strategic Signals,War on the Rocks,"Happy 250th Birthday, America!","Editor’s Note: Few rivalries in American history have been as consequential — or as personal — as the one between John Adams and Thomas Jefferson. The two men could hardly have been more different. Adams, the stocky and combative Massachusetts lawyer, was blunt to a fault and quick to suspicion. Jef",https://warontherocks.com/happy-250th-birthday-america/,"04 Jul 2026, 07:30"
Geopolitics,War on the Rocks,The Integrated Circuit and the Future of American AI Leadership,"Editor’s note: This is the first article in a limited series celebrating American defense technologies born from wartime and their effects on broader national security, politics, and society. This series will run for several weeks to commemorate America’s 250th anniversary, and winners will be selec",https://warontherocks.com/cogs-of-war/the-integrated-circuit-and-the-future-of-ai-leadership/,"03 Jul 2026, 08:00"
Policy & Regulation,CSIS,The Bio-Pharma Industry and Society,"The Bio-Pharma Industry and Society Listing Summary Please join the CSIS Global Health Policy Center on March 17, from 10:00am – 11:30am, for an exploration of how private bio-pharmaceutical firms can better support the critically important societal goals of improved affordability, access, quality, ",https://www.csis.org/events/bio-pharma-industry-and-society,"03 Mar 2016, 20:36"
Policy & Regulation,CSIS,The FY2017 Defense Budget and Strategic Outlook,"The FY2017 Defense Budget and Strategic Outlook Listing Summary Please join the CSIS International Security Program for a half-day Defense360 conference on the recently released FY2017 defense budget request and strategic priorities. Drupal Admin Mon, 02/29/2016 - 13:48 Featured Image Image Contribu",https://www.csis.org/events/fy2017-defense-budget-and-strategic-outlook,"29 Feb 2016, 18:48"
Policy & Regulation,CSIS,2016 U.S.-Japan Security Seminar,"2016 U.S.-Japan Security Seminar Listing Summary Michael J. Green interviews JIIA President Yoshiji Nogami Drupal Admin Fri, 02/26/2016 - 12:54 Featured Image Image Contributors Michael J. Green Programs & Projects Japan Chair Parent Geopolitics and Foreign Policy Featured Image AdobeStock_179685887",https://www.csis.org/events/2016-us-japan-security-seminar,"26 Feb 2016, 17:54"
Energy & Infrastructure,CSIS,The Future of the Grid—A View from ARPA-E,"The Future of the Grid—A View from ARPA-E Listing Summary The CSIS Energy and National Security Program is pleased to invite you to a discussion with Ellen Williams, Director of ARPA-E, the Advanced Research Projects Agency-Energy. Drupal Admin Thu, 02/25/2016 - 14:15 Featured Image Image Contributo",https://www.csis.org/events/future-grid-view-arpa-e,"25 Feb 2016, 19:15"
Geopolitics,CSIS,"Statesmen's Forum: Wang Yi, Minister of Foreign Affairs, PRC","Statesmen's Forum: Wang Yi, Minister of Foreign Affairs, PRC Listing Summary Please watch the live webcast of a discussion on Chinese foreign policy and US-China Relations Drupal Admin Fri, 02/19/2016 - 17:13 Featured Image Image Contributors John J. Hamre Christopher K. Johnson Downloads Download T",https://www.csis.org/events/statesmens-forum-wang-yi-minister-foreign-affairs-prc,"19 Feb 2016, 22:13"
Geopolitics,CSIS,"China Reality Check: China's ""Internet Sovereignty"" Initiative: Origins and Consequences","China Reality Check: China's ""Internet Sovereignty"" Initiative: Origins and Consequences Listing Summary Please join us for a discussion on China’s initiative to promote Internet sovereignty as a key governing concept of the global Internet. Drupal Admin Tue, 02/16/2016 - 11:49 Featured Image Image ",https://www.csis.org/events/china-reality-check-chinas-internet-sovereignty-initiative-origins-and-consequences,"16 Feb 2016, 16:49"
Policy & Regulation,CSIS,"Statesmen's Forum: The Right Honourable Theresa May, MP, Home Secretary, United Kingdom","Statesmen's Forum: The Right Honourable Theresa May, MP, Home Secretary, United Kingdom Listing Summary Please join the CSIS International Security Program for a discussion with UK Home Secretary Theresa May on counter-terrorism policy. Drupal Admin Fri, 02/12/2016 - 16:08 Featured Image Image Contr",https://www.csis.org/events/statesmens-forum-right-honourable-theresa-may-mp-home-secretary-united-kingdom,"12 Feb 2016, 21:08"
Strategic Signals,CSIS,Strategic Opportunities in the Indo-Asia-Pacific with Admiral Harry B. Harris,"Strategic Opportunities in the Indo-Asia-Pacific with Admiral Harry B. Harris Listing Summary Please join us for a discussion with Admiral Harry B. Harris, Commander, U.S. Pacific Command, on the Strategic Opportunities in the Indo-Asia-Pacific. Drupal Admin Tue, 01/26/2016 - 11:20 Featured Image Im",https://www.csis.org/events/strategic-opportunities-indo-asia-pacific-admiral-harry-b-harris,"26 Jan 2016, 16:20"
Strategic Signals,Al Jazeera,"World Cup Golden Boot: Messi leads Mbappe, Haaland before quarterfinals","Messi is the top goal scorer after tallying his eighth against Egypt, with Erling Haaland and Kylian Mbappe next best.",https://www.aljazeera.com/sports/2026/7/8/fifa-world-cup-golden-boot-race-messi-leads-mbappe-haaland-before-quarterfinals?traffic_source=rss,"08 Jul 2026, 10:21"
Strategic Signals,Al Jazeera,Switzerland fans’ joy as team reaches World Cup quarter-final,Switzerland fans’ joy as team reaches World Cup quarter-final,https://www.aljazeera.com/video/newsfeed/2026/7/8/switzerland-fans-joy-as-team-reaches-world-cup-quarter-final?traffic_source=rss,"08 Jul 2026, 10:21"
Geopolitics,Al Jazeera,"Trump says ceasefire ‘over’ after US, Iran trade attacks",Trump made the announcement at a NATO summit after Iran attacked bases hosting US forces in Kuwait and Bahrain.,https://www.aljazeera.com/news/2026/7/8/trump-says-ceasefire-over-after-us-iran-trade-attacks?traffic_source=rss,"08 Jul 2026, 10:06"
Geopolitics,Al Jazeera,Nigeria’s counterterrorism gains carry a warning,"Mass surrenders may weaken armed groups, but reintegration without justice risks fuelling resentment.",https://www.aljazeera.com/opinions/2026/7/8/nigerias-counterterrorism-gains-carry-a-warning?traffic_source=rss,"08 Jul 2026, 09:57"
Geopolitics,Al Jazeera,Why have US-Iran strikes resumed and what does it mean for peace?,Both sides have accused each other of violating the memorandum of understanding signed in June.,https://www.aljazeera.com/news/2026/7/8/why-have-us-iran-strikes-resumed-and-what-does-it-mean-for-peace-talks?traffic_source=rss,"08 Jul 2026, 09:42"
Strategic Signals,Al Jazeera,Pakistan searches for Boeing cargo plane missing over Arabian Sea,Karachi-bound aircraft lost contact with air traffic control after reporting navigation ⁠system fault.,https://www.aljazeera.com/news/2026/7/8/pakistan-searches-for-boeing-cargo-plane-missing-over-arabian-sea?traffic_source=rss,"08 Jul 2026, 09:39"
Strategic Signals,Al Jazeera,European MPs call for probe of FIFA boss Infantino over red card suspension,Lawmakers call FIFA decision to scrap Balogun suspension after Trump intervention 'a disgrace'.,https://www.aljazeera.com/news/2026/7/8/european-mps-call-for-probe-of-fifa-boss-infantino-over-red-card-suspension?traffic_source=rss,"08 Jul 2026, 09:24"
Geopolitics,Al Jazeera,"Trump says MoU with ‘vicious, violent’ Iran is over","Trump says MoU with 'vicious, violent' Iran is over",https://www.aljazeera.com/video/newsfeed/2026/7/8/trump-says-mou-with-vicious-violent-iran-is-over?traffic_source=rss,"08 Jul 2026, 09:14"
Strategic Signals,ETCFO Top Stories,"NFRA raises bar for audit sign-offs, says uncorrected errors can distort financial statements","Chairperson Nitin Gupta asks auditors to evaluate cumulative and qualitative impact of misstatements, strengthen communication with audit committees and boards before issuing audit opinions.",https://cfo.economictimes.indiatimes.com/news/tax-legal-accounting/nfra-urges-auditors-to-reassess-uncorrected-errors-in-financial-statements/132255461,"08 Jul 2026, 12:02"
Strategic Signals,ETCFO Top Stories,Gold Monetisation Scheme could boost organised jewellers as recycled gold gains momentum: DP Abhushan CFO,"DP Abhushan expects 25–30 per cent revenue growth and 30–35 per cent PAT growth in FY27 as it continues showroom expansion, gradually increases its lower-carat jewellery portfolio, and sees silver emerging as a fast-growing category.",https://cfo.economictimes.indiatimes.com/news/strategy-operations/gold-monetisation-scheme-to-propel-organised-jewellers-insights-from-dp-abhushan-cfo/132233906,"07 Jul 2026, 13:25"
Markets & Macro,ETCFO Top Stories,"Exclusive: ICAI seeks law backed crypto assets framework, says no divergence from RBI's position","People aware of the matter told ETCFO that the accounting body urged a cautious, legislation backed approach to Virtual Digital Assets before the Parliamentary Standing Committee on Finance while making it clear that it neither endorsed such assets nor expressed any view contrary to the Reserve Bank",https://cfo.economictimes.indiatimes.com/news/governance-risk-compliance/icai-calls-for-comprehensive-legal-framework-for-virtual-digital-assets-in-india/132213447,"06 Jul 2026, 15:20"
Geopolitics,ETCFO Top Stories,"India-UK CETA: CFOs anticipate export boom, expanding capacities ahead of July 15, 2026 implementation","Indian companies are gearing up for a promising boost in exports to the UK as a new trade deal looms on the horizon. CFOs are ramping up production capabilities to cater to anticipated demand, especially in sectors like textiles and auto parts, which are set to benefit from zero-duty access.",https://cfo.economictimes.indiatimes.com/news/strategy-operations/india-uk-ceta-cfos-anticipate-export-boom-expanding-capacities-ahead-of-july-15-2026-implementation/132201574,"06 Jul 2026, 09:55"
Strategic Signals,ETCFO Top Stories,"FPIs double down on Indian debt, keep equity bets on hold","Foreign investors are pouring money into Indian debt, with record inflows in June, while simultaneously pulling out of local equities. This shift is driven by tax benefits, expanded investment options, and hopes for inclusion in global bond indices. Despite a recent rupee recovery, concerns remain a",https://cfo.economictimes.indiatimes.com/news/corporate-finance/foreign-portfolio-investors-shift-focus-to-indian-debt-as-equity-bets-decline/132206376,"06 Jul 2026, 08:34"
Strategic Signals,ETCFO Top Stories,Income tax department slaps notices on foreign investors with no earnings,"Foreign investors are receiving unexpected tax notices in India, even for transactions where no profit or dividend was earned. The tax department is initiating reassessment proceedings, questioning the absence of income tax returns for share purchases. Experts highlight that such notices, potentiall",https://cfo.economictimes.indiatimes.com/news/tax-legal-accounting/income-tax-department-slaps-notices-on-foreign-investors-with-no-earnings/132206182,"06 Jul 2026, 08:24"
Energy & Infrastructure,ETCFO Top Stories,"Fall in global crude prices brightens fiscal outlook, El Nino risks linger","Easing West Asian tensions have significantly improved India's fiscal outlook, with economists now predicting a smaller deficit than previously feared. Lower global crude oil prices are reducing the government's subsidy burden and boosting revenue prospects. While subsidy pressures and potential agr",https://cfo.economictimes.indiatimes.com/news/economy/fall-in-global-crude-prices-brightens-fiscal-outlook-el-nino-risks-linger/132206218,"06 Jul 2026, 08:26"
Strategic Signals,ETCFO Top Stories,"GST at 9; Over 50,000 Appeals at GSTAT","As GST enters its tenth year, perhaps the debate should move beyond tax rates and revenue collections. The larger question is whether the system has matured enough to minimise disputes before they arise. A successful tax regime is not merely one that collects revenue efficiently, but one that inspir",https://cfo.economictimes.indiatimes.com/news/tax-legal-accounting/gst-at-9-over-50000-appeals-filed-as-industry-calls-for-reforms/132151268,"03 Jul 2026, 08:39"
Markets & Macro,ETCFO Policy,"RBI backs crypto ban, tax department warns of evasion risks, documents show","India's central bank has reiterated its preference for a cryptocurrency policy ""leaning towards prohibition,"" warning that crypto assets and stablecoins could threaten financial stability and monetary sovereignty, according to internal government documents reviewed by Reuters.",https://cfo.economictimes.indiatimes.com/news/policy/rbi-backs-crypto-ban-tax-department-warns-of-evasion-risks-documents-show/132258126,"08 Jul 2026, 13:57"
Markets & Macro,ETCFO Policy,SEBI shifts FPI registration fees from US dollar to rupee denomination,"The Securities and Exchange Board of India (SEBI) has notified amendments to the Foreign Portfolio Investors (FPI) Regulations, replacing the US dollar-denominated fee structure with a rupee-denominated payment mechanism for foreign investors and foreign venture capital investors (FVCIs).",https://cfo.economictimes.indiatimes.com/news/policy/sebi-shifts-fpi-registration-fees-from-us-dollar-to-rupee-denomination/132254939,"08 Jul 2026, 11:30"
Strategic Signals,ETCFO Policy,"Smartphone PLI plan exceeds targets, value addition quadruples: Industry informs Centre",The industry told commerce minister Piyush Goyal that the scheme had exceeded all its targets with production more than doubling to $71 billion in FY26 from $30 billion in FY20 and exports rising 10 times to $29.4 billion from $3 billion.,https://cfo.economictimes.indiatimes.com/news/policy/smartphone-pli-plan-exceeds-targets-value-addition-quadruples-industry-informs-centre/132252099,"08 Jul 2026, 08:07"
Strategic Signals,ETCFO Policy,India should aim higher than $5 bn in toy market: FM Sitharaman urges industry to target bigger global market share,"Union Finance Minister Nirmala Sitharaman on Tuesday called on the Indian toy industry to set more ambitious export goals, saying India has the capability to capture a much larger slice of the projected USD 179 billion global toy market by 2032, instead of limiting itself to the projected USD 5 bill",https://cfo.economictimes.indiatimes.com/news/policy/india-should-aim-higher-than-5-bn-in-toy-market-fm-sitharaman-urges-industry-to-target-bigger-global-market-share/132251946,"08 Jul 2026, 08:00"
Policy & Regulation,ETCFO Policy,"NFRA chief declines comment on Rajesh Exports' SEBI submission, says probe process is systematic","National Financial Reporting Authority (NFRA) Chairperson Nitin Gupta on Tuesday declined to comment on claims made by Rajesh Exports regarding the submission of records to market regulator SEBI, saying the matter falls within SEBI's jurisdiction.",https://cfo.economictimes.indiatimes.com/news/policy/nfra-chief-declines-comment-on-rajesh-exports-sebi-submission-says-probe-process-is-systematic/132236422,"07 Jul 2026, 15:30"
Policy & Regulation,ETCFO Policy,Sebi reintroduces open mkt share buyback from Aug 1,Sebi has reintroduced open-market share buybacks through stock exchanges starting August 1. Companies can now repurchase their own shares using regular trading mechanisms without a dedicated window. The execution period for these buybacks is capped at sixty-six working days from the offer opening. T,https://cfo.economictimes.indiatimes.com/news/policy/sebi-reintroduces-open-mkt-share-buyback-from-aug-1/132233316,"07 Jul 2026, 13:00"
Markets & Macro,ETCFO Policy,"RBI to auction Rs 32,000 crore government bonds on Friday",The Reserve Bank of India will auction government securities worth thirty-two thousand crore rupees. This auction involves re-issuing two specific bonds with different maturity dates. The government holds an option to retain additional subscriptions for each security. Bids will be submitted electron,https://cfo.economictimes.indiatimes.com/news/policy/rbi-to-auction-rs-32000-crore-government-bonds-on-friday/132232959,"07 Jul 2026, 12:28"
Strategic Signals,ETCFO Policy,"Direct cash transfers to women boost savings, spending: EAC-PM",Direct cash transfers to women boost household savings and spending effectively. Schemes in Maharashtra and Odisha showed significant improvements in savings. Monthly account balances increased substantially for beneficiaries in both states. Consumption spending also saw notable increases after thes,https://cfo.economictimes.indiatimes.com/news/policy/direct-cash-transfers-to-women-boost-savings-spending-eac-pm/132229256,"07 Jul 2026, 08:37"
