source,title,link,summary,published_at
The Diplomat,Lakshadweep’s Fishermen Are India’s First Line of Maritime Intelligence,https://thediplomat.com/2026/04/lakshadweeps-fishermen-are-indias-first-line-of-maritime-intelligence/,Fishing communities notice everything. But alienation from Delhi means India is losing intelligence input it can’t afford to lose.,2026-04-20T18:58:00+09:00
The Diplomat,From Malaysia to the World: The Asian Legacy of Pope Francis,https://thediplomat.com/2026/04/from-malaysia-to-the-world-the-asian-legacy-of-pope-francis/,"The canonization process for Sybil Kathigasu underscores how Pope Francis’s legacy continues to shift the lines of Catholicism, in subtle and surprising ways.",2026-04-20T04:16:00+09:00
The Diplomat,Australia-Japan Ink Deal for Mogami-class Frigates,https://thediplomat.com/2026/04/australia-japan-ink-deal-for-mogami-class-frigates/,"Canberra and Tokyo continue to build closer links with each other, with a shared understanding of the strategic environment, and a high degree of trust",2026-04-20T21:17:00+09:00
The Diplomat,The 500th Anniversary of the First Battle of Panipat,https://thediplomat.com/2026/04/the-500th-anniversary-of-the-first-battle-of-panipat/,"Contrary to popular belief, the Mughals did not bring Islamic rule to India — but their rule did shape India’s military, administrative, and geopolitical landscape in ways that endure to this day.",2026-04-20T18:50:00+09:00
The Diplomat,Why China Wants to Host the New BBNJ Secretariat,https://thediplomat.com/2026/04/why-china-wants-to-host-the-new-bbnj-secretariat/,China’s Xiamen bid ups the stakes in the the battle over the secretariat host.,2026-04-20T21:29:00+09:00
The Diplomat,How Vietnam’s ‘Four Nos’ Can Help a Region Manage the U.S. Rogue Use of Force,https://thediplomat.com/2026/04/how-vietnams-four-nos-can-help-a-region-manage-the-u-s-rogue-use-of-force/,The country's preference for an open and predicable international order is shared by most of its Asian neighbors.,2026-04-20T14:52:00+09:00
The Diplomat,South Korea’s President Set to Pay 4-Day State Visit To Vietnam,https://thediplomat.com/2026/04/south-koreas-president-set-to-pay-4-day-state-visit-to-vietnam/,Lee Jae Myung is the first foreign leader to visit Vietnam since the confirmation of the country's new leadership earlier this month.,2026-04-20T14:44:00+09:00
The Diplomat,New Myanmar Administration Releases Ousted President Win Myint in Mass Amnesty,https://thediplomat.com/2026/04/new-myanmar-administration-releases-ousted-president-win-myint-in-mass-amnesty/,Newly inaugurated President Min Aung Hlaing also announced a reduction in the 27-year prison sentence of ousted former leader Aung San Suu Kyi.,2026-04-20T10:37:00+09:00
The Diplomat,BRICS: Can India Lead a Bloc Without a Cause?,https://thediplomat.com/2026/04/brics-can-india-lead-a-bloc-without-a-cause/,BRICS appears to be more riddled with internal conflicts than most multilateral groups.,2026-04-18T01:48:00+09:00
The Diplomat,South Korea’s Renewed Strategic Pivot to India,https://thediplomat.com/2026/04/south-koreas-renewed-strategic-pivot-to-india/,"For the past decade, India-South Korea interactions have been limited. President Lee’s upcoming visit is set to change that.",2026-04-18T02:21:00+09:00
The Diplomat,The Deepening Deterioration of Public Sentiment Between Japan and China,https://thediplomat.com/2026/04/the-deepening-deterioration-of-public-sentiment-between-japan-and-china/,What do Japanese and Chinese think about each other’s countries? Let’s look at the numbers.,2026-04-18T01:55:00+09:00
The Diplomat,Japan’s Constitutional Theater: Revising Article 9 Would Be a Mistake,https://thediplomat.com/2026/04/japans-constitutional-theater-revising-article-9-would-be-a-mistake/,A constitutional revision solves the wrong problem – and creates new complications.,2026-04-17T23:40:00+09:00
The Diplomat,The Geopolitical Importance of India’s Shrinking ‘Red Corridor’,https://thediplomat.com/2026/04/the-geopolitical-importance-of-indias-shrinking-red-corridor/,India has turned the corner in its battle against Naxalism – and effectively governing its own margins is an essential step toward global power status.,2026-04-17T23:17:00+09:00
The Diplomat,"Move Over, Hungary: Spain Is China’s New Best Friend in the EU",https://thediplomat.com/2026/04/move-over-hungary-spain-is-chinas-new-best-friend-in-the-eu/,"With Viktor Orban’s election loss, Pedro Sanchez is now Beijing’s most useful European leader.",2026-04-17T22:20:00+09:00
The Diplomat,China Was Once Buying Up Sri Lankan Ports. Now It’s India’s Turn.,https://thediplomat.com/2026/04/china-was-once-buying-up-sri-lankan-ports-now-its-indias-turn/,"The Indian Ocean has no shortage of distressed strategic assets: financially stressed yards, ports, and logistics infrastructure in small states that cannot sustain them independently.",2026-04-17T22:27:00+09:00
The Diplomat,Japan’s Takaichi to Forge Closer Cooperation With Australia in Rare Earths,https://thediplomat.com/2026/04/japans-takaichi-to-forge-closer-cooperation-with-australia-in-rare-earths/,"In an era defined by geopolitical fragmentation, the Australia-Japan partnership shows how middle powers can cooperate to mitigate risk and enhance resilience.",2026-04-17T21:48:00+09:00
The Diplomat,The Iran War’s Impact on India and Pakistan,https://thediplomat.com/2026/04/the-iran-wars-impact-on-india-and-pakistan/,"The economic brunt of a prolonged war would be borne by the Indian and Pakistani people, who have no part in it but no escape from its consequences.",2026-04-17T12:37:00+09:00
The Diplomat,The Uncertain Future of the China-Myanmar Economic Corridor,https://thediplomat.com/2026/04/the-uncertain-future-of-the-china-myanmar-economic-corridor/,"Despite the swearing-in of a new ""civilian"" government, progress on the project is likely to remain sluggish.",2026-04-17T16:32:00+09:00
The Diplomat,Vietnam’s Top Leader Concludes 4-Day State Visit to China,https://thediplomat.com/2026/04/vietnams-top-leader-concludes-4-day-state-visit-to-china/,"Meeting in Beijing, To Lam and Xi Jinping declared that they view the bilateral relationship ""as a strategic choice of overarching and long-term significance.”",2026-04-17T15:54:00+09:00
The Diplomat,How China’s Arctic Ambitions Inflate Russia’s Geopolitical Leverage,https://thediplomat.com/2026/04/how-chinas-arctic-ambitions-inflate-russias-geopolitical-leverage/,Russia’s law suggests that Moscow is not preparing the Northern Sea Route for international use. It may instead be profiting from a misplaced expectation.,2026-04-17T01:43:00+09:00
The Diplomat,Plugging into Reality: The ASEAN Power Grid,https://thediplomat.com/2026/04/plugging-into-reality-the-asean-power-grid/,"For decades, the Southeast Asian bloc has envisioned the creation of a region-spanning power grid. Is the project finally set for take-off?",2026-04-17T10:51:00+09:00
The Diplomat,"Australian PM Secures Fuel, Fertilizer Supplies During Visits to Malaysia and Brunei",https://thediplomat.com/2026/04/australian-pm-secures-fuel-fertilizer-supplies-during-visits-to-malaysia-and-brunei/,"During his quick visits to the two nations, Prime Minister Anthony Albanese and his hosts pledged to “strengthen energy supply chain resilience.”",2026-04-17T08:57:00+09:00
The Diplomat,"Uzbekistan Wants Nuclear Energy, But Can It Afford the Water Cost?",https://thediplomat.com/2026/04/uzbekistan-wants-nuclear-energy-but-can-it-afford-the-water-cost/,The country is betting on nuclear power to secure its energy future – but it is doing so in one of the most water-stressed regions in the world.,2026-04-17T02:57:00+09:00
The Diplomat,When Climate Lies Kill: Red-Tagging Indigenous Defenders in the Philippines,https://thediplomat.com/2026/04/when-climate-lies-kill-red-tagging-indigenous-defenders-in-the-philippines/,"Climate disinformation is strategically deployed to reinforce red-tagging narratives, portraying Indigenous resistance to mining, energy, and infrastructure projects as a threat to national security.",2026-04-17T00:10:00+09:00
The Diplomat,Beyond the Rupture: Where Are China-Japan Relations Heading?,https://thediplomat.com/2026/04/beyond-the-rupture-where-are-china-japan-relations-heading/,"The evolution of Sino-Japanese relations has rarely followed a linear path – but it has always remained within clear guardrails, even during times of tension.",2026-04-16T23:43:00+09:00
The Diplomat,Australia’s New National Defense Strategy Feels Written for a Bygone Era,https://thediplomat.com/2026/04/australias-new-national-defense-strategy-feels-written-for-a-bygone-era/,It ignores the elephant in the room: an unreliable and unruly United States.,2026-04-16T23:15:00+09:00
The Diplomat,5-Year Prison Terms for Atajurt Activists Who Burned Chinese Flag,https://thediplomat.com/2026/04/5-year-prison-terms-for-atajurt-activists-who-burned-chinese-flag/,"After protesting Chinese state policies in Xinjiang, and after apparent pressure from Beijing, the group of Kazakhs were charged with “inciting national hatred.”",2026-04-16T23:21:00+09:00
The Diplomat,China’s Taiwan Calculus Ahead of the Trump-Xi Summit,https://thediplomat.com/2026/04/chinas-taiwan-calculus-ahead-of-the-trump-xi-summit/,"Beijing is not seeking a breakthrough on Taiwan at the Trump-Xi summit, but rather incremental gains that could gradually weaken Taiwan-U.S. ties.",2026-04-16T22:55:00+09:00
The Diplomat,PPP’s Chief Holds Meetings in Washington While His Party Faces Ruin at Home,https://thediplomat.com/2026/04/ppps-chief-holds-meetings-in-washington-while-his-party-faces-ruin-at-home/,People Power Party leader Jang Dong-hyeok’s Washington trip reveals more about his internal survival strategy than any genuine foreign policy agenda.,2026-04-16T22:23:00+09:00
The Diplomat,China’s Definition of an ‘Evil Cult’ Is Expanding Beyond Religious Groups,https://thediplomat.com/2026/04/chinas-definition-of-an-evil-cult-is-expanding-beyond-religious-groups/,"“Create Abundance” is not, in any conventional sense, a religion. For that reason, its persecution signals a dangerous expansion of China’s ideological control.",2026-04-16T21:53:00+09:00
The Diplomat,A New Dataset Maps Central Asia’s Extractive Economy,https://thediplomat.com/2026/04/a-new-dataset-maps-central-asias-extractive-economy/,"An open-access dataset from the Oxus Society maps more than $118 billion in resource exports across the five Central Asian republics, offering a rare quantitative window into the region’s shifting place in Eurasian supply chains.",2026-04-16T21:38:00+09:00
The Diplomat,Nepal’s New PM Balendra Shah Faces First Diplomatic Test With Upcoming India Visit,https://thediplomat.com/2026/04/nepals-new-pm-balendra-shah-faces-first-diplomatic-test-with-upcoming-india-visit/,"In New Delhi, he will not want to be seen to be too close to “big brother” India so early in his tenure.",2026-04-16T19:14:00+09:00
The Diplomat,"If Awami League Can Be Banned, Why Not the Jamaat on the Same Charges?",https://thediplomat.com/2026/04/if-awami-league-can-be-banned-why-not-the-jamaat-on-the-same-charges/,The Jamaat-e-Islami was complicit in the genocide of 3 million people in 1971. Why is that not reason enough for the BNP government to ban it?,2026-04-16T19:02:00+09:00
The Diplomat,Sri Lanka’s Fertility Fall May Outlast Its Economic Recovery,https://thediplomat.com/2026/04/sri-lankas-fertility-fall-may-outlast-its-economic-recovery/,The country will need to prepare for the consequences of sustained low fertility rates.,2026-04-16T18:35:00+09:00
The Diplomat,How China Is Positioning Itself Ahead of the Trump–Xi Summit,https://thediplomat.com/2026/04/how-china-is-positioning-itself-ahead-of-the-trump-xi-summit/,Beijing is working subtly to shape the regional environment ahead of the meeting – and take advantage of Washington’s focus on the Iran war.,2026-04-16T02:53:00+09:00
The Diplomat,AI Moves Fast. Southeast Asia’s Cybersecurity Policy Doesn’t.,https://thediplomat.com/2026/04/ai-moves-fast-southeast-asias-cybersecurity-policy-doesnt/,Anthropic’s Mythos Preview exposes a widening gap between accelerating AI-enabled threats and Southeast Asia’s capacity to respond — and the window to act is closing.,2026-04-16T03:18:00+09:00
The Diplomat,India Mulls Deployment of Crocodiles and Snakes at Border with Bangladesh,https://thediplomat.com/2026/04/india-mulls-deployment-of-crocodiles-and-snakes-at-border-with-bangladesh/,The plan was discussed even as Indian and Bangladeshi diplomats are working to reset bilateral relations.,2026-04-16T00:16:00+09:00
The Diplomat,The Christian Roots of Kimilsungism,https://thediplomat.com/2026/04/the-christian-roots-of-kimilsungism/,Insights from Jonathan Cheng.,2026-04-15T23:43:00+09:00
War on the Rocks,Airwaves of Power: Why the Pentagon Should Shift to a Commercial-First Spectrum Model,https://warontherocks.com/cogs-of-war/airwaves-of-power-why-the-pentagon-should-shift-to-a-commercial-first-spectrum-model/,"<p>The U.S. military is firing million-dollar missiles at Iranian drones that cost a tiny fraction as much &#8212; a striking example of the kind of overmatch modern warfare punishes.The Department of Defense&#8217;s approach to electromagnetic spectrum policy follows a similar logic, occupying prime mid-band frequencies for vital but relatively low-throughput national security uses &#8212; including radars, satellite communications, navigation, and electronic warfare &#8212; even as those same bands could generate much larger commercial, allied, and strategic returns.The Pentagon understandably views spectrum through a national security lens, but the current allocation reflects less strategic optimization than a legacy of policy choices</p>
<p>The post <a href=""https://warontherocks.com/cogs-of-war/airwaves-of-power-why-the-pentagon-should-shift-to-a-commercial-first-spectrum-model/"">Airwaves of Power: Why the Pentagon Should Shift to a Commercial-First Spectrum Model</a> appeared first on <a href=""https://warontherocks.com"">War on the Rocks</a>.</p>",2026-04-24T08:00:32+00:00
War on the Rocks,Presence or Capacity? The Coast Guard Can Have Both Through Small Boat Stations,https://warontherocks.com/presence-or-capacity-the-coast-guard-can-have-both-through-small-boat-stations/,"<p>Closing small boat stations has proven difficult. Leaving them unchanged is operationally inefficient. These units are enduring parts of the Coast Guard&#8217;s force structure, yet their full potential is not always realized. This article proposes a model to better align their mission with national priorities.During the recent Senate confirmation hearing for the next commandant of the U.S. Coast Guard, senators raised a wide range of global maritime concerns, including Arctic competition, cyber threats targeting ports, migration pressures, and increasingly severe storms. Yet the hearing repeatedly returned to a far more local subject: the Coast Guard units in senators&#8217; backyards.Coast Guard</p>
<p>The post <a href=""https://warontherocks.com/presence-or-capacity-the-coast-guard-can-have-both-through-small-boat-stations/"">Presence or Capacity? The Coast Guard Can Have Both Through Small Boat Stations</a> appeared first on <a href=""https://warontherocks.com"">War on the Rocks</a>.</p>",2026-04-24T07:30:17+00:00
War on the Rocks,Why Do Many Western Defense Tech Firms Struggle in Ukraine?,https://warontherocks.com/why-do-many-western-defense-tech-firms-struggle-in-ukraine/,"<p>Michael Kofman joined Ryan at a live event earlier this year to discuss the performance of American defense technology in Ukraine and why it often falls short. They examine the challenges of fielding and iterating systems in combat, from poor implementation and weak feedback loops to deeper mismatches between design and battlefield reality. They also explore what it takes to succeed in this environment and what it means for future conflicts. Thanks to Leonid Capital Partners for hosting the event at which this podcast was recorded. Image: ArmyInform via Wikimedia Commons</p>
<p>The post <a href=""https://warontherocks.com/why-do-many-western-defense-tech-firms-struggle-in-ukraine/"">Why Do Many Western Defense Tech Firms Struggle in Ukraine?</a> appeared first on <a href=""https://warontherocks.com"">War on the Rocks</a>.</p>",2026-04-23T16:07:47+00:00
War on the Rocks,A Formal Defense Pact in the Indo-Pacific Is the Wrong Answer,https://warontherocks.com/a-formal-defense-pact-in-the-indo-pacific-is-the-wrong-answer/,"<p>The debate over how best to deter China in the western Pacific has reached a new level of ambition. Ely Ratner, a former senior defense official in the Biden administration, proposed a &#8220;Pacific Defense Pact&#8221; &#8212; a legally binding multilateral treaty among the United States, Japan, Australia, and the Philippines. This reflects serious concerns over China&#8217;s rise and its potential future use of force along the first island chain. The underlying diagnosis is sound: Existing U.S. alliances in the region lack an integrated command and control structure and the collective responsiveness required to credibly deter China in a high-intensity conflict.</p>
<p>The post <a href=""https://warontherocks.com/a-formal-defense-pact-in-the-indo-pacific-is-the-wrong-answer/"">A Formal Defense Pact in the Indo-Pacific Is the Wrong Answer</a> appeared first on <a href=""https://warontherocks.com"">War on the Rocks</a>.</p>",2026-04-23T07:30:25+00:00
War on the Rocks,Seeing the Cyber in Economic Statecraft,https://warontherocks.com/seeing-the-cyber-in-economic-statecraft/,"<p>Editor&#8217;s note: This article is the seventh in an 11-part series examining how the United States should organize, lead, and integrate economic statecraft into strategy, defense practice, and the broader national security ecosystem. This special series is brought to you by the&#160;Potomac Institute for Policy Studies&#160;and War on the Rocks. Prior installments can be found at the&#160;War by Other Ledgers&#160;page.Americans lost nearly $21 billion to cybercrime in 2025, a new record for cyber-enabled economic losses. Private sector losses to malicious cyber activity regularly exceed $200 billion in a given year. Alongside criminal groups, state-sponsored hackers are increasingly targeting America&#8217;s pocketbook.</p>
<p>The post <a href=""https://warontherocks.com/seeing-the-cyber-in-economic-statecraft/"">Seeing the Cyber in Economic Statecraft</a> appeared first on <a href=""https://warontherocks.com"">War on the Rocks</a>.</p>",2026-04-23T07:00:45+00:00
War on the Rocks,Europe Might Sit Out In An Indo-Pacific War — But It Can’t Escape the Fallout,https://warontherocks.com/europe-might-sit-out-in-an-indo-pacific-war-but-it-cant-escape-the-fallout/,"<p>In 2024, Paul van Hooft and Tim Sweijs wrote, &#8220;Two-Theater Tragedy: A Reluctant Europe Cannot Easily Escape a Sino-American War Over Taiwan,&#8221; where they argued a war in the Indo-Pacific would likely draw in and weaken Europe, even if European states try to remain on the sidelines. Two years later, amidst heightened tensions in both theaters, we asked Paul to revisit their arguments.Image:&#160;U.S. Naval Forces Europe-Africa/U.S. Sixth FleetIn your 2024 article, you argue a U.S.&#8211;Chinese war over Taiwan would inevitably draw in and weaken Europe, even if European states try to stay on the sidelines militarily. How does Europe&#8217;s recent</p>
<p>The post <a href=""https://warontherocks.com/europe-might-sit-out-in-an-indo-pacific-war-but-it-cant-escape-the-fallout/"">Europe Might Sit Out In An Indo-Pacific War — But It Can&#8217;t Escape the Fallout</a> appeared first on <a href=""https://warontherocks.com"">War on the Rocks</a>.</p>",2026-04-22T17:30:31+00:00
War on the Rocks,When the Rules Fail: Tax Incentives and Defense Sustainment,https://warontherocks.com/cogs-of-war/when-the-rules-fail-tax-incentives-and-defense-sustainment/,"<p>In the 1986 World Cup, Diego Maradona scored his infamous &#8220;Hand of God&#8221; goal &#8212; an obvious handball that went uncalled, because the referee did not have the tools to see it. Today, soccer has addressed that vulnerability with sensors and video review, ensuring the game is adjudicated fairly. U.S. defense industrial policy faces a similar challenge. In America&#8217;s defense industrial base, the issue is not a lack of oversight, but distorted incentives that steer work toward private vendors even when the organic industrial base is well-positioned to perform it. When the organic industrial base is deprived of work, it</p>
<p>The post <a href=""https://warontherocks.com/cogs-of-war/when-the-rules-fail-tax-incentives-and-defense-sustainment/"">When the Rules Fail: Tax Incentives and Defense Sustainment</a> appeared first on <a href=""https://warontherocks.com"">War on the Rocks</a>.</p>",2026-04-22T08:00:56+00:00
War on the Rocks,Resilience Without Capacity: The Fatal Flaw in America’s New Cyber Strategy,https://warontherocks.com/resilience-without-capacity-the-fatal-flaw-in-americas-new-cyber-strategy/,"<p>What happens when a country develops a cyber strategy that depends on the capabilities it is actively cutting?The White House&#8217;s new cyber strategy offers exactly that kind of contradiction by pairing a strong vision for resilience and competition with policy choices that pull in the opposite direction. On the merits, it gets several important things right. It treats cyberspace as a domain of sustained strategic competition rather than a compliance problem. It puts unusual and welcome emphasis on national resilience. And it understands that offensive cyber action, paired with other tools of national power, should be part of any serious</p>
<p>The post <a href=""https://warontherocks.com/resilience-without-capacity-the-fatal-flaw-in-americas-new-cyber-strategy/"">Resilience Without Capacity: The Fatal Flaw in America’s New Cyber Strategy</a> appeared first on <a href=""https://warontherocks.com"">War on the Rocks</a>.</p>",2026-04-22T07:30:15+00:00
War on the Rocks,Why Iran Metabolizes the Pressure that Broke Venezuela,https://warontherocks.com/why-iran-metabolizes-the-pressure-that-broke-venezuela/,"<p>The reality that regime change is not going to happen as a result of this war seems to have settled in at the White House. When American policymakers reflect and wonder why Iran did not react like Venezuela under pressure, they will not just be misreading Iran &#8212; they will be misreading how coercive pressure works. Iran&#8217;s resilience rests on internal and external pillars that a Venezuela comparison completely misses. Internally, the Supreme Leader&#8217;s authority is anchored in a theocratic order where religious legitimacy underwrites a sprawling economic system. At its center are the Islamic Revolutionary Guard Corps and parastatal</p>
<p>The post <a href=""https://warontherocks.com/why-iran-metabolizes-the-pressure-that-broke-venezuela/"">Why Iran Metabolizes the Pressure that Broke Venezuela</a> appeared first on <a href=""https://warontherocks.com"">War on the Rocks</a>.</p>",2026-04-22T07:15:27+00:00
War on the Rocks,How the War in Iran Is Affecting Its Northern and Eastern Neighbors,https://warontherocks.com/how-the-war-in-iran-is-affecting-its-northern-and-eastern-neighbors/,"<p>When the U.S.&#8211;Israeli war with Iran began on Feb. 28, there were immediate impacts on the countries to Iran&#8217;s west &#8212; as Iran struck multiple Gulf Arab states and Jordan, Iraq absorbed direct attacks while facing renewed risks of internal stability, Israel launched intensive airstrikes and ground operations in Lebanon, and other countries and territories in the region struggled to cope with short-term and potential long-term ripple effects. However, Iran&#8217;s neighbors to its north and east are not immune to the risks &#8212; and opportunities &#8212; that the war poses. We asked five experts to assess the impact of the</p>
<p>The post <a href=""https://warontherocks.com/how-the-war-in-iran-is-affecting-its-northern-and-eastern-neighbors/"">How the War in Iran Is Affecting Its Northern and Eastern Neighbors</a> appeared first on <a href=""https://warontherocks.com"">War on the Rocks</a>.</p>",2026-04-21T17:30:41+00:00
War on the Rocks,The United States Is Repeating Its Silicon Mistake with Gallium Nitride,https://warontherocks.com/cogs-of-war/the-united-states-is-repeating-its-silicon-mistake-with-gallium-nitride/,"<p>China controls 99 percent of the world&#8217;s primary gallium, a critical mineral and semiconductor crucial for building the microchips of the future. In 2023, it placed export controls on gallium to retaliate against American restrictions on the export of advanced chips to China. In December 2024, China escalated to an outright ban on gallium exports to the United States. The U.S. National Defense Stockpile had zero gallium reserves when that ban landed.The United States has been here before. The United States pioneered and scaled modern silicon semiconductor infrastructure. A significant reliance on international manufacturing and the loss of domestic silicon</p>
<p>The post <a href=""https://warontherocks.com/cogs-of-war/the-united-states-is-repeating-its-silicon-mistake-with-gallium-nitride/"">The United States Is Repeating Its Silicon Mistake with Gallium Nitride</a> appeared first on <a href=""https://warontherocks.com"">War on the Rocks</a>.</p>",2026-04-21T08:00:13+00:00
