section,source,title,summary,link,published_at
Strategic Signals,The Diplomat,"India-US Relations: Too Important to Fail, Too Complicated to Trust","The killing of Indian sailors by the U.S. military adds to the web of complications, but the structural foundations haven't changed.",https://thediplomat.com/2026/06/india-us-relations-too-important-to-fail-too-complicated-to-trust/,"17 Jun 2026, 23:10"
Geopolitics,The Diplomat,Japan Is Re-engineering Its Intelligence Apparatus,The establishment of a National Intelligence Council and a National Intelligence Bureau is part of a long series of reforms and restructuring dating back to the end of World War II.,https://thediplomat.com/2026/06/japan-is-re-engineering-its-intelligence-apparatus/,"17 Jun 2026, 22:44"
Strategic Signals,The Diplomat,"Now Open, Tashiev Trial Proceeds in Kyrgyzstan",The first hearings featured a verbal argument between Tashiev and a witness and were followed by a leak of interrogation videos.,https://thediplomat.com/2026/06/now-open-tashiev-trial-proceeds-in-kyrgyzstan/,"17 Jun 2026, 23:35"
Geopolitics,The Diplomat,Chinese Surveillance Cameras Have Become a Huge Problem for India,The Ghaziabad CCTV espionage case is the logical outcome of a decade of unregulated Chinese surveillance hardware infiltrating India’s most sensitive locations.,https://thediplomat.com/2026/06/chinese-surveillance-cameras-have-become-a-huge-problem-for-india/,"17 Jun 2026, 22:17"
Strategic Signals,The Diplomat,Lee Jae-myung Caps First European Tour with G7 Appearance,South Korean President Lee Jae-myung made Korean Peninsula peace a central theme of his first trip to Europe.,https://thediplomat.com/2026/06/lee-jae-myung-caps-first-european-tour-with-g7-appearance/,"17 Jun 2026, 21:48"
Markets & Macro,The Diplomat,6 Months Into Kazakhstan’s Year of AI,"What have the national platform, AI law, and human capital programs delivered?",https://thediplomat.com/2026/06/6-months-into-kazakhstans-year-of-ai/,"17 Jun 2026, 21:40"
Strategic Signals,War on the Rocks,Macron’s Nuclear Gamble: Building a European Deterrent Faster Than French Politics Can Tear Down,"In early March, French President Emmanuel Macron stood at a windswept submarine base on the Breton coast and quietly buried four decades of French nuclear orthodoxy. The arsenal would grow. The numbers would be hidden. And for the first time, nuclear weapons that France built to defend Paris might o",https://warontherocks.com/macrons-nuclear-gamble-building-a-european-deterrent-faster-than-french-politics-can-tear-down/,"17 Jun 2026, 07:30"
Geopolitics,War on the Rocks,Three Short Tales on War Brad Carson Wants You to Read,"Editor’s Note: This is a new occasional series brought to you by War on the Rocks. If you would like to pitch your own version, please refer to the contact information and guidance on our submissions page.Every war, it seems, produces its famous novel, a book that captures not merely the tactics and",https://warontherocks.com/three-short-tales-on-war-brad-carson-wants-you-to-read/,"17 Jun 2026, 07:15"
Strategic Signals,War on the Rocks,The Fall of Fortress Singapore: Three Lessons from the Collapse of Britain’s Great Asian Bastion,"Editor’s note: This is part of a running series of essays by Iskander Rehman, entitled “Applied History,” which seeks, through the study of the history of strategy and military operations, to better illuminate contemporary defense challenges.The fall of Singapore on February 15 stupefied the Prime M",https://warontherocks.com/the-fall-of-fortress-singapore-three-lessons-from-the-collapse-of-britains-great-asian-bastion/,"16 Jun 2026, 07:30"
Geopolitics,War on the Rocks,Can Bankova Muster Political Will to Make Institutional Reforms During War?,"Welcome to The Ukraine Compass, a weekly digest of Ukrainian commentary and analysis from across the political spectrum only for War on the Rocks members. Each Monday, we bring you a curated selection of articles from Ukrainian media offering insight into how Ukrainians themselves debate the issues ",https://warontherocks.com/can-bankova-muster-political-will-to-make-institutional-reforms-during-war/,"15 Jun 2026, 17:15"
Strategic Signals,War on the Rocks,How Japan Could Co-Produce the Navy’s Future Fleet,"America’s defense industrial base cannot build the Navy out of the threat it faces. Decades of industry consolidation, persistent resource shortages, and inconsistent demand signals have delayed the production of critical vessels and munitions. With production bottlenecks stacking up, the Navy may h",https://warontherocks.com/cogs-of-war/how-japan-could-co-produce-the-navys-future-fleet/,"15 Jun 2026, 08:00"
Energy & Infrastructure,War on the Rocks,"South Korea Could Build Nuclear Submarines, But It Shouldn’t","In late May 2026, South Korean Defense Minister Ahn Gyu-back unveiled a roadmap to achieving one of Seoul’s top military acquisition goals: nuclear-powered submarines. This roadmap is heading in the wrong direction.During last month’s inaugural meeting of the Future Defense Strategy Committee, South",https://warontherocks.com/south-korea-could-build-nuclear-submarines-but-it-shouldnt/,"15 Jun 2026, 07:30"
Strategic Signals,War on the Rocks,The Gulf Arab States Need a Shield Built for Limited Trust,"Missiles, drones, and maritime disruptions do not stop at national borders. Gulf defense architecture still too often waits for national permission to act. The Gulf Cooperation Council has spent decades building defense institutions, diplomatic forums, and a language of indivisible Gulf security. Re",https://warontherocks.com/the-gulf-arab-states-need-a-shield-built-for-limited-trust/,"12 Jun 2026, 07:30"
Geopolitics,War on the Rocks,"Strike, Counterstrike, Repeat","Welcome to The Adversarial. Every other week, we’ll provide you with expert analysis on America’s greatest challengers: China, Russia, Iran, North Korea, and jihadists. Read more below.***Iran Hostilities have increased notably in the last few days, effectively ending the U.S.-Iranian truce that had",https://warontherocks.com/strike-counterstrike-repeat/,"11 Jun 2026, 20:20"
Policy & Regulation,CSIS,The Bio-Pharma Industry and Society,"The Bio-Pharma Industry and Society Listing Summary Please join the CSIS Global Health Policy Center on March 17, from 10:00am – 11:30am, for an exploration of how private bio-pharmaceutical firms can better support the critically important societal goals of improved affordability, access, quality, ",https://www.csis.org/events/bio-pharma-industry-and-society,"03 Mar 2016, 20:36"
Policy & Regulation,CSIS,The FY2017 Defense Budget and Strategic Outlook,"The FY2017 Defense Budget and Strategic Outlook Listing Summary Please join the CSIS International Security Program for a half-day Defense360 conference on the recently released FY2017 defense budget request and strategic priorities. Drupal Admin Mon, 02/29/2016 - 13:48 Featured Image Image Contribu",https://www.csis.org/events/fy2017-defense-budget-and-strategic-outlook,"29 Feb 2016, 18:48"
Policy & Regulation,CSIS,2016 U.S.-Japan Security Seminar,"2016 U.S.-Japan Security Seminar Listing Summary Michael J. Green interviews JIIA President Yoshiji Nogami Drupal Admin Fri, 02/26/2016 - 12:54 Featured Image Image Contributors Michael J. Green Programs & Projects Japan Chair Parent Geopolitics and Foreign Policy Featured Image AdobeStock_179685887",https://www.csis.org/events/2016-us-japan-security-seminar,"26 Feb 2016, 17:54"
Energy & Infrastructure,CSIS,The Future of the Grid—A View from ARPA-E,"The Future of the Grid—A View from ARPA-E Listing Summary The CSIS Energy and National Security Program is pleased to invite you to a discussion with Ellen Williams, Director of ARPA-E, the Advanced Research Projects Agency-Energy. Drupal Admin Thu, 02/25/2016 - 14:15 Featured Image Image Contributo",https://www.csis.org/events/future-grid-view-arpa-e,"25 Feb 2016, 19:15"
Geopolitics,CSIS,"Statesmen's Forum: Wang Yi, Minister of Foreign Affairs, PRC","Statesmen's Forum: Wang Yi, Minister of Foreign Affairs, PRC Listing Summary Please watch the live webcast of a discussion on Chinese foreign policy and US-China Relations Drupal Admin Fri, 02/19/2016 - 17:13 Featured Image Image Contributors John J. Hamre Christopher K. Johnson Downloads Download T",https://www.csis.org/events/statesmens-forum-wang-yi-minister-foreign-affairs-prc,"19 Feb 2016, 22:13"
Geopolitics,CSIS,"China Reality Check: China's ""Internet Sovereignty"" Initiative: Origins and Consequences","China Reality Check: China's ""Internet Sovereignty"" Initiative: Origins and Consequences Listing Summary Please join us for a discussion on China’s initiative to promote Internet sovereignty as a key governing concept of the global Internet. Drupal Admin Tue, 02/16/2016 - 11:49 Featured Image Image ",https://www.csis.org/events/china-reality-check-chinas-internet-sovereignty-initiative-origins-and-consequences,"16 Feb 2016, 16:49"
Policy & Regulation,CSIS,"Statesmen's Forum: The Right Honourable Theresa May, MP, Home Secretary, United Kingdom","Statesmen's Forum: The Right Honourable Theresa May, MP, Home Secretary, United Kingdom Listing Summary Please join the CSIS International Security Program for a discussion with UK Home Secretary Theresa May on counter-terrorism policy. Drupal Admin Fri, 02/12/2016 - 16:08 Featured Image Image Contr",https://www.csis.org/events/statesmens-forum-right-honourable-theresa-may-mp-home-secretary-united-kingdom,"12 Feb 2016, 21:08"
Strategic Signals,CSIS,Strategic Opportunities in the Indo-Asia-Pacific with Admiral Harry B. Harris,"Strategic Opportunities in the Indo-Asia-Pacific with Admiral Harry B. Harris Listing Summary Please join us for a discussion with Admiral Harry B. Harris, Commander, U.S. Pacific Command, on the Strategic Opportunities in the Indo-Asia-Pacific. Drupal Admin Tue, 01/26/2016 - 11:20 Featured Image Im",https://www.csis.org/events/strategic-opportunities-indo-asia-pacific-admiral-harry-b-harris,"26 Jan 2016, 16:20"
Geopolitics,Al Jazeera,Trump to Netanyahu: Use a ‘softer’ touch on Lebanon,US President Donald Trump has encouraged Israeli Prime Minister Benjamin Netanyahu to use a ‘softer touch’ in Lebanon.,https://www.aljazeera.com/video/newsfeed/2026/6/17/trump-to-netanyahu-use-a-softer-touch-on-lebanon?traffic_source=rss,"17 Jun 2026, 23:57"
Geopolitics,Al Jazeera,Trump says it’s ‘unfair’ for Iran to lack ballistic missiles,President Donald Trump says it’s ‘unfair’ for Iran to lack ballistic missiles if other regional countries have them.,https://www.aljazeera.com/video/newsfeed/2026/6/17/trump-says-its-unfair-for-iran-to-lack-ballistic-missiles?traffic_source=rss,"17 Jun 2026, 23:56"
Geopolitics,Al Jazeera,Diplomat confirms that US and Iran have signed MoU electronically,Foreign Ministry spokesperson Esmaeil Baghaei says the agreement has been finalised and signed with the US.,https://www.aljazeera.com/news/2026/6/17/iran-confirms-that-mou-has-been-signed-electronically-by-both-sides?traffic_source=rss,"17 Jun 2026, 23:02"
Strategic Signals,Al Jazeera,Kane double fires England past Croatia in World Cup thriller,"Harry Kane scores twice, while Jude Bellingham and Marcus Rashford also net, as England beat Croatia 4-2 in 2026 opener.",https://www.aljazeera.com/sports/2026/6/17/kane-double-fires-england-past-croatia-in-world-cup-thriller?traffic_source=rss,"17 Jun 2026, 22:19"
Geopolitics,Al Jazeera,Al Jazeera journalist reunited with family in Khartoum after years of war,Al Jazeera journalist Al-Tahir al-Mardi has been reunited with his family in Khartoum after three years of separation.,https://www.aljazeera.com/video/newsfeed/2026/6/17/al-jazeera-journalist-reunited-with-family-in-khartoum-after-years-of-war?traffic_source=rss,"17 Jun 2026, 21:34"
Geopolitics,Al Jazeera,"Huawei CFO’s admissions can be used at criminal trial, US judge rules",CFO Meng Wanzhou said in 2021 that Huawei illegally conducted business in Iran.,https://www.aljazeera.com/economy/2026/6/17/huawei-cfos-admissions-can-be-used-at-criminal-trial-us-judge-rules?traffic_source=rss,"17 Jun 2026, 21:32"
Strategic Signals,Al Jazeera,Thieves with bulldozer carry out ATM heist in 4 minutes,CCTV footage released by police shows thieves using a bulldozer to tear an ATM from the front of a bank.,https://www.aljazeera.com/video/newsfeed/2026/6/17/thieves-with-bulldozer-carry-out-atm-heist-in-4-minutes?traffic_source=rss,"17 Jun 2026, 21:11"
Strategic Signals,Al Jazeera,"Meet Yoane Wissa, who scored DR Congo’s first-ever goal at a World Cup","Wissa, who nearly lost his sight in 2021, scored a header marking DR Congo’s historic return to the World Cup.",https://www.aljazeera.com/sports/2026/6/17/meet-yoane-wissa-who-scored-dr-congos-first-ever-goal-at-a-world-cup?traffic_source=rss,"17 Jun 2026, 21:10"
Markets & Macro,ETCFO Top Stories,Foreign investors may bet big on Indian stocks after regulatory clarity emerges,"India has opened its stock markets to direct investment by foreign individuals, aiming to broaden capital sources beyond FPIs. While a long-term positive, initial inflows are expected to be slow due to operational, tax, and compliance hurdles for offshore investors navigating new procedures.",https://cfo.economictimes.indiatimes.com/news/tax-legal-accounting/foreign-investors-may-bet-big-on-indian-stocks-after-regulatory-clarity-emerges/131784936,"17 Jun 2026, 08:26"
Geopolitics,ETCFO Top Stories,India Inc. is profitable. So why isn’t it investing?,"Indian companies are making record profits, but they are not investing in new factories or infrastructure. This is creating fewer jobs and increasing inequality. Unlike China, which invests heavily, Indian businesses are hesitant. This trend risks trapping India in scarcity. Leaders must decide on a",https://cfo.economictimes.indiatimes.com/news/india-inc-is-profitable-so-why-isnt-it-investing/131757809,"16 Jun 2026, 08:16"
Strategic Signals,ETCFO Top Stories,No merit in issues flagged by ex-chair of HDFC Bank: Law firms,"The reviews were prompted by former Chairman Atanu Chakraborty's dramatic March 18 resignation, a decision he had said in a letter to the exchanges was prompted by alleged deviations 'incongruent' with his ethics and value systems. The reference to possible ethical transgressions at the country's mo",https://cfo.economictimes.indiatimes.com/news/no-merit-in-issues-flagged-by-ex-chair-of-hdfc-bank-law-firms/131757722,"16 Jun 2026, 08:11"
Energy & Infrastructure,ETCFO Top Stories,"US, Iran reach deal to end war, signing set for Friday","In a historic turnaround, the United States and Iran have reached a landmark peace agreement aimed at ending hostilities. The accord promises to lift the US blockade on Iran and will see the Strait of Hormuz reopened, a decision anticipated to bring relief to global energy markets.",https://cfo.economictimes.indiatimes.com/news/us-iran-reach-deal-to-end-war-signing-set-for-friday/131731458,"15 Jun 2026, 07:59"
Geopolitics,ETCFO Top Stories,Fable 5 shock puts sovereign AI back on India’s agenda,"US export controls on advanced AI models have spurred India's call for sovereign AI development. Industry leaders warn against reliance on foreign providers, urging a national mission for indigenous AI capabilities, similar to UPI and Aadhaar, to secure India's technological future and support local",https://cfo.economictimes.indiatimes.com/news/cfo-tech/fable-5-shock-puts-sovereign-ai-back-on-indias-agenda/131731516,"15 Jun 2026, 08:06"
Policy & Regulation,ETCFO Top Stories,Call to extend duty cuts on critical inputs soon,India is set to decide on extending customs duty relief for critical raw material imports beyond June 30. An inter-ministerial panel will review easing import curbs on key inputs and consider fresh duties on certain locally manufactured electronics. The government is also evaluating duty cut request,https://cfo.economictimes.indiatimes.com/news/policy/call-to-extend-duty-cuts-on-critical-inputs-soon/131697162,"13 Jun 2026, 09:10"
Strategic Signals,ETCFO Top Stories,India Inc CFOs : Not without AI?,"​Most CFOs are currently using AI for basic tasks such as invoice reading, document matching and accuracy checks. But the ambition is growing. Many are now exploring agentic AI, which goes beyond generating content and can execute workflows. Instead of merely reading an invoice, an AI agent could ve",https://cfo.economictimes.indiatimes.com/news/cfo-tech/india-inc-cfos-embrace-ai-the-future-of-business-efficiency/131672037,"12 Jun 2026, 08:32"
Geopolitics,ETCFO Top Stories,"Exclusive: SEBI Writes to NFRA, Seeks Examination of Rajesh Exports Auditors","Move follows market regulator's interim findings in the alleged Rs 15.15 lakh crore revenue misstatement case; audit regulator may independently examine the role of the company's statutory auditors, according to people aware of the development.",https://cfo.economictimes.indiatimes.com/news/governance-risk-compliance/sebi-seeks-nfra-investigation-into-rajesh-exports-auditors-amid-revenue-misrepresentation-claims/131623917,"10 Jun 2026, 09:07"
Markets & Macro,ETCFO Policy,"RBI infuses Rs 72,300 cr transient liquidity into banking system via VRR auctions as surplus narrows","The Reserve Bank of India injected Rs 72,300 crore into the banking system. This was done through two Variable Rate Repo auctions. The move followed a drop in surplus liquidity due to advance tax payments. Experts expect more such actions to manage liquidity. Overnight rates had risen above the RBI'",https://cfo.economictimes.indiatimes.com/news/policy/rbi-infuses-rs-72300-cr-transient-liquidity-into-banking-system-via-vrr-auctions-as-surplus-narrows/131798869,"17 Jun 2026, 18:00"
Markets & Macro,ETCFO Policy,"RBI's anti-mis-selling norms may redraw bancassurance business models, hit cross-sell revenues","The final guidelines, which will come into force from January 1, 2027, ban incentive arrangements that encourage aggressive sales practices and require banks to take responsibility for all financial products sold through their branches, digital channels, agents and outsourced partners.",https://cfo.economictimes.indiatimes.com/news/policy/rbis-anti-mis-selling-norms-may-redraw-bancassurance-business-models-hit-cross-sell-revenues/131798928,"17 Jun 2026, 17:30"
Energy & Infrastructure,ETCFO Policy,"Rupee touches six-week high on oil slump, RBI effect lingers",The Indian rupee has reached a six-week peak. This strength comes as Brent crude oil prices fall below $80 a barrel. Recent actions by the Reserve Bank of India are also supporting the currency. Investors are showing renewed interest in Indian bonds. The rupee is expected to continue its upward tren,https://cfo.economictimes.indiatimes.com/news/policy/rupee-touches-six-week-high-on-oil-slump-rbi-effect-lingers/131792991,"17 Jun 2026, 14:35"
Strategic Signals,ETCFO Policy,"Centre's disinvestment receipts poised to cross Rs 15,000 crore in the April-June quarter","The Centre's disinvestment receipts are set to cross Rs 15,000 crore in the April-June quarter of the financial year 2026-27, driven by the success of offer for sale transactions in the shares of public sector enterprises.",https://cfo.economictimes.indiatimes.com/news/news/centres-disinvestment-receipts-poised-to-cross-rs-15000-crore-in-the-april-june-quarter/131784944,"17 Jun 2026, 08:28"
Energy & Infrastructure,ETCFO Policy,"India, Canada agree to conclude free trade pact talks by year-end","India and Canada are set to finalize a free trade agreement by the end of this year. Prime Minister Narendra Modi and his Canadian counterpart Mark Carney met to strengthen bilateral ties. Discussions focused on enhancing cooperation in defense, trade, and energy sectors. Both nations aim to build a",https://cfo.economictimes.indiatimes.com/news/policy/india-canada-agree-to-conclude-free-trade-pact-talks-by-year-end/131784808,"17 Jun 2026, 08:19"
Policy & Regulation,ETCFO Policy,"Sebi Plans Buyback Via SEs Again, Easier MF Borrowing Rules",merchant banker role may be cut,https://cfo.economictimes.indiatimes.com/news/policy/sebi-plans-buyback-via-ses-again-easier-mf-borrowing-rules/131765461,"16 Jun 2026, 14:16"
Geopolitics,ETCFO Policy,"SEBI overhauls ETF trading framework, introduces dynamic price bands","The Securities and Exchange Board of India (SEBI) on Monday proposed a major overhaul of the framework governing exchange-traded funds (ETFs), introducing dynamic price bands, revised base price calculations, and new auction mechanisms to ensure ETF prices more accurately reflect the value of their ",https://cfo.economictimes.indiatimes.com/news/policy/sebi-overhauls-etf-trading-framework-introduces-dynamic-price-bands/131758282,"16 Jun 2026, 08:43"
Markets & Macro,ETCFO Policy,"SEBI likely to approve major reforms in bond markets, MFs and AIFs on June 19","India's markets regulator Securities and Exchange Board of India (SEBI) is expected to clear a package of reforms covering share buybacks, alternative investment funds, bond distribution and mutual fund liquidity at its board meeting on June 19.",https://cfo.economictimes.indiatimes.com/news/policy/sebi-likely-to-approve-major-reforms-in-bond-markets-mfs-and-aifs-on-june-19/131758280,"16 Jun 2026, 08:43"
