section,source,title,summary,link,published_at
Strategic Signals,Financial Times World,"Can the UK economy be revived? You asked, we answered",Economics leader writer Tej Parikh and economics commentator Chris Giles replied to reader questions,https://www.ft.com/content/ba0c7a8d-dab3-4e4c-ac30-9911612dc809,"28 May 2026, 16:25"
Energy & Infrastructure,Financial Times World,EU wants crisis powers to seize control of chip supplies,Chipmakers could be forced to override existing contracts under draft law,https://www.ft.com/content/9d7d6204-4fc7-4f1d-af05-473c3649efcd,"28 May 2026, 16:23"
Strategic Signals,Financial Times World,Billionaire Tilman Fertitta to buy Caesars Entertainment in $17.6bn deal,All-cash takeover will be one of the biggest gaming deals in years,https://www.ft.com/content/86b4d885-0bba-4547-832b-bb2481f3cae9,"28 May 2026, 16:03"
Markets & Macro,Financial Times World,Germany shifts on EU oversight of financial services,"Capital markets union ‘more important than clinging to national interests’, says finance minister",https://www.ft.com/content/c7507d54-768a-49ab-95e9-06ac13e94966,"28 May 2026, 15:55"
Strategic Signals,Financial Times World,The Bethlehem Project Podcast: An immigration raid divides a community,"In this first episode, we explore how an immigration raid sent a chill through the community",https://www.ft.com/content/60ce0671-a60d-4041-85a9-ec137d09ec7a,"28 May 2026, 15:27"
Energy & Infrastructure,Financial Times World,Meloni spars with defence minister over EU rearmament loans,Italian PM threatens to reject bloc’s funding unless Brussels shows more leniency on energy crisis,https://www.ft.com/content/9e929a78-b7c8-4c02-902d-78a296596448,"28 May 2026, 15:02"
Geopolitics,Financial Times World,EU to broaden import quotas and tariffs against China,"Trade defences needed to combat ‘existential’ threat to key sectors, industry commissioner Stéphane Séjourné says",https://www.ft.com/content/e28fe696-ac30-4543-a105-febc82789f87,"28 May 2026, 14:39"
Energy & Infrastructure,Financial Times World,US core PCE inflation continues to rise,"Higher inflation in April is due to energy, tariffs and AI-related spending",https://www.ft.com/content/ff56da96-fb1b-4924-9c44-b5442c531022,"28 May 2026, 14:27"
Energy & Infrastructure,Financial Times Companies,Caesars’ billionaire buyer hopes luck and leverage go hand in hand,"Fertitta’s gamble looks like a long shot, given the casino operator and Las Vegas have both been struggling",https://www.ft.com/content/427c4fb6-1eb6-4216-8f6e-36abb9813656,"28 May 2026, 17:48"
Geopolitics,Financial Times Companies,"And just like that, the software apocalypse was over",Snowflake’s stock pop demonstrates what companies must do to escape the sector downturn,https://www.ft.com/content/689ffcf5-e593-4cd1-ad99-dc0595696495,"28 May 2026, 17:18"
Geopolitics,Financial Times Companies,Iranian dissident news network received £650mn of debt relief,"Finances of UK-based broadcaster Iran International, a leading platform for opposition to regime, shored up by shareholders",https://www.ft.com/content/9d8dccaa-8a7d-452e-bdfc-786a07da5f8e,"28 May 2026, 16:52"
Markets & Macro,Financial Times Companies,SpaceX IPO boldly steps into the unknown of AI economics,We still need to learn many things about the basic business model of frontier models,https://www.ft.com/content/f757f67f-a7b4-45ec-a42e-026b986631e0,"28 May 2026, 16:51"
Energy & Infrastructure,Financial Times Companies,BP should never have made Manifold chair,The UK energy company’s board took an unwise gamble on a dominant executive,https://www.ft.com/content/bb2e4ffd-c9b1-4f8b-b7cd-66058da2d259,"28 May 2026, 14:49"
Geopolitics,The Hindu BusinessLine,"US and Iran agree to 60-day ceasefire extension, Trump approval pending","The agreement comes amid repeated claims by the Trump administration that a deal to halt hostilities is close, even as Iran has occasionally disputed or downplayed such assertions",https://www.thehindubusinessline.com/news/world/us-and-iran-agree-to-60-day-ceasefire-extension-trump-approval-pending/article71034640.ece,"28 May 2026, 22:18"
Strategic Signals,The Hindu BusinessLine,"‘All of govt’ to ensure fair NEET re-exam, CBSE Class XII evaluation",Air Force role in transporting NEET question paper mooted in high-level meet,https://www.thehindubusinessline.com/news/govt-in-damage-control-over-neet-leak-cbse-evaluation-row/article71033918.ece,"28 May 2026, 22:07"
Strategic Signals,The Hindu BusinessLine,Ashok Leyland Q4 profit rises 11% as CV volumes hit record high,"Commercial vehicle volumes, light commercial vehicle sales and exports all touched record highs, while Switch Mobility and the company’s finance businesses also delivered strong growth",https://www.thehindubusinessline.com/news/ashok-leyland-q4-profit-rises-11-as-cv-volumes-hit-record-high/article71033174.ece,"28 May 2026, 21:48"
Strategic Signals,The Hindu BusinessLine,Fearsome dinosaur-era marine reptile dubbed the T. rex of the sea,"The study, based on fossil analysis, shows that the giant mosasaur lived around 80 million years ago in an inland sea that once split North America",https://www.thehindubusinessline.com/news/science/fearsome-dinosaur-era-marine-reptile-dubbed-the-t-rex-of-the-sea/article71034560.ece,"28 May 2026, 21:46"
Strategic Signals,The Hindu BusinessLine,Editorial. Fund of options,"Third-party MF payments fine, not salary deductions",https://www.thehindubusinessline.com/opinion/editorial-fund-of-options/article71033555.ece,"28 May 2026, 21:34"
Strategic Signals,The Hindu BusinessLine,"Letters to the Editor dated May 28, 2026",,https://www.thehindubusinessline.com/opinion/letters-to-editor/article71034533.ece,"28 May 2026, 21:33"
Markets & Macro,The Hindu BusinessLine,"India’s concert economy set to cross ₹15,000 crore amid live events boom","The domestic Pro-AV and LED display markets are also witnessing steady expansion, reinforcing India’s position as a fast-growing entertainment economy",https://www.thehindubusinessline.com/economy/indias-concert-economy-set-to-cross-15000-crore-amid-live-events-boom/article71034420.ece,"28 May 2026, 21:28"
Strategic Signals,The Hindu BusinessLine,How AI is redefining the advertising ecosystem,Advertisers leveraging AI can boost return on ad spends by up to 20 per cent,https://www.thehindubusinessline.com/info-tech/how-ai-is-redefining-the-advertising-ecosystem/article71033737.ece,"28 May 2026, 21:27"
Strategic Signals,Times of India Business,US homebuyers face fresh pressure as mortgage rates climb to 9-month high,,https://timesofindia.indiatimes.com/business/international-business/us-homebuyers-face-fresh-pressure-as-mortgage-rates-climb-to-9-month-high/articleshow/131375552.cms,"28 May 2026, 23:08"
Energy & Infrastructure,Times of India Business,India’s energy investment likely to reach record $170 bn in 2026: IEA,,https://timesofindia.indiatimes.com/business/india-business/indias-energy-investment-likely-to-reach-record-170-bn-in-2026-iea/articleshow/131375007.cms,"28 May 2026, 22:54"
Strategic Signals,Times of India Business,"Reliance bets big on AI to reshape content, streaming and viewer engagement","Reliance Industries is making artificial intelligence central to its media and entertainment strategy. The company aims to drive growth across streaming, television, and digital content. AI will redefine entertainment and audience engagement. Reliance is integrating AI into core operations for effic",https://timesofindia.indiatimes.com/business/india-business/reliance-bets-big-on-ai-to-reshape-content-streaming-and-viewer-engagement/articleshow/131374404.cms,"28 May 2026, 22:08"
Energy & Infrastructure,Times of India Business,Centre plans coal gasification-based urea policy to cut gas import dependence,"India is finalizing a new policy to boost urea production using coal gasification, aiming to slash reliance on imported natural gas and enhance self-sufficiency in fertilizer. This strategic move, expected within a month, leverages domestic coal reserves to secure vital agricultural inputs and conse",https://timesofindia.indiatimes.com/business/india-business/centre-plans-coal-gasification-based-urea-policy-to-cut-gas-import-dependence/articleshow/131373019.cms,"28 May 2026, 20:38"
Energy & Infrastructure,Times of India Business,"US stock markets today (May 28, 2026): Wall Street stays near record highs despite fresh jump in oil prices","Indian markets remained steady near record highs despite rising oil prices due to Iran tensions. Strong corporate earnings, particularly from Dollar Tree and Kohl's, bolstered investor confidence. While some companies faced headwinds from higher fuel costs, others like Snowflake saw significant gain",https://timesofindia.indiatimes.com/business/international-business/us-stock-markets-today-may-28-2026-wall-street-stays-near-record-highs-despite-fresh-jump-in-oil-prices/articleshow/131372068.cms,"28 May 2026, 19:42"
Markets & Macro,Times of India Business,US GDP growth revised down to 1.6% in first quarter as consumer spending slows,,https://timesofindia.indiatimes.com/business/international-business/us-gdp-growth-revised-down-to-1-6-in-first-quarter-as-consumer-spending-slows/articleshow/131371098.cms,"28 May 2026, 18:37"
Markets & Macro,Times of India Business,"US key inflation rises to 3-year high as fuel, food costs squeeze households",,https://timesofindia.indiatimes.com/business/international-business/us-key-inflation-rises-to-3-year-high-as-fuel-food-costs-squeeze-households/articleshow/131370959.cms,"28 May 2026, 18:29"
Policy & Regulation,Times of India Business,"LIC reviews Rs 60,000 crore real estate portfolio, may explore separate subsidiary","LIC is undertaking a comprehensive review of its substantial real estate holdings, valued at over Rs 60,000 crore, to boost returns for policyholders and shareholders. The insurer is exploring options, including a potential separate subsidiary, to manage these assets more effectively. This strategic",https://timesofindia.indiatimes.com/business/india-business/lic-reviews-rs-60000-crore-real-estate-portfolio-may-explore-separate-subsidiary/articleshow/131370333.cms,"28 May 2026, 18:05"
Energy & Infrastructure,Hindustan Times India,‘Highly objectionable’: FSSAI issues notice to IRCTC over viral video of utensils being ‘washed’ in train toilet,"The Food Safety and Standards Authority of India (FSSAI) termed the act, if true, objectionable as it could lead to food contamination.",https://www.hindustantimes.com/india-news/highly-objectionable-fssai-issues-notice-to-irctc-over-viral-video-of-utensils-being-washed-in-train-toilet-101779985584173.html,"28 May 2026, 22:30"
Strategic Signals,Hindustan Times India,"5,000-10,000 infiltrators leave Bengal daily under BJP rule, says Amit Shah in Gujarat","Union home minister Amit Shah, who is on three-day visit to Gujarat, alleged that while 5,000 to 10,000 people earlier entered Bengal daily, the same number were now “going back each day”",https://www.hindustantimes.com/india-news/bengal-infiltration-trend-reversed-after-bjp-govt-formed-amit-shah-in-gujarat-101779983906499.html,"28 May 2026, 21:28"
Geopolitics,Hindustan Times India,"Myanmar President to visit India from May 30; trade, border security on agenda","Myanmar President Min Aung Hlaing will arrive in India on Saturday for a visit, his first after the formation of a new government following elections in the neighbouring country",https://www.hindustantimes.com/india-news/myanmar-president-to-visit-india-from-may-30-trade-border-security-on-agenda-101779982406150.html,"28 May 2026, 21:03"
Strategic Signals,Hindustan Times India,"In a first, Centre may use armed forces for NEET-UG re-exam logistics on June 21","The armed forces’ role would be confined to logistical coordination, secure transportation, and emergency contingencies linked to weather, not exam oversight",https://www.hindustantimes.com/india-news/centre-may-deploy-armed-forces-for-neet-ug-re-exam-on-june-21-officials-101779981326620.html,"28 May 2026, 20:45"
Strategic Signals,Hindustan Times India,Ebola scare dismissed: Gujarat Health Minister confirms negative test results,Gujarat Health Minister Praful Pansheriya on Thursday quelled public anxiety regarding a potential Ebola outbreak in the state.,https://www.hindustantimes.com/india-news/ebola-scare-dismissed-gujarat-health-minister-confirms-negative-test-results-101779978167809.html,"28 May 2026, 20:20"
Strategic Signals,Hindustan Times India,"20 years in Saudi jail, ₹34 crore blood money: Kerala man returns home after facing death sentence",Abdul Rahim was jailed for allegedly causing the accidental death of a specially-abled Saudi boy whom he was supposed to be taking care of.,https://www.hindustantimes.com/india-news/20-years-in-saudi-arabia-jail-rs-34-crore-blood-money-kerala-man-abdul-rahim-returns-home-after-facing-death-sentence-101779970270361.html,"28 May 2026, 19:31"
Geopolitics,Hindustan Times India,"India, China review border situation, discuss normalisation of ties",India and China expressed satisfaction over peace along the LAC during border talks held under the WMCC mechanism in Beijing.,https://www.hindustantimes.com/india-news/india-china-review-border-situation-discuss-normalisation-of-ties-101779976643931.html,"28 May 2026, 19:27"
Strategic Signals,Hindustan Times India,"Delhi airport, airlines issue advisory as heavy rain disrupts flight ops","Weather in Delhi: In view of unfavourable weather conditions, the Delhi airport along with airlines have issued advisory for passangers.",https://www.hindustantimes.com/india-news/delhi-weather-igi-airport-advisory-indigo-spicejet-flight-ops-hit-airlines-heavy-rain-thunderstorm-101779975113861.html,"28 May 2026, 19:21"
Strategic Signals,Indian Express Latest,BREAKING: Hardik Pandya set to lose Mumbai Indians captaincy,,https://indianexpress.com/article/sports/cricket/hardik-pandya-to-lose-mumbai-indians-captaincy-breaking-ipl-10712761/,"28 May 2026, 17:44"
Strategic Signals,Indian Express Latest,8 breathtaking pink lakes around the world,,https://indianexpress.com/article/lifestyle/destination-of-the-week/8-breathtaking-pink-lakes-around-the-world-10706777/,"28 May 2026, 17:30"
Geopolitics,Indian Express Latest,"US reaches 60-day truce ‘deal’ with Iran, but Trump approval pending: Report",,https://indianexpress.com/article/world/us-iran-60-day-ceasefire-extension-donald-trump-nuclear-talks-10712954/,"28 May 2026, 17:16"
Strategic Signals,Indian Express Latest,"‘Dushmani jam kar karo lekin…’ : Bashir Badr, poet who modernised the Urdu ghazal, passes away at 91",,https://indianexpress.com/article/books-and-literature/dushmani-jam-kar-karo-bashir-badr-urdu-ghazal-dead-91-10712958/,"28 May 2026, 17:11"
Strategic Signals,Indian Express Latest,Nhava Sheva transporters call off proposed stir after port authority meeting,,https://indianexpress.com/article/cities/mumbai/nhava-sheva-transporters-call-off-strike-jnpa-lolo-charges-container-yards-10712936/,"28 May 2026, 17:08"
Strategic Signals,Indian Express Latest,‘Nice it go so much attention’: Gukesh revisits Carlsen’s table slam one year later,,https://indianexpress.com/article/sports/chess/gukesh-revisits-magnus-carlsen-table-slam-1-year-later-10712951/,"28 May 2026, 17:02"
Strategic Signals,Indian Express Latest,"Delhi man uses AI tools to morph pictures, videos of Gujarat woman, uploads them on social media, held",,https://indianexpress.com/article/cities/ahmedabad/delhi-man-ai-morph-pictures-videos-gujarat-woman-social-media-10712944/,"28 May 2026, 16:50"
Strategic Signals,Indian Express Latest,Police arrest two from Indo-Pak border in 65 lakh jewellery theft case,,https://indianexpress.com/article/cities/mumbai/police-recover-stolen-gold-indo-pak-border-security-guards-arrested-10712935/,"28 May 2026, 16:49"
Geopolitics,SCMP Asia,"China’s BYD aims for zero accidents with ‘God’s Eye’, vows crash cost coverage","BYD, the world’s largest electric vehicle (EV) maker, has set its sights on achieving zero traffic accidents through self-developed autonomous driving technology, aiming to assemble next-generation cars affordable for mass consumers. Founder and chairman Wang Chuanfu told a press conference in Shenz",https://www.scmp.com/business/china-evs/article/3355217/chinas-byd-aims-zero-accidents-gods-eye-vows-crash-cost-coverage?utm_source=rss_feed,"28 May 2026, 14:40"
Geopolitics,SCMP Asia,Why MuleRun could be the next craze: new Alibaba AI agent platform promises safer adoption,"A new Chinese artificial intelligence agent platform is looking to replicate the “lobster craze” sparked by AI agent tool OpenClaw earlier this year, while avoiding some of the privacy and security risks associated with the open-source software. MuleRun, developed by Chinese tech giant Alibaba Group",https://www.scmp.com/tech/big-tech/article/3355175/why-mulerun-could-be-next-craze-new-alibaba-ai-agent-platform-promises-safer-adoption?utm_source=rss_feed,"28 May 2026, 13:00"
Geopolitics,SCMP Asia,ChinaAMC launches low-cost gold ETF as Hong Kong links bullion trading with blockchain,"China Asset Management (Hong Kong) launched a new gold exchange-traded fund (ETF) on Thursday, giving retail investors low-cost access to physical gold as the city pushes to link traditional financial products with digital-asset infrastructure. The ChinaAMC Digital Gold ETF, to be listed on the Hong",https://www.scmp.com/business/banking-finance/article/3355194/chinaamc-launches-low-cost-gold-etf-hong-kong-links-bullion-trading-blockchain?utm_source=rss_feed,"28 May 2026, 12:12"
Energy & Infrastructure,SCMP Asia,CATL set to boost global energy storage with world’s largest testing facility in Xiamen,"Contemporary Amperex Technology Ltd (CATL) hopes to use its energy-storage business to build on its global dominance in electric vehicle (EV) batteries, as the global oil crisis creates a surge in demand for its technologies and products. The company, which commands nearly 40 per cent of the world’s",https://www.scmp.com/business/china-business/article/3355190/catl-set-boost-global-energy-storage-worlds-largest-testing-facility-xiamen?utm_source=rss_feed,"28 May 2026, 11:30"
Strategic Signals,SCMP Asia,"HKEX revamps US$812m headquarters with new entrance, finance museum in Central","Hong Kong Exchanges and Clearing (HKEX) will revamp its HK$6.3 billion (US$812 million) headquarters in June next year, as the bourse operator upgrades its facilities in a bid to boost its competitiveness as a leading initial public offerings market and a fixed-income and commodities trading hub. Th",https://www.scmp.com/business/article/3355184/hkex-revamps-us812m-headquarters-new-entrance-finance-museum-central?utm_source=rss_feed,"28 May 2026, 10:50"
Geopolitics,SCMP Asia,"China’s MiniMax records 1-million client base, fivefold growth in half a year","Chinese artificial intelligence (AI) company MiniMax says it recorded a fivefold surge in its global enterprise and developer client base over the past six months, highlighting the sharp expansion of its international footprint, even as the Hong Kong-listed firm grapples with widening financial loss",https://www.scmp.com/tech/tech-trends/article/3355156/chinas-minimax-records-1-million-client-base-fivefold-growth-half-year?utm_source=rss_feed,"28 May 2026, 09:00"
Geopolitics,SCMP Asia,"China’s brokerage crackdown: banks cut stock forecasts for Futu, Tiger","Analysts lowered their valuations on Chinese online brokerages after Beijing unveiled a crackdown on unauthorised cross-border securities businesses, warning the tighter rules could slow profit growth and raise overseas customer acquisition costs. CCB International on Wednesday cut its target price ",https://www.scmp.com/business/markets/article/3355150/chinas-brokerage-crackdown-banks-cut-stock-forecasts-futu-tiger?utm_source=rss_feed,"28 May 2026, 08:00"
Energy & Infrastructure,SCMP Asia,Gold continues decline as inflation fears outweigh hope of end to Iran war,"Gold extended its downturn despite rising hopes for a diplomatic solution to Middle East tensions, as investors priced in a sticky inflationary trend that is being driven by the continued disruption of energy supplies and the resilience of the US economy. The price of the precious metal has dropped ",https://www.scmp.com/business/china-business/article/3355136/gold-continues-decline-inflation-fears-outweigh-hopes-end-iran-war?utm_source=rss_feed,"28 May 2026, 06:23"
Geopolitics,Foreign Policy,The Iran War Has Only Worsened Sudan’s Conflict,The country is uniquely vulnerable to regional shocks.,https://foreignpolicy.com/2026/05/28/sudan-iran-war-gulf-proxy-ripple-effects-peace-talks-quad/,"28 May 2026, 17:13"
Strategic Signals,Foreign Policy,Erdogan Is Forcibly Designing His Own Opposition,Turkey is moving from repressing the opposition to reshaping it.,https://foreignpolicy.com/2026/05/28/erdogan-turkey-opposition-chp-imamoglu-kilicdaroglu-ozel-istanbul-ankara/,"28 May 2026, 16:57"
Strategic Signals,Foreign Policy,Cubans Abandon the American Dream,"As conditions on the island worsen, people are leaving—just not for the United States.",https://foreignpolicy.com/2026/05/28/cuba-migration-us-trump-brazil-mexico-uruguay/,"28 May 2026, 16:23"
Strategic Signals,Foreign Policy,Bibi’s Manichean Politics,"Over three decades, Netanyahu’s pivot to divisive electioneering has paid off.",https://foreignpolicy.com/2026/05/28/netanyahu-israel-elections-terrorism-gaza-democracy/,"28 May 2026, 15:00"
Energy & Infrastructure,Foreign Policy,The Madman Strikes Back,Nixon’s theory on the power of unpredictability didn’t account for an actual madman adversary.,https://foreignpolicy.com/2026/05/28/trump-madman-theory-iran/,"28 May 2026, 13:50"
Energy & Infrastructure,Foreign Policy,Friedrich Merz Doesn’t Understand the EU,Germany’s chancellor keeps complaining about the source of the continent’s power.,https://foreignpolicy.com/2026/05/28/merz-germany-eu-brussels-regulation-leyen/,"28 May 2026, 13:48"
Geopolitics,Foreign Policy,Trump Should Just Admit He Screwed Up,The Iran war was obviously a mistake. Why not say so?,https://foreignpolicy.com/2026/05/28/trump-iran-war-mistake-admit/,"28 May 2026, 13:41"
Strategic Signals,Foreign Policy,Can the U.S. End Nigeria’s Insurgency?,"Despite recent successful strikes, experts doubt the campaign’s long-term success.",https://foreignpolicy.com/2026/05/27/us-nigeria-joint-strikes-military-insurgency-boko-haram-iswap-security-africa/,"27 May 2026, 22:30"
Strategic Signals,The Diplomat,ICC Announces November 30 as Start Date for Trial of Former Philippine President,Rodrigo Duterte faces three counts of crimes against humanity involving the murders of at least ⁠76 people during violent anti-drug crackdowns.,https://thediplomat.com/2026/05/icc-announces-november-30-as-start-date-for-trial-of-former-philippine-president/,"28 May 2026, 10:09"
Geopolitics,The Diplomat,The Strategic Corridor Turning Singapore Into China’s Indispensable Partner,Beijing’s New International Land-Sea Trade Corridor is emerging as a strategic supply line for Beijing – and Singapore helped design it.,https://thediplomat.com/2026/05/the-strategic-corridor-turning-singapore-into-chinas-indispensable-partner/,"28 May 2026, 12:56"
Geopolitics,The Diplomat,Singaporean Foreign Minister Winds Up Working Visit to North Korea,"The visit, which coincided with the 50th anniversary of relations between the two countries, came as part of a tour that also included stops in China and South Korea.",https://thediplomat.com/2026/05/singaporean-foreign-minister-winds-up-working-visit-to-north-korea/,"28 May 2026, 09:38"
Strategic Signals,The Diplomat,Where Does Bangladesh’s Once Dominant Awami League Stand Today?,"The former ruling party, once a mainstay of Bangladeshi politics, has largely disappeared from public political life. But its leaders remain defiant.",https://thediplomat.com/2026/05/where-does-bangladeshs-once-dominant-awami-league-stand-today/,"28 May 2026, 01:31"
Geopolitics,The Diplomat,A Textbook Debate: Why Russian Historians Told Kyrgyz Historians to Ditch the Term ‘Colonialism’,"If legitimacy is tied to history, then exactly how that history is interpreted matters beyond conference rooms packed with historians.",https://thediplomat.com/2026/05/a-textbook-debate-why-russian-historians-told-kyrgyz-historians-to-ditch-the-term-colonialism/,"28 May 2026, 02:25"
Geopolitics,The Diplomat,What’s Driving Anti-Qing Sentiment in Contemporary China?,A patriotic film backfired because a growing number of Han Chinese don’t see the Manchu-origin Qing dynasty as a part of their history.,https://thediplomat.com/2026/05/whats-driving-anti-qing-sentiment-in-contemporary-china/,"27 May 2026, 23:58"
Geopolitics,The Diplomat,China’s Rise and the Challenge to US Maritime Security,Insights from James R. Holmes.,https://thediplomat.com/2026/05/chinas-rise-and-the-challenge-to-us-maritime-security/,"27 May 2026, 23:29"
Strategic Signals,The Diplomat,"Understanding Cambodia’s Scam Economy, with Jacob Sims","The scam economy is an industrialized system that merges cyber fraud with human trafficking and money laundering, all thriving under political protection.",https://thediplomat.com/2026/05/understanding-cambodias-scam-economy-with-jacob-sims/,"28 May 2026, 02:08"
Geopolitics,War on the Rocks,What Would Relations with Post-War Russia Look Like?,"Rose Gottemoeller joined Ryan in Washington. They discussed how the West might think about relations with Russia once the war with Ukraine ends, as well as nuclear diplomacy and other critical issues. Gottemoeller was the deputy secretary general of NATO and, before that, served as a senior State De",https://warontherocks.com/what-would-relations-with-post-war-russia-look-like/,"28 May 2026, 16:00"
