section,source,title,summary,link,published_at
Geopolitics,Financial Times World,FirstFT: Trump declares US-Iran ceasefire ‘over’,Also in today’s newsletter: Italy’s UniCredit close to securing control of Germany’s Commerzbank and Japan’s borrowing costs hit a 30-year high,https://www.ft.com/content/5f6b653e-2016-48a8-a5c9-8b32eb709f62,"08 Jul 2026, 10:12"
Strategic Signals,Financial Times World,Family behind top US egg producer reaped $320mn after price surge,Descendants of Cal-Maine founder sold controlling stake near a record high after what authorities said was an effort to rig the market,https://www.ft.com/content/b3244fb3-6d23-4805-8f0c-60cda7e9969f,"08 Jul 2026, 10:00"
Strategic Signals,Financial Times World,Apple to buy $30bn of US-made chips from Broadcom,iPhone maker continues its attempt to curry favour with Donald Trump via investments in Colorado plant,https://www.ft.com/content/1bc10dd1-2aac-472d-b3d8-b76a83fb4abf,"08 Jul 2026, 10:00"
Strategic Signals,Financial Times World,"Nigel Farage’s rivals are ‘running scared’, says Reform",Senior figures dismiss claims that decision to call by-election in Clacton seat has backfired,https://www.ft.com/content/13ea13b7-b4f7-4ac9-82a0-47778c31a05e,"08 Jul 2026, 09:57"
Strategic Signals,Financial Times World,UniCredit secures 48% stake in Commerzbank,Italian bank closing in on majority control of German lender after end of tender period,https://www.ft.com/content/aa19cfe8-92a8-46f6-9395-60bb3ec66927,"08 Jul 2026, 09:36"
Markets & Macro,Financial Times World,Outspoken Chinese economist who doubted official GDP data dies,Gao Shanwen lauded by online commenters as ‘truth teller’ in country known for strict censorship,https://www.ft.com/content/e201f9f4-e3b2-4c59-8300-e50e9310a554,"08 Jul 2026, 09:03"
Strategic Signals,Financial Times World,Re-election would not put Farage in the clear,Opposition parties refuse to stand against scandal-hit politician in Reform’s safest seat of Clacton,https://www.ft.com/content/e5d9a138-22df-4919-af3b-3f4ed8bc9297,"08 Jul 2026, 07:56"
Geopolitics,Financial Times World,US and Iran trade strikes after attacks on tankers,Donald Trump says he thinks ceasefire deal with Tehran is ‘over’ after round of tit-for-tat bombing,https://www.ft.com/content/c7dac217-4a77-4640-9aa4-17ae7b0d5c0c,"08 Jul 2026, 07:49"
Strategic Signals,Financial Times Companies,The Newton’s Cradle of credit today,‘Technicals have not merely supported fundamental pricing this cycle — they have displaced it’,https://www.ft.com/content/a109cf2e-22ed-447f-b9a1-460358e38d9c,"08 Jul 2026, 10:21"
Strategic Signals,Financial Times Companies,The male wellness guide to peptides,"Injectable amino acids are being used for muscle gain, sexual health and skin tanning — but the benefits are questionable",https://www.ft.com/content/4417cf18-d8cd-4ccc-9745-e728e8d69348,"08 Jul 2026, 10:19"
Strategic Signals,Financial Times Companies,Tesco explores sale of European business,Disposal would refocus UK’s biggest grocer on home market and end decades-long attempt to build major global operation,https://www.ft.com/content/0f3ba8c7-eb96-4c18-a274-b8f8609b8f0c,"08 Jul 2026, 09:49"
Geopolitics,The Hindu BusinessLine,India seeks safe passage for nine ships as Hormuz truce falters,The government is closely monitoring the vessels as renewed attacks around the Strait of Hormuz threaten an already fragile interim ceasefire between the US and Iran,https://www.thehindubusinessline.com/economy/logistics/india-seeks-safe-passage-for-nine-ships-as-hormuz-truce-falters/article71197810.ece,"08 Jul 2026, 17:07"
Markets & Macro,The Hindu BusinessLine,Broker’s Call: Minda Corp (Buy),Monarch Networth Capital,https://www.thehindubusinessline.com/markets/brokers-call-minda-corp-buy/article71197446.ece,"08 Jul 2026, 17:01"
Energy & Infrastructure,The Hindu BusinessLine,Sun Mobility t3-55T electric trucks with world’s first modular battery swapping at Pravaas 5.0,"Unlike passenger cars, commercial vehicles are judged primarily on operating economics rather than technology. Sun Mobility is betting that battery swapping can tip that equation by cutting upfront vehicle costs, reducing charging downtime and creating a shared energy network that multiple truck and",https://www.thehindubusinessline.com/companies/sun-mobility-t3-55t-electric-trucks-with-worlds-first-modular-battery-swapping-at-pravaas-50/article71195227.ece,"08 Jul 2026, 17:00"
Policy & Regulation,The Hindu BusinessLine,EPFO processing interest payment on provident funds for FY26; members can check updates by next week,"Last month, the government approved the 8.25% interest payment on provident funds",https://www.thehindubusinessline.com/news/epfo-processing-interest-payment-on-provident-funds-for-fy26-members-can-check-updates-by-next-week/article71197849.ece,"08 Jul 2026, 17:00"
Strategic Signals,The Hindu BusinessLine,MAHE and Novo Nordisk GBS expand collaboration in pharmacometrics,"Novo Nordisk GBS will provide financial support of ₹1.75 crore over five years to enhance specialised talent development, research capacity and advanced infrastructure in quantitative drug development.",https://www.thehindubusinessline.com/news/education/mahe-and-novo-nordisk-gbs-expand-collaboration-in-pharmacometrics/article71197839.ece,"08 Jul 2026, 16:58"
Strategic Signals,The Hindu BusinessLine,"ISMA defends E20 fuel, silent on mileage drop","Sugar industry body says concerns over ethanol-blended fuel are driven by misinformation, not evidence.",https://www.thehindubusinessline.com/economy/agri-business/isma-defends-e20-fuel-silent-on-mileage-drop/article71197751.ece,"08 Jul 2026, 16:56"
Geopolitics,The Hindu BusinessLine,GJEPC prepares ground for FTA with UK from July 15,GJEPC estimates that India’s gem and jewellery exports to the UK can more than triple from $2.5 billion to $7 billion over the coming years on the back of bilateral trade,https://www.thehindubusinessline.com/news/gjepc-prepares-ground-for-fta-with-uk-from-july-15/article71197621.ece,"08 Jul 2026, 16:55"
Strategic Signals,The Hindu BusinessLine,BioCompute enlarges funding plan for DNA storage,BioCompute's proposition is an attempt to rethink how the world's rapidly growing digital data is archived,https://www.thehindubusinessline.com/news/biocompute-enlarges-funding-plan-for-dna-storage/article71197432.ece,"08 Jul 2026, 16:54"
Strategic Signals,Times of India Business,Income tax notices decoded: What every taxpayer should know about ITR filing to avoid scrutiny,"One important thing to understand is this: In the current compliance environment, tax notices are increasingly driven by data inconsistencies rather than intent. A tax notice can not only mean a process of explaining discrepancies but can also put any refund claims on hold till the matter is resolve",https://timesofindia.indiatimes.com/business/india-business/income-tax-notices-decoded-what-every-taxpayer-should-know-about-itr-filing-to-avoid-scrutiny/articleshow/132260233.cms,"08 Jul 2026, 16:31"
Strategic Signals,Times of India Business,"Are Indians swiping less? Credit card story has grown bigger, user base hasn’t","India's credit card market has grown significantly over the past decade. However, credit card penetration remains low compared to global benchmarks. Younger consumers and semi-urban areas now show increased credit card ownership. Credit cards now face competition from digital payment methods like UP",https://timesofindia.indiatimes.com/business/india-business/are-indians-swiping-less-credit-card-story-has-grown-bigger-user-base-hasnt/articleshow/132260484.cms,"08 Jul 2026, 16:04"
Strategic Signals,Times of India Business,"New EPFO portal: Faster claims, smarter processing & more — what changes for PF members",The Employees Provident Fund Organisation has completed its portal migration and restored online services. Members can now benefit from automated claim pre-validation and upfront error flagging. The new system offers a unified dashboard for viewing all membership details and balances. Interest credi,https://timesofindia.indiatimes.com/business/india-business/new-epfo-portal-claims-to-get-faster-smarter-processing-more-what-changes-for-pf-members/articleshow/132258532.cms,"08 Jul 2026, 15:07"
Geopolitics,Times of India Business,"Stock market crash: Bloodbath on Dalal Street! Sensex, Nifty50 tank 2% as Trump declares end of truce with Iran - top reasons for sharp fall","Stock market crash: Selling pressure gathered pace during the second half of the session after US President Donald Trump declared that the interim agreement with Iran to end the conflict was ""over,"" reigniting fears of further escalation in the Middle East.",https://timesofindia.indiatimes.com/business/india-business/stock-market-crash-bloodbath-on-dalal-street-sensex-nifty50-tank-2-as-trump-declares-end-of-truce-with-iran-top-reasons-for-sharp-fall/articleshow/132258582.cms,"08 Jul 2026, 14:25"
Energy & Infrastructure,Times of India Business,"Amid E20 petrol debate, why oil marketing companies are not too keen to expand E85 rollout","Automobiles manufactured between 2012 and March 2023 were designed to run on fuel containing up to 10% ethanol, while vehicles produced before April 2025 are not fully compatible with E20 blends either.",https://timesofindia.indiatimes.com/business/india-business/amid-e20-petrol-debate-why-oil-marketing-companies-are-not-to-keen-to-expand-e85-rollout/articleshow/132257629.cms,"08 Jul 2026, 13:52"
Geopolitics,Times of India Business,Fresh Trump tariff threat looms: India’s strong stand on US Section 301 probe that proposes 12.5% duties - explained,"According to policymakers and trade experts, the pace of the investigation suggests that the US may replace the existing 10% tariff, which remains in force until July 24, with the proposed forced labour-related tariff. The United States Trade Representative (USTR) has advanced one of its two investi",https://timesofindia.indiatimes.com/business/india-business/fresh-trump-tariff-threat-looms-indias-strong-stand-on-us-section-301-probe-that-proposes-12-5-duties-explained/articleshow/132255636.cms,"08 Jul 2026, 12:12"
Energy & Infrastructure,Times of India Business,"Rupee erases previous gains, tumbles 20 paise against US dollar","The Indian rupee opened weaker against the US dollar on Wednesday. Rising crude oil prices and geopolitical events impacted currency markets. The dollar index strengthened, and Brent crude futures climbed significantly. Domestic stock markets also mirrored this cautious sentiment, opening lower. For",https://timesofindia.indiatimes.com/business/india-business/rupee-erases-previous-gains-tumbles-20-paise-against-us-dollar/articleshow/132254044.cms,"08 Jul 2026, 10:34"
Markets & Macro,Times of India Business,"Top stocks to buy today: Stock recommendations for July 8, 2026 - check list","Stock market recommendations: Hero MotoCorp, Tata Steel are the top stocks to buy recommended by Mehul Kothari, DVP - Technical Research at Anand Rathi Shares for July 7, 2026. He also recommends buying Nippon India ETF Nifty IT (ITBEES).",https://timesofindia.indiatimes.com/business/india-business/top-stock-recommendations-for-july-08-2026-hero-motocorp-tata-steel-nippon-india-etf-nifty-it-itbees-best-stocks-to-buy-today/articleshow/132242782.cms,"08 Jul 2026, 08:11"
Strategic Signals,Hindustan Times India,"‘Paper sold for ₹2.25 lakh’: After NEET, Rahul alleges UGC-NET Sociology paper leak, claims ‘90 questions matched’","A response from the National Testing Agency (NTA), which conducts the UGC NET exam, is awaited.",https://www.hindustantimes.com/india-news/paper-sold-for-rs-2-25-lakh-after-neet-rahul-gandhi-alleges-ugc-net-sociology-paper-leak-claims-90-questions-matched-101783506823879.html,"08 Jul 2026, 16:41"
Strategic Signals,Hindustan Times India,Nagpur airport to get multi-phase upgrade; ₹300cr investment in first phase,"As part of the first phase, GMR Airports will invest about ₹300 crore over the next 12 to 18 months to modernise the existing airport",https://www.hindustantimes.com/india-news/nagpur-airport-to-get-multi-phase-upgrade-rs-300cr-investment-in-first-phase-101783507902027.html,"08 Jul 2026, 16:21"
Strategic Signals,Hindustan Times India,‘Got what he deserved’: Mother of Baruipur rape-murder accused refuses to ‘see his face’ after son killed in ‘encounter’,The accused died in an alleged encounter after he “snatched a firearm from a policeman and tried to escape from custody”.,https://www.hindustantimes.com/india-news/got-what-he-deserved-mother-of-baruipur-rape-murder-accused-refuses-to-see-his-face-after-son-killed-in-encounter-101783502789501.html,"08 Jul 2026, 16:11"
Strategic Signals,Hindustan Times India,Goa wants to curb rental Thars: Why SUVs aren't able to outrun reckless-driving perception,"Minister's remark revives a debate that goes beyond one vehicle. Here's what studies say about SUVs, status and risky driving.",https://www.hindustantimes.com/india-news/goa-wants-to-curb-rental-thars-why-suvs-are-not-able-to-outrun-reckless-driving-perception-101783504590338.html,"08 Jul 2026, 15:51"
Strategic Signals,Hindustan Times India,'Case against Dada is completely false': Pregnant patient's family defends Shiv Sena corporator in hospital assault row,The patient's mother claimed doctors refused to treat her daughter despite repeated pleas.,https://www.hindustantimes.com/india-news/case-against-dada-is-completely-false-pregnant-patients-family-defends-shiv-sena-corporator-in-hospital-assault-row-101783502207890.html,"08 Jul 2026, 15:41"
Strategic Signals,Hindustan Times India,"Govt issues draft notification to bring iron, steel sectors under CCTS","The proposed rules expand the scope of CCTS, notified in 2023, which covers sectors such as aluminium, cement, petroleum refineries and textiles",https://www.hindustantimes.com/india-news/govt-issues-draft-notification-to-bring-iron-steel-sectors-under-ccts-101783505322132.html,"08 Jul 2026, 15:38"
Strategic Signals,Hindustan Times India,16 feared trapped as civic building collapses in Pune's Pimpri Chinchwad,"The building that collapsed in Pimpri Chinchwad is situated in the premises of legacy waste dumping yard, officials said.",https://www.hindustantimes.com/india-news/16-feared-trapped-civic-building-collapses-in-punes-pimpri-chinchwad-garbage-mound-101783504023517.html,"08 Jul 2026, 15:27"
Strategic Signals,Hindustan Times India,‘Welcome to UP 2.0’: TMC MPs slam Bengal govt's 'jungle law' after Baruipur rape-murder accused's encounter killing,"Prabhas Mondal, the prime suspect in the rape and murder of a 12-year-old girl in Baruipur, in South 24 Parganas, was killed in an encounter, earlier today.",https://www.hindustantimes.com/india-news/baruipur-rape-murder-welcome-to-up-jungle-law-tmc-mps-mahua-moitra-slam-bengal-govt-accused-encounter-killing-cm-suvendu-101783500304895.html,"08 Jul 2026, 15:15"
Strategic Signals,Indian Express Latest,"“I regret altercation, but didn’t hit woman doctor”: Shiv Sena corporator on Thane hospital assault",,https://indianexpress.com/article/cities/mumbai/kdmc-hospital-assault-shiv-sena-corporator-ramesh-mhatre-statement-10777513/,"08 Jul 2026, 11:40"
Strategic Signals,Indian Express Latest,Rs 35-crore haul: What raid on retired UP transport officer’s home uncovered,,https://indianexpress.com/article/cities/lucknow/35-crore-haul-what-raid-on-retired-up-transport-officer-lalit-kumar-home-uncovered-10777461/,"08 Jul 2026, 11:39"
Strategic Signals,Indian Express Latest,Karnataka police constable dies by suicide during D K Shivakumar’s visit,,https://indianexpress.com/article/cities/bangalore/karnataka-police-constable-dies-by-suicide-kalaburagi-duty-d-k-shivakumar-10777460/,"08 Jul 2026, 11:38"
Strategic Signals,Indian Express Latest,Indira Point: Why Centre wants to protect landmark lighthouse and develop tourism hub,,https://indianexpress.com/article/explained/indira-point-protection-works-lighthouse-great-nicobar-10777453/,"08 Jul 2026, 11:38"
Geopolitics,Indian Express Latest,‘I nearly hate doing’: Ankur Warikoo on why he’s taken cold showers for 4 years,,https://indianexpress.com/article/lifestyle/health/ankur-warikoo-cold-shower-shock-proteins-expert-10764680/,"08 Jul 2026, 11:30"
Strategic Signals,Indian Express Latest,"Customer orders size 8 shoes online gets size 7, wins consumer payout",,https://indianexpress.com/article/legal-news/customer-orders-size-8-shoes-online-size-7-wins-consumer-payout-10775733/,"08 Jul 2026, 11:30"
Strategic Signals,Indian Express Latest,Kareena Kapoor gushes over ‘hot husband’ Saif Ali Khan during summer vacation,,https://indianexpress.com/article/entertainment/bollywood/kareena-kapoor-gushes-over-hot-husband-saif-ali-khan-during-summer-vacation-10777355/,"08 Jul 2026, 11:28"
Strategic Signals,Indian Express Latest,"TTE ‘illegally’ occupies passenger’s seat, Southern Railway ordered to pay Rs 60,000",,https://indianexpress.com/article/legal-news/tte-occupies-passenger-seat-southern-railway-ordered-pay-rs-60000-10777441/,"08 Jul 2026, 11:24"
Markets & Macro,SCMP Asia,Hong Kong IPO debut delayed in rare move over missing regulatory data: sources,"Hong Kong witnessed a rare delay of an initial public offering (IPO) debut on Wednesday, the first in more than eight months, triggered by a regulatory requirement for additional client information, according to people familiar with the matter. On Tuesday night, just before its scheduled listing on ",https://www.scmp.com/business/markets/article/3359860/hong-kong-ipo-debut-delayed-rare-move-over-missing-regulatory-data?utm_source=rss_feed,"08 Jul 2026, 10:00"
Markets & Macro,SCMP Asia,China further boosts Hong Kong’s role as offshore yuan hub,"China’s central bank announced more measures to expand Hong Kong’s role as an offshore yuan hub, injecting “vitality” into the city’s markets and supporting efforts to grow international use of the currency. Institutions in mainland China would be able to buy a net 800 billion yuan (US$118 billion) ",https://www.scmp.com/plus/business/banking-finance/article/3359848/china-further-boosts-hong-kongs-role-offshore-yuan-hub?utm_source=rss_feed,"08 Jul 2026, 09:11"
Geopolitics,SCMP Asia,Are the US’ AI models better than China’s? That may be beside the point,"As another heatwave rolled across Europe, the warehouses emptied before the politics could catch up. Air conditioners and fans sold out across Spain, Italy and Germany, most of them Chinese. Fan sales in Spain alone on the retail platform of Alibaba Group Holding (which owns the South China Morning ",https://www.scmp.com/opinion/china-opinion/article/3359364/are-us-ai-models-better-chinas-may-be-beside-point?utm_source=rss_feed,"08 Jul 2026, 08:30"
Markets & Macro,SCMP Asia,BYD challenges Porsche’s 911 with launch of electric supercar in Europe,"Chinese electric vehicle (EV) assembler BYD has set its sights on Porsche’s supercars with plans to sell its Denza-branded new models in developed markets, the latest sign of its increasing heft in designing and manufacturing premium vehicles. The Shenzhen-based carmaker planned to unveil the Denza ",https://www.scmp.com/business/china-business/article/3359827/byd-challenges-porsches-911-launch-electric-supercar-europe?utm_source=rss_feed,"08 Jul 2026, 08:00"
Geopolitics,SCMP Asia,Beyond the Noise: How Quality Journalism Drives Real-World Influence,"Business and marketing leaders gathered on a late-June afternoon in Hong Kong at the South China Morning Post’s The Lede Summit, which focused on how quality journalism resonates with decision-makers and drives measurable impact. The summit was preceded by two exclusive sessions earlier in the day: ",https://www.scmp.com/presented/business/topics/remarketing/article/3359552/beyond-noise-how-quality-journalism-drives-real-world-influence?utm_source=rss_feed,"08 Jul 2026, 07:54"
Energy & Infrastructure,SCMP Asia,BYD surpasses Tesla in global race; ‘do-or-die’ crisis in China’s market: 7 EV reads,"We have put together stories from our coverage on electric and new energy vehicles from the past two weeks to help you stay informed. If you would like to see more of our reporting, please consider subscribing. 1. China’s BYD surpasses Tesla to regain lead in global EV race China’s electric vehicle ",https://www.scmp.com/business/china-evs/article/3359708/byd-surpasses-tesla-global-race-do-or-die-crisis-chinas-market-7-ev-reads?utm_source=rss_feed,"08 Jul 2026, 07:30"
Markets & Macro,SCMP Asia,Mainland Chinese tech firms find more than just deep capital pools in Hong Kong,"Mainland Chinese technology companies newly listed on Hong Kong’s stock exchange are deepening their engagement with the city, tapping not only its capital markets but also its global connectivity to refine products, forge international partnerships and expand overseas, according to executives. For ",https://www.scmp.com/tech/tech-trends/article/3359826/mainland-tech-firms-find-more-just-deep-capital-pools-hong-kong?utm_source=rss_feed,"08 Jul 2026, 07:00"
Geopolitics,SCMP Asia,China’s biotech firms challenge US with rapidly developing RAS-targeted cancer therapies,When the shares of Revolution Medicines surged after the US biotech firm unveiled a landmark result – its drug nearly doubled the overall survival for late-stage pancreatic cancer patients to 13.2 months – investment banks and scientists flagged that the company’s Chinese rivals racing to target the,https://www.scmp.com/business/china-business/article/3359811/chinas-biotech-firms-challenge-us-rapidly-developing-ras-targeted-cancer-therapies?utm_source=rss_feed,"08 Jul 2026, 06:00"
Strategic Signals,Foreign Policy,Marco Rubio Burned Down the House to Fix a Sink,The secretary of state must be seen as the chief architect of the Trump administration’s assault on the rules-based order.,https://foreignpolicy.com/2026/07/08/marco-rubio-secretary-state-trump-administration-human-rights/,"08 Jul 2026, 10:00"
Strategic Signals,Foreign Policy,The Philippines’ ‘Trial of the Century’ Begins,A pall of cynicism hangs over proceedings against Vice President Sara Duterte.,https://foreignpolicy.com/2026/07/08/the-philippines-trial-of-the-century-begins/,"08 Jul 2026, 07:00"
Strategic Signals,Foreign Policy,Explosions in Damascus Won’t Shake Macron’s Faith in Sharaa,France remains committed to bolstering cooperation with Syria.,https://foreignpolicy.com/2026/07/07/explosions-damascus-syria-sharaa-macron-france-investment/,"07 Jul 2026, 21:55"
Strategic Signals,Foreign Policy,The Myth of Chinese Birth Tourism,The United States has recast a small industry as a national security threat.,https://foreignpolicy.com/2026/07/07/china-us-birth-tourism-immigration-citizenship/,"07 Jul 2026, 21:14"
Strategic Signals,Foreign Policy,NATO Goes Shopping,Alliance members tout defense investments to try to head off Trump’s complaints.,https://foreignpolicy.com/2026/07/07/nato-summit-trump-rutte-ankara-defense-spending/,"07 Jul 2026, 21:11"
Strategic Signals,Foreign Policy,Xi Is Defining History on His Own Terms,The language of the “new era” leaves real reform behind.,https://foreignpolicy.com/2026/07/07/xi-mao-deng-china-history-new-era/,"07 Jul 2026, 20:08"
Geopolitics,Foreign Policy,Taiwan Believes Japan Will Help Defend Against China,Opinion polling shows that trust in Tokyo is surprisingly deep.,https://foreignpolicy.com/2026/07/07/china-taiwan-japan-invasion-polling/,"07 Jul 2026, 18:46"
Strategic Signals,Foreign Policy,How Trump Lost America the World Cup,"A host is supposed to harvest the world’s goodwill, not burn it.",https://foreignpolicy.com/2026/07/07/folarin-balogun-world-cup-red-card-trump-infantino-fifa/,"07 Jul 2026, 17:10"
Geopolitics,The Diplomat,Not Just Rare Earths – Is This China’s Next Economic Weapon?,China’s dominance in the entire fluorine value chain is an overlooked source of geopolitical leverage.,https://thediplomat.com/2026/07/not-just-rare-earths-is-this-chinas-next-economic-weapon/,"07 Jul 2026, 23:42"
Geopolitics,The Diplomat,Whither an International Response to China’s Ethnic Unity Law?,"The conventional tools previously used to penalize China for its rights abuses – sanctions, public pressure, condemnation, institutional mechanisms, and more – have all been blunted.",https://thediplomat.com/2026/07/whither-an-international-response-to-chinas-ethnic-unity-law/,"07 Jul 2026, 23:20"
Energy & Infrastructure,The Diplomat,China’s Submarine-launched Ballistic Missile Test Was a Message to the Pacific,"The list of countries notified in advance, as well as the timing, suggests that China’s purpose was not merely a straightforward display of military power.",https://thediplomat.com/2026/07/chinas-submarine-launched-ballistic-missile-test-was-a-message-to-the-pacific/,"07 Jul 2026, 22:41"
Geopolitics,The Diplomat,"As the Dalai Lama Turns 91, India and China Are Fighting for the Future of Buddhism",With the revered Tibetan leader over 90 years old the rivalry between New Delhi and Beijing over who speaks for the Buddhist world is entering its most consequential phase.,https://thediplomat.com/2026/07/as-the-dalai-lama-turns-91-india-and-china-are-fighting-over-the-future-of-buddhism/,"07 Jul 2026, 22:05"
Strategic Signals,The Diplomat,From Partnership to Union: Australia and Fiji Sign 2 New Security Agreements,"With the Vuvale Union and the Veitacini Treaty, Canberra and Suva chart a new course for regional security.",https://thediplomat.com/2026/07/from-partnership-to-union-australia-and-fiji-sign-2-new-security-agreements/,"07 Jul 2026, 22:01"
