section,source,title,summary,link,published_at
Policy & Regulation,The Diplomat,"Czech-Taiwan Ties Are Cooling in Rhetoric, Not Reality","Czechia’s new government has changed its tone on Taiwan, but left most of the substance of the relationship intact.",https://thediplomat.com/2026/07/czech-taiwan-ties-are-cooling-in-rhetoric-not-reality/,"03 Jul 2026, 02:16"
Strategic Signals,The Diplomat,"Despite Chinese Mediation Efforts, Taliban-Pakistan Conflict Continues With New Strikes",The rupture between Afghanistan’s Taliban and their erstwhile allies in Pakistan continues to cause suffering on both sides of the border.,https://thediplomat.com/2026/07/despite-chinese-mediation-efforts-taliban-pakistan-conflict-continues-with-new-strikes/,"03 Jul 2026, 02:27"
Geopolitics,The Diplomat,What the ‘Mother of All Trade Deals’ Learned From the India-ASEAN FTA,India has spent the last 16 years paying for its trade deal with ASEAN. The India-EU FTA would not repeat those mistakes.,https://thediplomat.com/2026/07/what-the-mother-of-all-trade-deals-learned-from-the-india-asean-fta/,"03 Jul 2026, 00:00"
Strategic Signals,War on the Rocks,"Happy 250th Birthday, America!","Editor’s Note: Few rivalries in American history have been as consequential — or as personal — as the one between John Adams and Thomas Jefferson. The two men could hardly have been more different. Adams, the stocky and combative Massachusetts lawyer, was blunt to a fault and quick to suspicion. Jef",https://warontherocks.com/happy-250th-birthday-america/,"04 Jul 2026, 07:30"
Geopolitics,War on the Rocks,The Integrated Circuit and the Future of AI Leadership,"Editor’s note: This is the first article in a limited series celebrating American defense technologies born from wartime and their effects on broader national security, politics, and society. This series will run for several weeks to commemorate America’s 250th anniversary, and winners will be selec",https://warontherocks.com/cogs-of-war/the-integrated-circuit-and-the-future-of-ai-leadership/,"03 Jul 2026, 08:00"
Strategic Signals,War on the Rocks,Misguided and Misunderstood: Trump’s Approach to U.S. Troops in Europe,"For many observers, Secretary of Defense Pete Hegseth’s speech on the future of NATO, delivered in Brussels on June 18, 2026, constituted a perfect example of how the Trump administration is angrily abandoning the longstanding U.S. commitment to European security. The prevailing picture is that the ",https://warontherocks.com/misguided-and-misunderstood-trumps-approach-to-u-s-troops-in-europe/,"03 Jul 2026, 07:30"
Geopolitics,War on the Rocks,The Blind Spots in Chinese Military Studies,"During a recent conference on the People’s Liberation Army, I heard the same question posed to attendees and paper writers: “How would China react to U.S. force posture change X, Y, or Z?” or “How would the Chinese military respond to U.S. strikes in certain locations?” Having participated in dozens",https://warontherocks.com/the-blind-spots-in-chinese-military-studies/,"02 Jul 2026, 07:30"
Geopolitics,War on the Rocks,"From Shin Bet to Mossad, Netanyahu Reshapes Israeli Intelligence","Editor’s Note: Rewind and Reconnoiter is one of our weekly members-only newsletters. To access the full archive of Rewind and Reconnoiter as well as our other members-only content, including podcasts, newsletters, and exclusive access to the War on the Rocks app, sign up using the link in the graphi",https://warontherocks.com/from-shin-bet-to-mossad-netanyahu-reshapes-israeli-intelligence/,"01 Jul 2026, 17:30"
Strategic Signals,War on the Rocks,How a Team of Marines Built the Corps’ FPV Drone Training Program from a Cold Start,"Last fall, the U.S. Marine Corps had virtually no first-person view attack drones. That’s changed quickly. This episode is about how a team of marines at Weapons Training Battalion at Quantico went from a cold start to building a Marine Corps-wide first-person view drone training system. Ryan was pl",https://warontherocks.com/how-a-team-of-marines-built-the-corps-fpv-drone-training-program-from-a-cold-start/,"01 Jul 2026, 15:15"
Strategic Signals,War on the Rocks,"Trojan Spirit, the Army’s Intelligence Backbone, Needs a Successor","In 1990, the idea that deployed commanders could access the latest intelligence from three-letter agencies in the middle of nowhere was radical. But the Army was starting to make this idea real through a program called Trojan Spirit, so they could address a major strategic barrier: There were too ma",https://warontherocks.com/cogs-of-war/trojan-spirit-the-armys-intelligence-backbone-needs-a-successor/,"01 Jul 2026, 08:00"
Strategic Signals,War on the Rocks,The Hizballah Predicament: Why An Integrated Approach Is Necessary,"What can leaders do about a transnational organization that is a militia, a political party, a social services network, and a smuggling operation at the same time — and one that has resisted various dialogues and survived repeated attacks?American, Lebanese, and other leaders should recognize Hizbal",https://warontherocks.com/the-hizballah-predicament-why-an-integrated-approach-is-necessary/,"01 Jul 2026, 07:30"
Policy & Regulation,CSIS,The Bio-Pharma Industry and Society,"The Bio-Pharma Industry and Society Listing Summary Please join the CSIS Global Health Policy Center on March 17, from 10:00am – 11:30am, for an exploration of how private bio-pharmaceutical firms can better support the critically important societal goals of improved affordability, access, quality, ",https://www.csis.org/events/bio-pharma-industry-and-society,"03 Mar 2016, 20:36"
Policy & Regulation,CSIS,The FY2017 Defense Budget and Strategic Outlook,"The FY2017 Defense Budget and Strategic Outlook Listing Summary Please join the CSIS International Security Program for a half-day Defense360 conference on the recently released FY2017 defense budget request and strategic priorities. Drupal Admin Mon, 02/29/2016 - 13:48 Featured Image Image Contribu",https://www.csis.org/events/fy2017-defense-budget-and-strategic-outlook,"29 Feb 2016, 18:48"
Policy & Regulation,CSIS,2016 U.S.-Japan Security Seminar,"2016 U.S.-Japan Security Seminar Listing Summary Michael J. Green interviews JIIA President Yoshiji Nogami Drupal Admin Fri, 02/26/2016 - 12:54 Featured Image Image Contributors Michael J. Green Programs & Projects Japan Chair Parent Geopolitics and Foreign Policy Featured Image AdobeStock_179685887",https://www.csis.org/events/2016-us-japan-security-seminar,"26 Feb 2016, 17:54"
Energy & Infrastructure,CSIS,The Future of the Grid—A View from ARPA-E,"The Future of the Grid—A View from ARPA-E Listing Summary The CSIS Energy and National Security Program is pleased to invite you to a discussion with Ellen Williams, Director of ARPA-E, the Advanced Research Projects Agency-Energy. Drupal Admin Thu, 02/25/2016 - 14:15 Featured Image Image Contributo",https://www.csis.org/events/future-grid-view-arpa-e,"25 Feb 2016, 19:15"
Geopolitics,CSIS,"Statesmen's Forum: Wang Yi, Minister of Foreign Affairs, PRC","Statesmen's Forum: Wang Yi, Minister of Foreign Affairs, PRC Listing Summary Please watch the live webcast of a discussion on Chinese foreign policy and US-China Relations Drupal Admin Fri, 02/19/2016 - 17:13 Featured Image Image Contributors John J. Hamre Christopher K. Johnson Downloads Download T",https://www.csis.org/events/statesmens-forum-wang-yi-minister-foreign-affairs-prc,"19 Feb 2016, 22:13"
Geopolitics,CSIS,"China Reality Check: China's ""Internet Sovereignty"" Initiative: Origins and Consequences","China Reality Check: China's ""Internet Sovereignty"" Initiative: Origins and Consequences Listing Summary Please join us for a discussion on China’s initiative to promote Internet sovereignty as a key governing concept of the global Internet. Drupal Admin Tue, 02/16/2016 - 11:49 Featured Image Image ",https://www.csis.org/events/china-reality-check-chinas-internet-sovereignty-initiative-origins-and-consequences,"16 Feb 2016, 16:49"
Policy & Regulation,CSIS,"Statesmen's Forum: The Right Honourable Theresa May, MP, Home Secretary, United Kingdom","Statesmen's Forum: The Right Honourable Theresa May, MP, Home Secretary, United Kingdom Listing Summary Please join the CSIS International Security Program for a discussion with UK Home Secretary Theresa May on counter-terrorism policy. Drupal Admin Fri, 02/12/2016 - 16:08 Featured Image Image Contr",https://www.csis.org/events/statesmens-forum-right-honourable-theresa-may-mp-home-secretary-united-kingdom,"12 Feb 2016, 21:08"
Strategic Signals,CSIS,Strategic Opportunities in the Indo-Asia-Pacific with Admiral Harry B. Harris,"Strategic Opportunities in the Indo-Asia-Pacific with Admiral Harry B. Harris Listing Summary Please join us for a discussion with Admiral Harry B. Harris, Commander, U.S. Pacific Command, on the Strategic Opportunities in the Indo-Asia-Pacific. Drupal Admin Tue, 01/26/2016 - 11:20 Featured Image Im",https://www.csis.org/events/strategic-opportunities-indo-asia-pacific-admiral-harry-b-harris,"26 Jan 2016, 16:20"
Strategic Signals,Al Jazeera,"FIFA World Cup round of 16: Bracket, schedule, predictions and latest news","Second round of knockout matches features Brazil vs Norway, Mexico vs England. We have predictions and the latest news.",https://www.aljazeera.com/sports/2026/7/5/fifa-world-cup-round-of-16-bracket-schedule-predictions-latest-news?traffic_source=rss,"05 Jul 2026, 09:18"
Geopolitics,Al Jazeera,China releases underground church pastor after months in detention,Ezra Jin’s family says the Zion Church founder arrived in the US after months in detention in China.,https://www.aljazeera.com/news/2026/7/5/china-releases-underground-church-pastor-after-months-in-detention?traffic_source=rss,"05 Jul 2026, 08:54"
Strategic Signals,Al Jazeera,Watch World Cup Day 24: France and Morocco advance to quarterfinals,"Latest match highlights, reaction and previews from the FIFA World Cup 2026 in North America.",https://www.aljazeera.com/video/2026/7/5/video-world-cup-2026-highlights?traffic_source=rss,"05 Jul 2026, 08:30"
Strategic Signals,Al Jazeera,Palestinians in Gaza celebrate Morocco’s World Cup victory,Palestinians in Gaza celebrate Morocco's World Cup victory,https://www.aljazeera.com/video/newsfeed/2026/7/5/palestinians-in-gaza-celebrate-moroccos-world-cup-victory?traffic_source=rss,"05 Jul 2026, 08:25"
Geopolitics,Al Jazeera,Iran’s China envoy vows ‘special’ Hormuz treatment for ‘friendly’ countries,"Despite US objections, ambassador insists new fees to be charged to vessels transiting Strait of Hormuz.",https://www.aljazeera.com/news/2026/7/5/irans-china-envoy-vows-special-hormuz-treatment-for-friendly-countries?traffic_source=rss,"05 Jul 2026, 08:09"
Geopolitics,Al Jazeera,"Trump offers to help end Russia-Ukraine war in Putin call, Kremlin says",Kremlin aide Yury Ushakov says Trump made the offer during a nearly 90-minute phone call with the Russian president.,https://www.aljazeera.com/news/2026/7/5/trump-offers-to-help-end-ukraine-war-in-long-call-with-putin-kremlin-says?traffic_source=rss,"05 Jul 2026, 08:06"
Strategic Signals,Al Jazeera,Egypt and Morocco fans celebrate World Cup wins by singing for Palestine,Egypt and Morocco fans celebrated their World Cup success by singing ‘My Blood is Palestinian’ at a Dallas fan zone.,https://www.aljazeera.com/video/newsfeed/2026/7/5/egypt-and-morocco-fans-celebrate-world-cup-wins-by-singing-for-palestine?traffic_source=rss,"05 Jul 2026, 07:42"
Strategic Signals,Al Jazeera,"Brazil vs Norway: FIFA World Cup last 16 – Vinicius, Haaland and prediction",Norway are one of only three countries Brazil have faced at a World Cup without registering at least one victory.,https://www.aljazeera.com/sports/2026/7/5/brazil-vs-norway-fifa-world-cup-last-16-vinicius-haaland-and-prediction?traffic_source=rss,"05 Jul 2026, 06:22"
Strategic Signals,ETCFO Top Stories,"GST at 9; Over 50,000 Appeals at GSTAT","As GST enters its tenth year, perhaps the debate should move beyond tax rates and revenue collections. The larger question is whether the system has matured enough to minimise disputes before they arise. A successful tax regime is not merely one that collects revenue efficiently, but one that inspir",https://cfo.economictimes.indiatimes.com/news/tax-legal-accounting/gst-at-9-over-50000-appeals-filed-as-industry-calls-for-reforms/132151268,"03 Jul 2026, 08:39"
Policy & Regulation,ETCFO Top Stories,"ICAI, ICSI, ICoAI must truly collaborate to make Corporate Mitra Scheme a success, say experts","The Ministry of Corporate Affairs has launched the Corporate Mitra scheme to address the skill gap in MSMEs, offering compliance and financial guidance. Accounting bodies like ICAI, ICSI, and ICoAI are involved in training and implementation. Experts, while lauding the initiative, emphasize the need",https://cfo.economictimes.indiatimes.com/news/tax-legal-accounting/icai-icsi-icoai-must-truly-collaborate-to-make-corporate-mitra-scheme-a-success-say-experts/132127864,"02 Jul 2026, 08:40"
Strategic Signals,ETCFO Top Stories,"GST at 9: India Inc seeks GST 2.0 with faster ITC refunds, AI-led compliance and lower litigation","Finance chiefs say the indirect tax reform has transformed business over the past nine years, but call for quicker input tax credit refunds, simpler compliance, consistent tax interpretation and technology-driven administration as GST enters its next phase.",https://cfo.economictimes.indiatimes.com/news/tax-legal-accounting/celebrating-nine-years-of-gst-a-call-for-reform-and-innovation-in-indias-tax-landscape/132105350,"01 Jul 2026, 09:45"
Strategic Signals,ETCFO Top Stories,India’s top 10 States by GST collections in FY26 — and who lagged behind,"India's GST collections for FY2025-26 reached ₹22.27 lakh crore, a slight 0.8% rise, driven by an 11.7% surge in import-related taxes. Domestic collections saw a 2.6% dip. Maharashtra led state contributions with over ₹3.61 lakh crore. The composition of GST revenue shifted, with IGST, SGST, and CGS",https://cfo.economictimes.indiatimes.com/news/tax-legal-accounting/indias-gst-revenue-breakdown-for-fy26-top-performers-and-laggards-revealed/132093571,"30 Jun 2026, 19:54"
Strategic Signals,ETCFO Top Stories,"ICICI Prudential Life plans 10-15% premium growth, bets on protection to outpace savings, CFO Dhiren Salian says","ICICI Prudential Life Insurance aims for 10-15% premium growth, with protection products like term and annuity plans leading the charge. CFO Dhiren Salian highlighted that protection, currently 17% of premiums, is a key focus due to its underpenetration and higher profitability. The company is also ",https://cfo.economictimes.indiatimes.com/news/strategy-operations/icici-prudential-life-insurance-targets-10-15-premium-growth-focusing-on-protection-business/132087048,"30 Jun 2026, 15:06"
Policy & Regulation,ETCFO Top Stories,"Exclusive: MCA set to notify SA 600, 40 revised audit standards by August","The notification will conclude one of the most significant regulatory exercises in India's audit landscape in recent years, aimed at strengthening audit quality and updating the country's auditing framework in line with evolving international standards.",https://cfo.economictimes.indiatimes.com/news/tax-legal-accounting/mca-to-revise-40-audit-standards-including-sa-600-by-august-2024/132087362,"30 Jun 2026, 13:02"
Strategic Signals,ETCFO Top Stories,HDFC Bank appoints Puneet Sharma as CFO,"HDFC Bank has appointed Puneet Sharma as its new Chief Financial Officer, effective December 1, 2026, bringing over 26 years of financial expertise from Axis Bank. Jigar Shah will join as General Counsel from October 1, 2026. Additionally, former Finance Secretary Rajiv Kumar is set to become the ba",https://cfo.economictimes.indiatimes.com/news/leadership/hdfc-bank-appoints-puneet-sharma-as-cfo-rajiv-kumar-as-part-time-chairman/132082709,"30 Jun 2026, 08:32"
Policy & Regulation,ETCFO Top Stories,Portal glitches put thousands of GST appeals at risk; experts seek deadline extension,"Tax professionals, industry bodies and bar association urge Finance Ministry to defer June 30 cut-off, citing technical issues on GSTAT portal and nearly nine years of pending litigation.",https://cfo.economictimes.indiatimes.com/news/tax-legal-accounting/urgent-call-for-gst-appeal-deadline-extension-amid-portal-glitches/132070202,"29 Jun 2026, 16:34"
Geopolitics,ETCFO Policy,China's warning reveals what really happened at Modi-Takaichi summit,"India and Japan's recent summit in Delhi has sparked concern in Beijing. Agreements on defense, critical minerals, and AI signal a strategic shift, prompting China to caution against ""exclusive small groupings."" The summit's focus on economic security, diversified supply chains, and defense co-devel",https://cfo.economictimes.indiatimes.com/news/policy/chinas-warning-reveals-what-really-happened-at-modi-takaichi-summit/132173051,"04 Jul 2026, 06:08"
Markets & Macro,ETCFO Policy,Banks register rise in NRI deposits under RBI's new scheme,"Banks have registered a gradual increase in the flow of overseas funds after the rollout of the Reserve Bank of India's (RBI) revised Foreign Currency Non-Resident Bank (FCNR-B) deposit scheme, and expect collections to accelerate further this month as awareness among NRIs is growing.",https://cfo.economictimes.indiatimes.com/news/policy/banks-register-rise-in-nri-deposits-under-rbis-new-scheme/132159723,"03 Jul 2026, 16:39"
Markets & Macro,ETCFO Policy,"SEBI proposes INR-based registration fee payment for FPIs, FVCIs to simplify processes","The Securities and Exchange Board of India (SEBI) on Friday proposed that foreign portfolio investors (FPIs) and foreign venture capital investors (FVCIs) pay registration and related fees in Indian rupees (INR), replacing the existing system of payments in US dollars (USD), according to board meeti",https://cfo.economictimes.indiatimes.com/news/policy/sebi-proposes-inr-based-registration-fee-payment-for-fpis-fvcis-to-simplify-processes/132157887,"03 Jul 2026, 15:12"
Markets & Macro,ETCFO Policy,"RBI backs crypto containment and keeps ban on table, officials tell house panel","The Reserve Bank of India has strongly advised a prohibition strategy for crypto assets, recommending that banks and financial institutions be completely shielded from them. Officials argued that allowing exposure could legitimize speculative products with no economic benefit and pose financial stab",https://cfo.economictimes.indiatimes.com/news/policy/rbi-backs-crypto-containment-and-keeps-ban-on-table-officials-tell-house-panel/132154137,"03 Jul 2026, 12:00"
Markets & Macro,ETCFO Policy,Functional & Innovative Foods files DRHP with Sebi for IPO,"Functional & Innovative Foods has filed its DRHP with Sebi for an IPO comprising a fresh issue of 60 lakh shares and an offer for sale of 25 lakh shares. The company plans to use the proceeds for capacity expansion, debt repayment, subsidiary investment, working capital and general corporate purpose",https://cfo.economictimes.indiatimes.com/news/policy/functional-innovative-foods-files-drhp-with-sebi-for-ipo/132139100,"02 Jul 2026, 17:47"
Energy & Infrastructure,ETCFO Policy,Indian rupee weakness to persist despite RBI measures to bring in dollars,"Despite the Reserve Bank of India's efforts to attract foreign capital, the Indian rupee is expected to remain weak against the U.S. dollar in the coming months. While recent measures and falling oil prices have offered some support, analysts predict the rupee will trade around current levels. Expec",https://cfo.economictimes.indiatimes.com/news/policy/indian-rupee-weakness-to-persist-despite-rbi-measures-to-bring-in-dollars/132111368,"01 Jul 2026, 15:03"
Energy & Infrastructure,ETCFO Policy,RBI warns unwinding of leveraged hedge fund positions during stress could roil bond markets,"The Reserve Bank of India has issued a stark warning regarding the increasing influence of large, leveraged hedge funds in global sovereign bond markets. Their rapid exit during market turmoil could trigger significant sell-offs and widespread financial instability. This concern is amplified by risi",https://cfo.economictimes.indiatimes.com/news/policy/rbi-warns-unwinding-of-leveraged-hedge-fund-positions-during-stress-could-roil-bond-markets/132108988,"01 Jul 2026, 14:30"
Energy & Infrastructure,ETCFO Policy,India plans to add strategic fuel reserves after Iran war shock,"This ambitious move follows a review of existing, limited stockpiles and includes expanding underground crude storage and addressing the challenges of storing gas.",https://cfo.economictimes.indiatimes.com/news/policy/india-to-strengthen-energy-security-with-strategic-fuel-reserves-post-iran-conflict/132104646,"01 Jul 2026, 08:25"
