section,source,title,summary,link,published_at
Geopolitics,Financial Times World,Trump administration warns leftwing extremism is ‘fatal cancer to civilisation’,State department says violence from the left is international counterterrorism blind spot,https://www.ft.com/content/025c6f9f-cef8-401d-9a9c-72c67c5f4652?syn-25a6b1a6=1,"16 Jul 2026, 17:11"
Policy & Regulation,Financial Times World,MPs decline to endorse former Virgin Money chief’s role as regulator,City figure Jayne-Anne Gadhia confirmed by government as chair of Financial Reporting Council,https://www.ft.com/content/ee3b9d37-a5dc-4a2d-8929-3ad88fbaa991?syn-25a6b1a6=1,"16 Jul 2026, 16:55"
Markets & Macro,Financial Times World,Trump teleprompter operator faces scrutiny over prediction market bets,Aide allegedly used advanced knowledge of president’s speeches to profit on ‘mention markets’ wagers,https://www.ft.com/content/7c315b15-1575-4a1b-aead-4d997a449940?syn-25a6b1a6=1,"16 Jul 2026, 16:54"
Policy & Regulation,Financial Times World,Monte dei Paschi claims €30.6bn bid from Intesa ‘undervalues’ bank,"MPS’s board says offer carries regulatory and execution risk, leaving door open to potential tie-up with Banco BPM",https://www.ft.com/content/e79977e9-cf50-4a0c-8043-328d807e5e5a?syn-25a6b1a6=1,"16 Jul 2026, 16:52"
Strategic Signals,Financial Times World,The great British corporate sell-off,The UK’s business case needs strengthening to stop a self-reinforcing exodus,https://www.ft.com/content/5b36df97-f005-43b7-a91b-5324ccf14bce?syn-25a6b1a6=1,"16 Jul 2026, 16:47"
Energy & Infrastructure,Financial Times World,Zelenskyy government plunged into turmoil after defence minister fired,Ukraine president forced into concession as ousting of popular minister prompts public and political backlash,https://www.ft.com/content/06865b90-5b62-46c5-ae8d-147842b41cd0?syn-25a6b1a6=1,"16 Jul 2026, 16:34"
Geopolitics,Financial Times World,Ex-motorway boss handed 12-year prison term over Genoa bridge disaster,Former chief executive of Autostrade per l’Italia convicted for his role in 2018 tragedy in north-west Italy,https://www.ft.com/content/148e0ce0-ef6c-4e3c-a81b-0ebd01f7876d?syn-25a6b1a6=1,"16 Jul 2026, 16:33"
Strategic Signals,Financial Times World,Chevron and Iraq seek to bypass Strait of Hormuz with Syria pipeline,Consortium backing project also includes Syrian-Qatari group and LA venture firm with ties to Trump ally Tom Barrack,https://www.ft.com/content/eb6e0b25-6682-46bc-a879-136a38d1d7d6?syn-25a6b1a6=1,"16 Jul 2026, 16:14"
Strategic Signals,Financial Times Companies,Advisers overseeing billions of pounds to leave St James’s Place,"Prospera and Wellesley have both left SJP, according to the FCA’s register",https://www.ft.com/content/78d42c9c-32b9-49b2-8aa6-3effad11ef3e?syn-25a6b1a6=1,"16 Jul 2026, 17:27"
Geopolitics,Financial Times Companies,Russian strikes threaten Ukraine’s Black Sea grain trade,Wheat prices have surged as heavy attacks disrupt shipments,https://www.ft.com/content/5c64e7a5-fe26-4f14-8d77-1d0f1d8a30d3?syn-25a6b1a6=1,"16 Jul 2026, 15:53"
Strategic Signals,Financial Times Companies,Uber’s super app ‘synergies’ deserve some suspension of disbelief,Ride-hailing giant’s purchase of Delivery Hero may be more appetising than it looks,https://www.ft.com/content/aaa16c77-192f-412b-b123-1c4fcee5fb76?syn-25a6b1a6=1,"16 Jul 2026, 15:48"
Strategic Signals,Financial Times Companies,Paralysed man regains hand function through novel brain technology,Patient went from not being able to lift his hands to his face to independently wiping his mouth,https://www.ft.com/content/65d60f8e-76fe-47c5-beca-cfd86629f929?syn-25a6b1a6=1,"16 Jul 2026, 15:00"
Strategic Signals,Financial Times Companies,"Estate agents fear retaliation over Rightmove lawsuit, tribunal told",Proposed £1.6bn class action suit seeks to challenge high listings fees,https://www.ft.com/content/a6ed5c8a-4d51-4df9-adb7-374b845c9a5e?syn-25a6b1a6=1,"16 Jul 2026, 14:44"
Strategic Signals,The Hindu BusinessLine,"Tech Mahindra outshines Wipro in Q1 with stronger growth, margin expansion","Tech Mahindra’s revenue rose 17.6% y-o-y to ₹15,711 crore, with a net profit of ₹1,486 crore, up 31.6%; Wipro’s revenue increased 10.6% y-o-y to ₹24,479 crore, net profit fell 4.7%",https://www.thehindubusinessline.com/info-tech/tech-mahindra-outshines-wipro-in-q1-with-stronger-growth-margin-expansion/article71230118.ece,"16 Jul 2026, 22:05"
Markets & Macro,The Hindu BusinessLine,"SBI Funds Management IPO subscribed 41.66 times on final day, driven by QIBs demand","The ₹9,813-crore IPO received bids for ₹2.98 lakh crore",https://www.thehindubusinessline.com/markets/sbi-funds-management-ipo-subscribed-4044-times-so-far-on-final-day-driven-by-qibs-demand/article71229413.ece,"16 Jul 2026, 21:54"
Strategic Signals,The Hindu BusinessLine,South Indian Bank posts 17% rise in net profit to ₹378 crore,"P R Seshadri, MD & CEO, noted consistent growth in targeted segments, focusing on quality asset acquisition in corporate lending, auto loans, and gold loans",https://www.thehindubusinessline.com/money-and-banking/south-indian-bank-posts-17-rise-in-net-profit-to-378-crore/article71229397.ece,"16 Jul 2026, 21:51"
Strategic Signals,The Hindu BusinessLine,Over 50% of Indian major reservoirs still half-empty,59% of the country has received deficient or no rainfall as the monsoon is 24% below normal,https://www.thehindubusinessline.com/economy/agri-business/over-50-of-indian-major-reservoirs-still-half-empty/article71230123.ece,"16 Jul 2026, 21:41"
Energy & Infrastructure,The Hindu BusinessLine,"Russia to continue to meet half of India’s crude oil imports in July, August",July imports will surpass 5 million barrels per day (mb/d) with Russia accounting for around 2.6-2.7 mb/d,https://www.thehindubusinessline.com/news/russia-to-continue-to-meet-half-of-indias-crude-oil-imports-in-july-august/article71230646.ece,"16 Jul 2026, 21:38"
Markets & Macro,The Hindu BusinessLine,Barclays sees FCNR inflows falling short of market hype,"According to the report, expectations may have been inflated by comparisons with the RBI’s successful 2013 FCNR scheme",https://www.thehindubusinessline.com/money-and-banking/barclays-sees-fcnr-inflows-falling-short-of-market-hype/article71231009.ece,"16 Jul 2026, 21:30"
Markets & Macro,The Hindu BusinessLine,Editorial. Inflated worries,RBI can look through the spike in CPI in June,https://www.thehindubusinessline.com/opinion/editorial/inflated-worries/article71230293.ece,"16 Jul 2026, 21:21"
Strategic Signals,The Hindu BusinessLine,Pocket,,https://www.thehindubusinessline.com/opinion/cartoons/pocket/article71231006.ece,"16 Jul 2026, 21:21"
Energy & Infrastructure,Times of India Business,India’s First Hydrogen-Powered Train To Be Flagged Off On July 17: 10 Facts & Photos You Shouldn’t Miss,"India’s first hydrogen-powered train is ready for launch! Marking a major milestone for Indian Railways, the country’s first hydrogen will be flagged off by Prime Minister Narendra Modi on July 17. This is the first time that India is introducing a train that produces its own electricity onboard usi",https://timesofindia.indiatimes.com/business/india-business/india-first-hydrogen-powered-train-indian-railways-flag-off-pm-modi-top-speed-route-jind-sonipat-photos-all-facts-you-want-to-know/photostory/132443589.cms,"16 Jul 2026, 21:48"
Strategic Signals,Times of India Business,‘Aim to make India the world's most authentic experience destination:’ Shekhawat,,https://timesofindia.indiatimes.com/business/india-business/aim-to-make-india-the-worlds-most-authentic-experience-destination-shekhawat/articleshow/132442369.cms,"16 Jul 2026, 20:31"
Strategic Signals,Times of India Business,"In tough Q1, ITC Hotels sees profit, revenue zoom",,https://timesofindia.indiatimes.com/business/india-business/in-tough-q1-itc-hotels-sees-profit-revenue-zoom/articleshow/132442403.cms,"16 Jul 2026, 20:26"
Strategic Signals,Times of India Business,"Cyberattack hits Japan's ice cream giant Glico after KFC, disrupts sushi and supermarket deliveries",A cyberattack on Nichirei has disrupted ice cream and fast food supplies across Japan. Popular companies like Ezaki Glico and KFC Japan are experiencing significant product delays. Some restaurants may face temporary menu changes and potential store closures due to shortages. This incident follows o,https://timesofindia.indiatimes.com/business/international-business/cyberattack-hits-japans-ice-cream-giant-glico-after-kfc-disrupts-sushi-and-supermarket-deliveries/articleshow/132441658.cms,"16 Jul 2026, 20:15"
Geopolitics,Times of India Business,"100 items, imports worth $51 billion: India eyes fresh domestic manufacturing push to reduce reliance on overseas suppliers","The renewed focus on expanding domestic production comes as India faces heightened supply-chain risks arising from geopolitical tensions. At the same time, the government is seeking to lower its dependence on China while reducing the country's trade deficit.",https://timesofindia.indiatimes.com/business/india-business/100-items-imports-worth-51-billion-india-eyes-fresh-domestic-manufacturing-push-to-reduce-reliance-on-overseas-suppliers/articleshow/132441564.cms,"16 Jul 2026, 19:51"
Energy & Infrastructure,Times of India Business,US stocks today: AI stocks drop again; crude oil prices continue to climb,"The S&P 500 declined 0.4%, a day after coming within 0.5% of the record high it reached last month. As of 7:05 PM IST, the Dow Jones Industrial Average had gained 64 points, or 0.1%, while the Nasdaq Composite was down 0.8%.",https://timesofindia.indiatimes.com/business/international-business/us-stocks-today-july-16-2026-wall-street-ai-stocks-drop-again-crude-oil-prices-continue-to-climb/articleshow/132441261.cms,"16 Jul 2026, 19:31"
Strategic Signals,Times of India Business,"Harsh reality for H-1B visa returnees: Changed Indian IT hiring landscape, lower salaries and fewer jobs","Recruitment trends indicate that companies are hiring cautiously, and many returnees are getting jobs at less than their salary expectations. Artificial intelligence has compounded the challenge since many roles have become redundant.",https://timesofindia.indiatimes.com/business/india-business/harsh-reality-for-h-1b-visa-returnees-changed-indian-it-hiring-landscape-lower-salaries-and-fewer-jobs/articleshow/132435837.cms,"16 Jul 2026, 17:54"
Geopolitics,Times of India Business,Why India’s trade deal with UK is not just about tariffs - the benefits extend beyond that,"Yes, the tariff story matters. Britain will eliminate duties on 99% of Indian tariff lines, and that is no small concession. But the real point is sectoral: the benefits fall squarely on labour-intensive industries that create jobs at scale.",https://timesofindia.indiatimes.com/business/india-business/why-indias-trade-deal-with-uk-is-not-just-about-tariffs-the-benefits-extend-beyond-that/articleshow/132437026.cms,"16 Jul 2026, 16:18"
Strategic Signals,Hindustan Times India,Women outshine men in NEET UG 2026; make up over 58% of qualifiers,The NEET UG re-exam was held on June 21 after the exam held on May 3 was cancelled over alleged paper leak.,https://www.hindustantimes.com/india-news/neet-ug-2026-results-out-women-outshine-men-58-percent-qualifying-candidates-toppers-direct-link-to-check-scorecard-101784221823680.html,"16 Jul 2026, 22:49"
Strategic Signals,Hindustan Times India,"NEET UG 2026 results declared, 11.21 lakh candidates qualify | See how to check scorecard here",The highest score of 715 out of 720 in the examination was obtained jointly by Aryan Gupta (Punjab) and Panshul Bansal (Haryana).,https://www.hindustantimes.com/india-news/neet-ug-result-2026-out-declared-at-neet-nta-nic-in-direct-link-to-check-scorecard-for-neet-re-exam-here-101784218133106.html,"16 Jul 2026, 22:30"
Geopolitics,Hindustan Times India,'Don't appoint Smriti Irani in place of Dharmendra Pradhan': AAP leader's dig at BJP from CJP protest,"The CJP announced that they will march towards the Parliament on Monday, July 20, to make the government listen to them.",https://www.hindustantimes.com/india-news/aap-saurabh-bharadwaj-arvind-kejriwal-cjp-protest-sonam-wangchuk-don-t-appoint-smriti-irani-dharmendra-pradhan-101784218486058.html,"16 Jul 2026, 22:23"
Strategic Signals,Hindustan Times India,Those under pressure should quit before July 21: Mamata after Koel Mallick's Rajya Sabha exit,"""Today I saw that another MP, who is also a respected and talented film artist, met a BJP leader and resigned,"" Banerjee said.",https://www.hindustantimes.com/india-news/those-under-pressure-should-quit-before-july-21-mamata-after-koel-mallicks-rajya-sabha-exit-101784216312734.html,"16 Jul 2026, 22:09"
Geopolitics,Hindustan Times India,"NEET UG result likely tonight: NTA releases final answer key, drops 1 Physics question, awards 8 bonus marks",One of the disputed questions involved a Vernier calipers problem that asked candidates to determine the length of a wire based on the instrument's reading.,https://www.hindustantimes.com/india-news/nta-releases-final-neet-ug-2026-answer-key-drops-one-physics-question-awards-bonus-marks-neet-result-date-101784216815055.html,"16 Jul 2026, 21:43"
Strategic Signals,Hindustan Times India,"Ex-chief secretary’s son posed as IPS, RAW and army officer, swindled lakhs; arrested","Police said Yashovardhan, a retired IAS officer’s son, wanted to become an IPS officer but could not clear UPSC’s civi services exam despite multiple attempts",https://www.hindustantimes.com/india-news/exchief-secretary-s-son-posed-as-ips-raw-and-army-officer-swindled-lakhs-arrested-101784218093629.html,"16 Jul 2026, 21:38"
Strategic Signals,Hindustan Times India,"Gujarat man installs audio recording system at home to expose wife's affair, moves court to freeze joint bank locker",The complainant alleged that the audio that he captured confirmed his suspicion that his wife was having an affair with the man.,https://www.hindustantimes.com/india-news/gujarat-man-installs-audio-recording-system-at-home-to-expose-wifes-affair-moves-court-to-freeze-joint-bank-locker-101784211856609.html,"16 Jul 2026, 21:06"
Strategic Signals,Hindustan Times India,'We share our anguish and outrage': Congress appeals to Sonam Wangchuk to end fast,"Appealing to Wangchuk to call off his fast, Congress general secretary (organisation) K C Venugopal said his health had become a matter of concern.",https://www.hindustantimes.com/india-news/congress-appeals-to-rahul-gandhi-sonam-wangchuk-to-end-fast-cjp-hunger-strike-abhijeet-dipke-cjp-news-modi-101784209173132.html,"16 Jul 2026, 19:58"
Strategic Signals,Indian Express Latest,"Gates MRI, SII tie-up for manufacture TB vaccine candidate",,https://indianexpress.com/article/cities/pune/gates-mri-sii-tie-up-for-manufacture-tb-vaccine-candidate-10790041/,"16 Jul 2026, 17:59"
Strategic Signals,Indian Express Latest,Govt calls for IOA panel to probe ex-hockey captain’s sexual harrasment allegations,,https://indianexpress.com/article/sports/hockey/hockey-sexual-harrasment-sports-ministry-calls-for-ioa-panel-asunta-lakra-allegations-10790030/,"16 Jul 2026, 17:43"
Strategic Signals,Indian Express Latest,"NEET UG Re-Exam 2026 Result: Meet the toppers – Aryan Gupta, Panshul Bansal",,https://indianexpress.com/article/education/neet-ug-re-exam-2026-toppers-aryan-gupta-panshul-bansal-interview-10790020/,"16 Jul 2026, 17:40"
Strategic Signals,Indian Express Latest,Sonu Sood raises alarm over India’s loneliness crisis: ‘Bigger issue than most realise’,,https://indianexpress.com/article/lifestyle/sonu-sood-highlights-india-growing-loneliness-crisis-10764432/,"16 Jul 2026, 17:30"
Strategic Signals,Indian Express Latest,"After meeting Law Minister, Delhi HC lawyers call off strike over jurisdiction concerns",,https://indianexpress.com/article/cities/delhi/after-meeting-law-minister-delhi-hc-lawyers-call-off-strike-over-jurisdiction-concerns-10790024/,"16 Jul 2026, 17:27"
Strategic Signals,Indian Express Latest,DG Shipping advises firms to avoid deploying Indian seafarers on Strait of Hormuz,,https://indianexpress.com/article/business/dg-shipping-indian-seafarers-strait-of-hormuz-10790015/,"16 Jul 2026, 17:19"
Strategic Signals,Indian Express Latest,Arjun Bijlani slams dating rumours with Mouni Roy: ‘Friendship doesn’t need romantic angle’,,https://indianexpress.com/article/entertainment/television/arjun-bijlani-slams-dating-rumours-with-mouni-roy-friendship-doesnt-need-romantic-angle-10789988/,"16 Jul 2026, 17:07"
Strategic Signals,Indian Express Latest,"NEET UG 2026 result declared: 11.21 lakh qualify, over 58% successful candidates are women",,https://indianexpress.com/article/education/neet-ug-2026-result-declared-11-21-lakh-qualify-over-58-successful-candidates-are-women-neet-nta-nic-in-10757757/,"16 Jul 2026, 17:06"
Energy & Infrastructure,SCMP Asia,"Giant models grab headlines, but some Chinese start-ups bet on smaller phone-ready AI","As the global artificial intelligence race pushes the limits of scale with massive, trillion-parameter models, a parallel contest is heating up over smaller systems. Instead of relying on sprawling, power-hungry cloud data centres, a growing number of tech companies in China and elsewhere are turnin",https://www.scmp.com/tech/tech-trends/article/3360820/giant-models-grab-headlines-some-chinese-start-ups-bet-smaller-phone-ready-ai?utm_source=rss_feed,"16 Jul 2026, 13:30"
Markets & Macro,SCMP Asia,China’s OnePlus bows out of Western markets as memory crisis hammers smartphone industry,"Chinese handset vendor OnePlus is retreating from the US and European markets amid deepening woes from a memory crisis hammering the global smartphone industry. “After thorough evaluation, OnePlus has decided to conclude product roll-outs in Europe and North America,” the brand operated under Chines",https://www.scmp.com/tech/tech-trends/article/3360829/chinas-oneplus-bows-out-western-markets-memory-crisis-hammers-smartphone-industry?utm_source=rss_feed,"16 Jul 2026, 12:45"
Markets & Macro,SCMP Asia,CXMT’s mega IPO draws frenzy from retail investors to DeepSeek founder’s fund,"As soon as ChangXin Memory Technologies opened its blockbuster initial public offering to public subscription on Thursday morning, Luo Yi applied for 86,000 shares – despite acknowledging that she knew little about the semiconductor industry. The 60-year-old stock investor from southwestern Sichuan ",https://www.scmp.com/tech/article/3360822/cxmts-mega-ipo-draws-frenzy-retail-investors-deepseek-founders-fund?utm_source=rss_feed,"16 Jul 2026, 12:00"
Markets & Macro,SCMP Asia,China memory-chip maker CXMT set for mega IPO,"Subscriptions began on Thursday for shares in memory-chip maker ChangXin Memory Technologies (CXMT) ahead of its listing on Shanghai’s Star Market in what could be mainland China’s second biggest initial public offering. With pricing set at 8.66 yuan (US$1.28) per share, the IPO of nearly 6.7 billio",https://www.scmp.com/plus/tech/big-tech/article/3360797/china-memory-chip-maker-cxmt-set-mega-ipo?utm_source=rss_feed,"16 Jul 2026, 09:07"
Markets & Macro,SCMP Asia,"BYD aims to build 3,000 ‘flash-charging’ stations across Europe within months","Chinese electric car giant BYD is building a network of 6,000 charging stations in overseas markets including Europe, as it looks to turbocharge its deliveries with the roll-out of cutting-edge flash-charging technology. The world’s largest electric vehicle (EV) maker aims to have 3,000 charging sta",https://www.scmp.com/business/china-business/article/3360759/byd-aims-build-3000-flash-charging-stations-across-europe-within-months?utm_source=rss_feed,"16 Jul 2026, 09:00"
Markets & Macro,SCMP Asia,"Ex-World Bank official warns to diversify away from US markets, people ‘will suffer’","A coordinated push towards global market diversification is urgently needed to shield savers from a potentially dangerous valuation correction in highly concentrated US equities, a former World Bank official has warned. Speaking at an event in Hong Kong on Thursday, Ian Goldin, the former World Bank",https://www.scmp.com/business/markets/article/3360789/ex-world-bank-official-warns-need-diversify-away-us-markets-people-will-suffer?utm_source=rss_feed,"16 Jul 2026, 08:01"
Geopolitics,SCMP Asia,"Cafe de Coral, in 1986, becomes first Hong Kong food chain to go public – SCMP archive","This article was first published on July 17, 1986. Cafe de Coral the live wire in quiet market by John Mulcahy Fast-food counter Cafe de Coral hit the boards yesterday (July 16, 1986), trading up to $1.35 and recording the biggest volume of the day. Although 16.6 million Cafe de Coral shares traded,",https://www.scmp.com/news/hong-kong/article/3360769/cafe-de-coral-1986-becomes-first-hong-kong-food-chain-go-public-scmp-archive?utm_source=rss_feed,"16 Jul 2026, 06:15"
Markets & Macro,SCMP Asia,What does South Korea’s Kospi chaos mean for China’s markets?,"The volatile state of South Korean stocks is reminiscent for some investors of China’s rapid boom-to-bust cycle a decade ago, analysts say, when leveraged trading fuelled a meltdown that eventually wiped US$5 trillion from the market within months. The South Korean stock market’s frantic artificial ",https://www.scmp.com/business/china-business/article/3360766/what-does-south-koreas-kospi-chaos-mean-chinas-markets?utm_source=rss_feed,"16 Jul 2026, 06:00"
Energy & Infrastructure,Foreign Policy,German Military Power Needs to Go It Alone,NATO’s multinational forces are an unwieldy relic of a more peaceful past.,https://foreignpolicy.com/2026/07/16/germany-military-power-bundeswehr-nato-europe-russia/,"16 Jul 2026, 16:05"
Strategic Signals,Foreign Policy,A Divided World Is North Korea’s Greatest Asset,Geopolitical fragmentation has hamstrung nuclear sanctions regimes. Pyongyang is taking advantage.,https://foreignpolicy.com/2026/07/16/north-korea-sanctions-nuclear-weapons-united-states-russia-china-united-nations-security-council/,"16 Jul 2026, 14:02"
Energy & Infrastructure,Foreign Policy,Nigeria Is Quietly Becoming a Diplomatic Powerhouse,Many analysts think Abuja’s foreign policy is on the decline. Here’s why that view is misguided.,https://foreignpolicy.com/2026/07/16/nigeria-diplomacy-west-africa-bola-tinubu-doctrine/,"16 Jul 2026, 13:00"
Geopolitics,Foreign Policy,Iranian Attacks Need Not Change the Gulf’s AI Ambitions,Ukraine offers lessons in how to keep infrastructure alive in wartime.,https://foreignpolicy.com/2026/07/16/iranian-attacks-gulf-ai-ambitions/,"16 Jul 2026, 04:01"
Geopolitics,Foreign Policy,Russia Shifts Its Focus to the Black Sea,Moscow is targeting trade routes and deepwater ports to strain Ukraine’s wartime economy.,https://foreignpolicy.com/2026/07/15/russia-ukraine-war-strikes-black-sea-ports-odesa-zelensky-koretskyi-fedorov/,"15 Jul 2026, 20:45"
Strategic Signals,Foreign Policy,Will Hasina Return to Bangladesh?,"The former prime minister set a timeline for her homecoming, despite the threat of arrest.",https://foreignpolicy.com/2026/07/15/bangladesh-sheikh-hasina-return-bnp-rahman/,"15 Jul 2026, 20:35"
Geopolitics,Foreign Policy,A New Law Heralds China’s Fraught Ethnic Future,Xi Jinping’s push for assimilation won’t solve long-standing issues.,https://foreignpolicy.com/2026/07/15/china-ethnic-laws-xinjiang-tibet-xi/,"15 Jul 2026, 19:58"
Geopolitics,Foreign Policy,Sudan Faces New Sanctions as Evidence of Atrocities Mounts,But countries remain unwilling to directly sanction foreign actors enabling the war.,https://foreignpolicy.com/2026/07/15/sudan-civil-war-crimes-sanctions-un-report-genocide/,"15 Jul 2026, 19:46"
Strategic Signals,The Diplomat,Why Gen Z Is Back on the Streets in Bangladesh,A controversy centered on Bangladesh's Higher Secondary Certificate (HSC) exam brought students back out to protest.,https://thediplomat.com/2026/07/why-gen-z-is-back-on-the-streets-in-bangladesh/,"16 Jul 2026, 23:20"
Geopolitics,The Diplomat,Why China Will Not Sell 5th-Generation J-35 Fighter Jets to Pakistan (Yet),"For China, the decision to sell the J-35 would carry ramifications far exceeding those of any previous Chinese arms sale.",https://thediplomat.com/2026/07/why-china-will-not-sell-5th-generation-j-35-fighter-jets-to-pakistan-yet/,"16 Jul 2026, 22:38"
Energy & Infrastructure,The Diplomat,The Gap Between Reform and Local Power in Uzbekistan,One woman’s attempt to stand for election as mahalla chairperson reveals the barriers that remain to inclusive self-government in Uzbekistan.,https://thediplomat.com/2026/07/the-gap-between-reform-and-local-power-in-uzbekistan/,"16 Jul 2026, 22:22"
Strategic Signals,The Diplomat,Playing for a Place in the World Through Taiwan’s Baseball Diplomacy,International sport offers something that conventional diplomacy often cannot: a stage on which Taiwan can appear before a global audience.,https://thediplomat.com/2026/07/playing-for-a-place-in-the-world-through-taiwans-baseball-diplomacy/,"16 Jul 2026, 21:40"
Strategic Signals,The Diplomat,How Water Is Becoming Pakistan’s Nuclear Threshold,The real danger lies not in the immediate scarcity of Indus water flowing from India into Pakistan but in the widening gap between how they interpret the same facts.,https://thediplomat.com/2026/07/how-water-is-becoming-pakistans-nuclear-threshold/,"16 Jul 2026, 13:19"
Policy & Regulation,The Diplomat,What the West Bengal Egg Row Says About Indian Society,"The BJP government, whose support base includes traditionalist Hindus, moved to drop eggs from the midday meal program in Kolkata.",https://thediplomat.com/2026/07/what-the-west-bengal-egg-row-says-about-indian-society/,"16 Jul 2026, 13:11"
