section,source,title,summary,link,published_at
Policy & Regulation,Financial Times World,VPN use in UK doubles as people circumvent porn laws,Regulator Ofcom found evidence of children using the technology to get around curbs,https://www.ft.com/content/f2f77b53-f141-43b0-9ce4-94cf49819fba,"16 Jul 2026, 09:01"
Strategic Signals,Financial Times World,Thousands of Ukrainians protest against Zelenskyy’s firing of defence minister,Deputy air force commander resigns as president faces backlash over decision,https://www.ft.com/content/06865b90-5b62-46c5-ae8d-147842b41cd0,"16 Jul 2026, 08:47"
Strategic Signals,Financial Times World,Shabana Mahmood ticks almost every box,Home secretary is aligned with Andy Burnham but poor at selling tough policies to MPs,https://www.ft.com/content/3d477cd0-5d74-4b82-8481-d55d3190cbab,"16 Jul 2026, 08:30"
Strategic Signals,Financial Times World,Varun Chandra to stay as Number 10 business adviser under Burnham,Decision expected to be welcomed by UK business leaders,https://www.ft.com/content/cba000af-05a4-4af5-94c3-bf028bf27cb1,"16 Jul 2026, 08:22"
Strategic Signals,Financial Times World,UK economy grew 0.1% in May,Figure comes as Andy Burnham prepares to enter Number 10,https://www.ft.com/content/ab436c8d-6d21-466a-8337-3a7467c9aff8,"16 Jul 2026, 07:52"
Strategic Signals,Financial Times World,Uber agrees €13bn deal to acquire Delivery Hero,German food delivery group will spin off Turkish and some European operations to New York-based SSW Partners,https://www.ft.com/content/c15115ea-7386-4f44-9643-f95f58187514,"16 Jul 2026, 06:49"
Strategic Signals,Financial Times World,An unelucidating post about the UK’s mysterious ‘Other’ direct debits,Committing to debit,https://www.ft.com/content/24ffe2f4-20cc-4a32-82c5-2ccecc95259c,"16 Jul 2026, 05:30"
Geopolitics,Financial Times World,Merz and Macron to reset ties after fighter jet project collapse,Also in this newsletter: former Norway premier calls for EU membership debate and Orbán ex-minister joins China’s BYD,https://www.ft.com/content/ffdf7127-cf31-4521-be13-23dbf2ae24fa,"16 Jul 2026, 05:00"
Policy & Regulation,Financial Times Companies,PwC and partner fined more than £3mn over Babcock audit failings,Regulator says Big Four firm committed ‘serious breaches’ in work on defence and aerospace group,https://www.ft.com/content/da387737-38d0-4c68-913c-e0b541ec529a,"16 Jul 2026, 08:30"
Strategic Signals,Financial Times Companies,ABB buys UK engineering group Rotork in £4.1bn deal,Acquisition adds to wave of interest from foreign buyers in London-listed companies,https://www.ft.com/content/2aed9949-737b-48dd-81b9-b5f2b5cdeef2,"16 Jul 2026, 08:22"
Strategic Signals,Financial Times Companies,Chipmaker TSMC to invest another $100bn in US production,Total commitment rises to $265bn as world’s leading supplier of semiconductors lifts revenue forecasts and spending,https://www.ft.com/content/491927e1-1532-486d-94ec-8d6ee2de7bcd,"16 Jul 2026, 07:24"
Strategic Signals,Financial Times Companies,"Huawei aims for growth, Malaysia moves into batteries","The inside story on the Asia tech trends that matter, from Nikkei Asia and the Financial Times",https://www.ft.com/content/1ce69ce4-92bf-493d-b5b6-350a122edf29,"16 Jul 2026, 06:57"
Strategic Signals,Financial Times Companies,BHP’s Australian iron ore workers go on strike,Operations in key Pilbara region have been under threat from new projects including Simandou mine in Guinea,https://www.ft.com/content/83dc5efd-987b-4fdd-9bc6-814d47a7bc0d,"16 Jul 2026, 06:12"
Strategic Signals,The Hindu BusinessLine,Naturis Cosmetics raises ₹100 cr in funding round led by Sharrp ventures,Naturis Cosmetics recorded a revenue growth of over 50% CAGR over the last four years,https://www.thehindubusinessline.com/companies/naturis-cosmetics-raises-100-cr-in-funding-round-led-by-sharrp-ventures/article71229164.ece,"16 Jul 2026, 14:38"
Policy & Regulation,The Hindu BusinessLine,"TVK Govt’s maiden Budget to focus on efficient use of public funds and prudent spending, says Minister","The new government is reviewing the State’s finances before finalising spending plans, Minister CTR Nirmal Kumar says.",https://www.thehindubusinessline.com/news/tvk-govts-maiden-budget-to-focus-on-efficient-use-of-public-funds-and-prudent-spending-says-minister/article71229107.ece,"16 Jul 2026, 14:34"
Energy & Infrastructure,The Hindu BusinessLine,Huawei Launches the latest Grid-Forming Strategy for Future Power Systems at The Smarter E 2026,Huawei Launches the latest Grid-Forming Strategy for Future Power Systems at The Smarter E 2026,https://www.thehindubusinessline.com/brandhub/pr-release/huawei-launches-the-latest-grid-forming-strategy-for-future-power-systems-at-the-smarter-e-2026/article71229192.ece,"16 Jul 2026, 14:30"
Strategic Signals,The Hindu BusinessLine,Angel Yeast Showcases Sustainable Protein Innovation at the Growth Asia Summit 2026,Angel Yeast Showcases Sustainable Protein Innovation at the Growth Asia Summit 2026,https://www.thehindubusinessline.com/brandhub/pr-release/angel-yeast-showcases-sustainable-protein-innovation-at-the-growth-asia-summit-2026/article71229188.ece,"16 Jul 2026, 14:30"
Strategic Signals,The Hindu BusinessLine,"Q1 Results Today Live: BHEL logs ₹382 cr profit in Q1FY27, Wipro, Jio Financial, Tech Mahindra, CEAT, WeWork to announce Q1 results, Polycab India, ITC Hotels profit rise","Q1 Results Today, 16th July 2026 Live Updates: Catch live updates",https://www.thehindubusinessline.com/markets/q1-results-today-live-updates-wipro-jio-financial-tech-mahindra-polycab-india-bhel-piramal-finance-itc-hotels-ceat-wework-hdbfs-groww-icici-pru-hdfc-results-16-july-2026/article71225300.ece,"16 Jul 2026, 14:27"
Energy & Infrastructure,The Hindu BusinessLine,"Sensex today | Stock Market Live: Sensex rises 100 pts, Nifty above 24,000; SBI Life, Eternal lead losers","Sensex, Nifty, Share Prices LIVE: Indian benchmark indices opened higher on Thursday, supported by positive Wall Street cues, even as a sharp sell-off across Asian markets, elevated crude oil prices and escalating West Asia tensions kept investor sentiment cautious and limited gains.",https://www.thehindubusinessline.com/markets/sensex-nifty50-today-stock-market-live-updates-16-july-2026/article71225304.ece,"16 Jul 2026, 14:27"
Strategic Signals,The Hindu BusinessLine,AI-boom fuels 'K' shaped global economic growth: Moody's Analytics,"The agency said AI boom has driven a surge in data centre investment, exports in Asia's tech-heavy economies, and stock market valuations across the world",https://www.thehindubusinessline.com/info-tech/ai-boom-fuels-k-shaped-global-economic-growth-moodys-analytics/article71229167.ece,"16 Jul 2026, 14:25"
Energy & Infrastructure,The Hindu BusinessLine,"Sterling & Wilson Renewable Energy stock tumbles 7% despite record order book of ₹13,000 crore","The stock opened at ₹241.76 and hit a low of ₹218.79 during the session, with sell-side pressure heavily dominant.",https://www.thehindubusinessline.com/markets/stock-markets/sterling-wilson-renewable-energy-stock-tumbles-7-despite-record-order-book-of-13000-crore/article71229166.ece,"16 Jul 2026, 14:23"
Energy & Infrastructure,Times of India Business,100% US tariff threat over Russian oil: India may have reasons to stay calm,"This is not the first attempt by the US to penalise countries purchasing Russian oil. Last year, Washington imposed an additional 25% tariff on India over its imports of Russian crude, before reversing the measure in February.",https://timesofindia.indiatimes.com/business/india-business/100-us-tariff-sanctions-threat-over-russian-crude-oil-india-may-have-reasons-to-stay-calm/articleshow/132432976.cms,"16 Jul 2026, 13:25"
Energy & Infrastructure,Times of India Business,India's first hydrogen train set for launch: All you need to know,India will soon launch its first hydrogen fuel cell train on Friday. Prime Minister Narendra Modi will flag off the train in Haryana. This train generates its own electricity onboard using hydrogen fuel. The project establishes India's first integrated hydrogen railway ecosystem. This initiative mar,https://timesofindia.indiatimes.com/business/india-business/indias-first-hydrogen-train-set-for-july-17-launch-route-features-inside-look-and-faqs/articleshow/132431994.cms,"16 Jul 2026, 12:35"
Markets & Macro,Times of India Business,"US Fed enlists ex-RBI guv Rajan, 2 other Indians for massive policy overhaul","Former RBI governor Raghuram Rajan will help shape US monetary policy. He joins a Federal Reserve task force reviewing its policy framework. Rajan will examine balance sheet policy alongside other experts. Other panels will assess data, productivity, and inflation frameworks. These initiatives aim t",https://timesofindia.indiatimes.com/business/international-business/ex-rbi-governor-raghuram-rajan-and-2-other-indians-on-us-feds-monetary-policy-review-panels/articleshow/132430111.cms,"16 Jul 2026, 10:49"
Strategic Signals,Times of India Business,Bank holiday today: Will banks remain shut for Rath Yatra and Harela on July 16? Check state-wise list,"Bank branches will be closed in Odisha, Uttarakhand, and Manipur on July 16. These closures are for Ratha Yatra and the Harela festival celebrations. Customers can still use online and mobile banking services for transactions. Other regional holidays are scheduled later this month across various sta",https://timesofindia.indiatimes.com/business/india-business/bank-holiday-today-will-banks-remain-shut-for-rath-yatra-and-harela-on-july-16-check-state-wise-list/articleshow/132429136.cms,"16 Jul 2026, 10:00"
Geopolitics,Times of India Business,"Stock market Live Updates: BSE Sensex jumps over 150 points, Nifty50 climbs above 24,100 in early trade",,https://timesofindia.indiatimes.com/business/india-business/sensex-stock-market-today-16-july-2026-live-updates-nse-bse-gift-nifty-50-top-gainers-losers-mcx-stocks-in-focus-market-news/liveblog/132429223.cms,"16 Jul 2026, 09:34"
Markets & Macro,Times of India Business,"Top stocks to buy today: Stock recommendations for July 16, 2026 - check list","Top stock market recommendations: Anant Raj, Sobha Ltd, and PNB Housing Finance have been identified as the top stocks to buy by Aakash K Hindocha, Vice President - Research, Nuvama Professional Clients Group/Nuvama Wealth Management for July 16, 2026. Views on Nifty and Bank Nifty have also been sh",https://timesofindia.indiatimes.com/business/india-business/top-stock-recommendations-for-july-16-2026-anant-raj-sobha-pnb-housing-finance-best-stocks-to-buy-today/articleshow/132428685.cms,"16 Jul 2026, 08:55"
Strategic Signals,Times of India Business,'Very cute': US President Donald Trump welcomes new $1 coin with his face on it,A new US dollar coin will feature President Donald Trump for America's 250th birthday. This commemorative coin is scheduled for release in the autumn of 2026. The design includes Trump's image and traditional American symbols on both sides. Critics raised concerns about this move conflicting with an,https://timesofindia.indiatimes.com/business/international-business/very-cute-us-president-donald-trump-welcomes-new-1-coin-with-his-face-on-it/articleshow/132428202.cms,"16 Jul 2026, 08:41"
Geopolitics,Times of India Business,China's economy stumbles with growth below target: Report,"China's economy slowed more than expected last quarter, reaching its weakest point in over three years. Gross domestic product grew 4.3% from a year ago, missing official targets. This slowdown will likely dominate upcoming Politburo meetings this month. Officials may accelerate public spending and ",https://timesofindia.indiatimes.com/business/international-business/chinas-economy-stumbles-with-growth-below-target-report/articleshow/132427771.cms,"16 Jul 2026, 07:38"
Strategic Signals,Hindustan Times India,Rath Yatra: Millions brave heavy rain as Jagannath chariots roll in Odisha’s Puri,"Despite over 200 mm of rain, millions of devotees gathered in Puri as Odisha deployed 12,000 security personnel for Lord Jagannath’s annual Rath Yatra.",https://www.hindustantimes.com/india-news/rath-yatra-millions-brave-heavy-rain-as-jagannath-chariots-roll-in-odisha-s-puri-101784191466811.html,"16 Jul 2026, 14:14"
Strategic Signals,Hindustan Times India,‘Global uncertainties need decisive actions’: Ajit Doval tells BIMSTEC on security challenges,The NSA said the BIMSTEC grouping has strengthened cooperation across several security domains and made significant progress in tackling shared challenges.,https://www.hindustantimes.com/india-news/global-uncertainties-need-decisive-actions-ajit-doval-tells-bimstec-on-security-challenges-101784188855877.html,"16 Jul 2026, 14:09"
Strategic Signals,Hindustan Times India,'Ram Mandir Trust treasurer must also be investigated': Sena UBT's Sanjay Raut amid donation scam row,"Sanjay Raut also addressed Maharashtra CM Devendra Fadnavis as a ""devout devotee of Lord Ram"" and recalled his association with the Ram Janmabhoomi movement.",https://www.hindustantimes.com/india-news/ram-mandir-trust-treasurer-must-also-be-investigated-sena-ubt-sanjay-raut-amid-alleged-donation-scam-row-ayodhya-temple-101784187850192.html,"16 Jul 2026, 13:58"
Geopolitics,Hindustan Times India,Kanwariyas vandalise pickup truck after vehicle allegedly brushed against Kanwar in UP's Muzaffarnagar,"The incident took place near Khadar Chowk in Purkazi town on Wednesday night when a group of kanwariyas, including Naveen, Prince and Navneet.",https://www.hindustantimes.com/india-news/kanwariyas-vandalise-pickup-truck-after-vehicle-allegedly-brushed-against-kanwar-in-ups-muzaffarnagar-101784186056269.html,"16 Jul 2026, 13:41"
Strategic Signals,Hindustan Times India,Tamil Nadu: Relatives stage overnight protest as man dies in judicial custody,"Relatives of S Sabari Varman, an undertrial prisoner who died in the sub-jail, staged an overnight protest demanding a second autopsy and an independent probe.",https://www.hindustantimes.com/india-news/tamil-nadu-relatives-stage-overnight-protest-as-man-dies-in-judicial-custody-101784186256167.html,"16 Jul 2026, 13:37"
Markets & Macro,Hindustan Times India,'Don't deploy Indian sailors…': India's big warning to shipowners over Hormuz amid renewed US-Iran tensions,"Two Indian nationals, 31-year-old Rohan Kumar from Bihar's Gopalganj and 30-year-old Herambh Karmarkar from Pune, have been killed in separate attacks on ships.",https://www.hindustantimes.com/india-news/avoid-deploying-indian-seafarers-on-ships-passing-through-hormuz-india-dgma-notice-shipowners-amid-us-iran-war-101784186911515.html,"16 Jul 2026, 13:22"
Strategic Signals,Hindustan Times India,'Swastika connects India and Azerbaijan': Indian diplomat invokes ancient symbol amid strained ties,Abhay Kumar's post comes against the backdrop of a relationship that has faced significant strain in recent months.,https://www.hindustantimes.com/india-news/swastika-connects-india-and-azerbaijan-indian-diplomat-abhay-kumar-invokes-ancient-symbol-amid-strained-ties-101784186209262.html,"16 Jul 2026, 13:21"
Strategic Signals,Hindustan Times India,"Don’t burden class 9 students with a new language, SC tells Centre, CBSE",The remarks by Justice BV Nagarathna assume significance as they come barely a fortnight after the CBSE announced a one-time relaxation for the current batch.,https://www.hindustantimes.com/india-news/dont-burden-class-9-students-with-a-new-language-sc-tells-centre-cbse-101784186787379.html,"16 Jul 2026, 12:56"
Strategic Signals,Indian Express Latest,Trinamool MP Koel Mallick quits Rajya Sabha in latest setback for Mamata Banerjee,,https://indianexpress.com/article/cities/kolkata/trinamool-mp-koel-mallick-quits-rajya-sabha-mamata-banerjee-10789273/,"16 Jul 2026, 09:03"
Strategic Signals,Indian Express Latest,Saif Ali Khan says he was refused Ajay Devgn’s role in Omkara: ‘You are too handsome’,,https://indianexpress.com/article/entertainment/bollywood/saif-ali-khan-vishal-bhardwaj-refused-ajay-devgn-role-in-omkara-too-handsome-10789070/,"16 Jul 2026, 08:59"
Strategic Signals,Indian Express Latest,"Over 500 feared dead as boat capsizes off Myanmar’s coast, says UN",,https://indianexpress.com/article/world/world-myanmar-boat-capsize-500-rohingya-refugees-feared-dead-un-10789226/,"16 Jul 2026, 08:59"
Strategic Signals,Indian Express Latest,"Doctor sold old Grand Vitara to get E20-compliant model, Rs 1 lakh compensation, consumer forum says",,https://indianexpress.com/article/india/doctor-grand-vitara-old-model-e20-compliant-car-consumer-forum-order-10789266/,"16 Jul 2026, 08:58"
Geopolitics,Indian Express Latest,UPSC Mains Answer Practice — GS 2: India’s Act East Policy and vulnerability of global maritime trade routes (Week 163),,https://indianexpress.com/article/upsc-current-affairs/upsc-essentials/upsc-mains-answer-practice-gs-2-week-163-10787451/,"16 Jul 2026, 08:50"
Strategic Signals,Indian Express Latest,Stalker stabs schoolgirl to death near Kolkata after she spurned advances,,https://indianexpress.com/article/cities/kolkata/stalker-stabs-schoolgirl-to-death-howrah-kolkata-after-spurned-advances-10789175/,"16 Jul 2026, 08:49"
Strategic Signals,Indian Express Latest,‘I carried the trauma for years’: Sohail Khan reveals he was sexually harassed as a child,,https://indianexpress.com/article/entertainment/bollywood/sohail-khan-reveals-he-was-sexually-harassed-as-a-child-trauma-alliance-10789162/,"16 Jul 2026, 08:48"
Strategic Signals,Indian Express Latest,Falling slab kills 21-year-old in Uttarakhand tunnel 3 years after dramatic rescue of 41 workers,,https://indianexpress.com/article/india/falling-slab-kills-worker-uttarakhand-tunnel-rescue-10789251/,"16 Jul 2026, 08:48"
Markets & Macro,SCMP Asia,China memory-chip maker CXMT set for mega IPO,"Subscriptions began on Thursday for shares in memory-chip maker ChangXin Memory Technologies (CXMT) ahead of its listing on Shanghai’s Star Market in what could be mainland China’s second biggest initial public offering. With pricing set at 8.66 yuan (US$1.28) per share, the IPO of nearly 6.7 billio",https://www.scmp.com/plus/tech/big-tech/article/3360797/china-memory-chip-maker-cxmt-set-mega-ipo?utm_source=rss_feed,"16 Jul 2026, 09:07"
Markets & Macro,SCMP Asia,"BYD aims to build 3,000 ‘flash-charging’ stations across Europe within months","Chinese electric car giant BYD is building a network of 6,000 charging stations in overseas markets including Europe, as it looks to turbocharge its deliveries with the roll-out of cutting-edge flash-charging technology. The world’s largest electric vehicle (EV) maker aims to have 3,000 charging sta",https://www.scmp.com/business/china-business/article/3360759/byd-aims-build-3000-flash-charging-stations-across-europe-within-months?utm_source=rss_feed,"16 Jul 2026, 09:00"
Markets & Macro,SCMP Asia,"Ex-World Bank official warns to diversify away from US markets, people ‘will suffer’","A coordinated push towards global market diversification is urgently needed to shield savers from a potentially dangerous valuation correction in highly concentrated US equities, a former World Bank official has warned. Speaking at an event in Hong Kong on Thursday, Ian Goldin, the former World Bank",https://www.scmp.com/business/markets/article/3360789/ex-world-bank-official-warns-need-diversify-away-us-markets-people-will-suffer?utm_source=rss_feed,"16 Jul 2026, 08:01"
Geopolitics,SCMP Asia,"Cafe de Coral, in 1986, becomes first Hong Kong food chain to go public – SCMP archive","This article was first published on July 17, 1986. Cafe de Coral the live wire in quiet market by John Mulcahy Fast-food counter Cafe de Coral hit the boards yesterday (July 16, 1986), trading up to $1.35 and recording the biggest volume of the day. Although 16.6 million Cafe de Coral shares traded,",https://www.scmp.com/news/hong-kong/article/3360769/cafe-de-coral-1986-becomes-first-hong-kong-food-chain-go-public-scmp-archive?utm_source=rss_feed,"16 Jul 2026, 06:15"
Markets & Macro,SCMP Asia,What does South Korea’s Kospi chaos mean for China’s markets?,"The volatile state of South Korean stocks is reminiscent for some investors of China’s rapid boom-to-bust cycle a decade ago, analysts say, when leveraged trading fuelled a meltdown that eventually wiped US$5 trillion from the market within months. The South Korean stock market’s frantic artificial ",https://www.scmp.com/business/china-business/article/3360766/what-does-south-koreas-kospi-chaos-mean-chinas-markets?utm_source=rss_feed,"16 Jul 2026, 06:00"
Policy & Regulation,SCMP Asia,"Goldman Sachs backs HKEX with ‘buy rating’, citing Beijing’s policy support, AI stock boost","Wall Street investment bank Goldman Sachs has cast a vote of confidence in Hong Kong’s financial future by reaffirming its “buy rating” on Hong Kong Exchanges and Clearing (HKEX), as Beijing ramps up policy support to cement the city’s status as an international financial centre. “We see multiple ta",https://www.scmp.com/business/markets/article/3360753/goldman-sachs-backs-hkex-buy-rating-citing-beijings-policy-support-ai-stock-boost?utm_source=rss_feed,"16 Jul 2026, 04:21"
Markets & Macro,SCMP Asia,Mainland China funds increase stakes in Hong Kong biotech amid surge of licensing deals,"A growing number of mainland Chinese institutional fund managers have built up stakes in Hong Kong-listed biotechnology stocks over the past month, drawn by attractive valuations amid a surge in cross-border licensing deals in the sector. China’s largest mutual fund manager, E Fund Management, has t",https://www.scmp.com/business/china-business/article/3360741/mainland-china-funds-increase-stakes-hong-kong-biotech-amid-surge-licensing-deals?utm_source=rss_feed,"16 Jul 2026, 03:03"
Markets & Macro,SCMP Asia,HKIC reports double-digit investment return as ‘patient capital’ strategy bears fruit,"The Hong Kong Investment Corporation (HKIC) recorded a major jump in investment income during its second year of operation, as it expanded its role as the city’s “patient capital” engine driving local economic development. The wholly state-owned investment firm generated about HK$6.46 billion (US$82",https://www.scmp.com/business/banking-finance/article/3360736/hkic-reports-double-digit-investment-return-patient-capital-strategy-bears-fruit?utm_source=rss_feed,"16 Jul 2026, 01:00"
Geopolitics,Foreign Policy,Iranian Attacks Need Not Change the Gulf’s AI Ambitions,Ukraine offers lessons in how to keep infrastructure alive in wartime.,https://foreignpolicy.com/2026/07/16/iranian-attacks-gulf-ai-ambitions/,"16 Jul 2026, 04:01"
Geopolitics,Foreign Policy,Russia Shifts Its Focus to the Black Sea,Moscow is targeting trade routes and deepwater ports to strain Ukraine’s wartime economy.,https://foreignpolicy.com/2026/07/15/russia-ukraine-war-strikes-black-sea-ports-odesa-zelensky-koretskyi-fedorov/,"15 Jul 2026, 20:45"
Strategic Signals,Foreign Policy,Will Hasina Return to Bangladesh?,"The former prime minister set a timeline for her homecoming, despite the threat of arrest.",https://foreignpolicy.com/2026/07/15/bangladesh-sheikh-hasina-return-bnp-rahman/,"15 Jul 2026, 20:35"
Geopolitics,Foreign Policy,A New Law Heralds China’s Fraught Ethnic Future,Xi Jinping’s push for assimilation won’t solve long-standing issues.,https://foreignpolicy.com/2026/07/15/china-ethnic-laws-xinjiang-tibet-xi/,"15 Jul 2026, 19:58"
Geopolitics,Foreign Policy,Sudan Faces New Sanctions as Evidence of Atrocities Mounts,But countries remain unwilling to directly sanction foreign actors enabling the war.,https://foreignpolicy.com/2026/07/15/sudan-civil-war-crimes-sanctions-un-report-genocide/,"15 Jul 2026, 19:46"
Energy & Infrastructure,Foreign Policy,Ukraine Isn’t Waiting Around for Patriots,A new European coalition is looking to build quicker and cheaper anti-ballistic missile systems—off Ukrainian technology.,https://foreignpolicy.com/2026/07/15/ukraine-ballistic-missile-freyja-patriot-europe-france/,"15 Jul 2026, 19:27"
Geopolitics,Foreign Policy,"Ukraine’s Drones Have Turned the Tide, but Can They Change the Map?",Mid-range drone strikes may not be enough to regain Ukrainian territory.,https://foreignpolicy.com/2026/07/15/ukraine-drones-russia-war-territory-battlefield-offensive/,"15 Jul 2026, 18:03"
Energy & Infrastructure,Foreign Policy,The Other American Anniversary,The 1826 Congress of Panama sought to resist the predations of great powers. It was as relevant then as it is now.,https://foreignpolicy.com/2026/07/15/panama-congress-anniversary-america-250-us-trump-bolivar-history/,"15 Jul 2026, 14:51"
Strategic Signals,The Diplomat,Australia Wants to ‘Manage’ AI. What Will That Look Like?,"“This is our time to decide what AI looks like here in Australia,” Prime Minister Albanese said.",https://thediplomat.com/2026/07/australia-wants-to-manage-ai-what-will-that-look-like/,"15 Jul 2026, 23:15"
Policy & Regulation,The Diplomat,India’s Monsoon Deluge Reflects Intensifying Global Climate Emergency,"From floods to heatwaves, cascading climate disasters expose mounting vulnerabilities demanding coordinated scientific and policy responses.",https://thediplomat.com/2026/07/indias-monsoon-deluge-reflects-intensifying-global-climate-emergency/,"15 Jul 2026, 23:02"
Geopolitics,The Diplomat,The China Factor in Cuba-US Tensions,Insights from Orlando J. Pérez,https://thediplomat.com/2026/07/the-china-factor-in-cuba-us-tensions/,"15 Jul 2026, 22:44"
Energy & Infrastructure,The Diplomat,South Korea’s Biggest Criminal Justice Reform,Controversy is raging over how – and how much – to shave the prosecutors’ inordinate powers.,https://thediplomat.com/2026/07/south-koreas-biggest-criminal-justice-reform/,"15 Jul 2026, 22:17"
