section,source,title,summary,link,published_at
Strategic Signals,Financial Times World,Nasdaq tumbles 4% as shares in chip and memory groups sink,Rising expectations of Federal Reserve rate rise send US bond yields rising sharply,https://www.ft.com/content/2929bbd3-1f71-4424-a577-f016c3c65603,"05 Jun 2026, 19:04"
Strategic Signals,Financial Times World,Investors boost bets for Fed rate rise after bumper US jobs report,"World’s biggest economy adds 172,000 jobs in May in sign labour market is ‘turning the corner’",https://www.ft.com/content/ab37709f-9b5e-493c-902c-a87cba23b493,"05 Jun 2026, 18:53"
Strategic Signals,Financial Times World,Parents force Starmer into embracing social media ban,Prime minister set to announce restrictions this month despite previous opposition,https://www.ft.com/content/224e2b68-0ccd-4dd3-bdfb-a2b2511098a5,"05 Jun 2026, 18:12"
Strategic Signals,Financial Times World,Burnham aims to boost social housing if he becomes prime minister,Labour leadership hopeful sees way to funnel billions of pounds into sector while adhering to party’s fiscal rules,https://www.ft.com/content/0aef8a78-15d3-4463-b43d-5a97a417619c,"05 Jun 2026, 18:00"
Strategic Signals,Financial Times World,UK ministers consider lowering university fees for EU students,Concession would sweeten deal as Starmer looks to get British companies under EU’s ‘economic security’ umbrella,https://www.ft.com/content/c746eb1a-f3e2-47bb-b267-f12bb4c8509e,"05 Jun 2026, 17:43"
Geopolitics,Financial Times World,US demands tougher rules for car parts in Mexico trade talks,Washington wants to reduce Chinese supplies from North America’s vehicles while increasing American content,https://www.ft.com/content/e1a1f02e-a55d-442d-a51f-000c33173dcd,"05 Jun 2026, 17:37"
Strategic Signals,Financial Times World,Bond investors bet Colombia’s ‘Tiger’ will slash public spending,Rightwing populist Abelardo de la Espriella goes into second-round presidential vote,https://www.ft.com/content/62b6b2c4-5d7a-4992-94bb-2c7c080b7e55,"05 Jun 2026, 16:28"
Strategic Signals,Financial Times World,Rate cut red card,US labour market strength has kicked Fed rate cuts into touch,https://www.ft.com/content/a189bd3a-8093-477d-bf72-57f31ad6aaad,"05 Jun 2026, 16:26"
Strategic Signals,Financial Times Companies,Meta weighs big equity raising after blockbuster Google deal,Facebook parent could sell tens of billions of dollars in new stock as it seeks to finance AI infrastructure,https://www.ft.com/content/e6df645d-1709-4a77-b15d-aa43a0209efd,"05 Jun 2026, 18:12"
Strategic Signals,Financial Times Companies,The ethical dilemmas of AI,How we address the revolution is a question of how we manage its uncertainties,https://www.ft.com/content/d2c90246-11d7-4169-ac35-988de7fdb2af,"05 Jun 2026, 17:52"
Geopolitics,Financial Times Companies,Raspberry Pi surges as investors bet on hardware linked to AI boom,UK maker of tiny low-cost computers expects ‘robust demand’ to push unit sales above 4mn in first half,https://www.ft.com/content/22c5c127-fbab-44eb-a982-a26b9a40eb5c,"05 Jun 2026, 17:05"
Strategic Signals,Financial Times Companies,Could you be the FT’s new stock picking champion?,Register your portfolio now — the 8-week competition starts on 9 June,https://www.ft.com/content/d80d9d48-4604-42ae-a9c7-ba968c0a17a6,"05 Jun 2026, 15:56"
Geopolitics,Financial Times Companies,Bitcoin tumbles after Strategy sale unnerves crypto traders,Cryptocurrency is heading for biggest weekly loss since November 2022,https://www.ft.com/content/06bb85c7-ab3c-4cc2-bdcf-679976b6e901,"05 Jun 2026, 15:20"
Strategic Signals,Financial Times Companies,Mike Ashley’s Frasers seeks Big Four auditor after push to improve governance,Retail group has tried to professionalise after previously struggling to find a firm to sign off its accounts,https://www.ft.com/content/bcfa39b9-2a7a-4cff-9d5c-a9b3ac52dd4e,"05 Jun 2026, 14:26"
Strategic Signals,Financial Times Companies,Pugilistic Florida billionaire plots law firm stake sale to private equity,Move by largest US personal injury firm could cement buyout groups’ arrival in a sector that has long been off-limits,https://www.ft.com/content/ac309e7b-b5eb-43d4-a668-d9090b2bceaa,"05 Jun 2026, 14:14"
Markets & Macro,The Hindu BusinessLine,"RBI keeps repo rate unchanged at 5.25%, policy stance neutral",The RBI upped the FY27 retail inflation projection 5.1 per cent (earlier projection: 4.6 per cent) and cut the real GDP growth projection to 6.6 per cent (6.9 per cent),https://www.thehindubusinessline.com/money-and-banking/rbi-keeps-repo-rate-unchanged-at-525-policy-stance-neutral/article71066064.ece,"05 Jun 2026, 22:09"
Strategic Signals,The Hindu BusinessLine,"Maize farmers likely to shift to cotton, soybean, paddy, ragi",Deviations in rainfall during the June-September monsoon season will have significant implications for agricultural production in India,https://www.thehindubusinessline.com/economy/agri-business/maize-farmers-likely-to-shift-to-cotton-soybean-paddy-ragi/article71066164.ece,"05 Jun 2026, 22:07"
Geopolitics,The Hindu BusinessLine,India-US interim trade deal likely by mid-July: Piyush Goyal,Trump expresses optimism but slams India’s “tremendous tariffs”; New Delhi negotiates preferential market access over rivals like Vietnam and Bangladesh,https://www.thehindubusinessline.com/economy/trump-optimistic-on-india-trade-deal-despite-criticism-of-high-tariffs/article71064140.ece,"05 Jun 2026, 22:02"
Strategic Signals,The Hindu BusinessLine,"India is largest source for immigrant founders of US unicorns, but still not shooting for the stars",Indians feature prominently among founders who first arrived in the US as international students. There are 76 Indians who came to the US as international students and founded unicorns,https://www.thehindubusinessline.com/data-stories/india-is-largest-source-for-immigrant-founders-of-us-unicorns-but-still-not-shooting-for-the-stars/article71065983.ece,"05 Jun 2026, 22:01"
Markets & Macro,The Hindu BusinessLine,CMR Green Technologies IPO subscribed 127 times on final day,"The IPO, priced in the range of ₹182-₹192 per share, is entirely an offer-for-sale of up to 3.28 crore equity shares by promoters and an investor-selling shareholder",https://www.thehindubusinessline.com/markets/cmr-green-technologies-ipo-subscribed-123-times-so-far-on-final-day/article71065061.ece,"05 Jun 2026, 21:57"
Strategic Signals,The Hindu BusinessLine,Glass maker HNGIL issues legal notice to BIRA 91 over outstanding dues and unlifted inventory,Glassmaker seeks ₹11.19 crore and demands lifting of over 51 lakh customised bottles,https://www.thehindubusinessline.com/companies/glass-maker-hngil-issues-legal-notice-to-bira-91-over-outstanding-dues-and-unlifted-inventory/article71066368.ece,"05 Jun 2026, 21:57"
Markets & Macro,The Hindu BusinessLine,India remains fastest-growing major economy despite global uncertainty : PM Modi on latest GDP numbers,"Modi said that India achieved a 7.7% growth rate in FY26, with a 7.8% expansion in Q4, highlighting the effectiveness of his government’s reforms, infrastructure development, and welfare measures",https://www.thehindubusinessline.com/news/national/india-remains-fastest-growing-major-economy-despite-global-uncertainty-pm-modi-on-latest-gdp-numbers/article71066791.ece,"05 Jun 2026, 21:57"
Strategic Signals,The Hindu BusinessLine,Blackstone-backed AirTrunk to invest ₹3 lakh crore and over 5GW in India’s digital infrastructure,"The investment will drive cloud and AI growth, positioning India as a key market in AirTrunk’s global strategy, according to a press release",https://www.thehindubusinessline.com/companies/blackstone-backed-airtrunk-to-invest-3-lakh-crore-and-over-5gw-in-indias-digital-infrastructure/article71065321.ece,"05 Jun 2026, 21:55"
Strategic Signals,Times of India Business,Trump immigration push: US Treasury asks banks to flag suspicious transactions linked to illegal migrants,,https://timesofindia.indiatimes.com/business/international-business/trump-immigration-push-us-treasury-asks-banks-to-flag-suspicious-transactions-linked-to-illegal-migrants/articleshow/131538619.cms,"05 Jun 2026, 23:29"
Markets & Macro,Times of India Business,India's FPI debt inflows reached 62% of cumulative equity at $95.5 billion since FY99; $19.3 billion since FY25: Report,"Foreign investors are increasingly favoring India's debt market, with FPI debt inflows comprising a significant portion of overall foreign capital. This trend is boosted by global bond index inclusion and easier access routes. With attractive real yields and a stable currency outlook, India is poise",https://timesofindia.indiatimes.com/business/india-business/indias-fpi-debt-inflows-reached-62-of-cumulative-equity-at-95-5-billion-since-fy99-19-3-billion-since-fy25-report/articleshow/131537078.cms,"05 Jun 2026, 22:52"
Strategic Signals,Times of India Business,Lower fuel and vehicle costs key to driving ethanol demand: Experts,,https://timesofindia.indiatimes.com/business/india-business/lower-fuel-and-vehicle-costs-key-to-driving-ethanol-demand-experts/articleshow/131537581.cms,"05 Jun 2026, 22:51"
Markets & Macro,Times of India Business,Govt extends tenure of RBI deputy governor Swaminathan J for two years,"The government has extended the tenure of Reserve Bank Deputy Governor Swaminathan Janakiraman for another two years, effective June 26, 2026. Janakiraman, who was initially appointed in June 2023, will continue in his role as the central bank maintains its four-deputy governor structure.",https://timesofindia.indiatimes.com/business/india-business/govt-extends-tenure-of-rbi-deputy-governor-swaminathan-j-for-two-years/articleshow/131537233.cms,"05 Jun 2026, 22:35"
Markets & Macro,Times of India Business,Rupee jumps 56 paise to 95.18 vs US dollar after RBI announces forex-support measures,"The rupee surged 56 paise to 95.18 against the US dollar following RBI's measures to attract foreign capital and boost forex liquidity. These policy announcements, including expanding the Fully Accessible Route and removing taxes on foreign investment in G-Secs, improved investor sentiment. Analysts",https://timesofindia.indiatimes.com/business/india-business/rupee-jumps-56-paise-to-95-18-vs-us-dollar-after-rbi-announces-forex-support-measures/articleshow/131536642.cms,"05 Jun 2026, 22:20"
Energy & Infrastructure,Times of India Business,OIL reports presence of natural gas in its third exploratory well in Andaman block,"State-run Oil India Limited (OIL) has reported the discovery of natural gas in its third exploratory well, Vijayapuram-3, in the Andaman shallow offshore block. This finding further indicates the hydrocarbon potential in the region, following a previous discovery in the Vijayapuram-2 well. OIL is no",https://timesofindia.indiatimes.com/business/india-business/oil-reports-presence-of-natural-gas-in-its-third-exploratory-well-in-andaman-block/articleshow/131536039.cms,"05 Jun 2026, 21:36"
Energy & Infrastructure,Times of India Business,More than 75 lakh households to have rooftop solar systems by Dec: Pralhad Joshi,,https://timesofindia.indiatimes.com/business/india-business/more-than-75-lakh-households-to-have-rooftop-solar-systems-by-dec-pralhad-joshi/articleshow/131536023.cms,"05 Jun 2026, 21:29"
Markets & Macro,Times of India Business,"At 7.7%, India's GDP growth in FY26 beats slowdown predictions; but will the momentum continue amid US-Iran war?","What does the GDP data tell us about India’s economic prospects? Will the real hit from the US-Iran conflict reflect in the first quarter GDP numbers? And, is India’s long-term growth story under threat? Let’s take a look:",https://timesofindia.indiatimes.com/business/india-business/at-7-7-indias-gdp-growth-in-fy26-beats-slowdown-predictions-but-will-the-momentum-continue-amid-us-iran-war/articleshow/131535168.cms,"05 Jun 2026, 21:12"
Energy & Infrastructure,Hindustan Times India,"‘Trust-based, brotherly relations’: Putin on nearly 80 years of India-Russia ties",Russian President Vladimir Putin spoke of both nations navigating energy supply vulnerabilities caused by the US-Israeli war near the Strait of Hormuz.,https://www.hindustantimes.com/india-news/trustbased-brotherly-relations-putin-on-nearly-80-years-of-india-russia-ties-strait-of-hormuz-iran-west-asia-oil-101780685318352.html,"06 Jun 2026, 00:29"
Strategic Signals,Hindustan Times India,Ex-TMC MLA Saokat Molla arrested in NIA crackdown on pre-poll Bhangar blast case,The investigation concerns a bomb blast that occurred days ahead of the West Bengal Assembly elections. One person was killed.,https://www.hindustantimes.com/india-news/extmc-mla-saokat-molla-arrested-in-nia-crackdown-on-pre-poll-bhangar-blast-trinamool-bengal-elections-mamata-banerjee-101780683114620.html,"05 Jun 2026, 23:50"
Strategic Signals,Hindustan Times India,No relaxation in IIT admission 75% Class 12 marks rule: Joint Admission Board,JAB says IIT admissions through JEE Advanced 2026 will continue to require 75% Class 12 marks despite demands for relaxation over CBSE delays.,https://www.hindustantimes.com/india-news/no-relaxation-in-iit-admission-75-class-12-marks-rule-joint-admission-board-101780681498417.html,"05 Jun 2026, 23:20"
Strategic Signals,Hindustan Times India,PoK would have been ours had Operation Sindoor continued for 2 more days: Rambhadracharya,The spiritual guru also predicted a 2029 victory for PM Modi and a continued run as defence minister for Rajnath Singh,https://www.hindustantimes.com/india-news/pok-would-have-been-ours-had-operation-sindoor-continued-for-2-more-days-rambhadracharya-101780677841253.html,"05 Jun 2026, 22:55"
Strategic Signals,Hindustan Times India,"‘No need for medical colleges, hospitals’: Bihar minister lays out his vision","Vijay Sinha said, “Make Bihar so healthy that there would be no need for medical colleges and hospitals.”",https://www.hindustantimes.com/india-news/no-need-for-medical-colleges-and-hospitals-bihar-deputy-cm-lays-out-health-vision-101780667678162.html,"05 Jun 2026, 22:12"
Strategic Signals,Hindustan Times India,"Assam cabinet approves dearness allowance hike, raises it to 60%: CM Sarma","The decision was taken at the first cabinet meeting following its expansion with the inclusion of 12 new ministers, 11 from the Bharatiya Janata Party (BJP) and one from the Asom Gana Parishad (AGP)",https://www.hindustantimes.com/india-news/assam-cabinet-approves-dearness-allowance-hike-raises-it-to-60-cm-sarma-101780677415712.html,"05 Jun 2026, 22:06"
Strategic Signals,Hindustan Times India,"Abhishek Banerjee retains his spot in TMC rejig, flanked by Mamata loyalists",TMC parliamentary leader in the Rajya Sabha Derek O’Brien and RS member Dola Sen have been appointed national joint secretaries to assist Abhishek Banerjee,https://www.hindustantimes.com/india-news/abhishek-banerjee-retains-his-spot-in-tmc-rejig-now-flanked-by-mamata-loyalists-101780676335287.html,"05 Jun 2026, 21:48"
Strategic Signals,Hindustan Times India,It's not just Annamalai. Another BJP leader leader exits party in Tamil Nadu ‘after careful thought’,State secretary Sumathi Venkatesh announced her decision to quit the party on Friday after K Annamalai and Karu Nagarajan's exit.,https://www.hindustantimes.com/india-news/with-heavy-heart-another-key-tamil-nadu-bjp-leader-sumathi-venkatesh-resigns-third-after-annamalais-exit-101780674278196.html,"05 Jun 2026, 21:47"
Strategic Signals,Indian Express Latest,Neetu Kapoor calls Ranbir and Alia ‘outstanding’ parents to Raha: ‘Very scared of her mother’,,https://indianexpress.com/article/lifestyle/neetu-kapoor-ranbir-alia-bhatt-parenting-raha-expert-10683636/,"05 Jun 2026, 18:30"
Strategic Signals,Indian Express Latest,"US adds 172,000 jobs in May, easing fears of labour market slowdown",,https://indianexpress.com/article/world/us-job-report-may-2026-unemployment-federal-reserve-interest-rates-iran-war-10726225/,"05 Jun 2026, 17:36"
Strategic Signals,Indian Express Latest,Why the size of your prostate matters less than the daily symptoms,,https://indianexpress.com/article/lifestyle/health/why-the-size-of-your-prostate-matters-less-than-the-daily-symptoms-10720425/,"05 Jun 2026, 17:30"
Strategic Signals,Indian Express Latest,Extreme heat at FIFA World Cup 2026: England to use palm-cooling tech – Report,,https://indianexpress.com/article/sports/football/extreme-heat-fifa-world-cup-england-palm-cooling-tech-10726280/,"05 Jun 2026, 17:30"
Strategic Signals,Indian Express Latest,Buffy the Vampire Slayer actor Anthony Head dies at 72,,https://indianexpress.com/article/entertainment/television/buffy-the-vampire-slayer-actor-anthony-head-dies-at-72-10726281/,"05 Jun 2026, 17:29"
Strategic Signals,Indian Express Latest,"Parimala and Co movie review: Jayaram, Urvashi’s comedy thriller is a lazy disaster",,https://indianexpress.com/article/entertainment/movie-review/parimala-and-co-movie-review-jayaram-urvashi-mysskin-pandiraaj-10724782/,"05 Jun 2026, 17:20"
Strategic Signals,Indian Express Latest,Zverev vs Cobolli set for French Open final after Arnaldi withdraws with virus,,https://indianexpress.com/article/sports/tennis/zverev-vs-cobolli-french-open-final-arnaldi-withdraws-virus-10726272/,"05 Jun 2026, 17:19"
Strategic Signals,Indian Express Latest,Delhi LG asks DTC to deploy armed female police personnel in buses for women safety,,https://indianexpress.com/article/cities/delhi/delhi-dtc-buses-armed-female-police-women-safety-10726199/,"05 Jun 2026, 17:16"
Strategic Signals,SCMP Asia,"AI infrastructure is multi-tiered, and HDDs are central to scaling AI, WD shares","[The content of this article has been produced by our advertising partner.] AI has long been caught in a paradox: AI workloads demand high performance storage, long associated with flash, but scaling at AI levels with all-flash is prohibitively expensive. Hard disk drives (HDDs), on the other hand, ",https://www.scmp.com/presented/business/topics/wd-computex-2026/article/3355936/ai-infrastructure-multi-tiered-and-hdds-are-central-scaling-ai-wd-shares?utm_source=rss_feed,"05 Jun 2026, 16:00"
Markets & Macro,SCMP Asia,China launches space computing hub as SpaceX gears up for historic IPO,"China is ramping up its bets on space-based artificial intelligence computing with the launch of a state-backed research institute in Beijing, accelerating a frontier tech race with the US just as Elon Musk’s SpaceX eyes a record-shattering US$75 billion market debut to fund its own orbital AI ambit",https://www.scmp.com/tech/big-tech/article/3356102/china-launches-space-computing-hub-spacex-gears-historic-ipo?utm_source=rss_feed,"05 Jun 2026, 14:00"
Geopolitics,SCMP Asia,"Chinese EVs reclaim momentum as tech upgrades, incentives squeeze gains of foreign marques","International marques have failed to sustain the market share they regained in China early this year after consumers fell back in love with electric vehicles (EVs), a sector where domestic brands continue to enjoy an overwhelming advantage. Foreign carmakers from Volkswagen to Toyota held a combined",https://www.scmp.com/business/china-evs/article/3356147/chinese-evs-reclaim-momentum-tech-upgrades-incentives-squeeze-gains-foreign-marques?utm_source=rss_feed,"05 Jun 2026, 12:00"
Policy & Regulation,SCMP Asia,"Hong Kong taps banks, lawyers and crypto firms to help rewrite rules for tokenised bonds","Hong Kong’s de facto central bank has formed a group of industry experts to help remove legal and regulatory hurdles to tokenized bonds, as authorities seek to move beyond pilot projects and encourage wider adoption from private issuers. The Hong Kong Monetary Authority (HKMA) said on Friday it had ",https://www.scmp.com/business/cryptocurrency/article/3356125/hong-kong-taps-banks-lawyers-and-crypto-firms-help-rewrite-rules-tokenised-bonds?utm_source=rss_feed,"05 Jun 2026, 10:45"
Markets & Macro,SCMP Asia,"China sees revival of foreign investors through IPOs, convertibles: UBS","Foreign investors are returning to Chinese assets through convertible bonds and IPOs, helping fuel a fundraising rebound in Hong Kong as global investors seek exposure to the country’s artificial intelligence (AI), semiconductor and advanced manufacturing sectors. According to estimates by UBS, Chin",https://www.scmp.com/business/china-business/article/3356097/china-sees-revival-foreign-investors-through-ipos-convertibles-ubs?utm_source=rss_feed,"05 Jun 2026, 10:00"
Geopolitics,SCMP Asia,Mainland China’s investors face new hurdles as Hong Kong brokers tighten rules,"Shenzhen-based AI engineer Sihan Wang recently decided to liquidate all holdings in his Futu Securities account, which he opened a year ago, citing concerns that escalating regulatory oversight could restrict his ability to manage overseas investments. “I would rather step back now than risk having ",https://www.scmp.com/business/china-business/article/3356095/mainland-chinas-investors-face-new-hurdles-hong-kong-brokers-tighten-rules?utm_source=rss_feed,"05 Jun 2026, 08:47"
Geopolitics,SCMP Asia,AI hyperscaler effect vaults China’s Zhongji Innolight to top of CSI 300 benchmark,"The artificial intelligence frenzy has made Zhongji Innolight, a supplier of optical modules to US hyperscalers, the biggest constituent of China’s stock benchmark, highlighting AI’s profound impact on the world’s second-largest equity market. The northern Shandong province-based company had a 5 per",https://www.scmp.com/business/china-business/article/3356074/ai-hyperscaler-effect-vaults-chinas-zhongji-innolight-top-csi-300-benchmark?utm_source=rss_feed,"05 Jun 2026, 07:30"
Markets & Macro,SCMP Asia,"Inside Labuan IBFC, the Malaysian centre built for cross-border finance","Cross-border finance is becoming more complex, not less. Businesses operating across jurisdictions are dealing with tighter regulation and more pressure to demonstrate transparency across markets, raising the bar for the international financial centres they use. This shift helps explain why global b",https://www.scmp.com/native/business/topics/gateway-global-business/article/3354840/inside-labuan-ibfc-malaysian-centre-built-cross-border-finance?utm_source=rss_feed,"05 Jun 2026, 07:00"
Energy & Infrastructure,Foreign Policy,"Contain, Consolidate, and Co-Opt",How Europe has learned to live with great-power politics.,https://foreignpolicy.com/2026/06/05/europe-strategy-turkey-russia-china-putin-erdogan-brussels/,"05 Jun 2026, 18:40"
Strategic Signals,Foreign Policy,Romania Has Perfected the Art of Forgetting,"In a new memoir, Nobel laureate Herta Müller condemns her homeland for failing to reconcile with history.",https://foreignpolicy.com/2026/06/05/herta-muller-memoir-romania-ceausescu-communist-history/,"05 Jun 2026, 18:20"
Geopolitics,Foreign Policy,What in the World?,"Test yourself on the week of May 30: Malta votes, Japan responds to militarism accusations, and Iran pauses talks with the U.S.",https://foreignpolicy.com/2026/06/05/news-quiz-malta-election-japan-militarism-iran-peace-negotiations/,"05 Jun 2026, 16:26"
Energy & Infrastructure,Foreign Policy,Myanmar’s Military Isn’t Conceding Much,Prisoner releases mostly reflect the regime’s growing confidence five years after seizing power in a coup.,https://foreignpolicy.com/2026/06/05/myanmar-president-min-aung-hlaing-military-concessions/,"05 Jun 2026, 15:45"
Geopolitics,Foreign Policy,"Sleeping in Mexico, Playing in America",The journey of Iran’s World Cup team sets a dangerous precedent for international soccer.,https://foreignpolicy.com/2026/06/05/mexico-america-trump-iran-fifa-olympics-world-cup/,"05 Jun 2026, 15:11"
Geopolitics,Foreign Policy,Does the United States Have the Weapons for Trade War?,Economic strategists are pitching tougher policies for an anxious world.,https://foreignpolicy.com/2026/06/05/trade-war-trump-china-economics/,"05 Jun 2026, 13:27"
Strategic Signals,Foreign Policy,How Brazilian Soccer Shed Protectionism,Will openness to foreign players and coaches make a difference at the World Cup?,https://foreignpolicy.com/2026/06/05/brazil-soccer-world-cup-foreign-coach-protectionism/,"05 Jun 2026, 12:00"
Strategic Signals,Foreign Policy,Washington Is Testing Singapore’s Patience,Donald Trump is working hard to alienate yet another strategic partner.,https://foreignpolicy.com/2026/06/05/singapore-trump-tariffs-trade-forced-labor-china-geopolitics/,"05 Jun 2026, 09:34"
Strategic Signals,The Diplomat,Oh Se-hoon Becomes Seoul’s Mayor for the 5th Time,"Why Seoul picked the PPP incumbent yet again, and what it means for the city.",https://thediplomat.com/2026/06/oh-se-hoon-becomes-seouls-mayor-for-the-5th-time/,"06 Jun 2026, 01:28"
Strategic Signals,The Diplomat,India’s Eye in the Sky: The Rise of a State-Deep Tech Startup Space Partnership,"India’s deep tech space startups are transforming the country’s space ambitions, as the state increasingly supports private innovation to strengthen India’s strategic and economic position in the global space race.",https://thediplomat.com/2026/06/indias-eye-in-the-sky-the-rise-of-a-state-deep-tech-startup-space-partnership/,"05 Jun 2026, 23:01"
Markets & Macro,The Diplomat,The Bipolar Trap: The Real Danger in the Trump-Xi Era,The challenge is not just preventing war between China and the U.S. It’s how to prevent their rivalry from becoming the sole organizing principle of international politics.,https://thediplomat.com/2026/06/the-bipolar-trap-the-real-danger-in-the-trump-xi-era/,"06 Jun 2026, 00:04"
Strategic Signals,The Diplomat,Why Did Nepali PM Balendra Shah Call on UK to ‘Take an Interest’ in an India-Nepal Dispute?,The controversial comment was made on the eve of ruling party chief Ravi Lamichhane’s visit to India.,https://thediplomat.com/2026/06/why-did-nepali-pm-balendra-shah-call-on-uk-to-take-an-interest-in-an-india-nepal-dispute/,"05 Jun 2026, 23:56"
