section,source,title,summary,link,published_at
Strategic Signals,The Diplomat,"Cambodia-Thailand Relations, Not Myanmar, Will Define ASEAN’s Immediate Future",The ongoing conflict between the two member states is a direct challenge to the Southeast Asian bloc's founding purpose.,https://thediplomat.com/2026/06/cambodia-thailand-relations-not-myanmar-will-define-aseans-immediate-future/,"12 Jun 2026, 14:25"
Strategic Signals,The Diplomat,The Yuan’s Quiet Advance on Commodity Pricing,"A miner paid in yuan has a reason to borrow in yuan, and a miner indebted in yuan has a reason to price in it.",https://thediplomat.com/2026/06/the-yuans-quiet-advance-on-commodity-pricing/,"12 Jun 2026, 06:24"
Strategic Signals,The Diplomat,AUKUS After AUKMIN: The Test Beyond Washington,"While the U.S. remains the dominant partner in AUKUS, closer collaboration between Canberra and London will be vital to its success.",https://thediplomat.com/2026/06/aukus-after-aukmin-the-test-beyond-washington/,"12 Jun 2026, 07:09"
Strategic Signals,The Diplomat,Xi’s Summit with Kim: Views from the Neighborhood,"By keeping neighbors guessing about his intentions and avoiding any concessions, it is Kim who appears to have gained the most from the Chinese leader's visit.",https://thediplomat.com/2026/06/xis-summit-with-kim-views-from-the-neighborhood/,"12 Jun 2026, 03:50"
Geopolitics,The Diplomat,Three Characteristics of China’s Criticism of the Takaichi Administration,Beijing’s campaign against Tokyo is unlike anything seen before.,https://thediplomat.com/2026/06/three-characteristics-of-chinas-criticism-of-the-takaichi-administration/,"12 Jun 2026, 13:58"
Strategic Signals,War on the Rocks,The Gulf Arab States Need a Shield Built for Limited Trust,"Missiles, drones, and maritime disruptions do not stop at national borders. Gulf defense architecture still too often waits for national permission to act. The Gulf Cooperation Council has spent decades building defense institutions, diplomatic forums, and a language of indivisible Gulf security. Re",https://warontherocks.com/the-gulf-arab-states-need-a-shield-built-for-limited-trust/,"12 Jun 2026, 07:30"
Geopolitics,War on the Rocks,"Strike, Counterstrike, Repeat","Welcome to The Adversarial. Every other week, we’ll provide you with expert analysis on America’s greatest challengers: China, Russia, Iran, North Korea, and jihadists. Read more below.***Iran Hostilities have increased notably in the last few days, effectively ending the U.S.-Iranian truce that had",https://warontherocks.com/strike-counterstrike-repeat/,"11 Jun 2026, 20:20"
Geopolitics,War on the Rocks,The Evolution of Ukraine’s Asymmetrical Combat Tactics,"In 2022, Scott Sweetow wrote, “Of Roadside Bombs and Drones: Putin’s Looming Insurgency Problem,” where he argued Ukraine’s fight against Russia would rely on a combination of conventional and asymmetrical insurgent tactics. Four years of combat later, we asked Scott to revisit his arguments.Image: ",https://warontherocks.com/the-evolution-of-ukraines-asymmetrical-combat-tactics/,"11 Jun 2026, 16:00"
Geopolitics,War on the Rocks,Wargaming for Improved Acquisition: What Does It Take?,"A few months ago, I attended a panel discussion for a wargame simulating rapid industrial mobilization for armed conflict. Conducted by a leading university, with teams composed of former senior defense officials, the game probed how government and industry collaboration would play out given minimal",https://warontherocks.com/cogs-of-war/wargaming-for-improved-acquisition-what-does-it-take/,"11 Jun 2026, 08:00"
Geopolitics,War on the Rocks,The Chain of Peace: Do Supply Chain Chokepoints Deter War?,"The next war over Taiwan may be deterred not by aircraft carriers or nuclear arsenals, but by a Dutch lithography machine. ASML, headquartered in Veldhoven, the Netherlands, is the sole manufacturer of the extreme ultraviolet lithography systems required to produce the world’s most advanced semicond",https://warontherocks.com/the-chain-of-peace-do-supply-chain-chokepoints-deter-war/,"11 Jun 2026, 07:30"
Geopolitics,War on the Rocks,The Maritime Action Plan Needs a Yardstick: Enter the Mahan Ratio,"Washington is littered with the corpses of grand plans to restore the Merchant Marine. The Trump administration’s Maritime Action Plan is the latest attempt, and to its credit, the most comprehensive since World War II.The plan is the government’s blueprint to resurrect America’s commercial shipping",https://warontherocks.com/the-maritime-action-plan-needs-a-yardstick-enter-the-mahan-ratio/,"11 Jun 2026, 07:15"
Strategic Signals,War on the Rocks,Dusting a Dirt Road: How The United States Can Break the Cycle of Failing Military Infrastructure,"Winter Storm Uri ripped through Texas in January 2021. The frigid temperatures froze pipes, which then burst and caused flooding in aging barracks at Fort Hood, many of which were overdue for renovations and had vulnerable mechanical and utility systems. The burst pipes, damaged sprinkler systems, a",https://warontherocks.com/cogs-of-war/dusting-a-dirt-road-how-the-united-states-can-break-the-cycle-of-failing-military-infrastructure/,"10 Jun 2026, 08:00"
Energy & Infrastructure,War on the Rocks,Cascading Failure: The Spanish Navy’s Reserve Squadron and the Tragedy of Unpreparedness,"It is in long periods of peace that victories and defeats are prepared. Peace is the period for men of government, just as war is for men of action. Without the calm preparation carried out by the former, the courage and energy of the latter are of no use. — Captain First Class Ramón Auñón y Villaló",https://warontherocks.com/cascading-failure-the-spanish-navys-reserve-squadron-and-the-tragedy-of-unpreparedness/,"10 Jun 2026, 07:30"
Policy & Regulation,CSIS,The Bio-Pharma Industry and Society,"The Bio-Pharma Industry and Society Listing Summary Please join the CSIS Global Health Policy Center on March 17, from 10:00am – 11:30am, for an exploration of how private bio-pharmaceutical firms can better support the critically important societal goals of improved affordability, access, quality, ",https://www.csis.org/events/bio-pharma-industry-and-society,"03 Mar 2016, 20:36"
Policy & Regulation,CSIS,The FY2017 Defense Budget and Strategic Outlook,"The FY2017 Defense Budget and Strategic Outlook Listing Summary Please join the CSIS International Security Program for a half-day Defense360 conference on the recently released FY2017 defense budget request and strategic priorities. Drupal Admin Mon, 02/29/2016 - 13:48 Featured Image Image Contribu",https://www.csis.org/events/fy2017-defense-budget-and-strategic-outlook,"29 Feb 2016, 18:48"
Policy & Regulation,CSIS,2016 U.S.-Japan Security Seminar,"2016 U.S.-Japan Security Seminar Listing Summary Michael J. Green interviews JIIA President Yoshiji Nogami Drupal Admin Fri, 02/26/2016 - 12:54 Featured Image Image Contributors Michael J. Green Programs & Projects Japan Chair Parent Geopolitics and Foreign Policy Featured Image AdobeStock_179685887",https://www.csis.org/events/2016-us-japan-security-seminar,"26 Feb 2016, 17:54"
Energy & Infrastructure,CSIS,The Future of the Grid—A View from ARPA-E,"The Future of the Grid—A View from ARPA-E Listing Summary The CSIS Energy and National Security Program is pleased to invite you to a discussion with Ellen Williams, Director of ARPA-E, the Advanced Research Projects Agency-Energy. Drupal Admin Thu, 02/25/2016 - 14:15 Featured Image Image Contributo",https://www.csis.org/events/future-grid-view-arpa-e,"25 Feb 2016, 19:15"
Geopolitics,CSIS,"Statesmen's Forum: Wang Yi, Minister of Foreign Affairs, PRC","Statesmen's Forum: Wang Yi, Minister of Foreign Affairs, PRC Listing Summary Please watch the live webcast of a discussion on Chinese foreign policy and US-China Relations Drupal Admin Fri, 02/19/2016 - 17:13 Featured Image Image Contributors John J. Hamre Christopher K. Johnson Downloads Download T",https://www.csis.org/events/statesmens-forum-wang-yi-minister-foreign-affairs-prc,"19 Feb 2016, 22:13"
Geopolitics,CSIS,"China Reality Check: China's ""Internet Sovereignty"" Initiative: Origins and Consequences","China Reality Check: China's ""Internet Sovereignty"" Initiative: Origins and Consequences Listing Summary Please join us for a discussion on China’s initiative to promote Internet sovereignty as a key governing concept of the global Internet. Drupal Admin Tue, 02/16/2016 - 11:49 Featured Image Image ",https://www.csis.org/events/china-reality-check-chinas-internet-sovereignty-initiative-origins-and-consequences,"16 Feb 2016, 16:49"
Policy & Regulation,CSIS,"Statesmen's Forum: The Right Honourable Theresa May, MP, Home Secretary, United Kingdom","Statesmen's Forum: The Right Honourable Theresa May, MP, Home Secretary, United Kingdom Listing Summary Please join the CSIS International Security Program for a discussion with UK Home Secretary Theresa May on counter-terrorism policy. Drupal Admin Fri, 02/12/2016 - 16:08 Featured Image Image Contr",https://www.csis.org/events/statesmens-forum-right-honourable-theresa-may-mp-home-secretary-united-kingdom,"12 Feb 2016, 21:08"
Strategic Signals,CSIS,Strategic Opportunities in the Indo-Asia-Pacific with Admiral Harry B. Harris,"Strategic Opportunities in the Indo-Asia-Pacific with Admiral Harry B. Harris Listing Summary Please join us for a discussion with Admiral Harry B. Harris, Commander, U.S. Pacific Command, on the Strategic Opportunities in the Indo-Asia-Pacific. Drupal Admin Tue, 01/26/2016 - 11:20 Featured Image Im",https://www.csis.org/events/strategic-opportunities-indo-asia-pacific-admiral-harry-b-harris,"26 Jan 2016, 16:20"
Strategic Signals,Al Jazeera,Older runners defy age in Kenya’s central highlands,Members of a self-funded athletics club in Meru are proving that competition does not end with age.,https://www.aljazeera.com/news/2026/6/13/older-runners-defy-age-in-kenyas-central-highlands?traffic_source=rss,"13 Jun 2026, 04:31"
Geopolitics,Al Jazeera,UK court jails Palestine Action activists on ‘terrorism’ charges,UK court has sentenced four pro-Palestine activists to jail for a raid on an Israeli arms factory near Bristol in 2024.,https://www.aljazeera.com/video/newsfeed/2026/6/13/aje-onl-nf_uk-court-jails-palestine-action-activists-130626?traffic_source=rss,"13 Jun 2026, 04:22"
Strategic Signals,Al Jazeera,Canada World Cup opener splits Bosnian fans among two ‘home nations’,Thousands of Bosnia fans turned Toronto blue as they marched to the chants of 'Free Palestine' in Toronto.,https://www.aljazeera.com/sports/2026/6/13/canada-world-cup-opener-splits-bosnian-fans-among-two-home-nations?traffic_source=rss,"13 Jun 2026, 04:11"
Strategic Signals,Al Jazeera,Canada and Bosnia fight out historic World Cup opener,Bosnia and Herzegovina and Canada have fought out a 1–1 draw in their World Cup opening match.,https://www.aljazeera.com/video/newsfeed/2026/6/13/aje-onl-nf_canada-and-bosnia-world-cup-opener-120626?traffic_source=rss,"13 Jun 2026, 04:06"
Strategic Signals,Al Jazeera,USA hit Paraguay for four in dream start to their World Cup campaign,USA beat Paraguay 4-1 in Los Angeles as each of the three World Cup cohosts have now staged a game in 2026 edition.,https://www.aljazeera.com/sports/2026/6/13/usa-ease-past-paraguay-to-complete-world-cup-opening-rounds-of-hosts?traffic_source=rss,"13 Jun 2026, 03:19"
Strategic Signals,Al Jazeera,"World Cup kicks off in US as Katy Perry, Future headline opening ceremony","Tom Cruise, David Beckham, Halle Berry among celebrities in attendance at Hollywood-style opening ceremony.",https://www.aljazeera.com/sports/2026/6/13/world-cup-kicks-off-in-us-as-katy-perry-future-headline-opening-ceremony?traffic_source=rss,"13 Jun 2026, 03:04"
Strategic Signals,Al Jazeera,"Thomas Partey denied entry into Canada, will miss Ghana’s World Cup opener",Partey's visa was denied due to the multiple charges of rape he faces in the United Kingdom.,https://www.aljazeera.com/sports/2026/6/13/thomas-partey-denied-entry-into-canada-will-miss-ghanas-world-cup-opener?traffic_source=rss,"13 Jun 2026, 00:14"
Geopolitics,Al Jazeera,"Iran war live: US, Tehran signal peace deal within reach but not signed yet",Four activists from Palestine Action jailed by a British court over protest raid on Israeli arms firm in UK.,https://www.aljazeera.com/news/liveblog/2026/6/13/iran-war-live-us-tehran-signal-peace-deal-within-reach-but-not-signed-yet?traffic_source=rss,"13 Jun 2026, 00:00"
Policy & Regulation,ETCFO Top Stories,Call to extend duty cuts on critical inputs soon,India is set to decide on extending customs duty relief for critical raw material imports beyond June 30. An inter-ministerial panel will review easing import curbs on key inputs and consider fresh duties on certain locally manufactured electronics. The government is also evaluating duty cut request,https://cfo.economictimes.indiatimes.com/news/policy/call-to-extend-duty-cuts-on-critical-inputs-soon/131697162,"13 Jun 2026, 09:10"
Strategic Signals,ETCFO Top Stories,India Inc CFOs : Not without AI?,"​Most CFOs are currently using AI for basic tasks such as invoice reading, document matching and accuracy checks. But the ambition is growing. Many are now exploring agentic AI, which goes beyond generating content and can execute workflows. Instead of merely reading an invoice, an AI agent could ve",https://cfo.economictimes.indiatimes.com/news/cfo-tech/india-inc-cfos-embrace-ai-the-future-of-business-efficiency/131672037,"12 Jun 2026, 08:32"
Geopolitics,ETCFO Top Stories,"Exclusive: SEBI Writes to NFRA, Seeks Examination of Rajesh Exports Auditors","Move follows market regulator's interim findings in the alleged Rs 15.15 lakh crore revenue misstatement case; audit regulator may independently examine the role of the company's statutory auditors, according to people aware of the development.",https://cfo.economictimes.indiatimes.com/news/governance-risk-compliance/sebi-seeks-nfra-investigation-into-rajesh-exports-auditors-amid-revenue-misrepresentation-claims/131623917,"10 Jun 2026, 09:07"
Strategic Signals,ETCFO Top Stories,"Sky Gold eyes 30-35% CAGR revenue growth, market leadership by FY30: CFO Siddharth Sipani","Sky Gold and Diamonds aims for a threefold revenue jump to Rs 18,000-19,000 crore by FY30. The company plans to achieve this by expanding its advance gold model, boosting exports, and diversifying its product range. Sky Gold also expects to become cash flow positive in the first half of FY27.",https://cfo.economictimes.indiatimes.com/news/strategy-operations/sky-gold-aiming-for-30-35-revenue-growth-by-fy30-exclusive-insights-from-cfo-siddharth-sipani/131606886,"10 Jun 2026, 07:00"
Strategic Signals,ETCFO Top Stories,Exclusive: Reliance Retail appoints Abhishek Gupta to lead finance at fashion & lifestyle vertical,"With experience spanning retail, consumer goods and e-commerce, Gupta's appointment bolsters the finance leadership of a strategically important business vertical.",https://cfo.economictimes.indiatimes.com/news/leadership/exclusive-reliance-retail-appoints-abhishek-gupta-to-lead-finance-at-fashion-lifestyle-vertical/131601001,"09 Jun 2026, 09:23"
Markets & Macro,ETCFO Top Stories,"India's corporate profit-to-GDP ratio hits all-time high of 5.2% in FY26, Nifty-500 profits nearly double in four years: Report","Indian companies have achieved record profits. The corporate profit-to-GDP ratio for Nifty-500 firms hit an all-time high of 5.2 percent in FY26. Profits have nearly doubled in four years, significantly outpacing economic growth. This trend is expected to continue in FY27, though global commodity pr",https://cfo.economictimes.indiatimes.com/news/indias-corporate-profit-to-gdp-ratio-hits-all-time-high-of-5-2-in-fy26-nifty-500-profits-nearly-double-in-four-years-report/131652651,"11 Jun 2026, 13:01"
Markets & Macro,ETCFO Top Stories,"Federal Bank eyes growth through credit cards, higher-yield assets and 100 new branches; ECL implementation on track: CFO","Manikandan M says the bank has built ECL models and data sets ahead of the RBI's Expected Credit Loss framework, while focusing on CASA growth, margin expansion, fee income and wealth management.",https://cfo.economictimes.indiatimes.com/news/strategy-operations/federal-bank-targets-growth-through-credit-cards-new-branches-and-ecl-implementation/131583427,"08 Jun 2026, 14:39"
Strategic Signals,ETCFO Top Stories,Indian CFOs remain Asia-Pacific's most optimistic despite Middle East conflict,"Indian chief financial officers remain the most optimistic in Asia Pacific about their businesses and the domestic economy despite escalating geopolitical tensions in the Middle East, although most expect the conflict to negatively affect economic activity and corporate performance, according to the",https://cfo.economictimes.indiatimes.com/news/strategy-operations/indian-cfos-showcase-unmatched-optimism-amid-geopolitical-turmoil/131600520,"09 Jun 2026, 08:53"
Geopolitics,ETCFO Policy,India-based entities among firms targeted in EU's proposed 21st Russia sanctions package,The European Union is proposing new sanctions against Russia. These measures could affect companies in India and other nations. The EU aims to stop support for Russia's war efforts. Restrictions will target technology and materials crucial for Russia's defense. New designations will also impact Russ,https://cfo.economictimes.indiatimes.com/news/policy/india-based-entities-among-firms-targeted-in-eus-proposed-21st-russia-sanctions-package/131634317,"10 Jun 2026, 17:30"
Markets & Macro,ETCFO Policy,India scraps capital gains tax on foreign investors in government debt to support rupee,"India will exempt foreign institutional investors and the Bank for International Settlements from capital gains tax on government securities. This move aims to attract more stable foreign capital. The exemption will take effect from April 1, 2026. This decision is expected to improve post-tax return",https://cfo.economictimes.indiatimes.com/news/policy/india-scraps-capital-gains-tax-on-foreign-investors-in-government-debt-to-support-rupee/131527095,"05 Jun 2026, 14:45"
Markets & Macro,ETCFO Policy,"Rupee inches up, defies Asian peers; caution prevails before RBI policy","The Indian rupee strengthened today, moving against weaker Asian markets. This rise occurred before a key Reserve Bank of India policy announcement. Markets are watching closely for any interest rate changes. Economists generally do not expect a hike. The central bank faces challenges attracting cap",https://cfo.economictimes.indiatimes.com/news/policy/rupee-inches-up-defies-asian-peers-caution-prevails-before-rbi-policy/131524247,"05 Jun 2026, 12:35"
Policy & Regulation,ETCFO Policy,Government said to weigh up to $525 million Hindustan Zinc share sale,"The government is considering selling up to a 2% stake in Hindustan Zinc Ltd., a move that could raise around Rs 5,000 crore. The stake sale, likely this month or in July, is part of a broader divestment drive aimed at boosting revenue through public asset sales. Several investment banks have been a",https://cfo.economictimes.indiatimes.com/news/policy/government-said-to-weigh-up-to-525-million-hindustan-zinc-share-sale/131524223,"05 Jun 2026, 12:17"
Energy & Infrastructure,ETCFO Policy,RBI MPC Meeting 2026: Sanjay Malhotra & co warn weak monsoon could stir food inflation despite price stability,"RBI monetary policy meeting: India's monsoon season is critical for farms and prices. A weak monsoon could impact crop yields and raise food costs. The Reserve Bank of India is watching weather closely. Inflation has already risen slightly. Experts warn of price pressures from rain, energy, and curr",https://cfo.economictimes.indiatimes.com/news/policy/rbi-mpc-meeting-2026-sanjay-malhotra-co-warn-weak-monsoon-could-stir-food-inflation-despite-price-stability/131522158,"05 Jun 2026, 10:31"
Energy & Infrastructure,ETCFO Policy,RBI keeps repo rate unchanged at 5.25%; MPC retains neutral stance amid global uncertainties,"The Reserve Bank of India on Friday left the repo rate unchanged at 5.25 per cent and retained its neutral policy stance, while lowering its FY27 growth forecast to 6.6 per cent and projecting inflation at 5.1 per cent amid escalating geopolitical tensions, rising energy prices and mounting global u",https://cfo.economictimes.indiatimes.com/news/policy/rbi-maintains-repo-rate-at-525-in-june-2026-policy-meeting/131521208,"05 Jun 2026, 10:03"
Markets & Macro,ETCFO Policy,Parliamentary Finance panel concerned over slow private investment despite substantial surge in public capex,"Parliamentary panel on finance raises concern over private investment not keeping pace with government capex, with Standing Committee on Finance Chairman Bhartruhari Mahtab on Thursday saying the issue remains a key challenge for the Indian economy even as public capital expenditure continues to ris",https://cfo.economictimes.indiatimes.com/news/policy/parliamentary-finance-panel-concerned-over-slow-private-investment-despite-substantial-surge-in-public-capex/131505877,"04 Jun 2026, 17:02"
