section,source,title,summary,link,published_at
Geopolitics,The Diplomat,Beyond the Malacca Dilemma: China’s Emerging Corridor-Hedging Logic,China’s approach to external connectivity recognizes that different trade routes perform different functions under different political and operational conditions.,https://thediplomat.com/2026/06/beyond-the-malacca-dilemma-chinas-emerging-corridor-hedging-logic/,"16 Jun 2026, 04:22"
Strategic Signals,War on the Rocks,The Fall of Fortress Singapore: Three Lessons from the Collapse of Britain’s Great Asian Bastion,"Editor’s note: This is part of a running series of essays by Iskander Rehman, entitled “Applied History,” which seeks, through the study of the history of strategy and military operations, to better illuminate contemporary defense challenges.The fall of Singapore on February 15 stupefied the Prime M",https://warontherocks.com/the-fall-of-fortress-singapore-three-lessons-from-the-collapse-of-britains-great-asian-bastion/,"16 Jun 2026, 07:30"
Geopolitics,War on the Rocks,Can Bankova Muster Political Will to Make Institutional Reforms During War?,"Welcome to The Ukraine Compass, a weekly digest of Ukrainian commentary and analysis from across the political spectrum only for War on the Rocks members. Each Monday, we bring you a curated selection of articles from Ukrainian media offering insight into how Ukrainians themselves debate the issues ",https://warontherocks.com/can-bankova-muster-political-will-to-make-institutional-reforms-during-war/,"15 Jun 2026, 17:15"
Strategic Signals,War on the Rocks,How Japan Could Co-Produce the Navy’s Future Fleet,"America’s defense industrial base cannot build the Navy out of the threat it faces. Decades of industry consolidation, persistent resource shortages, and inconsistent demand signals have delayed the production of critical vessels and munitions. With production bottlenecks stacking up, the Navy may h",https://warontherocks.com/cogs-of-war/how-japan-could-co-produce-the-navys-future-fleet/,"15 Jun 2026, 08:00"
Energy & Infrastructure,War on the Rocks,"South Korea Could Build Nuclear Submarines, But It Shouldn’t","In late May 2026, South Korean Defense Minister Ahn Gyu-back unveiled a roadmap to achieving one of Seoul’s top military acquisition goals: nuclear-powered submarines. This roadmap is heading in the wrong direction.During last month’s inaugural meeting of the Future Defense Strategy Committee, South",https://warontherocks.com/south-korea-could-build-nuclear-submarines-but-it-shouldnt/,"15 Jun 2026, 07:30"
Strategic Signals,War on the Rocks,The Gulf Arab States Need a Shield Built for Limited Trust,"Missiles, drones, and maritime disruptions do not stop at national borders. Gulf defense architecture still too often waits for national permission to act. The Gulf Cooperation Council has spent decades building defense institutions, diplomatic forums, and a language of indivisible Gulf security. Re",https://warontherocks.com/the-gulf-arab-states-need-a-shield-built-for-limited-trust/,"12 Jun 2026, 07:30"
Geopolitics,War on the Rocks,"Strike, Counterstrike, Repeat","Welcome to The Adversarial. Every other week, we’ll provide you with expert analysis on America’s greatest challengers: China, Russia, Iran, North Korea, and jihadists. Read more below.***Iran Hostilities have increased notably in the last few days, effectively ending the U.S.-Iranian truce that had",https://warontherocks.com/strike-counterstrike-repeat/,"11 Jun 2026, 20:20"
Geopolitics,War on the Rocks,The Evolution of Ukraine’s Asymmetrical Combat Tactics,"In 2022, Scott Sweetow wrote, “Of Roadside Bombs and Drones: Putin’s Looming Insurgency Problem,” where he argued Ukraine’s fight against Russia would rely on a combination of conventional and asymmetrical insurgent tactics. Four years of combat later, we asked Scott to revisit his arguments.Image: ",https://warontherocks.com/the-evolution-of-ukraines-asymmetrical-combat-tactics/,"11 Jun 2026, 16:00"
Geopolitics,War on the Rocks,Wargaming for Improved Acquisition: What Does It Take?,"A few months ago, I attended a panel discussion for a wargame simulating rapid industrial mobilization for armed conflict. Conducted by a leading university, with teams composed of former senior defense officials, the game probed how government and industry collaboration would play out given minimal",https://warontherocks.com/cogs-of-war/wargaming-for-improved-acquisition-what-does-it-take/,"11 Jun 2026, 08:00"
Policy & Regulation,CSIS,The Bio-Pharma Industry and Society,"The Bio-Pharma Industry and Society Listing Summary Please join the CSIS Global Health Policy Center on March 17, from 10:00am – 11:30am, for an exploration of how private bio-pharmaceutical firms can better support the critically important societal goals of improved affordability, access, quality, ",https://www.csis.org/events/bio-pharma-industry-and-society,"03 Mar 2016, 20:36"
Policy & Regulation,CSIS,The FY2017 Defense Budget and Strategic Outlook,"The FY2017 Defense Budget and Strategic Outlook Listing Summary Please join the CSIS International Security Program for a half-day Defense360 conference on the recently released FY2017 defense budget request and strategic priorities. Drupal Admin Mon, 02/29/2016 - 13:48 Featured Image Image Contribu",https://www.csis.org/events/fy2017-defense-budget-and-strategic-outlook,"29 Feb 2016, 18:48"
Policy & Regulation,CSIS,2016 U.S.-Japan Security Seminar,"2016 U.S.-Japan Security Seminar Listing Summary Michael J. Green interviews JIIA President Yoshiji Nogami Drupal Admin Fri, 02/26/2016 - 12:54 Featured Image Image Contributors Michael J. Green Programs & Projects Japan Chair Parent Geopolitics and Foreign Policy Featured Image AdobeStock_179685887",https://www.csis.org/events/2016-us-japan-security-seminar,"26 Feb 2016, 17:54"
Energy & Infrastructure,CSIS,The Future of the Grid—A View from ARPA-E,"The Future of the Grid—A View from ARPA-E Listing Summary The CSIS Energy and National Security Program is pleased to invite you to a discussion with Ellen Williams, Director of ARPA-E, the Advanced Research Projects Agency-Energy. Drupal Admin Thu, 02/25/2016 - 14:15 Featured Image Image Contributo",https://www.csis.org/events/future-grid-view-arpa-e,"25 Feb 2016, 19:15"
Geopolitics,CSIS,"Statesmen's Forum: Wang Yi, Minister of Foreign Affairs, PRC","Statesmen's Forum: Wang Yi, Minister of Foreign Affairs, PRC Listing Summary Please watch the live webcast of a discussion on Chinese foreign policy and US-China Relations Drupal Admin Fri, 02/19/2016 - 17:13 Featured Image Image Contributors John J. Hamre Christopher K. Johnson Downloads Download T",https://www.csis.org/events/statesmens-forum-wang-yi-minister-foreign-affairs-prc,"19 Feb 2016, 22:13"
Geopolitics,CSIS,"China Reality Check: China's ""Internet Sovereignty"" Initiative: Origins and Consequences","China Reality Check: China's ""Internet Sovereignty"" Initiative: Origins and Consequences Listing Summary Please join us for a discussion on China’s initiative to promote Internet sovereignty as a key governing concept of the global Internet. Drupal Admin Tue, 02/16/2016 - 11:49 Featured Image Image ",https://www.csis.org/events/china-reality-check-chinas-internet-sovereignty-initiative-origins-and-consequences,"16 Feb 2016, 16:49"
Policy & Regulation,CSIS,"Statesmen's Forum: The Right Honourable Theresa May, MP, Home Secretary, United Kingdom","Statesmen's Forum: The Right Honourable Theresa May, MP, Home Secretary, United Kingdom Listing Summary Please join the CSIS International Security Program for a discussion with UK Home Secretary Theresa May on counter-terrorism policy. Drupal Admin Fri, 02/12/2016 - 16:08 Featured Image Image Contr",https://www.csis.org/events/statesmens-forum-right-honourable-theresa-may-mp-home-secretary-united-kingdom,"12 Feb 2016, 21:08"
Strategic Signals,CSIS,Strategic Opportunities in the Indo-Asia-Pacific with Admiral Harry B. Harris,"Strategic Opportunities in the Indo-Asia-Pacific with Admiral Harry B. Harris Listing Summary Please join us for a discussion with Admiral Harry B. Harris, Commander, U.S. Pacific Command, on the Strategic Opportunities in the Indo-Asia-Pacific. Drupal Admin Tue, 01/26/2016 - 11:20 Featured Image Im",https://www.csis.org/events/strategic-opportunities-indo-asia-pacific-admiral-harry-b-harris,"26 Jan 2016, 16:20"
Strategic Signals,Al Jazeera,Argentina vs Algeria live: World Cup 2026,"Follow our live build-up, with full team news coverage, ahead of our text commentary stream service.",https://www.aljazeera.com/sports/liveblog/2026/6/16/argentina-vs-algeria-live-world-cup-2026?traffic_source=rss,"16 Jun 2026, 21:05"
Strategic Signals,Al Jazeera,South Korea World Cup squad at odds with media over Son Heung-min mockery,South Korean players reportedly refrain from speaking to national media outside official World Cup commitments.,https://www.aljazeera.com/sports/2026/6/16/south-korea-world-cup-squad-at-odds-with-media-over-son-heung-min-mockery?traffic_source=rss,"16 Jun 2026, 20:57"
Geopolitics,Al Jazeera,Palestinian Bedouin villagers demolish homes after Israeli orders,Palestinian Bedouins in Beersheba are demolishing their own homes after Israel issued demolition orders.,https://www.aljazeera.com/video/newsfeed/2026/6/16/palestinian-bedouin-villagers-demolish-homes-after-israeli-orders?traffic_source=rss,"16 Jun 2026, 20:42"
Strategic Signals,Al Jazeera,US Justice Department accuses 15 Minnesota activists of ‘antifa’ activities,Prosecutors have accused the activists of seeking 'to interfere with lawful immigration enforcement operations'.,https://www.aljazeera.com/news/2026/6/16/us-justice-department-accuses-15-minnesota-activists-of-antifa-activities?traffic_source=rss,"16 Jun 2026, 20:39"
Strategic Signals,Al Jazeera,Returning to destruction in south Lebanon,Many Lebanese are returning to their homes in the south to face the destruction that upended their livelihoods.,https://www.aljazeera.com/video/newsfeed/2026/6/16/returning-to-destruction-in-south-lebanon?traffic_source=rss,"16 Jun 2026, 20:38"
Geopolitics,Al Jazeera,"Iran, Ukraine dominate G7 summit",Here’s what came out of the G7 summit in France.,https://www.aljazeera.com/video/newsfeed/2026/6/16/iran-ukraine-dominate-g7-summit?traffic_source=rss,"16 Jun 2026, 20:36"
Geopolitics,Al Jazeera,Iranian fans honour Minab victims at World Cup match,"Iranian fans turned their World Cup match against New Zealand into a moment of remembrance, raising ‘Minab 168’ banners.",https://www.aljazeera.com/video/newsfeed/2026/6/16/iranian-fans-honour-minab-victims-at-world-cup-match?traffic_source=rss,"16 Jun 2026, 20:29"
Strategic Signals,Al Jazeera,Africa’s chances at the World Cup,"From Cape Verde’s debut to Ghana’s quarter-final legacy, six teams from sub-Saharan Africa to watch at the World Cup.",https://www.aljazeera.com/video/newsfeed/2026/6/16/africas-chances-at-the-world-cup-2?traffic_source=rss,"16 Jun 2026, 20:14"
Geopolitics,ETCFO Top Stories,India Inc. is profitable. So why isn’t it investing?,"Indian companies are making record profits, but they are not investing in new factories or infrastructure. This is creating fewer jobs and increasing inequality. Unlike China, which invests heavily, Indian businesses are hesitant. This trend risks trapping India in scarcity. Leaders must decide on a",https://cfo.economictimes.indiatimes.com/news/india-inc-is-profitable-so-why-isnt-it-investing/131757809,"16 Jun 2026, 08:16"
Strategic Signals,ETCFO Top Stories,No merit in issues flagged by ex-chair of HDFC Bank: Law firms,"The reviews were prompted by former Chairman Atanu Chakraborty's dramatic March 18 resignation, a decision he had said in a letter to the exchanges was prompted by alleged deviations 'incongruent' with his ethics and value systems. The reference to possible ethical transgressions at the country's mo",https://cfo.economictimes.indiatimes.com/news/no-merit-in-issues-flagged-by-ex-chair-of-hdfc-bank-law-firms/131757722,"16 Jun 2026, 08:11"
Energy & Infrastructure,ETCFO Top Stories,"US, Iran reach deal to end war, signing set for Friday","In a historic turnaround, the United States and Iran have reached a landmark peace agreement aimed at ending hostilities. The accord promises to lift the US blockade on Iran and will see the Strait of Hormuz reopened, a decision anticipated to bring relief to global energy markets.",https://cfo.economictimes.indiatimes.com/news/us-iran-reach-deal-to-end-war-signing-set-for-friday/131731458,"15 Jun 2026, 07:59"
Geopolitics,ETCFO Top Stories,Fable 5 shock puts sovereign AI back on India’s agenda,"US export controls on advanced AI models have spurred India's call for sovereign AI development. Industry leaders warn against reliance on foreign providers, urging a national mission for indigenous AI capabilities, similar to UPI and Aadhaar, to secure India's technological future and support local",https://cfo.economictimes.indiatimes.com/news/cfo-tech/fable-5-shock-puts-sovereign-ai-back-on-indias-agenda/131731516,"15 Jun 2026, 08:06"
Policy & Regulation,ETCFO Top Stories,Call to extend duty cuts on critical inputs soon,India is set to decide on extending customs duty relief for critical raw material imports beyond June 30. An inter-ministerial panel will review easing import curbs on key inputs and consider fresh duties on certain locally manufactured electronics. The government is also evaluating duty cut request,https://cfo.economictimes.indiatimes.com/news/policy/call-to-extend-duty-cuts-on-critical-inputs-soon/131697162,"13 Jun 2026, 09:10"
Strategic Signals,ETCFO Top Stories,India Inc CFOs : Not without AI?,"​Most CFOs are currently using AI for basic tasks such as invoice reading, document matching and accuracy checks. But the ambition is growing. Many are now exploring agentic AI, which goes beyond generating content and can execute workflows. Instead of merely reading an invoice, an AI agent could ve",https://cfo.economictimes.indiatimes.com/news/cfo-tech/india-inc-cfos-embrace-ai-the-future-of-business-efficiency/131672037,"12 Jun 2026, 08:32"
Geopolitics,ETCFO Top Stories,"Exclusive: SEBI Writes to NFRA, Seeks Examination of Rajesh Exports Auditors","Move follows market regulator's interim findings in the alleged Rs 15.15 lakh crore revenue misstatement case; audit regulator may independently examine the role of the company's statutory auditors, according to people aware of the development.",https://cfo.economictimes.indiatimes.com/news/governance-risk-compliance/sebi-seeks-nfra-investigation-into-rajesh-exports-auditors-amid-revenue-misrepresentation-claims/131623917,"10 Jun 2026, 09:07"
Strategic Signals,ETCFO Top Stories,"Sky Gold eyes 30-35% CAGR revenue growth, market leadership by FY30: CFO Siddharth Sipani","Sky Gold and Diamonds aims for a threefold revenue jump to Rs 18,000-19,000 crore by FY30. The company plans to achieve this by expanding its advance gold model, boosting exports, and diversifying its product range. Sky Gold also expects to become cash flow positive in the first half of FY27.",https://cfo.economictimes.indiatimes.com/news/strategy-operations/sky-gold-aiming-for-30-35-revenue-growth-by-fy30-exclusive-insights-from-cfo-siddharth-sipani/131606886,"10 Jun 2026, 07:00"
Policy & Regulation,ETCFO Policy,"Sebi Plans Buyback Via SEs Again, Easier MF Borrowing Rules",merchant banker role may be cut,https://cfo.economictimes.indiatimes.com/news/policy/sebi-plans-buyback-via-ses-again-easier-mf-borrowing-rules/131765461,"16 Jun 2026, 14:16"
Geopolitics,ETCFO Policy,"SEBI overhauls ETF trading framework, introduces dynamic price bands","The Securities and Exchange Board of India (SEBI) on Monday proposed a major overhaul of the framework governing exchange-traded funds (ETFs), introducing dynamic price bands, revised base price calculations, and new auction mechanisms to ensure ETF prices more accurately reflect the value of their ",https://cfo.economictimes.indiatimes.com/news/policy/sebi-overhauls-etf-trading-framework-introduces-dynamic-price-bands/131758282,"16 Jun 2026, 08:43"
Markets & Macro,ETCFO Policy,"SEBI likely to approve major reforms in bond markets, MFs and AIFs on June 19","India's markets regulator Securities and Exchange Board of India (SEBI) is expected to clear a package of reforms covering share buybacks, alternative investment funds, bond distribution and mutual fund liquidity at its board meeting on June 19.",https://cfo.economictimes.indiatimes.com/news/policy/sebi-likely-to-approve-major-reforms-in-bond-markets-mfs-and-aifs-on-june-19/131758280,"16 Jun 2026, 08:43"
Markets & Macro,ETCFO Policy,India will do more to boost inflows: Finance Minister Nirmala Sitharaman,India plans further measures to attract foreign capital. Finance Minister Nirmala Sitharaman stated that additional steps will be taken if required to boost capital inflows. These actions follow recent tax relief and banking regulator initiatives aimed at strengthening the Indian market. The governm,https://cfo.economictimes.indiatimes.com/news/policy/india-will-do-more-to-boost-inflows-finance-minister-nirmala-sitharaman/131757864,"16 Jun 2026, 08:21"
Policy & Regulation,ETCFO Policy,India looking to scale up local AI infrastructure; NITI to review,The Indian government is developing a strategy for domestically controlled AI infrastructure to enhance AI adoption in governance and cultivate skilled talent. NITI Aayog is identifying ecosystem gaps and recommending measures to bolster India's independent AI development and deployment capabilities,https://cfo.economictimes.indiatimes.com/news/policy/india-looking-to-scale-up-local-ai-infrastructure-niti-to-review/131731880,"15 Jun 2026, 08:24"
Energy & Infrastructure,ETCFO Policy,Govt said to accept tweaks to Securities Markets Code draft,The government has accepted significant changes to the proposed Securities Markets Code. Investigation timelines will be extended to one year. Depositories will gain powers to correct records. The Centre's authority to supersede market infrastructure institution boards will now require Sebi's recomm,https://cfo.economictimes.indiatimes.com/news/policy/govt-said-to-accept-tweaks-to-securities-markets-code-draft/131731756,"15 Jun 2026, 08:18"
Geopolitics,ETCFO Policy,India-based entities among firms targeted in EU's proposed 21st Russia sanctions package,The European Union is proposing new sanctions against Russia. These measures could affect companies in India and other nations. The EU aims to stop support for Russia's war efforts. Restrictions will target technology and materials crucial for Russia's defense. New designations will also impact Russ,https://cfo.economictimes.indiatimes.com/news/policy/india-based-entities-among-firms-targeted-in-eus-proposed-21st-russia-sanctions-package/131634317,"10 Jun 2026, 17:30"
