section,source,title,summary,link,published_at
Markets & Macro,The Diplomat,How Social Media Posts Are Fueling the Dehumanization of Malaysia’s Rohingya Population,The growing negative sentiment about the community bears a disturbing resemblance to the narratives that justified their mass expulsion from Myanmar in 2017.,https://thediplomat.com/2026/07/how-social-media-posts-are-fueling-the-dehumanization-of-malaysias-rohingya-population/,"16 Jul 2026, 14:15"
Strategic Signals,The Diplomat,"Bloomberg Ordered to Pay $357,000 in Damages After Losing Singapore Defamation Case",The High Court ruled that a 2024 article on the city-state's luxury real estate market maliciously defamed ministers Tan See Leng and K. Shanmugam.,https://thediplomat.com/2026/07/bloomberg-ordered-to-pay-357000-in-damages-after-losing-singapore-defamation/,"16 Jul 2026, 13:33"
Geopolitics,War on the Rocks,Reading through the Lines of the FY2027 NDAA,"The relationship between Congress and the Pentagon over the past year has been marked by public disagreements and frustrations over lawmakers’ concerns about the Iran War, and by what some lawmakers view as politically motivated firings of top military leaders. In many ways, the House and Senate ver",https://warontherocks.com/cogs-of-war/reading-through-the-lines-of-the-fy2027-ndaa/,"16 Jul 2026, 08:00"
Geopolitics,War on the Rocks,The Peace That Redistributes War: What Camp David Reveals About Lebanon and Iran,"Nothing reveals truths more effectively than patterns. If you can identify a pattern, you can see what actions conceal, what statements leave unsaid, and what agreements postpone. Peace treaties and the negotiations surrounding them are rarely analyzed in this way, even though they may exhibit patte",https://warontherocks.com/the-peace-that-redistributes-war-what-camp-david-reveals-about-lebanon-and-iran/,"16 Jul 2026, 07:30"
Strategic Signals,War on the Rocks,Academia’s Critical Role in Developing an Economic Security Workforce,"Editor’s note: This is the tenth article in an 11-part series examining how the United States should organize, lead, and integrate economic statecraft into strategy, defense practice, and the broader national security ecosystem. The special series is brought to you by the Potomac Institute for Polic",https://warontherocks.com/academias-critical-role-in-developing-an-economic-security-workforce/,"16 Jul 2026, 07:15"
Strategic Signals,War on the Rocks,One Size Doesn’t Fit All: The Many Faces of Africa’s Foreign Fighters,"In 2020, Austin Doctor wrote, “The Looming Influx of Foreign Fighters in Sub-Saharan Africa,” in which he predicted the region would see an influx of foreign fighters to aid Islamist extremist groups. Six years later, we asked Austin to revisit his arguments.Image: African Union Mission in Somalia (",https://warontherocks.com/one-size-doesnt-fit-all-the-many-faces-of-africas-foreign-fighters/,"15 Jul 2026, 17:30"
Geopolitics,War on the Rocks,"MOLLE, PALS, and the Empty Loops of America’s Civil-Military Divide","Editor’s note: This is the third article in a limited series celebrating American defense technologies born from wartime and their effects on broader national security, politics, and society. This series will run for several weeks to commemorate America’s 250th anniversary, and winners will be selec",https://warontherocks.com/cogs-of-war/molle-pals-and-the-empty-loops-of-americas-civil-military-divide/,"15 Jul 2026, 08:00"
Strategic Signals,War on the Rocks,Before the Next Mythos Moment: The Case for an AI Threat Fusion Center,"Earlier this spring, Claude’s developers found the cyber potential of Anthropic’s model, Mythos 5, hazardous enough to pump the brakes on model release, creating the Project Glasswing collaboration to give cyber defenders the upper hand through controlled access to the model. Despite these efforts, ",https://warontherocks.com/before-the-next-mythos-moment-the-case-for-an-ai-threat-fusion-center/,"15 Jul 2026, 07:30"
Energy & Infrastructure,War on the Rocks,Breaking America’s Promise to Pacific Island Veterans,"In January, Robson Henry died at the age of 66. Chances are, you have never heard of Henry. He was not famous, rich, or powerful. In many ways, Henry was no different from the thousands of young men and women who, at the age of 18, chose to serve by enlisting in the U.S. Army. Nor does the fact that",https://warontherocks.com/breaking-americas-promise-to-pacific-island-veterans/,"15 Jul 2026, 07:15"
Geopolitics,War on the Rocks,NATO’s Unity on Paper and Fractures Beneath the Surface,"On July 7-8, NATO held its 36th official summit in Ankara, Turkey. There were several consequential topics to discuss at this year’s meeting, chief among them the wars in Ukraine and Iran and the uncertain future of European defense and security. We asked five experts to assess the outcomes of the s",https://warontherocks.com/natos-unity-on-paper-and-fractures-beneath-the-surface/,"14 Jul 2026, 18:00"
Policy & Regulation,CSIS,The Bio-Pharma Industry and Society,"The Bio-Pharma Industry and Society Listing Summary Please join the CSIS Global Health Policy Center on March 17, from 10:00am – 11:30am, for an exploration of how private bio-pharmaceutical firms can better support the critically important societal goals of improved affordability, access, quality, ",https://www.csis.org/events/bio-pharma-industry-and-society,"03 Mar 2016, 20:36"
Policy & Regulation,CSIS,The FY2017 Defense Budget and Strategic Outlook,"The FY2017 Defense Budget and Strategic Outlook Listing Summary Please join the CSIS International Security Program for a half-day Defense360 conference on the recently released FY2017 defense budget request and strategic priorities. Drupal Admin Mon, 02/29/2016 - 13:48 Featured Image Image Contribu",https://www.csis.org/events/fy2017-defense-budget-and-strategic-outlook,"29 Feb 2016, 18:48"
Policy & Regulation,CSIS,2016 U.S.-Japan Security Seminar,"2016 U.S.-Japan Security Seminar Listing Summary Michael J. Green interviews JIIA President Yoshiji Nogami Drupal Admin Fri, 02/26/2016 - 12:54 Featured Image Image Contributors Michael J. Green Programs & Projects Japan Chair Parent Geopolitics and Foreign Policy Featured Image AdobeStock_179685887",https://www.csis.org/events/2016-us-japan-security-seminar,"26 Feb 2016, 17:54"
Energy & Infrastructure,CSIS,The Future of the Grid—A View from ARPA-E,"The Future of the Grid—A View from ARPA-E Listing Summary The CSIS Energy and National Security Program is pleased to invite you to a discussion with Ellen Williams, Director of ARPA-E, the Advanced Research Projects Agency-Energy. Drupal Admin Thu, 02/25/2016 - 14:15 Featured Image Image Contributo",https://www.csis.org/events/future-grid-view-arpa-e,"25 Feb 2016, 19:15"
Geopolitics,CSIS,"Statesmen's Forum: Wang Yi, Minister of Foreign Affairs, PRC","Statesmen's Forum: Wang Yi, Minister of Foreign Affairs, PRC Listing Summary Please watch the live webcast of a discussion on Chinese foreign policy and US-China Relations Drupal Admin Fri, 02/19/2016 - 17:13 Featured Image Image Contributors John J. Hamre Christopher K. Johnson Downloads Download T",https://www.csis.org/events/statesmens-forum-wang-yi-minister-foreign-affairs-prc,"19 Feb 2016, 22:13"
Geopolitics,CSIS,"China Reality Check: China's ""Internet Sovereignty"" Initiative: Origins and Consequences","China Reality Check: China's ""Internet Sovereignty"" Initiative: Origins and Consequences Listing Summary Please join us for a discussion on China’s initiative to promote Internet sovereignty as a key governing concept of the global Internet. Drupal Admin Tue, 02/16/2016 - 11:49 Featured Image Image ",https://www.csis.org/events/china-reality-check-chinas-internet-sovereignty-initiative-origins-and-consequences,"16 Feb 2016, 16:49"
Policy & Regulation,CSIS,"Statesmen's Forum: The Right Honourable Theresa May, MP, Home Secretary, United Kingdom","Statesmen's Forum: The Right Honourable Theresa May, MP, Home Secretary, United Kingdom Listing Summary Please join the CSIS International Security Program for a discussion with UK Home Secretary Theresa May on counter-terrorism policy. Drupal Admin Fri, 02/12/2016 - 16:08 Featured Image Image Contr",https://www.csis.org/events/statesmens-forum-right-honourable-theresa-may-mp-home-secretary-united-kingdom,"12 Feb 2016, 21:08"
Strategic Signals,CSIS,Strategic Opportunities in the Indo-Asia-Pacific with Admiral Harry B. Harris,"Strategic Opportunities in the Indo-Asia-Pacific with Admiral Harry B. Harris Listing Summary Please join us for a discussion with Admiral Harry B. Harris, Commander, U.S. Pacific Command, on the Strategic Opportunities in the Indo-Asia-Pacific. Drupal Admin Tue, 01/26/2016 - 11:20 Featured Image Im",https://www.csis.org/events/strategic-opportunities-indo-asia-pacific-admiral-harry-b-harris,"26 Jan 2016, 16:20"
Geopolitics,Al Jazeera,"In Syria’s Jobar, locals struggle to rebuild their destroyed homes",Jobar was held by rebels for much of Syria's 13-year war but was destroyed by repeated government assaults.,https://www.aljazeera.com/features/2026/7/16/in-syrias-jobar-locals-struggle-to-rebuild-their-destroyed-homes?traffic_source=rss,"16 Jul 2026, 17:54"
Geopolitics,Al Jazeera,US approves nearly $2bn in weapons sale to Saudi Arabia,The sale intends to bolster Saudi air defence systems as the kingdom risks escalation with the Iran-backed Houthis.,https://www.aljazeera.com/news/2026/7/16/us-approves-nearly-2bn-in-weapons-sale-to-saudi-arabia?traffic_source=rss,"16 Jul 2026, 17:22"
Strategic Signals,Al Jazeera,Rare protests in Kyiv over dismissal of defence minister,Rare protests erupted in central Kyiv over Ukrainian President Zelenskyy’s dismissal of defence minister.,https://www.aljazeera.com/video/newsfeed/2026/7/16/rare-protests-in-kyiv-over-dismissal-of-defence-minister?traffic_source=rss,"16 Jul 2026, 17:15"
Strategic Signals,Al Jazeera,Eleven killed in Algeria orphanage fire,Eleven people were killed and 19 injured after a fire tore through an orphanage in Algiers.,https://www.aljazeera.com/video/newsfeed/2026/7/16/eleven-killed-in-algeria-orphanage-fire?traffic_source=rss,"16 Jul 2026, 16:56"
Strategic Signals,Al Jazeera,Ex-CEO of Italian motorway sentenced to 12 years for Genoa bridge collapse,"In all, 32 convicted and 25 acquitted or cleared by statute ‌of limitations over 2018 Morandi bridge disaster.",https://www.aljazeera.com/news/2026/7/16/ex-ceo-of-italian-motorway-sentenced-to-12-years-for-genoa-bridge-collapse?traffic_source=rss,"16 Jul 2026, 16:43"
Geopolitics,Al Jazeera,US to impose new 25 percent tariffs on some Brazilian imports,"Beef, coffee, and rare-earth materials escaped US tariffs amid trade tensions with Brazil over alleged unfair practices.",https://www.aljazeera.com/economy/2026/7/16/us-to-impose-new-25-percent-tariffs-on-some-brazilian-imports?traffic_source=rss,"16 Jul 2026, 16:27"
Strategic Signals,Al Jazeera,"Trump limits length of visas for students, exchange visitors, journalists",New rule ends open-ended stays and requires extensions after fixed visa periods for students and foreign media.,https://www.aljazeera.com/news/2026/7/16/trump-limits-length-of-visas-for-students-exchange-visitors-journalists?traffic_source=rss,"16 Jul 2026, 16:25"
Strategic Signals,Al Jazeera,How can Argentina and Messi beat Spain and Yamal to defend World Cup?,"Despite Lionel Messi's presence, Argentina enter the 2026 final as underdogs to Spain and their starlet Lamine Yamal.",https://www.aljazeera.com/sports/2026/7/16/how-can-argentina-beat-favourites-spain-to-win-back-to-back-world-cups?traffic_source=rss,"16 Jul 2026, 16:25"
Strategic Signals,ETCFO Top Stories,"NCLAT upholds NFRA order, says 'statutory audit is not a ceremonial exercise'","Tribunal dismisses appeal against NFRA's disciplinary action, holding that auditors cannot rely solely on management representations or anticipated settlements. Ruling underscores the mandatory nature of auditing standards, professional scepticism and robust audit documentation.",https://cfo.economictimes.indiatimes.com/news/tax-legal-accounting/nclat-ruling-reinforces-importance-of-statutory-audits-not-a-ceremonial-exercise/132430968,"16 Jul 2026, 11:33"
Policy & Regulation,ETCFO Top Stories,State Bank of India appoints former LIC finance head Sunil Agrawal as CFO,"State Bank of India has named Sunil Agrawal its new Chief Financial Officer, bringing with him a wealth of experience from his 27 years at LIC. His role as key managerial personnel highlights his expertise in financial planning and regulatory matters. This significant appointment aligns with ongoing",https://cfo.economictimes.indiatimes.com/news/leadership/state-bank-of-india-appoints-former-lic-cfo-sunil-agrawal-as-new-finance-chief/132428225,"16 Jul 2026, 08:15"
Strategic Signals,ETCFO Top Stories,Infosys CFO Jayesh Sanghrajka tops IT sector CFO pay in FY26; Tech Mahindra's Rohit Anand next,"An ETCFO analysis of annual reports of the country's largest IT companies shows Infosys CFO Jayesh Sanghrajka emerged as the highest-paid finance chief among companies that have disclosed remuneration details, followed by Tech Mahindra's Rohit Anand and Wipro's Aparna Iyer.",https://cfo.economictimes.indiatimes.com/news/leadership/infosys-cfo-jayesh-sanghrajka-tops-it-sector-cfo-pay-in-fy26-wipros-aparna-iyer-next/132413241,"15 Jul 2026, 16:18"
Geopolitics,ETCFO Top Stories,"GSTAT token mechanism safeguards appeal rights, but experts warn legal ambiguity could trigger fresh litigation","Tax experts say GSTAT's token-based appeal mechanism is a pragmatic safeguard against portal-related disruptions, but caution that its long-term success will depend on statutory clarity, robust digital safeguards and a resilient e-filing system to prevent fresh litigation.",https://cfo.economictimes.indiatimes.com/news/tax-legal-accounting/gstat-token-system-safeguards-for-taxpayer-appeal-rights-amid-concerns-over-legal-clarity/132406374,"15 Jul 2026, 10:14"
Policy & Regulation,ETCFO Top Stories,Exclusive: MCA flags jurisdiction issue over ICAI's Global Networking Guidelines,Ministry's observations centre on who should issue the framework; ICAI pauses rollout and president is likely to discuss the matter with MCA officials.,https://cfo.economictimes.indiatimes.com/news/tax-legal-accounting/icai-halts-global-networking-guidelines-amid-concerns-from-mca/132369718,"14 Jul 2026, 07:00"
Strategic Signals,ETCFO Top Stories,"AI, automation redraw finance jobs: FP&A leads hiring as routine accounting roles continue to shrink",The finance function has seen a continued transformation over the last couple of years and much of that is being driven by automation rather than artificial intelligence (AI). Organisations are either no longer hiring or are actively cutting repetitive job roles that are now handed over to automatio,https://cfo.economictimes.indiatimes.com/news/strategy-operations/ai-automation-redraw-finance-jobs-fpa-leads-hiring-as-routine-accounting-roles-continue-to-shrink/132379031,"14 Jul 2026, 07:38"
Geopolitics,ETCFO Top Stories,CBIC allows self-certification for origin declarations under India-UK CETA,"The Central Board of Indirect Taxes and Customs (CBIC) has issued a circular operationalising the self-certification framework for origin declarations under the India-UK Comprehensive Economic and Trade Agreement (CETA), which comes into force on July 15, 2026. The move replaces the conventional sys",https://cfo.economictimes.indiatimes.com/news/tax-legal-accounting/cbic-notifies-self-certification-framework-for-origin-declarations-under-india-uk-ceta/132382818,"14 Jul 2026, 12:34"
Policy & Regulation,ETCFO Top Stories,GST law panel clears proposal to shield buyers' input tax credit from supplier defaults,A GST Council proposal will protect buyers from losing input tax credit. This protection applies if suppliers fail to deposit taxes with the government.,https://cfo.economictimes.indiatimes.com/news/tax-legal-accounting/gst-law-committee-proposes-safeguards-for-buyers-input-tax-credit/132354815,"13 Jul 2026, 07:56"
Energy & Infrastructure,ETCFO Policy,RBI to counter USD/INR volatility aggressively amid geopolitical crude shock: Kotak Securities' Anindya Banerjee,"The Reserve Bank of India (RBI) is expected to aggressively intervene in the currency markets if the rupee faces excessive downward pressure toward the 98 to 100 mark, though short-term capital inflows will provide a major cushion against global energy shocks, according to Anindya Banerjee, Head of ",https://cfo.economictimes.indiatimes.com/news/policy/rbi-to-counter-usd/inr-volatility-aggressively-amid-geopolitical-crude-shock-kotak-securities-anindya-banerjee/132436225,"16 Jul 2026, 16:15"
Markets & Macro,ETCFO Policy,"SEBI clears over 5,000 investor complaints through 'SCORES' in June","The Securities and Exchange Board of India (Sebi) resolved more than 5,000 investor complaints through its online grievance redressal platform 'SCORES' in June, while the number of pending complaints declined marginally during the month, according to data released by the capital markets regulator.",https://cfo.economictimes.indiatimes.com/news/policy/sebi-clears-over-5000-investor-complaints-through-scores-in-june/132433672,"16 Jul 2026, 15:00"
Policy & Regulation,ETCFO Policy,NSE got SEBI's nod to launch derivatives on Nifty India FPI 150 Index from August 12,"The National Stock Exchange of India (NSE) has received SEBI's approval to launch derivatives on the Nifty India FPI 150 Index (NIFTYFPI) from August 12, as per a statement by the stock exchange.",https://cfo.economictimes.indiatimes.com/news/policy/nse-got-sebis-nod-to-launch-derivatives-on-nifty-india-fpi-150-index-from-august-12/132433658,"16 Jul 2026, 14:25"
Markets & Macro,ETCFO Policy,"The Rs 1.5 lakh crore bank guarantee link that could rattle NSE, BSE and MCX","Revised RBI norms on bank guarantees could squeeze proprietary traders by sharply reducing leverage and raising funding costs, potentially hurting derivatives trading volumes. Analysts say the move, along with higher STT, may weigh on the valuations of exchange operators such as NSE, BSE and MCX.",https://cfo.economictimes.indiatimes.com/news/policy/the-rs-1-5-lakh-crore-bank-guarantee-link-that-could-rattle-nse-bse-and-mcx/132431966,"16 Jul 2026, 12:24"
Strategic Signals,ETCFO Policy,"India, Brazil agree to cooperate on digital labour platforms, skills, social protection: Union minister Shobha Karandlaje","During the meeting, the Indian side shared details of the country's Digital Public Infrastructure for labour, including the National Career Service Portal and the e-Shram Portal, described as the world's largest database of informal sector workers.",https://cfo.economictimes.indiatimes.com/news/policy/india-brazil-agree-to-cooperate-on-digital-labour-platforms-skills-social-protection-union-minister-shobha-karandlaje/132428152,"16 Jul 2026, 08:07"
Markets & Macro,ETCFO Policy,"RBI governor meets bank CEOs to discuss AI, geopolitics and ECL guidelines",Central bank governor Sanjay Malhotra met bank chief executives on Tuesday. Geopolitical complexities and artificial intelligence were key discussion points. New expected credit loss guidelines also featured in the important talks. Some banks shared their FCNR(B) scheme inflow estimates with the gov,https://cfo.economictimes.indiatimes.com/news/policy/rbi-governor-meets-bank-ceos-to-discuss-ai-geopolitics-and-ecl-guidelines/132409289,"15 Jul 2026, 13:00"
Strategic Signals,ETCFO Policy,Raising bank stakes gets easier for DIIs,"The Reserve Bank of India announces proposed amendments to bank shareholding regulations, designed to more effectively facilitate investments from domestic institutional investors. Additionally, the central bank emphasizes stronger disclosure and monitoring protocols. The new directives will provide",https://cfo.economictimes.indiatimes.com/news/policy/raising-bank-stakes-gets-easier-for-diis/132408797,"15 Jul 2026, 12:30"
Policy & Regulation,ETCFO Policy,Sebi exempts Mehta Family Trust from Saurashtra Cement open offer,Sebi exempted Mehta Family Trust from an open offer for Saurashtra Cement shares. This exemption allows internal family reorganisation and succession planning. Jay Mahendra Mehta and Juhi Chawla Mehta are trustees of the family trust. The transaction involves indirect acquisition of shares and votin,https://cfo.economictimes.indiatimes.com/news/policy/sebi-exempts-mehta-family-trust-from-saurashtra-cement-open-offer/132407936,"15 Jul 2026, 11:48"
