section,source,title,summary,link,published_at
Strategic Signals,Financial Times World,"US economy undershoots forecasts with 57,000 jobs added in June",Hiring slows after 3-month streak of overperformance,https://www.ft.com/content/4fd134b3-b75b-4a25-9f2c-8bdb4f8f7dea,"02 Jul 2026, 18:12"
Strategic Signals,Financial Times World,Modi and Takaichi meet in the shadow of Chinese pressure,Japan and India draw closer after falling foul of Beijing’s restrictions on rare earth exports,https://www.ft.com/content/9240e19a-8a7e-4213-8ac4-b03c16120cd7,"02 Jul 2026, 18:02"
Strategic Signals,Financial Times World,The faltering engine of Germany’s auto industry,VW is a test of the country’s ability to adapt,https://www.ft.com/content/f97cb278-be62-41b0-9d14-c8acb2d77f5f,"02 Jul 2026, 17:55"
Strategic Signals,Financial Times World,Pubs to stay open until 5am for England’s World Cup match,"Keir Starmer bows to pressure to allow an all-night party — or wake, depending on the result",https://www.ft.com/content/de7b4c8d-d7a8-436c-a127-0be7e5a0251e,"02 Jul 2026, 17:52"
Energy & Infrastructure,Financial Times World,The chip rally is tightening tech’s grip on Wall Street,AI spending frenzy has powered a semiconductor surge,https://www.ft.com/content/3b44b33f-40da-43e4-98a7-10658e82a781,"02 Jul 2026, 17:19"
Strategic Signals,Financial Times World,Apollo struggles to sell Hispanic grocer after US immigration raids hit sales,Investors and analysts say customers’ fear of Trump’s deportation campaign weakened the private equity-owned chain,https://www.ft.com/content/556a939d-b080-4fc4-a799-2807c465ea29,"02 Jul 2026, 17:16"
Strategic Signals,Financial Times World,Teenage rapists given stricter sentence after public outcry,Boys handed a four-year detention sentence after attorney-general’s referral to the Court of Appeal,https://www.ft.com/content/4fee941a-7ad8-4440-85da-0de5239b2d75,"02 Jul 2026, 16:53"
Strategic Signals,Financial Times World,Vatican schism puts Maga Catholics under pressure,Pope Leo excommunicates ultra-conservative bishops whose views resonate with parts of the US right,https://www.ft.com/content/6b6caf0c-4c17-4612-a8cc-67c376b4bd70,"02 Jul 2026, 16:24"
Strategic Signals,Financial Times Companies,FCA criticises investment firms for unintelligible disclosure documents,UK financial watchdog also bans ‘double-dipping’ as it pushes to improve treatment of customers,https://www.ft.com/content/18ead4af-5dfc-4a49-83e0-2e69ee28023b,"02 Jul 2026, 16:20"
Geopolitics,Financial Times Companies,Tesla deliveries climb 25% as fuel price surge boosts Europe demand,Strong second-quarter sales in Europe and China help offset weak US figures hit by end of EV tax credits,https://www.ft.com/content/d4d19d9b-3576-4a28-b972-3007b6cb0bdc,"02 Jul 2026, 13:06"
Strategic Signals,Financial Times Companies,Eliminate ‘personal pricing’ and you risk harming consumers,"Students, seniors and coupon savers could all lose out under plans to make prices fairer",https://www.ft.com/content/e8a52d2a-9b48-45ac-8044-9143a014c3ef,"02 Jul 2026, 13:00"
Strategic Signals,Financial Times Companies,There will be no more games like Minecraft without maths,Cuts to UK higher education courses are a danger to our tech industries,https://www.ft.com/content/ecb19335-a6ad-4cb5-936f-5ccb23805b34,"02 Jul 2026, 13:00"
Strategic Signals,Financial Times Companies,Blue Owl hit by $4.7bn of redemption requests as investor exodus persists,Withdrawal requests at 20 private credit funds tracked by FT totalled more than $22bn in second quarter,https://www.ft.com/content/b302a86d-f6eb-4d47-b90b-523c1c19b3fa,"02 Jul 2026, 12:33"
Strategic Signals,Financial Times Companies,UK car finance compensation delayed as tribunal pauses scheme,FCA programme thrown into doubt by challenges from lenders and consumer group,https://www.ft.com/content/43e848b0-dd0d-4db2-a32d-0e2c30a219d4,"02 Jul 2026, 11:45"
Strategic Signals,Financial Times Companies,How capable is AI? It depends what you’re worried about,Metrics for dangerous success and dangerous failure should be interpreted differently,https://www.ft.com/content/40a8abaa-cdb1-4568-b1a6-28219696a1c0,"02 Jul 2026, 11:30"
Energy & Infrastructure,Financial Times Companies,US energy regulator sets ultimatum for data centres,Last month FERC gave grid operators 60 days to justify or revise how they connect ‘large loads’ — or the regulator will make the decision for them,https://www.ft.com/content/5055a170-69d9-4eb6-ad93-be953bbad263,"02 Jul 2026, 11:00"
Geopolitics,The Hindu BusinessLine,"India’s coffee exports volumes rise 28% in Q1, value up 12% on higher demand","Outlook positive for rest of the year with slowing shipments from Vietnam, Brazil, says trade",https://www.thehindubusinessline.com/economy/agri-business/indias-coffee-exports-volumes-rise-28-in-q1-value-up-12-on-higher-demand/article71175116.ece,"02 Jul 2026, 23:32"
Strategic Signals,The Hindu BusinessLine,"SC scraps NCLT, NCLAT rulings over AI-generated fake precedents","Court flags AI risks in judiciary, orders Bar Council to frame rules",https://www.thehindubusinessline.com/news/sc-scraps-nclt-nclat-rulings-over-ai-generated-fake-precedents/article71174976.ece,"02 Jul 2026, 23:32"
Strategic Signals,The Hindu BusinessLine,"Nearly 8 lakh GST registrations in 6 months, UP leads the way",One important reason for rise in registrations is easier process announced last September by the GST Council.,https://www.thehindubusinessline.com/news/national/nearly-8-lakh-gst-registrations-in-6-months-up-leads-the-way/article71174542.ece,"02 Jul 2026, 23:31"
Markets & Macro,The Hindu BusinessLine,"South Korea, Taiwan stocks fall as investors reassess AI bets; FX muted",Overcapacity fears in chip sector prompt sharp falls in KOSPI and TSMC,https://www.thehindubusinessline.com/markets/south-korea-taiwan-stocks-fall-as-investors-reassess-ai-bets-fx-muted/article71175608.ece,"02 Jul 2026, 23:30"
Strategic Signals,The Hindu BusinessLine,STL raises INR 1500 Cr through Qualified Institutions Placement,STL raises INR 1500 Cr through Qualified Institutions Placement,https://www.thehindubusinessline.com/brandhub/pr-release/stl-raises-inr-1500-cr-through-qualified-institutions-placement/article71175655.ece,"02 Jul 2026, 22:30"
Energy & Infrastructure,The Hindu BusinessLine,"Oil Minister rules out cut in petrol, diesel prices until global crude stays low for a few weeks","The Minister highlighted that the government has shielded the consumer from full impact of the volatility in prices of crude oil, LNG and LPG",https://www.thehindubusinessline.com/news/oil-minister-rules-out-cut-in-petrol-diesel-prices-until-global-crude-stays-low-for-a-few-weeks/article71175039.ece,"02 Jul 2026, 22:07"
Markets & Macro,The Hindu BusinessLine,Updated scale-based regulations for NBFCs: Tata Sons may be required to list,No material change in RBI’s NBFC norms; revised directions merely clarify ‘public funds’ definition,https://www.thehindubusinessline.com/money-and-banking/updated-scale-based-regulations-for-nbfcs-tata-sons-may-be-required-to-list/article71175269.ece,"02 Jul 2026, 22:06"
Strategic Signals,The Hindu BusinessLine,BoB to pay $600 m in out-of-court settlement with UAE-based NMC Health,"This is to avoid prolonged litigation, uncertainty and associated costs",https://www.thehindubusinessline.com/money-and-banking/bob-to-pay-600-m-in-out-of-court-settlement-with-uae-based-nmc-health/article71174946.ece,"02 Jul 2026, 22:05"
Geopolitics,Times of India Business,"US stock market today: Wall street trades mixed after job data release; Dow jumps 400 points, Nasdaq trades flat","Wall Street saw a mixed trading session as a weaker-than-expected US jobs report fueled hopes the Federal Reserve might pause interest rate hikes. The Dow and S&P 500 edged up, while the Nasdaq dipped. Investors are now betting on an 80% chance of the Fed holding rates steady, influenced by easing i",https://timesofindia.indiatimes.com/business/international-business/us-stock-market-today-wall-street-trades-mixed-after-us-releases-job-data-dow-jumps-400-points-nasdaq-trades-flat/articleshow/132141162.cms,"02 Jul 2026, 20:22"
Strategic Signals,Times of India Business,"US adds just 57,000 jobs in June as hiring loses momentum despite easing unemployment","US job creation significantly decelerated in June, with only 57,000 new positions added, a stark drop from May's revised figure. While the unemployment rate dipped slightly to 4.2%, the labor force participation rate also declined. Despite job gains in sectors like healthcare and professional servic",https://timesofindia.indiatimes.com/business/international-business/us-adds-just-57000-jobs-in-june-as-hiring-loses-momentum-despite-easing-unemployment/articleshow/132140733.cms,"02 Jul 2026, 19:59"
Strategic Signals,Times of India Business,Japan’s Rs 1 trillion investment push in India: PM Modi and Japanese PM Sanae Takaichi unveil initiatives to boost ties,"Highlighting the growing economic partnership between the two nations, PM Modi said more than 100 new business agreements had been signed over the past year, paving the way for Japanese investments worth over $10 billion in India.",https://timesofindia.indiatimes.com/business/india-business/japans-rs-1-trillion-investment-push-in-india-pm-modi-and-japanese-pm-sanae-takaichi-unveil-initiatives-to-boost-ties/articleshow/132140833.cms,"02 Jul 2026, 19:59"
Energy & Infrastructure,Times of India Business,Market wrap: Top gainers and losers on NSE Nifty50 and BSE Sensex today,"Indian stock markets surged on Thursday, with Sensex and Nifty climbing nearly 1%. A significant rally in IT stocks, coupled with easing crude oil prices and positive India-Japan strategic agreements, boosted investor confidence. Despite some blue-chip weakness, the market extended its upward trend,",https://timesofindia.indiatimes.com/business/india-business/market-wrap-top-gainers-and-losers-on-nse-nifty50-and-bse-sensex-today-on-june-2026/articleshow/132139432.cms,"02 Jul 2026, 18:31"
Strategic Signals,Times of India Business,"Air India Express restores Middle East flights: Check routes, destinations and schedules","Air India Express has fully reinstated its Middle East flight operations, bringing back services to Kuwait and Salalah. Flights to Kuwait from Kozhikode and Bengaluru are resuming with increased frequencies. The airline's Middle East network now spans 13 destinations, with approximately 780 weekly f",https://timesofindia.indiatimes.com/business/india-business/air-india-express-restores-middle-east-flights-check-routes-destinations-and-schedules/articleshow/132137650.cms,"02 Jul 2026, 17:14"
Strategic Signals,Times of India Business,"FPIs continue to exit India: June equity outflows hit Rs 49,340 crore as debt inflows persist","Foreign investors continued their exit from Indian equities in June, withdrawing Rs 49,340 crore amid global risk aversion and domestic valuation concerns. Despite a brief February recovery, outflows have reached Rs 2.7 lakh crore this year, surpassing 2025's total. While equities saw selling, forei",https://timesofindia.indiatimes.com/business/india-business/fpis-continue-to-exit-india-june-equity-outflows-hit-rs-49340-crore-as-debt-inflows-persist/articleshow/132136235.cms,"02 Jul 2026, 16:50"
Geopolitics,Times of India Business,"India-Japan trade: PM Modi, 'younger sister' Takaichi sign MoC including $10 billion investment, AI boost","India and Japan elevated their trade and strategic ties with a new Memorandum of Cooperation signed during the 16th Annual Summit in New Delhi. Prime Minister Modi welcomed his Japanese counterpart, highlighting shared priorities for a free and prosperous Indo-Pacific. The leaders discussed initiati",https://timesofindia.indiatimes.com/business/india-business/india-japan-trade-pm-modi-younger-sister-takaichi-sign-moc-including-10-billion-investment-ai-boost/articleshow/132133312.cms,"02 Jul 2026, 14:00"
Strategic Signals,Times of India Business,Who should file ITR & is income tax return filing mandatory for salaried taxpayers?,"The important thing to understand is that ITR filing is a statutory requirement and an important financial record-keeping. For the financial year 2025-26, the basic exemption limit for individuals below 60 years of age is Rs 2.5 lakh under the old income tax regime and Rs 4 lakh under the new income",https://timesofindia.indiatimes.com/business/india-business/who-should-file-itr-is-income-tax-return-filing-mandatory-for-salaried-taxpayers/articleshow/132133313.cms,"02 Jul 2026, 13:48"
Energy & Infrastructure,Hindustan Times India,"India, Japan deepen defence, AI, energy ties; finalise economic roadmap","Japanese PM Sanae Takaichi , on her first visit to India since becoming PM, arrived with a high-powered business delegation and joined Modi for the 16th annual India-Japan Summit.",https://www.hindustantimes.com/india-news/india-japan-deepen-defence-ai-energy-ties-finalise-economic-roadmap-101783010252470.html,"02 Jul 2026, 22:07"
Strategic Signals,Hindustan Times India,"Modi, Japan PM condemn Pakistan-backed terror, call for action against LeT, JeM",PM Modi and Japan's Takaichi condemned last year's Pahalgam terror attack and Red Fort blasts that jolted the country.,https://www.hindustantimes.com/india-news/narendra-modi-japan-pm-sanae-takaichi-condemn-pakistan-backed-terror-call-for-action-against-terrorism-groups-let-jem-101783005612802.html,"02 Jul 2026, 22:00"
Strategic Signals,Hindustan Times India,"Centre revises CBSE chief’s appointment, assigns additional charge","A month after appointing Lokhande Prashant Sitaram as CBSE chairperson, the Centre revised the order, giving him only additional charge of the post.",https://www.hindustantimes.com/india-news/centre-revises-cbse-chief-s-appointment-assigns-additional-charge-101783008811109.html,"02 Jul 2026, 21:43"
Strategic Signals,Hindustan Times India,Ahmedabad JCP shoots history-sheeter in self-defence after knife attack,A history-sheeter in Ahmedabad was shot in the leg by police after attacking officers with a knife during questioning; he has over 30 criminal cases.,https://www.hindustantimes.com/india-news/ahmedabad-jcp-shoots-history-sheeter-in-self-defence-after-knife-attack-101783008393177.html,"02 Jul 2026, 21:36"
Strategic Signals,Hindustan Times India,Odisha lands largest-ever FDI as Adani-IHC JV signs ₹1 lakh cr aluminium project,"Odisha signs an $11.5 billion MoU with Adani Group and IHC for an integrated aluminium project, boosting jobs and industrialization in the state.",https://www.hindustantimes.com/india-news/odisha-lands-largest-ever-fdi-as-adani-ihc-jv-signs-1-lakh-cr-aluminium-project-101783007973016.html,"02 Jul 2026, 21:29"
Strategic Signals,Hindustan Times India,'Shows BJP's double standards': Congress questions PM Modi's ‘silence’ over Ayodhya Ram Temple donation row,Congress's KC Venugopal said PM Modi's silence on the Ram Temple donation scam exposes the BJP's double standards and moral failure,https://www.hindustantimes.com/india-news/congress-questions-pm-narendra-modi-over-ayodhya-ram-temple-donation-row-shows-bjps-doubled-standards-cm-yogi-champat-101783005791671.html,"02 Jul 2026, 21:19"
Strategic Signals,Hindustan Times India,"All 500 police stations in Bengal get cyber, women help desks",West Bengal's CM Suvendu Adhikari launched cyber and women help desks in 500 police stations to combat rising cybercrime and enhance women's security.,https://www.hindustantimes.com/india-news/all-500-police-stations-in-bengal-get-cyber-women-help-desks-101783006471106.html,"02 Jul 2026, 21:04"
Strategic Signals,Hindustan Times India,No one should object to India-Pak dialogue aimed at improving ties: Omar Abdullah,Omar Abdullah said the conflict between the two countries was not new and has persisted for the last three to four decades.,https://www.hindustantimes.com/india-news/no-one-should-object-to-india-pak-dialogue-aimed-at-improving-ties-omar-abdullah-101783003790466.html,"02 Jul 2026, 20:26"
Strategic Signals,Indian Express Latest,NIA records statement of 6 over Mumbai Press Club meet cited in Elgaar bail plea,,https://indianexpress.com/article/cities/mumbai/elgaar-parishad-bail-plea-nia-mumbai-press-club-statements-varavara-rao-10768751/,"02 Jul 2026, 17:30"
Strategic Signals,Indian Express Latest,Priyanka Chopra on gender roles: ‘Cleaning and cooking aren’t women’s work’; an expert weighs in,,https://indianexpress.com/article/lifestyle/priyanka-chopra-gender-roles-household-chores-womens-work-10762688/,"02 Jul 2026, 17:30"
Strategic Signals,Indian Express Latest,PMC to widen Yerawada road from Bindumadhav Thackeray Chowk to Ambedkar Chowk,,https://indianexpress.com/article/cities/pune/pmc-to-widen-yerawada-road-from-bindumadhav-thackeray-chowk-to-ambedkar-chowk-10768761/,"02 Jul 2026, 17:23"
Policy & Regulation,Indian Express Latest,"After WhatsApp, IT Ministry sends notice to Telegram, Signal over username feature",,https://indianexpress.com/article/business/it-ministry-notice-telegram-signal-whatsapp-username-feature-fraud-scams-10768746/,"02 Jul 2026, 17:16"
Geopolitics,Indian Express Latest,"‘Rain, lack of awareness’: BLOs flag difficulty in completion of SIR forms in time",,https://indianexpress.com/article/cities/pune/blo-completion-sir-forms-10768742/,"02 Jul 2026, 17:15"
Strategic Signals,Indian Express Latest,Taylor Swift and Travis Kelce’s wedding: Leaked NYPD memo reveals key details,,https://indianexpress.com/article/entertainment/music/taylor-swift-and-travis-kelces-wedding-leaked-nypd-memo-reveals-key-details-10768549/,"02 Jul 2026, 17:14"
Strategic Signals,Indian Express Latest,Revenge wears a crown: Aditya Rawal’s The Queen brings a Forgotten monarch’s fury to life,,https://indianexpress.com/article/cities/pune/aditya-rawal-the-queen-pune-play-interview-jilted-monarch-revenge-10768588/,"02 Jul 2026, 17:12"
Strategic Signals,Indian Express Latest,‘Rains and you’: Vicky Kaushal shares dreamy monochrome photo with Katrina Kaif,,https://indianexpress.com/article/entertainment/bollywood/vicky-kaushal-shares-dreamy-monochrome-photo-with-katrina-kaif-rains-and-you-10768665/,"02 Jul 2026, 17:00"
Geopolitics,SCMP Asia,China AI drug-design deals swell as US scrutiny mounts,"Riding a wave of booming cross-border dealmaking, China’s AI-driven drug-design firms are charging onto the global stage despite Washington’s growing scrutiny of Chinese biotech firms. The value of out-licensing deals struck by Chinese biotech companies with top global multinational pharmaceutical c",https://www.scmp.com/business/china-business/article/3359182/china-ai-drug-design-deals-swell-us-scrutiny-mounts?utm_source=rss_feed,"02 Jul 2026, 11:00"
Geopolitics,SCMP Asia,Hong Kong assets hit record US$5.38 trillion on renewed China appetite: SFC,"Assets and wealth under management in Hong Kong surged to a record high last year as global investors returned to Chinese assets, underscoring the city’s edge over Switzerland as a wealth hub. Financial firms in Hong Kong managed HK$42.2 trillion (US$5.38 trillion) worth of assets last year, a 20 pe",https://www.scmp.com/business/banking-finance/article/3359181/hong-kong-assets-hit-record-us538-trillion-renewed-china-appetite-sfc?utm_source=rss_feed,"02 Jul 2026, 09:29"
Markets & Macro,SCMP Asia,Clogged pipeline: Many Hong Kong IPO hopefuls near application expiration,"A large number of mainland Chinese companies hoping to list shares on the Hong Kong stock exchange are anxiously waiting for a nod from the mainland securities regulator, with many now at risk of having their listing applications lapse. More than 430 companies were currently waiting in the initial p",https://www.scmp.com/business/banking-finance/article/3359108/clogged-pipeline-many-hong-kong-ipo-hopefuls-near-application-expiration?utm_source=rss_feed,"02 Jul 2026, 08:00"
Energy & Infrastructure,SCMP Asia,New technologies power China’s Tesla challengers to monthly sales records,"Chinese Tesla challengers Leapmotor and Zeekr, banking on their latest battery and self-driving technologies, bucked a downward trend in domestic electric vehicle sales with record deliveries last month, ratcheting up pressure on the US carmaker amid weak consumer sentiment towards big-ticket items.",https://www.scmp.com/business/china-business/article/3359102/new-technologies-power-chinas-tesla-challengers-monthly-sales-records?utm_source=rss_feed,"02 Jul 2026, 06:00"
Geopolitics,SCMP Asia,China’s AI-defined vehicles make smart motoring human-centred,"How does an electric vehicle (EV) stand out in China’s ultra-competitive market when batteries, behaviours and functions are so similar? Through its intelligence: how well is this robot on wheels going to get to know you, adapt to your habits and moods and anticipate your needs? Welcome to the era o",https://www.scmp.com/plus/business/china-evs/article/3359123/chinas-ai-defined-vehicles-make-smart-motoring-human-centred?utm_source=rss_feed,"02 Jul 2026, 05:25"
Energy & Infrastructure,SCMP Asia,From AI chips to energy drinks: Hong Kong’s biggest listing deals of 2026 so far,"Hong Kong’s stock exchange ranked second globally by capital raised in the first half of 2026, with total proceeds from initial public offerings and secondary listings rising 84.3 per cent year on year to US$26.4 billion. Among the 84 new listings during the period, mainland Chinese issuers accounte",https://www.scmp.com/business/markets/article/3359105/ai-chips-energy-drinks-hong-kongs-biggest-listing-deals-2026-so-far?utm_source=rss_feed,"02 Jul 2026, 04:00"
Geopolitics,SCMP Asia,PDD embraces China’s ‘city of the future’ after bruising regulatory clash and record fine,The operator of budget online marketplaces Temu and Pinduoduo is ramping up its commitment in a state-backed development zone – dubbed a “city of the future” in official discourse – months after the e-commerce group was hit by the heaviest penalty in a record food-safety crackdown and accused by reg,https://www.scmp.com/tech/big-tech/article/3359060/pdd-embraces-chinas-city-future-after-bruising-regulatory-clash-and-record-fine?utm_source=rss_feed,"02 Jul 2026, 02:30"
Markets & Macro,SCMP Asia,China’s tax crackdown shakes A-share and Hong Kong-listed firms with major payouts,"China’s anti-tax evasion campaign is sweeping across the A-share and Hong Kong stock markets, with at least 80 listed firms already having been ordered to pay back corporate income taxes and late fees to local authorities. The number of listed companies involved in the first half of the year is like",https://www.scmp.com/economy/article/3359042/chinas-tax-crackdown-shakes-share-and-hong-kong-listed-firms-major-payouts?utm_source=rss_feed,"02 Jul 2026, 02:00"
Strategic Signals,Foreign Policy,A Short Economic History of the United States,From a slave economy to a global empire in 250 years.,https://foreignpolicy.com/2026/07/02/united-states-economy-slavery-empire-immigration-socialism/,"02 Jul 2026, 17:23"
Strategic Signals,Foreign Policy,"America, the Once Global Nation","At 250, the country is struggling to come to terms with the world it created.",https://foreignpolicy.com/2026/07/02/america-the-once-global-nation/,"02 Jul 2026, 16:30"
Geopolitics,Foreign Policy,The MOU Is Paying Off Early for Iran,Washington and Tehran are grappling over a “memorandum of misunderstanding.”,https://foreignpolicy.com/2026/07/02/mou-iran-us-talks-doha-strait-hormuz-oil-sanctions-profits-exports/,"02 Jul 2026, 15:56"
Strategic Signals,Foreign Policy,The U.S. at 250: Terminally Ill or Just Very Sick?,Experts question whether one of the world’s oldest democracies can survive.,https://foreignpolicy.com/2026/07/02/united-states-250-independence-day-democracy-president/,"02 Jul 2026, 14:35"
Policy & Regulation,Foreign Policy,Between Independence and Freedom,How a fundamental tension in the declaration echoed through U.S. foreign policy.,https://foreignpolicy.com/2026/07/02/america-250-declaration-independence-foreign-policy/,"02 Jul 2026, 14:25"
Strategic Signals,Foreign Policy,The Hypocrisy That Shields Erdogan From Global Criticism,Rising human rights violations in Turkey should be called out.,https://foreignpolicy.com/2026/07/02/turkey-erdogan-trump-human-rights-kavala-imamoglu/,"02 Jul 2026, 11:00"
Geopolitics,Foreign Policy,The Strategy Behind the Battle for Crimea,Ukraine’s new offensive on the territory has military stakes far beyond payback.,https://foreignpolicy.com/2026/07/02/ukraine-crimea-russia-strategy/,"02 Jul 2026, 10:47"
Energy & Infrastructure,Foreign Policy,The Political Aftershocks of Venezuela’s Earthquakes,The disasters exposed Delcy Rodríguez’s weak grasp on power.,https://foreignpolicy.com/2026/07/01/venezuela-earthquakes-us-politics-rodriguez-maduro-machado/,"01 Jul 2026, 21:32"
Geopolitics,The Diplomat,Italy’s Indo-Pacific Strategy Turns Toward Defense Contracts,"Italy is making an unexpectedly assertive return to Southeast Asia – not through trade or development aid, but through defense diplomacy.",https://thediplomat.com/2026/07/italys-indo-pacific-strategy-turns-toward-defense-contracts/,"02 Jul 2026, 23:17"
Strategic Signals,The Diplomat,Guam: Where America’s 250th Birthday Will First Be Honored,"As the country celebrates its past, let it also recognize the place where its future security begins: an island that has given more to the United States than most Americans will ever know.",https://thediplomat.com/2026/07/guam-where-americas-250th-birthday-will-first-be-honored/,"02 Jul 2026, 23:21"
Geopolitics,The Diplomat,Forging China-US ‘Constructive Strategic Stability’ Starts in the Nuclear Realm,Real strategic stability starts with recognizing mutual vulnerability.,https://thediplomat.com/2026/07/forging-china-us-constructive-strategic-stability-starts-in-the-nuclear-realm/,"02 Jul 2026, 22:45"
