section,source,title,summary,link,published_at
Geopolitics,The Diplomat,Whatever Happened to ‘Wolf Warrior’ Diplomacy?,"In recent years, Beijing has become a lot more selective in how, where, and when it deploys the assertive diplomatic tactic.",https://thediplomat.com/2026/07/whatever-happened-to-wolf-warrior-diplomacy/,"23 Jul 2026, 01:11"
Geopolitics,The Diplomat,ASEAN Foreign Ministers Call for ‘Immediate Cessation’ of Middle East Hostilities,"The fighting between Iran and the United States is set to have “immediate and long-term effects” on Southeast Asia and its people, the ministers said.",https://thediplomat.com/2026/07/asean-foreign-ministers-call-for-immediate-cessation-of-middle-east-hostilities/,"23 Jul 2026, 11:25"
Geopolitics,The Diplomat,Malaysia Must Reject Hate and Confront Myanmar Over the Rohingya Crisis,"Prime Minister Anwar Ibrahim’s government has largely remained silent about the recent online ""hate campaign"" targeting Rohingya refugees.",https://thediplomat.com/2026/07/malaysia-must-reject-hate-and-confront-myanmar-over-the-rohingya-crisis/,"23 Jul 2026, 10:45"
Geopolitics,The Diplomat,"Philippine, Chinese Foreign Ministers Exchange Protests Over South China Sea Clash","Both nations have accused the other for instigating the incident at Second Thomas Shoal, which has overshadowed this week's ASEAN meetings in Manila.",https://thediplomat.com/2026/07/philippine-chinese-foreign-ministers-exchange-protests-over-south-china-sea-clash/,"23 Jul 2026, 09:51"
Strategic Signals,War on the Rocks,Chaotic Progress: European NATO’s Quest for Stronger Defense,"In 2024, Max Bergmann wrote, “NATO Missed a Chance to Transform Itself,” where he argued NATO’s leadership needs to facilitate a strong European pillar of the alliance through structural reforms in European institutions. Two years later, we asked Max to revisit his arguments.Image: The White House v",https://warontherocks.com/chaotic-progress-european-natos-quest-for-stronger-defense/,"23 Jul 2026, 20:00"
Policy & Regulation,War on the Rocks,America Needs an Off-Ramp Between Doing Nothing and Shutting AI Down,"For 18 days in June, two of America’s most capable AI models went dark worldwide, not for technical or business reasons, but because the U.S. government ordered it. On June 12, 2026, the Commerce Department informed Anthropic that its Fable 5 and Mythos 5 models could no longer be provided to any fo",https://warontherocks.com/cogs-of-war/america-needs-an-off-ramp-between-doing-nothing-and-shutting-ai-down/,"23 Jul 2026, 08:00"
Geopolitics,War on the Rocks,The King of Cool: Mobile Refrigeration and the Remaking of Global Logistics,"Editor’s note: This is the fifth article in a limited series celebrating American defense technologies born from wartime and their effects on broader national security, politics, and society. This series will run for several weeks to commemorate America’s 250th anniversary, and winners will be selec",https://warontherocks.com/cogs-of-war/the-king-of-cool-mobile-refrigeration-and-the-remaking-of-global-logistics/,"23 Jul 2026, 07:45"
Strategic Signals,War on the Rocks,The Importance of the Invasion of Sicily,"On July 10, 1943, the Allied invasion of Sicily — codenamed Operation Husky — put more assault troops ashore on its first day than the Normandy landings would 11 months later. Despite the scale of these amphibious and vertical assaults on the Mediterranean’s largest island, the images most carry of ",https://warontherocks.com/the-importance-of-the-invasion-of-sicily/,"23 Jul 2026, 07:30"
Geopolitics,War on the Rocks,Total War on Taipei: China Explores Elevating Cognitive Effects into Its Vision of Warfare,"In March 2025, China’s military researchers published a concept describing how to rapidly capture and subdue the city of Taipei. Distributed in restricted military channels, this approach argues Beijing can achieve victory “by blocking the city’s ability to receive external assistance, restricting i",https://warontherocks.com/total-war-on-taipei-china-explores-elevating-cognitive-effects-into-its-vision-of-warfare/,"22 Jul 2026, 07:30"
Energy & Infrastructure,War on the Rocks,How Ukraine Put Russia on the Backfoot,"Ukraine’s expanding use of drones at all ranges has changed the war’s momentum. This episode examines how Kyiv is reaching deeper into Russian territory, disrupting operations and logistics as well as energy infrastructure. How is Russia adapting (or not)? Can these strikes produce lasting advantage",https://warontherocks.com/how-ukraine-put-russia-on-the-backfoot/,"21 Jul 2026, 18:43"
Geopolitics,War on the Rocks,How the War with Iran is Shaping Key U.S. Relations Beyond the Middle East,"The U.S. war with Iran has had political, economic, and military implications that spread far beyond the Middle East. We asked five experts to assess how the war with Iran has affected U.S. bilateral relations with key countries that illustrate some of the global ramifications: South Korea, India, U",https://warontherocks.com/how-the-war-with-iran-is-shaping-key-u-s-relations-beyond-the-middle-east/,"21 Jul 2026, 17:30"
Markets & Macro,War on the Rocks,Rebuilding America’s Critical Minerals Base,"There’s a clear consensus that America hollowed out its critical minerals base. How to rebuild it is less settled. Alex Grant of Magrathea Metals and Wes Spurlock of Principal Mineral join Jonathan to discuss the processing technology, labor force, and how government can catalyze private capital inv",https://warontherocks.com/cogs-of-war/rebuilding-americas-critical-minerals-base/,"21 Jul 2026, 08:00"
Policy & Regulation,CSIS,The Bio-Pharma Industry and Society,"The Bio-Pharma Industry and Society Listing Summary Please join the CSIS Global Health Policy Center on March 17, from 10:00am – 11:30am, for an exploration of how private bio-pharmaceutical firms can better support the critically important societal goals of improved affordability, access, quality, ",https://www.csis.org/events/bio-pharma-industry-and-society,"03 Mar 2016, 20:36"
Policy & Regulation,CSIS,The FY2017 Defense Budget and Strategic Outlook,"The FY2017 Defense Budget and Strategic Outlook Listing Summary Please join the CSIS International Security Program for a half-day Defense360 conference on the recently released FY2017 defense budget request and strategic priorities. Drupal Admin Mon, 02/29/2016 - 13:48 Featured Image Image Contribu",https://www.csis.org/events/fy2017-defense-budget-and-strategic-outlook,"29 Feb 2016, 18:48"
Policy & Regulation,CSIS,2016 U.S.-Japan Security Seminar,"2016 U.S.-Japan Security Seminar Listing Summary Michael J. Green interviews JIIA President Yoshiji Nogami Drupal Admin Fri, 02/26/2016 - 12:54 Featured Image Image Contributors Michael J. Green Programs & Projects Japan Chair Parent Geopolitics and Foreign Policy Featured Image AdobeStock_179685887",https://www.csis.org/events/2016-us-japan-security-seminar,"26 Feb 2016, 17:54"
Energy & Infrastructure,CSIS,The Future of the Grid—A View from ARPA-E,"The Future of the Grid—A View from ARPA-E Listing Summary The CSIS Energy and National Security Program is pleased to invite you to a discussion with Ellen Williams, Director of ARPA-E, the Advanced Research Projects Agency-Energy. Drupal Admin Thu, 02/25/2016 - 14:15 Featured Image Image Contributo",https://www.csis.org/events/future-grid-view-arpa-e,"25 Feb 2016, 19:15"
Geopolitics,CSIS,"Statesmen's Forum: Wang Yi, Minister of Foreign Affairs, PRC","Statesmen's Forum: Wang Yi, Minister of Foreign Affairs, PRC Listing Summary Please watch the live webcast of a discussion on Chinese foreign policy and US-China Relations Drupal Admin Fri, 02/19/2016 - 17:13 Featured Image Image Contributors John J. Hamre Christopher K. Johnson Downloads Download T",https://www.csis.org/events/statesmens-forum-wang-yi-minister-foreign-affairs-prc,"19 Feb 2016, 22:13"
Geopolitics,CSIS,"China Reality Check: China's ""Internet Sovereignty"" Initiative: Origins and Consequences","China Reality Check: China's ""Internet Sovereignty"" Initiative: Origins and Consequences Listing Summary Please join us for a discussion on China’s initiative to promote Internet sovereignty as a key governing concept of the global Internet. Drupal Admin Tue, 02/16/2016 - 11:49 Featured Image Image ",https://www.csis.org/events/china-reality-check-chinas-internet-sovereignty-initiative-origins-and-consequences,"16 Feb 2016, 16:49"
Policy & Regulation,CSIS,"Statesmen's Forum: The Right Honourable Theresa May, MP, Home Secretary, United Kingdom","Statesmen's Forum: The Right Honourable Theresa May, MP, Home Secretary, United Kingdom Listing Summary Please join the CSIS International Security Program for a discussion with UK Home Secretary Theresa May on counter-terrorism policy. Drupal Admin Fri, 02/12/2016 - 16:08 Featured Image Image Contr",https://www.csis.org/events/statesmens-forum-right-honourable-theresa-may-mp-home-secretary-united-kingdom,"12 Feb 2016, 21:08"
Strategic Signals,CSIS,Strategic Opportunities in the Indo-Asia-Pacific with Admiral Harry B. Harris,"Strategic Opportunities in the Indo-Asia-Pacific with Admiral Harry B. Harris Listing Summary Please join us for a discussion with Admiral Harry B. Harris, Commander, U.S. Pacific Command, on the Strategic Opportunities in the Indo-Asia-Pacific. Drupal Admin Tue, 01/26/2016 - 11:20 Featured Image Im",https://www.csis.org/events/strategic-opportunities-indo-asia-pacific-admiral-harry-b-harris,"26 Jan 2016, 16:20"
Strategic Signals,Al Jazeera,Is this Italy’s ‘George Floyd moment’?,The death of Moroccan-born Abderrahim Fakir after he was restrained by police in Bologna has sparked protests.,https://www.aljazeera.com/video/newsfeed/2026/7/23/is-this-italys-george-floyd?traffic_source=rss,"23 Jul 2026, 22:07"
Geopolitics,Al Jazeera,US war on Iran: The $110 billion price tag,"America's war on Iran has cost the US nearly $110 billion. Now, the Trump administration wants another $67 billion.",https://www.aljazeera.com/video/newsfeed/2026/7/23/us-war-on-iran-the-110-billion-price-tag?traffic_source=rss,"23 Jul 2026, 22:04"
Geopolitics,Al Jazeera,Trump warns of largest strikes on Iran yet as Tehran lashes out across Gulf,"The US president's threat comes after another day of Iranian attacks on Bahrain, Kuwait and Jordan.",https://www.aljazeera.com/news/2026/7/23/trump-warns-of-biggest-strikes-yet-on-iran-as-tehran-lashes-out-across-gulf?traffic_source=rss,"23 Jul 2026, 21:43"
Geopolitics,Al Jazeera,US-Saudi nuclear deal hinges on normalisation with Israel,President Trump said a proposed US-Saudi civilian nuclear deal is subject to Saudi Arabia joining the Abraham Accords,https://www.aljazeera.com/video/newsfeed/2026/7/23/us-saudi-nuclear-deal-hinges-on-normalisation-with-israel?traffic_source=rss,"23 Jul 2026, 21:41"
Strategic Signals,Al Jazeera,Rally attendee steals the show by mimicking Trump’s gestures,A rally attendee seated directly behind Trump drew attention by mimicking the president.,https://www.aljazeera.com/video/newsfeed/2026/7/23/rally-attendee-steals-the-show-by-mimicking-trumps-gestures?traffic_source=rss,"23 Jul 2026, 21:08"
Strategic Signals,Al Jazeera,"France wildfires force evacuation of over 20,000 people from tourist town",About 800 firefighters and hundreds of gendarmes and soldiers deployed to battle the flames west of Bordeaux.,https://www.aljazeera.com/news/2026/7/23/france-wildfires-force-evacuation-of-over-20000-people-from-tourist-town?traffic_source=rss,"23 Jul 2026, 21:07"
Strategic Signals,Al Jazeera,Videos show the moment police officer shoots man on street in Wisconsin,Outrage is growing after videos show a police officer fatally shooting a man in the US state of Wisconsin.,https://www.aljazeera.com/video/newsfeed/2026/7/23/videos-show-the-moment-police-officer-shoots-man-on-street-in-wisconsin?traffic_source=rss,"23 Jul 2026, 21:04"
Strategic Signals,Al Jazeera,White House says will not block Tate brothers’ extradition to UK,Social media influencers to be extradited after UK authorities file dozens of new sex crime charges against them.,https://www.aljazeera.com/news/2026/7/23/white-house-says-will-not-block-tate-brothers-extradition-to-uk?traffic_source=rss,"23 Jul 2026, 21:02"
Strategic Signals,ETCFO Top Stories,"PM Internship Scheme sees 1.65 lakh-plus offers in first two rounds, just 16,068 join; Round III crosses 10,000 joinings",Latest Parliament data show third pilot round has already surpassed physical joinings recorded in either of the first two rounds.,https://cfo.economictimes.indiatimes.com/news/policy/pm-internship-scheme-over-165-lakh-offers-round-iii-sees-10195-joinings/132572654,"23 Jul 2026, 11:28"
Energy & Infrastructure,ETCFO Top Stories,"Centralised GST administration can cut duplicate audits, compliance costs; Centre State jurisdiction key, say experts","Tax experts say a PAN level administrative framework could bring greater consistency to audits and tax positions for multi state businesses, but caution that the model must preserve State oversight, avoid overlapping powers and be backed by a unified digital system.",https://cfo.economictimes.indiatimes.com/news/tax-legal-accounting/experts-say-centralised-gst-administration-can-significantly-reduce-compliance-costs/132551479,"22 Jul 2026, 11:10"
Strategic Signals,ETCFO Top Stories,Top 10 Highest-Paid CFOs in India: L&T’s Shankar Raman Tops List,"An ETCFO analysis of annual reports and annual returns filed by some of India's largest listed companies shows Larsen & Toubro (L&T) CFO R Shankar Raman emerged as the highest-paid finance chief in FY26, drawing ₹54.02 crore, followed by Reliance Industries CFO Srikanth Venkatachari at ₹19.95 crore.",https://cfo.economictimes.indiatimes.com/news/leadership/india-incs-highest-paid-cfos-in-fy26-lts-r-shankar-raman-leads-the-pack/132526647,"21 Jul 2026, 08:14"
Policy & Regulation,ETCFO Top Stories,MCA plans unified digital platform for insolvency ecosystem; seeks stakeholder suggestions,"The Ministry of Corporate Affairs is proposing a new integrated digital platform for insolvency. This unified system aims to streamline processes and improve information exchange among stakeholders. It will digitize the entire insolvency lifecycle, from commencement to resolution and liquidation. Th",https://cfo.economictimes.indiatimes.com/news/governance-risk-compliance/mca-plans-unified-digital-platform-for-insolvency-ecosystem-seeks-stakeholder-suggestions/132532878,"21 Jul 2026, 15:08"
Strategic Signals,ETCFO Top Stories,CBIC weighs centralised GST registration under one PAN,The proposal seeks to address a longstanding industry demand by examining whether businesses operating across multiple states can be administered by a single central GST authority instead of dealing with multiple field formations for different GST registrations.,https://cfo.economictimes.indiatimes.com/news/tax-legal-accounting/cbic-weighs-centralised-gst-registration-under-one-pan/132526783,"21 Jul 2026, 08:18"
Strategic Signals,ETCFO Top Stories,"FCNR scheme: Withholding tax fear haunts US, Singapore NRIs","Non-resident Indians residing in Singapore and the United States are expressing significant concerns over withholding taxes. These taxes threaten to diminish their net returns from leveraging FCNR deposit schemes. For instance, borrowing from Indian banks' GIFT City branches triggers Singapore withh",https://cfo.economictimes.indiatimes.com/news/fcnr-scheme-withholding-tax-fear-haunts-us-singapore-nris/132526814,"21 Jul 2026, 08:22"
Strategic Signals,ETCFO Top Stories,"Axis Bank appoints Rajeev Mantri as new finance chief, replacing Puneet Sharma","Axis Bank welcomes Rajeev Mantri as its new finance chief, marking a pivotal moment in its leadership. With almost thirty years of expertise, previously as Chief Financial Officer at Bandhan Bank, Mantri steps into this role amidst a broader trend of significant transformations in India’s banking la",https://cfo.economictimes.indiatimes.com/news/leadership/axis-bank-appoints-rajeev-mantri-as-new-finance-chief-replacing-puneet-sharma/132504541,"20 Jul 2026, 08:03"
Strategic Signals,ETCFO Top Stories,"JPC weighs key changes to Corporate Laws Bill, reviews AIF-to-LLP conversion and CSR norms",A parliamentary panel is examining changes to corporate law amendments. Investors may become partners in newly formed LLPs instead of trustees. The committee also debates proposed relaxations in corporate social responsibility norms. A framework for overseas companies to re-domicile in India is unde,https://cfo.economictimes.indiatimes.com/news/governance-risk-compliance/jpc-weighs-key-changes-to-corporate-laws-bill-reviews-aif-to-llp-conversion-and-csr-norms/132504426,"20 Jul 2026, 07:54"
Strategic Signals,ETCFO Policy,India in strongest credit growth phase since 2012 on robust corporate demand: Report,India's credit expansion is currently its strongest since 2012. Corporate loan growth reached a thirteen-year high in May. Household loan growth has also remained resilient for four months. Non-banking financial companies saw retail loan growth accelerate significantly. Overall credit demand is expe,https://cfo.economictimes.indiatimes.com/news/policy/india-in-strongest-credit-growth-phase-since-2012-on-robust-corporate-demand-report/132581153,"23 Jul 2026, 18:30"
Geopolitics,ETCFO Policy,Trump tariffs may stay alive as US set to impose new import taxes by Friday,"Donald Trump is likely planning new import duties on many nations by Friday. These levies aim to continue his tariff regime after current ones expire. The administration proposed these tariffs citing lax forced-labor standards. Temporary charges are set to expire Friday, avoiding any tariff gap. The",https://cfo.economictimes.indiatimes.com/news/policy/trump-tariffs-may-stay-alive-as-us-set-to-impose-new-import-taxes-by-friday/132570898,"23 Jul 2026, 08:14"
Policy & Regulation,ETCFO Policy,"PLI schemes attract Rs 2.4 lakh crore investment, create 14.15 lakh jobs: Govt","The government's Production Linked Incentive (PLI) schemes have attracted actual investments of more than Rs 2.40 lakh crore, generated over 14.15 lakh direct and indirect jobs, and enabled exports worth Rs 15.2 lakh crore across 14 key sectors as of March 31, 2026, Parliament was informed on Tuesda",https://cfo.economictimes.indiatimes.com/news/policy/pli-schemes-attract-rs-2-4-lakh-crore-investment-create-14-15-lakh-jobs-govt/132549990,"22 Jul 2026, 08:13"
Geopolitics,ETCFO Policy,"Trump announces new generic drugs tariff plan: No tariffs for 2 years, then 100%, and then 200%","For Indian exporters, the two-year tariff-free period offers additional time to reassess supply chains and investment plans. While the immediate impact on exports is likely to be limited, the proposed escalation to 100% and eventually 200% tariffs could significantly alter the economics of supplying",https://cfo.economictimes.indiatimes.com/news/policy/trump-announces-new-generic-drugs-tariff-plan-no-tariffs-for-2-years-then-100-and-then-200/132549841,"22 Jul 2026, 07:58"
Policy & Regulation,ETCFO Policy,Sebi asks depositories to put in place operational framework to implement buyback rules from Aug 1,"Sebi has directed depositories to implement a new framework for freezing promoter holdings. This operational framework will be in place by August 1, 2026. The mechanism freezes promoter and promoter group holdings at the ISIN level. Exceptions allow promoters to tender shares in tender offer buyback",https://cfo.economictimes.indiatimes.com/news/policy/sebi-asks-depositories-to-put-in-place-operational-framework-to-implement-buyback-rules-from-aug-1/132536143,"21 Jul 2026, 17:33"
Markets & Macro,ETCFO Policy,"RBI's inflow push gets off to strong start, fortifying India's balance of payments",Foreign currency inflows are strengthening India's balance of payments position. The Reserve Bank of India's measures have mobilized over twenty billion dollars. This inflow is significantly higher than anticipated by economists and analysts. Such robust initial response bodes well for future fund m,https://cfo.economictimes.indiatimes.com/news/policy/rbis-inflow-push-gets-off-to-strong-start-fortifying-indias-balance-of-payments/132531177,"21 Jul 2026, 13:31"
Strategic Signals,ETCFO Policy,"Lagging on FCNR(B) deposit collections, banks pin hopes on September-end rush","Banks anticipate a surge in FCNR-B deposits before the September deadline. Initial inflows have been below expectations, but partnerships are being forged. Demand from non-resident Indians remains strong, especially from the Middle East. Lenders are intensifying outreach efforts to attract more over",https://cfo.economictimes.indiatimes.com/news/policy/lagging-on-fcnrb-deposit-collections-banks-pin-hopes-on-september-end-rush/132514829,"20 Jul 2026, 17:30"
