section,source,title,summary,link,published_at
Energy & Infrastructure,The Diplomat,"Uzbekistan, Russia Celebrate Start of Nuclear Power Plant Construction… Again",Tashkent and Moscow celebrated the start of construction on the plant – two months after the companies involved celebrated the same thing.,https://thediplomat.com/2026/06/uzbekistan-russia-celebrate-start-of-nuclear-power-plant-construction-again/,"06 Jun 2026, 00:07"
Strategic Signals,The Diplomat,Pete Hegseth’s Missed Chance to Reassure – and Deter – on Taiwan,The U.S. defense secretary failed to mention Taiwan once during his closely-watched speech at the Shangri-La Dialogue.,https://thediplomat.com/2026/06/pete-hegseths-missed-chance-to-reassure-and-deter-on-taiwan/,"05 Jun 2026, 22:17"
Geopolitics,The Diplomat,Could a Democratic Mid-Term Win Upset the China-US Detente?,If Democrats ride a “blue wave” to reclaim the House in November’s mid-term elections – a distinct possibility – U.S. China policy will become dangerously volatile.,https://thediplomat.com/2026/06/could-a-democratic-mid-term-win-upset-the-china-us-detente/,"05 Jun 2026, 21:56"
Policy & Regulation,The Diplomat,Pacific Nations Adopt First Regional Climate Relocation Framework,"Pacific governments have launched the world's first regional framework for planned climate relocation, creating new guidance for communities facing displacement from rising seas, coastal erosion, and intensifying storms.",https://thediplomat.com/2026/06/pacific-nations-adopt-first-regional-climate-relocation-framework/,"05 Jun 2026, 22:39"
Geopolitics,War on the Rocks,The Pentagon’s AI Edge Is Being Distilled Away,"Adversaries do not need to breach the Pentagon’s systems: They only need to harvest the logic of the publicly released frontier AI models that underpin them. This is a defining risk as the Department of Defense pivots to an “AI-first” warfighting machine. In this new context, military predominance i",https://warontherocks.com/cogs-of-war/the-pentagons-ai-edge-is-being-distilled-away/,"05 Jun 2026, 08:00"
Geopolitics,War on the Rocks,After the Invasion: China Considers the Problem of Ruling Taiwan,"In August 2024, scholars at a Xiamen-based think tank published a paper urging Beijing to immediately establish a shadow Taiwan government on the Chinese mainland in preparation for a full takeover of the island. “It is imperative to prepare a plan for the comprehensive takeover of Taiwan after unif",https://warontherocks.com/after-the-invasion-china-considers-the-problem-of-ruling-taiwan/,"05 Jun 2026, 07:30"
Energy & Infrastructure,War on the Rocks,Is Time on China’s Side? Beijing’s Taiwan Calculus and the Balance of Power,When is the risk of war the highest? And what should the United States be doing about it? One of the most important but underappreciated questions in international politics is how states think about the future balance of power. Countries that believe their position is improving often choose patience,https://warontherocks.com/is-time-on-chinas-side-beijings-taiwan-calculus-and-the-balance-of-power/,"04 Jun 2026, 16:00"
Markets & Macro,War on the Rocks,Forged in a Knife Fight: China’s Brutal Domestic AI Competition,"China’s plan to become a world leader in AI by 2030 is a fixture of practically every Congressional briefing and expert commentary on Beijing’s AI ambitions. The plan’s logic — introduced in 2017 — was simple and alarming: Beijing would direct capital, mobilize its firms, recruit talent, and execute",https://warontherocks.com/cogs-of-war/forged-in-a-knife-fight-chinas-brutal-domestic-ai-competition/,"04 Jun 2026, 08:00"
Strategic Signals,War on the Rocks,Revisiting The Importance of the Battle of Midway,"The Battle of Midway has assumed a place in American naval lore that has put it on par with other great battles in world naval history. What Salamis was for the Greeks, Trafalgar for the British Royal Navy, and Tsushima for the Japanese, the clash northwest of Midway Island on June 4, 1942, represen",https://warontherocks.com/revisiting-the-importance-of-the-battle-of-midway/,"04 Jun 2026, 07:30"
Geopolitics,War on the Rocks,"Wrong Audience, Wrong Ask: Why Trump’s Abraham Accords Gambit Falls on Deaf Ears",When President Donald Trump repeatedly pressed regional leaders on Abraham Accords expansion late last month — framing Arab-Israeli normalization as a debt owed and a condition for a settlement to end the Iran war — he apparently commented there had been silence on the other end of the line.Arab and,https://warontherocks.com/wrong-audience-wrong-ask-why-trumps-abraham-accords-gambit-falls-on-deaf-ears/,"04 Jun 2026, 07:15"
Geopolitics,War on the Rocks,Will China and the United States Pursue Strategic Stability?,"In 2024, Michael Swaine wrote, “How to Stop the United States and China from Sliding into War,” where he identified areas that could increase the possibility of an armed conflict between the United States and China. Two years later, after recent talks between President Trump and President Xi, we ask",https://warontherocks.com/will-china-and-the-united-states-pursue-strategic-stability/,"03 Jun 2026, 17:30"
Geopolitics,War on the Rocks,The Rain in Spain Falls Harder on Ukraine: Rethinking the Spanish Civil War Analogy,"In 2023, the NATO Baltic Defense College in Tartu, Estonia devoted its entire annual conference to the Interwar Period (1919 to 1939), a theme repeated at subsequent conferences sponsored by national militaries and academic societies throughout the United States and Europe. Western scholars and fore",https://warontherocks.com/the-rain-in-spain-falls-harder-on-ukraine-rethinking-the-spanish-civil-war-analogy/,"03 Jun 2026, 07:30"
Policy & Regulation,CSIS,The Bio-Pharma Industry and Society,"The Bio-Pharma Industry and Society Listing Summary Please join the CSIS Global Health Policy Center on March 17, from 10:00am – 11:30am, for an exploration of how private bio-pharmaceutical firms can better support the critically important societal goals of improved affordability, access, quality, ",https://www.csis.org/events/bio-pharma-industry-and-society,"03 Mar 2016, 20:36"
Policy & Regulation,CSIS,The FY2017 Defense Budget and Strategic Outlook,"The FY2017 Defense Budget and Strategic Outlook Listing Summary Please join the CSIS International Security Program for a half-day Defense360 conference on the recently released FY2017 defense budget request and strategic priorities. Drupal Admin Mon, 02/29/2016 - 13:48 Featured Image Image Contribu",https://www.csis.org/events/fy2017-defense-budget-and-strategic-outlook,"29 Feb 2016, 18:48"
Policy & Regulation,CSIS,2016 U.S.-Japan Security Seminar,"2016 U.S.-Japan Security Seminar Listing Summary Michael J. Green interviews JIIA President Yoshiji Nogami Drupal Admin Fri, 02/26/2016 - 12:54 Featured Image Image Contributors Michael J. Green Programs & Projects Japan Chair Parent Geopolitics and Foreign Policy Featured Image AdobeStock_179685887",https://www.csis.org/events/2016-us-japan-security-seminar,"26 Feb 2016, 17:54"
Energy & Infrastructure,CSIS,The Future of the Grid—A View from ARPA-E,"The Future of the Grid—A View from ARPA-E Listing Summary The CSIS Energy and National Security Program is pleased to invite you to a discussion with Ellen Williams, Director of ARPA-E, the Advanced Research Projects Agency-Energy. Drupal Admin Thu, 02/25/2016 - 14:15 Featured Image Image Contributo",https://www.csis.org/events/future-grid-view-arpa-e,"25 Feb 2016, 19:15"
Geopolitics,CSIS,"Statesmen's Forum: Wang Yi, Minister of Foreign Affairs, PRC","Statesmen's Forum: Wang Yi, Minister of Foreign Affairs, PRC Listing Summary Please watch the live webcast of a discussion on Chinese foreign policy and US-China Relations Drupal Admin Fri, 02/19/2016 - 17:13 Featured Image Image Contributors John J. Hamre Christopher K. Johnson Downloads Download T",https://www.csis.org/events/statesmens-forum-wang-yi-minister-foreign-affairs-prc,"19 Feb 2016, 22:13"
Geopolitics,CSIS,"China Reality Check: China's ""Internet Sovereignty"" Initiative: Origins and Consequences","China Reality Check: China's ""Internet Sovereignty"" Initiative: Origins and Consequences Listing Summary Please join us for a discussion on China’s initiative to promote Internet sovereignty as a key governing concept of the global Internet. Drupal Admin Tue, 02/16/2016 - 11:49 Featured Image Image ",https://www.csis.org/events/china-reality-check-chinas-internet-sovereignty-initiative-origins-and-consequences,"16 Feb 2016, 16:49"
Policy & Regulation,CSIS,"Statesmen's Forum: The Right Honourable Theresa May, MP, Home Secretary, United Kingdom","Statesmen's Forum: The Right Honourable Theresa May, MP, Home Secretary, United Kingdom Listing Summary Please join the CSIS International Security Program for a discussion with UK Home Secretary Theresa May on counter-terrorism policy. Drupal Admin Fri, 02/12/2016 - 16:08 Featured Image Image Contr",https://www.csis.org/events/statesmens-forum-right-honourable-theresa-may-mp-home-secretary-united-kingdom,"12 Feb 2016, 21:08"
Strategic Signals,CSIS,Strategic Opportunities in the Indo-Asia-Pacific with Admiral Harry B. Harris,"Strategic Opportunities in the Indo-Asia-Pacific with Admiral Harry B. Harris Listing Summary Please join us for a discussion with Admiral Harry B. Harris, Commander, U.S. Pacific Command, on the Strategic Opportunities in the Indo-Asia-Pacific. Drupal Admin Tue, 01/26/2016 - 11:20 Featured Image Im",https://www.csis.org/events/strategic-opportunities-indo-asia-pacific-admiral-harry-b-harris,"26 Jan 2016, 16:20"
Strategic Signals,Al Jazeera,"Judge strikes down Trump bar on asylum, visa processing for 39 countries","Judge says restrictions put lives of immigrants in 'indeterminate legal limbo', motivated by 'anti-immigrant sentiment'.",https://www.aljazeera.com/news/2026/6/5/judge-strikes-down-trump-bar-on-asylum-visa-processing-for-39-countries?traffic_source=rss,"05 Jun 2026, 18:50"
Geopolitics,Al Jazeera,Is the latest US ceasefire deal for Lebanon meaningless?,Israel and Hezbollah continue fighting after truce announcement.,https://www.aljazeera.com/video/inside-story/2026/6/5/is-the-latest-us-ceasefire-deal-for-lebanon-meaningless?traffic_source=rss,"05 Jun 2026, 18:45"
Geopolitics,Al Jazeera,Huge fire erupts at Honda warehouse in Barcelona,Around 150 workers were evacuated after a fire broke out at a Honda industrial warehouse in Barcelona.,https://www.aljazeera.com/video/newsfeed/2026/6/5/huge-fire-erupts-at-honda-warehouse-in-barcelona?traffic_source=rss,"05 Jun 2026, 18:39"
Energy & Infrastructure,Al Jazeera,Trump admin’s cancellation of wind energy projects causes business turmoil,Seven northeastern states have sued US gov't for paying TotalEnergies to withdraw from offshore wind projects.,https://www.aljazeera.com/economy/2026/6/5/trump-admins-cancellation-of-wind-energy-projects-causes-business-turmoil?traffic_source=rss,"05 Jun 2026, 18:12"
Geopolitics,Al Jazeera,Russia’s Putin says ‘no point’ meeting Ukraine’s Zelenskyy for now,The Russian leader insisted military action would only stop after Moscow achieves its 'goals'.,https://www.aljazeera.com/news/2026/6/5/russias-putin-says-no-point-meeting-ukraines-zelenskyy-for-now?traffic_source=rss,"05 Jun 2026, 18:04"
Geopolitics,Al Jazeera,Ukraine and Russia exchange 185 prisoners of war each,"Russia and Ukraine have each released 185 prisoners in a major exchange, which Russia says was mediated by the UAE.",https://www.aljazeera.com/video/newsfeed/2026/6/5/ukraine-and-russia-exchange-185-prisoners-of-war-each?traffic_source=rss,"05 Jun 2026, 17:54"
Geopolitics,Al Jazeera,Video shows moment Israeli air strike hits car in southern Lebanon,"Video shows the moment when journalist Abbas Fakih was reporting in Nabatieh, Lebanon and an Israeli air strike hit.",https://www.aljazeera.com/video/newsfeed/2026/6/5/video-shows-moment-israeli-air-strike-hits-car-in-southern-lebanon?traffic_source=rss,"05 Jun 2026, 17:44"
Geopolitics,Al Jazeera,Germany’s Merz says EU to initiate integration of Western Balkans,"Alongside Ukraine and Moldova, six Western Balkan nations wish to join the European Union.",https://www.aljazeera.com/news/2026/6/5/germanys-merz-says-eu-to-initiate-integration-of-western-balkans?traffic_source=rss,"05 Jun 2026, 17:40"
Energy & Infrastructure,ETCFO Top Stories,RBI keeps repo rate unchanged at 5.25%; MPC retains neutral stance amid global uncertainties,"The Reserve Bank of India on Friday left the repo rate unchanged at 5.25 per cent and retained its neutral policy stance, while lowering its FY27 growth forecast to 6.6 per cent and projecting inflation at 5.1 per cent amid escalating geopolitical tensions, rising energy prices and mounting global u",https://cfo.economictimes.indiatimes.com/news/policy/rbi-maintains-repo-rate-at-525-in-june-2026-policy-meeting/131521208,"05 Jun 2026, 10:03"
Policy & Regulation,ETCFO Top Stories,Rajesh Exports: All that glitters is not gold,"Rajesh Exports, a listed entity is in the eye of the storm after the Securities and Exchange Board of India (SEBI), in its 109-page interim order, stated that 97% to 99% of the nearly Rs 15 lakh crore revenue reported by the company was ""inflated, egregious, and unheard of."" The obvious question is:",https://cfo.economictimes.indiatimes.com/news/governance-risk-compliance/rajesh-exports-major-accounting-scandal-exposed/131519465,"05 Jun 2026, 08:09"
Strategic Signals,ETCFO Top Stories,Exclusive: Livspace CFO Abhishek Gupta resigns after brief stint,Finance veteran exits home interiors company months after joining; set to take up a larger Group CFO role at a major conglomerate.,https://cfo.economictimes.indiatimes.com/news/leadership/livspace-cfo-abhishek-gupta-resigns-a-major-shift-in-leadership/131513215,"04 Jun 2026, 23:12"
Markets & Macro,ETCFO Top Stories,BIT sweeter? India weighs easing treaty rules with safeguards to attract foreign capital,"As the world shifts economically, India is set to revamp its investment treaty frameworks. The government is exploring options to simplify the timelines for foreign entities aiming for global arbitration. This proactive step is aimed at enticing foreign investment into the country, while also incorp",https://cfo.economictimes.indiatimes.com/news/tax-legal-accounting/bit-sweeter-india-weighs-easing-treaty-rules-with-safeguards-to-attract-foreign-capital/131520185,"05 Jun 2026, 08:25"
Strategic Signals,ETCFO Top Stories,"ICAI reinforces mandatory forensic audit, sustainability assurance norms in revised Code of Ethics","Updated framework reiterates applicability of forensic investigation, ESG assurance and social impact assessment standards, underscoring the profession's expanding assurance responsibilities.",https://cfo.economictimes.indiatimes.com/news/tax-legal-accounting/icai-enforces-forensic-audit-and-sustainability-assurance-standards-in-revised-code-of-ethics/131497125,"04 Jun 2026, 10:48"
Geopolitics,ETCFO Top Stories,"M3M targets Rs 28,000 crore in sales by FY27, plans to deliver one crore Sq Ft annually, Director Finance Wahaal says","M3M India aims to deliver nearly one crore square feet annually, backed by a pipeline of 10,000 apartment deliveries and an expanding branded residences project on Dwarka Expressway. The real estate major is focusing on scale and product elevation, targeting ultra-HNIs with premium facilities and ex",https://cfo.economictimes.indiatimes.com/news/strategy-operations/m3m-aims-for-rs-28000-crore-in-sales-by-fy27-with-major-expansion-plans/131441450,"02 Jun 2026, 06:11"
Energy & Infrastructure,ETCFO Top Stories,"Price shock: How Middle East conflict has raised inflation risks, squeezed corporate margins","The prolonged conflict in the Middle East has emerged more as a price shock than a growth shock for India, with rising energy costs feeding into wholesale inflation and corporate margins while economic activity remains relatively resilient.",https://cfo.economictimes.indiatimes.com/news/economy/price-shock-how-middle-east-conflict-has-raised-inflation-risks-squeezed-corporate-margins/131495028,"04 Jun 2026, 08:07"
Policy & Regulation,ETCFO Top Stories,"SEBI clears path for promoter-group cousin to serve as independent director, clarifies LODR eligibility norms",Informal guidance to Maithan Alloys says cousin of promoter-group member is not a 'relative' under LODR Regulations; clarification may influence board appointments across listed companies.,https://cfo.economictimes.indiatimes.com/news/governance-risk-compliance/sebi-allows-promoter-cousin-as-independent-director-amidst-governance-clarification/131475482,"03 Jun 2026, 09:43"
Markets & Macro,ETCFO Policy,India scraps capital gains tax on foreign investors in government debt to support rupee,"India will exempt foreign institutional investors and the Bank for International Settlements from capital gains tax on government securities. This move aims to attract more stable foreign capital. The exemption will take effect from April 1, 2026. This decision is expected to improve post-tax return",https://cfo.economictimes.indiatimes.com/news/policy/india-scraps-capital-gains-tax-on-foreign-investors-in-government-debt-to-support-rupee/131527095,"05 Jun 2026, 14:45"
Markets & Macro,ETCFO Policy,"Rupee inches up, defies Asian peers; caution prevails before RBI policy","The Indian rupee strengthened today, moving against weaker Asian markets. This rise occurred before a key Reserve Bank of India policy announcement. Markets are watching closely for any interest rate changes. Economists generally do not expect a hike. The central bank faces challenges attracting cap",https://cfo.economictimes.indiatimes.com/news/policy/rupee-inches-up-defies-asian-peers-caution-prevails-before-rbi-policy/131524247,"05 Jun 2026, 12:35"
Policy & Regulation,ETCFO Policy,Government said to weigh up to $525 million Hindustan Zinc share sale,"The government is considering selling up to a 2% stake in Hindustan Zinc Ltd., a move that could raise around Rs 5,000 crore. The stake sale, likely this month or in July, is part of a broader divestment drive aimed at boosting revenue through public asset sales. Several investment banks have been a",https://cfo.economictimes.indiatimes.com/news/policy/government-said-to-weigh-up-to-525-million-hindustan-zinc-share-sale/131524223,"05 Jun 2026, 12:17"
Energy & Infrastructure,ETCFO Policy,RBI MPC Meeting 2026: Sanjay Malhotra & co warn weak monsoon could stir food inflation despite price stability,"RBI monetary policy meeting: India's monsoon season is critical for farms and prices. A weak monsoon could impact crop yields and raise food costs. The Reserve Bank of India is watching weather closely. Inflation has already risen slightly. Experts warn of price pressures from rain, energy, and curr",https://cfo.economictimes.indiatimes.com/news/policy/rbi-mpc-meeting-2026-sanjay-malhotra-co-warn-weak-monsoon-could-stir-food-inflation-despite-price-stability/131522158,"05 Jun 2026, 10:31"
Markets & Macro,ETCFO Policy,Parliamentary Finance panel concerned over slow private investment despite substantial surge in public capex,"Parliamentary panel on finance raises concern over private investment not keeping pace with government capex, with Standing Committee on Finance Chairman Bhartruhari Mahtab on Thursday saying the issue remains a key challenge for the Indian economy even as public capital expenditure continues to ris",https://cfo.economictimes.indiatimes.com/news/policy/parliamentary-finance-panel-concerned-over-slow-private-investment-despite-substantial-surge-in-public-capex/131505877,"04 Jun 2026, 17:02"
Markets & Macro,ETCFO Policy,RBI likely to hold rates as West Asia crisis impact on growth remains unclear: Bank of Baroda Report,"The Reserve Bank of India (RBI) is likely to maintain status quo on interest rates in its monetary policy announcement on Friday as the impact of the ongoing crisis in West Asia on economic growth remains difficult to assess, according to a report by Bank of Baroda.",https://cfo.economictimes.indiatimes.com/news/policy/rbi-likely-to-hold-rates-as-west-asia-crisis-impact-on-growth-remains-unclear-bank-of-baroda-report/131495433,"04 Jun 2026, 08:29"
Markets & Macro,ETCFO Policy,SBI chairman Shetty sees MPC’s repo rate pause ‘appropriate’ at this juncture: Report,"SBI Chairman CS Setty anticipates the Monetary Policy Committee will pause interest rates this week. This aligns with market expectations as economic growth and inflation dynamics support the decision. While a pause is expected now, some economists foresee rate hikes later. Investors await the RBI's",https://cfo.economictimes.indiatimes.com/news/policy/sbi-chairman-shetty-sees-mpcs-repo-rate-pause-appropriate-at-this-juncture-report/131478770,"03 Jun 2026, 13:23"
