section,source,title,summary,link,published_at
Geopolitics,War on the Rocks,Control Without Ownership: How China’s Party-Business Networks Dominate Indonesia’s Mineral Supply Chains,"In 2024, when Jiangsu Delong, the world’s second-largest stainless-steel producer, filed for bankruptcy, several Chinese firms and state-owned enterprises quietly absorbed its Indonesian assets. Among them was China First Heavy Industries, a state-owned enterprise founded in 1954 as one of China’s e",https://warontherocks.com/cogs-of-war/control-without-ownership-how-chinas-party-business-networks-dominate-indonesias-mineral-supply-chains/,"28 May 2026, 08:00"
Strategic Signals,War on the Rocks,A Sea Control Revolution?,"Sea control has changed. In recent years, there has been a quiet revolution in maritime strategy that has seen navies increasingly expected to exert greater levels of control over more of the world’s oceans, more of the time. Whether it is NATO forces protecting critical maritime infrastructure in t",https://warontherocks.com/a-sea-control-revolution/,"28 May 2026, 07:30"
Policy & Regulation,War on the Rocks,What Everyone is Missing About North Korea’s Reunification Strategy,"When news broke that North Korea had revised its constitution, analysts in the West and across the Korean Peninsula rushed to declare it the formal death of Korean reunification as a policy objective. The changes were hard to ignore. Pyongyang stripped all references to a unified Korean nation, codi",https://warontherocks.com/what-everyone-is-missing-about-north-koreas-reunification-strategy/,"28 May 2026, 07:15"
Strategic Signals,War on the Rocks,What Did the NPT Review Conference Achieve?,"The 11th Review Conference of the Nuclear Non-Proliferation Treaty (NPT) concluded on May 22. Held every five years, the conference offers an opportunity to evaluate the treaty’s implementation, respond to technological and geopolitical developments, and reinforce states’ commitment to the treaty. F",https://warontherocks.com/what-did-the-npt-review-conference-achieve/,"27 May 2026, 19:15"
Energy & Infrastructure,War on the Rocks,Washington Shouldn’t Fly Solo on Building Space Superiority,"In 2025, Nazmelis Zengin wrote, “The Fragility of U.S. Space Power in a Multipolar World,” where she argued Washington’s space superiority could be challenged if the United States doesn’t rethink its course, taking lessons from mid-tier space powers. A year later, we asked Nazmelis to revisit her ar",https://warontherocks.com/washington-shouldnt-fly-solo-on-building-space-superiority/,"27 May 2026, 18:00"
Strategic Signals,War on the Rocks,"Synthetic Biology, Drones, and AI: The Risks of Dual-Use Technologies","Is it too late to stop criminals and American adversaries from exploiting AI to conduct cyberattacks or design novel pathogens? Has regulation kept pace with the threat civilian drones pose to critical infrastructure? AI researcher Lennart Heim, Army drone strategist Paul Lushenko, and CEO of Sentin",https://warontherocks.com/cogs-of-war/synthetic-biology-drones-and-ai-the-risks-of-dual-use-technologies/,"27 May 2026, 08:00"
Strategic Signals,War on the Rocks,The Road to Space Runs through the Poles,"Why are there more antennas on Svalbard than anywhere else on Earth? Svalbard of all places, where cats and childbirth are banned and there are more polar bears than people? This cluster of islands in the Arctic, one thousand kilometers from Norway, is key to everything from your weather forecast to",https://warontherocks.com/the-road-to-space-runs-through-the-poles/,"27 May 2026, 07:30"
Policy & Regulation,CSIS,The Bio-Pharma Industry and Society,"The Bio-Pharma Industry and Society Listing Summary Please join the CSIS Global Health Policy Center on March 17, from 10:00am – 11:30am, for an exploration of how private bio-pharmaceutical firms can better support the critically important societal goals of improved affordability, access, quality, ",https://www.csis.org/events/bio-pharma-industry-and-society,"03 Mar 2016, 20:36"
Policy & Regulation,CSIS,The FY2017 Defense Budget and Strategic Outlook,"The FY2017 Defense Budget and Strategic Outlook Listing Summary Please join the CSIS International Security Program for a half-day Defense360 conference on the recently released FY2017 defense budget request and strategic priorities. Drupal Admin Mon, 02/29/2016 - 13:48 Featured Image Image Contribu",https://www.csis.org/events/fy2017-defense-budget-and-strategic-outlook,"29 Feb 2016, 18:48"
Policy & Regulation,CSIS,2016 U.S.-Japan Security Seminar,"2016 U.S.-Japan Security Seminar Listing Summary Michael J. Green interviews JIIA President Yoshiji Nogami Drupal Admin Fri, 02/26/2016 - 12:54 Featured Image Image Contributors Michael J. Green Programs & Projects Japan Chair Parent Geopolitics and Foreign Policy Featured Image AdobeStock_179685887",https://www.csis.org/events/2016-us-japan-security-seminar,"26 Feb 2016, 17:54"
Energy & Infrastructure,CSIS,The Future of the Grid—A View from ARPA-E,"The Future of the Grid—A View from ARPA-E Listing Summary The CSIS Energy and National Security Program is pleased to invite you to a discussion with Ellen Williams, Director of ARPA-E, the Advanced Research Projects Agency-Energy. Drupal Admin Thu, 02/25/2016 - 14:15 Featured Image Image Contributo",https://www.csis.org/events/future-grid-view-arpa-e,"25 Feb 2016, 19:15"
Geopolitics,CSIS,"Statesmen's Forum: Wang Yi, Minister of Foreign Affairs, PRC","Statesmen's Forum: Wang Yi, Minister of Foreign Affairs, PRC Listing Summary Please watch the live webcast of a discussion on Chinese foreign policy and US-China Relations Drupal Admin Fri, 02/19/2016 - 17:13 Featured Image Image Contributors John J. Hamre Christopher K. Johnson Downloads Download T",https://www.csis.org/events/statesmens-forum-wang-yi-minister-foreign-affairs-prc,"19 Feb 2016, 22:13"
Geopolitics,CSIS,"China Reality Check: China's ""Internet Sovereignty"" Initiative: Origins and Consequences","China Reality Check: China's ""Internet Sovereignty"" Initiative: Origins and Consequences Listing Summary Please join us for a discussion on China’s initiative to promote Internet sovereignty as a key governing concept of the global Internet. Drupal Admin Tue, 02/16/2016 - 11:49 Featured Image Image ",https://www.csis.org/events/china-reality-check-chinas-internet-sovereignty-initiative-origins-and-consequences,"16 Feb 2016, 16:49"
Policy & Regulation,CSIS,"Statesmen's Forum: The Right Honourable Theresa May, MP, Home Secretary, United Kingdom","Statesmen's Forum: The Right Honourable Theresa May, MP, Home Secretary, United Kingdom Listing Summary Please join the CSIS International Security Program for a discussion with UK Home Secretary Theresa May on counter-terrorism policy. Drupal Admin Fri, 02/12/2016 - 16:08 Featured Image Image Contr",https://www.csis.org/events/statesmens-forum-right-honourable-theresa-may-mp-home-secretary-united-kingdom,"12 Feb 2016, 21:08"
Strategic Signals,CSIS,Strategic Opportunities in the Indo-Asia-Pacific with Admiral Harry B. Harris,"Strategic Opportunities in the Indo-Asia-Pacific with Admiral Harry B. Harris Listing Summary Please join us for a discussion with Admiral Harry B. Harris, Commander, U.S. Pacific Command, on the Strategic Opportunities in the Indo-Asia-Pacific. Drupal Admin Tue, 01/26/2016 - 11:20 Featured Image Im",https://www.csis.org/events/strategic-opportunities-indo-asia-pacific-admiral-harry-b-harris,"26 Jan 2016, 16:20"
Energy & Infrastructure,Al Jazeera,"CNN sues Perplexity, alleging unlawful distribution of copyrighted content","Perplexity unlawfully copied thousands of CNN stories, videos and images to power its products, CNN said in its lawsuit.",https://www.aljazeera.com/economy/2026/5/28/cnn-sues-perplexity-alleging-unlawful-distribution-of-copyrighted-content?traffic_source=rss,"28 May 2026, 17:45"
Geopolitics,Al Jazeera,How War Changed Eid in Lebanon,"After nearly three years of war and displacement, Eid in Lebanon no longer feels like celebration for many families.",https://www.aljazeera.com/video/newsfeed/2026/5/28/how-war-changed-eid-in-lebanon?traffic_source=rss,"28 May 2026, 17:40"
Geopolitics,Al Jazeera,UN ‘adds Israel to blacklist’ for conflict-related sexual violence,Israeli ambassador to the UN says Tel Aviv will cut ties with UN chief Antonio Guterres over the upcoming report.,https://www.aljazeera.com/news/2026/5/28/un-adds-israel-to-blacklist-for-sexual-violence-in-war-zones?traffic_source=rss,"28 May 2026, 17:16"
Energy & Infrastructure,Al Jazeera,Latvia parliament approves new gov’t after drone dispute toppled coalition,Latvia's government reform ensures a pro-Western path as regional drone incidents heighten security concerns.,https://www.aljazeera.com/news/2026/5/28/latvia-parliament-approves-new-govt-after-drone-dispute-toppled-coalition?traffic_source=rss,"28 May 2026, 17:00"
Markets & Macro,Al Jazeera,US inflation surges to three-year high amid tensions with Iran,"Heightened petrol prices led the inflationary pressures, with prices that jumped 5.5 percent in April.",https://www.aljazeera.com/economy/2026/5/28/us-inflation-surges-to-three-year-high-amid-tensions-with-iran?traffic_source=rss,"28 May 2026, 16:54"
Markets & Macro,Al Jazeera,Smoke rises over Beirut after Israeli strike,Footage shows smoke billowing over south Beirut following an Israeli attack on the Lebanese capital.,https://www.aljazeera.com/video/newsfeed/2026/5/28/smoke-rises-over-beirut-after-israeli-strike?traffic_source=rss,"28 May 2026, 16:42"
Strategic Signals,Al Jazeera,Hundreds flee India crackdown on undocumented migrants,Hundreds flee India crackdown on undocumented migrants,https://www.aljazeera.com/video/newsfeed/2026/5/28/hundreds-flee-india-crackdown-on-undocumented-migrants?traffic_source=rss,"28 May 2026, 16:41"
Strategic Signals,Al Jazeera,Fire kills 16 students at Kenyan girls’ boarding school,At least 16 students were killed and dozens injured after a fire tore through the dormitory of a girls’ school in Kenya.,https://www.aljazeera.com/video/newsfeed/2026/5/28/fire-kills-16-students-at-kenyan-girls-boarding-school?traffic_source=rss,"28 May 2026, 16:25"
Geopolitics,ETCFO Top Stories,Supreme Court upholds retrospective GST on online gaming; experts warn of Rs 1 lakh crore ‘balance sheet event’,Apex court validates 28% GST levy on real money gaming platforms; tax experts say ruling could trigger massive financial and regulatory reset for industry.,https://cfo.economictimes.indiatimes.com/news/tax-legal-accounting/supreme-court-rules-on-retrospective-gst-for-online-gaming-industry-faces-major-tax-hit/131362756,"28 May 2026, 09:44"
Geopolitics,ETCFO Top Stories,Greenwashing in ESG reporting in India : with impunity and without accountability,"Can India’s ESG regime remain credible if companies disclose sustainability claims without verifiable data or accountability? Seasoned finance expert Ashok Haldia warns that despite near-total compliance under the Business Responsibility and Sustainability Reporting framework, weak enforcement, poor",https://cfo.economictimes.indiatimes.com/news/esg/unveiling-greenwashing-in-indias-esg-reporting-a-call-for-accountability/131362846,"28 May 2026, 10:05"
Markets & Macro,ETCFO Top Stories,"AI, purpose-led careers and salary pressures redefine India’s finance workforce: ACCA","81% of finance professionals aspire for social-impact roles while AI adoption surges amid rising inflation concerns, says ACCA India Talent Trends 2026 report.",https://cfo.economictimes.indiatimes.com/news/tax-legal-accounting/ai-transforming-career-aspirations-in-indias-finance-sector-acca-report/131345596,"27 May 2026, 14:35"
Strategic Signals,ETCFO Top Stories,"Allcargo Logistics targets ₹3,000 cr revenue by FY30, CFO bets on pricing and service quality","Allcargo Logistics aims for over ₹3,000 crore revenue by FY30, driven by service quality and disciplined pricing, said CFO Deepak Pareek. Pareek also spoke on how the company is navigating fuel cost volatility, the pricing actions built into FY27 assumptions, segment-wise growth outlook within consu",https://cfo.economictimes.indiatimes.com/news/strategy-operations/allcargo-logistics-aims-for-3000-crore-revenue-by-fy30-through-enhanced-pricing-and-service-quality/131337208,"27 May 2026, 07:00"
Geopolitics,ETCFO Top Stories,BJP CA Cell writes to Centre as delay in 57th GST Council meet keeps key reforms pending,"Haryana BJP CA Cell seeks relief on legacy GST disputes, refund bottlenecks and procedural lapses; experts warn prolonged gap in GST Council meetings is delaying critical reforms and increasing compliance uncertainty for businesses.",https://cfo.economictimes.indiatimes.com/news/tax-legal-accounting/urgent-call-for-gst-council-meeting-bjp-ca-cell-pressures-centre-for-tax-reforms/131305782,"25 May 2026, 14:55"
Markets & Macro,ETCFO Top Stories,Indian firms opt for confidential IPO route amid West Asia-led market volatility,"Rising geopolitical tensions, volatile equity markets and weak investor sentiment are pushing more companies towards SEBI’s confidential filing route, allowing them to keep listing plans flexible while protecting sensitive business information.",https://cfo.economictimes.indiatimes.com/news/corporate-finance/rising-trend-indian-firms-embrace-confidential-ipos-amid-global-market-turbulence/131320928,"26 May 2026, 09:00"
Geopolitics,ETCFO Top Stories,"Any tax change will only fuel FPI exodus, not stop it, former finance secretary SC Garg warns","Former finance secretary Subhash Chandra Garg argues that slashing withholding tax won't stop FPI outflows, citing a lack of profitable investment opportunities and rupee depreciation as primary drivers. He believes tax changes are a ""small irritant"" compared to negative investment returns, advocati",https://cfo.economictimes.indiatimes.com/news/tax-legal-accounting/former-finance-secretary-sc-garg-tax-changes-will-boost-fpi-outflows-amidst-economic-challenges/131296209,"25 May 2026, 06:00"
Strategic Signals,ETCFO Top Stories,upGrad appoints former JioStar finance head Mukesh Mundra as CFO,"Edtech firm upGrad has appointed Mukesh Mundra as its new Chief Financial Officer to bolster its financial leadership during global expansion. With over 26 years of experience in diverse sectors, Mundra will oversee finance and administration, focusing on strategy and scaling operations. This move s",https://cfo.economictimes.indiatimes.com/news/leadership/upgrad-appoints-former-jiostar-finance-head-mukesh-mundra-as-cfo/131326194,"26 May 2026, 15:15"
Markets & Macro,ETCFO Policy,RBI panel to evaluate impact of quantum tech in finance,"The Reserve Bank of India has formed an eight-member committee to explore quantum technology's role in finance. Headed by an IIT Madras professor, the panel will assess opportunities, risks, and challenges. It will also review the financial sector's readiness for quantum-related threats. The committ",https://cfo.economictimes.indiatimes.com/news/policy/rbi-panel-to-evaluate-impact-of-quantum-tech-in-finance/131340879,"27 May 2026, 08:55"
Geopolitics,ETCFO Policy,"Trump says any Iran deal will involve 'no cash', differ from Obama-era agreement","Donald Trump outlined his vision for a future Iran deal. He emphasized no financial concessions would be made, contrasting it with the Obama administration's agreement. Trump asserted his proposed deal would prevent Iran from acquiring nuclear weapons. Senator Lindsey Graham supported Trump's strate",https://cfo.economictimes.indiatimes.com/news/policy/trump-promises-new-iran-deal-without-cash-critiques-obama-agreement/131300168,"25 May 2026, 09:05"
Markets & Macro,ETCFO Policy,RBI MPC: Bank economists back a rate hike in H2 of FY27,Bank economists have advised the Reserve Bank of India that interest rate increases will be necessary later this financial year. This is to manage the effects of the West Asia conflict and ensure economic stability. Most economists do not expect a rate hike in the upcoming June policy meeting.,https://cfo.economictimes.indiatimes.com/news/policy/rbi-mpc-bank-economists-back-a-rate-hike-in-h2-of-fy27/131271435,"23 May 2026, 08:39"
Geopolitics,ETCFO Policy,"""Confident"" US-India trade deal will be finalised in ""coming weeks"": Ambassador Gor","A pivotal trade agreement between India and the United States is soon to be concluded, promising a new chapter in their bilateral relations. US Ambassador Sergio Gor is confident that we will see a resolution in the upcoming weeks. High-ranking officials from both sides are preparing to engage in di",https://cfo.economictimes.indiatimes.com/news/policy/confident-us-india-trade-deal-will-be-finalised-in-coming-weeks-ambassador-gor/131248149,"21 May 2026, 19:47"
Geopolitics,ETCFO Policy,"PM Modi, Italy's Meloni script new chapter with ‘Special Strategic Partnership’; push defence, trade cooperation","India and Italy have elevated their relationship to a Special Strategic Partnership. Prime Minister Narendra Modi and Italian Prime Minister Giorgia Meloni announced a roadmap for cooperation. This includes defence, innovation, manufacturing, logistics, and maritime sectors. The leaders emphasized g",https://cfo.economictimes.indiatimes.com/news/policy/pm-modi-italys-meloni-script-new-chapter-with-special-strategic-partnership-push-defence-trade-cooperation/131238924,"21 May 2026, 08:42"
Energy & Infrastructure,ETCFO Policy,"As India's R&D faces funding & talent crunch, Niti panel suggests 50+ fixes",India's research and development spending lags behind global leaders. A Niti Aayog report highlights funding issues and bureaucratic delays. The report suggests increasing R&D investment to 2% of GDP. It also calls for streamlining processes and boosting manpower. Reforms aim to enhance India's rese,https://cfo.economictimes.indiatimes.com/news/policy/as-indias-rd-faces-funding-talent-crunch-niti-panel-suggests-50-fixes/131238905,"21 May 2026, 08:40"
Geopolitics,ETCFO Policy,"China's new supply chain curbs threaten India's electronics hub ambitions, industry seeks relief",New Chinese regulations are impacting India's goal to become a global electronics manufacturing center. These curbs aim to control supply chains and can lead to penalties for companies shifting production. India's electronics industry is seeking urgent government help. The measures could affect supp,https://cfo.economictimes.indiatimes.com/news/policy/chinas-new-supply-chain-curbs-threaten-indias-electronics-hub-ambitions-industry-seeks-relief/131238873,"21 May 2026, 08:37"
Geopolitics,ETCFO Policy,"India reviews curbs on non-essential imports to support rupee, boost local manufacturing","If necessary, the government can impose higher duties or selective restrictions to curb such imports. India's merchandise trade deficit widened to $28.4 billion in April, from $20.7 billion in March, adding to balance of payments concerns amid portfolio outflows and tepid foreign direct investment.",https://cfo.economictimes.indiatimes.com/news/policy/india-reviews-curbs-on-non-essential-imports-to-support-rupee-boost-local-manufacturing/131214896,"20 May 2026, 08:17"
