section,source,title,summary,link,published_at
Geopolitics,Financial Times World,"Submit your questions: Ten years on, what’s next for Brexit?","Take part in a live Ask an Expert Q&A with the FT’s Europe editor Ben Hall and Peter Foster, the FT’s World trade editor, today at 1pm BST",https://www.ft.com/content/8d6dacc0-0def-45ef-bd00-95e2daca35ef,"04 Jun 2026, 08:51"
Strategic Signals,Financial Times World,Disparities between ethnic groups are not always cause for alarm,"Different outcomes merit investigation, but we should not assume reducing the gaps is desirable or necessary",https://www.ft.com/content/e3de7929-6baf-4432-8306-62d8b01c6566,"04 Jun 2026, 08:30"
Strategic Signals,Financial Times World,Darren Jones told Mandelson he was ‘so sorry’ he was sacked as US envoy,"Chief secretary to PM discussed his own ambitions with the disgraced peer and sniped about colleagues, leaked messages show",https://www.ft.com/content/593b8cfe-1509-4054-ab0f-01e547ccbe81,"04 Jun 2026, 07:36"
Geopolitics,Financial Times World,Israel and Lebanon agree to implement ceasefire,Deal announced by US state department calls for Hizbollah to stop all attacks,https://www.ft.com/content/468ce636-1a7e-4a14-9be1-6d0f48b6b48f,"04 Jun 2026, 06:47"
Strategic Signals,Financial Times World,Japan’s bonds,"Plus, India’s wobble",https://www.ft.com/content/6d67410c-0445-4d3b-abb1-42489e2b9af6,"04 Jun 2026, 05:30"
Geopolitics,Financial Times World,Hungary lifts 17-month veto on Ukraine’s EU membership bid,Also in this newsletter: Talking tough and acting soft on migration,https://www.ft.com/content/c78f2716-8c97-4c38-a2e7-a474061bf7fd,"04 Jun 2026, 05:00"
Markets & Macro,Financial Times World,FirstFT: Trump’s US manufacturing push falters,Also in today’s newsletter: Russian drone warfare and SpaceX IPO,https://www.ft.com/content/bc3a88e9-4456-4fde-b704-64851cf397e7,"04 Jun 2026, 04:31"
Strategic Signals,Financial Times World,Trump to nominate his former lawyer as US attorney-general,Blanche has been justice department’s acting leader since Pam Bondi was ousted in early April,https://www.ft.com/content/70210ca3-5aea-4e91-a763-d6f04b86315d,"04 Jun 2026, 04:22"
Strategic Signals,Financial Times Companies,Partners Group prepares to cap withdrawals at US fund for wealthy individuals,Swiss group faces increasing strains as redemption requests from investors rise,https://www.ft.com/content/33a78e0c-39ea-4a72-b188-b19f753247e7,"04 Jun 2026, 07:27"
Geopolitics,Financial Times Companies,Nvidia’s CPU move and China’s EV makers go solid,"The inside story on the Asia tech trends that matter, from Nikkei Asia and the Financial Times",https://www.ft.com/content/f357cb1e-f387-4087-80ec-51f37afb1bfb,"04 Jun 2026, 06:13"
Geopolitics,Financial Times Companies,Accelerating Business,A monthly series that examines how the legal ecosystem uses new technologies to serve fast-changing business needs. This time: how legal tech stalwarts plan to maintain their service to clients as challengers mount incursions,https://www.ft.com/reports/accelerating-business,"04 Jun 2026, 04:13"
Strategic Signals,Financial Times Companies,Europe’s Best Employers,"In the report, we look at defence groups rise up in the FT’s employer ranking; Amsterdam as an attractive employment hub; engineering’s gender gap; debate over work-life balance in start-ups; Americans look abroad for the longer term",https://www.ft.com/reports/best-employers-europe,"04 Jun 2026, 04:09"
Strategic Signals,Financial Times Companies,Kirkland & Ellis and Palantir to build AI tool to assist private equity firms,Technology to be used to advise buyout groups on bringing in money from investors such as public pension funds,https://www.ft.com/content/4243f9c0-63eb-48d8-b395-bd1ca5cc37a2,"04 Jun 2026, 04:00"
Strategic Signals,Financial Times Companies,America’s ‘other’ economy tells a different growth story,Investors should pay attention to the struggles of the consumer packaged goods industry,https://www.ft.com/content/e318cc17-a42d-40b9-b112-2a2a401a6795,"04 Jun 2026, 04:00"
Policy & Regulation,Financial Times Companies,"AI cyber security risk ‘top of list’ for banking threats, says UK regulator","Sam Woods, the outgoing chief of the PRA, says he is ‘very concerned’ about vulnerabilities in lenders’ IT systems",https://www.ft.com/content/c5f7a9f0-d3d1-499c-aafb-ad03c85730bd,"04 Jun 2026, 04:00"
Markets & Macro,The Hindu BusinessLine,Tata Communications stock rises 2%; new study exposes AI infrastructure gap in global enterprises,"The stock has gained over 25% in the past month and trades at a price-to-earnings ratio of 54.77, with a total market capitalisation of approximately ₹56,259 crore",https://www.thehindubusinessline.com/markets/stock-markets/tata-communications-stock-rises-2-new-study-exposes-ai-infrastructure-gap-in-global-enterprises/article71060403.ece,"04 Jun 2026, 14:36"
Strategic Signals,The Hindu BusinessLine,"Need to reduce fossil fuel imports through alternative fuels, biofuels: Nitin Gadkari","From an economic standpoint, the minister stressed the need to reduce India's dependence on imported fossil fuels",https://www.thehindubusinessline.com/economy/logistics/need-to-reduce-fossil-fuel-imports-through-alternative-fuels-biofuels-nitin-gadkari/article71060330.ece,"04 Jun 2026, 14:36"
Markets & Macro,The Hindu BusinessLine,"Sensex today | Stock Market Live: Sensex trades flat, Nifty near 23,400 as geopolitical tensions weigh on sentiment","Sensex, Nifty, Stock Price Live Updates: Indian equities traded weak in a lacklustre midday session on Thursday as global cues stayed subdued and West Asia tensions escalated, with Sensex and Nifty slipping amid persistent FII selling and cautious derivatives positioning.",https://www.thehindubusinessline.com/markets/sensex-nifty50-today-stock-market-live-updates-4th-june-2026/article71056600.ece,"04 Jun 2026, 14:32"
Energy & Infrastructure,The Hindu BusinessLine,Blue Energy Motors crosses 100 million kms of fleet operations,"The development comes when the commercial vehicle industry is undergoing a significant transformation, driven by rising fuel costs, sustainability commitments from corporates and India’s long-term decarbonisation goals",https://www.thehindubusinessline.com/companies/blue-energy-motors-crosses-100-million-kms-of-fleet-operations/article71060212.ece,"04 Jun 2026, 14:26"
Geopolitics,The Hindu BusinessLine,"BIS studying implementation challenges for mandatory silver hallmarking, says DG","Silver hallmarking has been voluntary since 2005 and from September 2025 onwards, hallmarked silver articles carry a Hallmark Unique Identification (HUID) number, enabling buyers to verify purity.",https://www.thehindubusinessline.com/markets/gold/bis-studying-implementation-challenges-for-mandatory-silver-hallmarking-says-dg/article71060323.ece,"04 Jun 2026, 14:26"
Policy & Regulation,The Hindu BusinessLine,"L&T to invest ₹18,600 cr in Tamil Nadu, signs MoU in presence of CM Vijay",The MoU is the first industrial agreement signed after the Vijay-led government took office,https://www.thehindubusinessline.com/companies/lt-to-invest-18600-cr-in-tamil-nadu-signs-mou-in-presence-of-cm-vijay/article71060339.ece,"04 Jun 2026, 14:16"
Energy & Infrastructure,The Hindu BusinessLine,Energy price shocks may slow down economic recovery but inflation to remain stable: Report,"As per ICICI Bank Global Markets report, inflation is speedily increasing, majorly led by food which now should also be driven by energy prices",https://www.thehindubusinessline.com/economy/energy-price-shocks-may-slow-down-economic-recovery-but-inflation-to-remain-stable-report/article71060158.ece,"04 Jun 2026, 14:16"
Markets & Macro,The Hindu BusinessLine,"Silver drops in futures trade on weak global cues, inflation worries","On the MCX, the white metal for July delivery depreciated by ₹621, or 0.24%, to ₹2,62,337 per kg in a business turnover of 11,830 lots.",https://www.thehindubusinessline.com/markets/gold/silver-drops-in-futures-trade-on-weak-global-cues-inflation-worries/article71060336.ece,"04 Jun 2026, 14:16"
Markets & Macro,Times of India Business,"‘World's long-term capital is looking at India’: Global investors betting big, says Piyush Goyal",Global investors are showing strong confidence in India's future. Union Minister Piyush Goyal stated that India is set to be the world's fastest-growing economy for more than twenty years. Companies like Hyundai and JCB have seen significant returns by investing in India. The nation is becoming a ma,https://timesofindia.indiatimes.com/business/india-business/worlds-long-term-capital-is-looking-at-india-global-investors-betting-big-says-piyush-goyal/articleshow/131501438.cms,"04 Jun 2026, 14:23"
Policy & Regulation,Times of India Business,Rajesh Exports share price today: Stock tanks 5% to hit lower circuit as SEBI bans CMD for financial irregularities,"On the BSE, the stock fell 4.99% to Rs 104.65, reaching its daily lower limit. A similar trend was seen on the NSE, where the share price declined 4.99% to Rs 103.92, also locking into the lower circuit.",https://timesofindia.indiatimes.com/business/india-business/rajesh-exports-share-price-today-stock-tanks-5-to-hit-lower-circuit-as-sebi-bans-cmd-for-financial-irregularities/articleshow/131499792.cms,"04 Jun 2026, 13:05"
Strategic Signals,Times of India Business,"Gold, silver price prediction: Will gold hit Rs 1.65 lakh/10 grams & silver rise to Rs 2.85 lakh per kg? Check outlook","Gold and silver price prediction today: The base trendline for MCX Gold, and MCX Silver remains bullish according to Abhilash Koikkara, Head - Forex & Commodities, Nuvama Professional Clients Group.",https://timesofindia.indiatimes.com/business/india-business/gold-silver-price-prediction-today-what-is-the-gold-rate-outlook-for-june-04-2026-should-you-buy-or-sell-mcx-gold-mcx-silver/articleshow/131499032.cms,"04 Jun 2026, 12:30"
Energy & Infrastructure,Times of India Business,"Stock Market Live Updates Today: BSE Sensex opens over 450 points down, Nifty50 below 23,350; crude oil prices drop",,https://timesofindia.indiatimes.com/business/india-business/sensex-stock-market-today-04-june-2026-live-updates-nse-bse-gift-nifty-50-top-gainers-losers-mcx-stocks-in-focus-market-news/liveblog/131495226.cms,"04 Jun 2026, 08:15"
Markets & Macro,Times of India Business,US-Iran war: India looks to attract foreign investment; capital gains tax on government securities may be scrapped,Reports suggest that PM Narendra Modi-led Union Cabinet on Wednesday cleared an ordinance that will amend the Income Tax Act and enable the proposed tax exemption.,https://timesofindia.indiatimes.com/business/india-business/us-iran-war-india-looks-to-attract-foreign-investment-capital-gains-tax-on-government-securities-may-be-scrapped/articleshow/131495909.cms,"04 Jun 2026, 09:16"
Markets & Macro,Times of India Business,"Top stocks to buy today: Stock recommendations for June 4, 2026 - check list","Top stock market recommendations: Cyient, Timken India, and Bosch have been shortlisted as the top stocks to buy by Aakash K Hindocha, Vice President - Research, Nuvama Professional Clients Group/Nuvama Wealth Management for June 4, 2026. The expert has also shared his outlook for Nifty, and Bank Ni",https://timesofindia.indiatimes.com/business/india-business/top-stock-recommendations-for-june-04-2026-cyient-timken-india-bosch-best-stocks-to-buy-today/articleshow/131495341.cms,"04 Jun 2026, 08:27"
Policy & Regulation,Times of India Business,Sebi bans Rajesh Exports' CMD for fin irregularities,"Sebi has banned Rajesh Mehta, CMD of Rajesh Exports, from dealing in the company's shares pending further orders. The regulator's investigation revealed significant manipulation of accounts, particularly overseas subsidiary revenues, inflating them by an ""egregious"" 97%-99%. The company also failed ",https://timesofindia.indiatimes.com/business/india-business/sebi-bans-rajesh-exports-cmd-for-fin-irregularities/articleshow/131492064.cms,"04 Jun 2026, 02:18"
Markets & Macro,Times of India Business,"RBI rejects bids for treasury bills, move signals lower rates","The RBI rejected bids for longer-term treasury bills, signaling discomfort with rising short-term yields ahead of its monetary policy decision. This move, aimed at softening interest rates, comes as the MPC meets to decide on rates, with a pause widely expected. Yields on government bonds subsequent",https://timesofindia.indiatimes.com/business/india-business/rbi-rejects-bids-for-treasury-bills-move-signals-lower-rates/articleshow/131492057.cms,"04 Jun 2026, 02:14"
Strategic Signals,Hindustan Times India,"'Want him to sacrifice life, but...': Ex-officer backs Army captain amid row over proposal",A newly commissioned Army captain's proposal to his girlfriend after a passing-out parade ceremony has gone viral and drawn mixed reactions.,https://www.hindustantimes.com/india-news/want-him-to-sacrifice-life-ex-officer-lt-gen-kjs-dhillon-backs-army-captain-bharat-bhardwaj-row-proposal-arushi-101780559512341.html,"04 Jun 2026, 14:11"
Geopolitics,Hindustan Times India,‘Consequence of corrupt system’: NEET aspirant's suicide ahead of re-exam sparks Opposition fury,Rahul blamed the Centre for the aspirant's death and said it was a consequence of a corrupt and broken system being run under Prime Minister Narendra Modi.,https://www.hindustantimes.com/india-news/consequence-of-corrupt-system-under-modiji-rahul-gandhi-arvind-kejriwal-attack-centre-after-neet-aspirants-suicide-101780557200673.html,"04 Jun 2026, 13:46"
Strategic Signals,Hindustan Times India,List of places Monsoon has covered so far and where it is headed next,"Along with Kerala, the monsoon has advanced across several parts of the Arabian Sea and the Bay of Bengal and is expected to expand further.",https://www.hindustantimes.com/india-news/list-of-places-monsoon-has-covered-so-far-and-where-it-is-headed-next-101780558999156.html,"04 Jun 2026, 13:46"
Policy & Regulation,Hindustan Times India,Delhi govt to scrap B&B scheme after Malviya Nagar fire: ‘All establishments to be checked’,Tourism Minister Kapil Mishra said the government would formally withdraw the scheme and take action against operators violating licence conditions.,https://www.hindustantimes.com/india-news/delhi-govt-to-scrap-b-b-scheme-after-malviya-nagar-fire-all-establishments-to-be-checked-101780554686959.html,"04 Jun 2026, 13:11"
Strategic Signals,Hindustan Times India,Heatwave conditions to intensify in parts of Andhra Pradesh,Heatwave conditions to intensify in parts of Andhra Pradesh,https://www.hindustantimes.com/india-news/heatwave-conditions-to-intensify-in-parts-of-andhra-pradesh-101780557883932.html,"04 Jun 2026, 12:54"
Geopolitics,Hindustan Times India,Terms of Trade: India’s democracy needs a bonfire of the alibis,"It is not democracy which has failed the TMC, it is the TMC which has failed democracy in West Bengal",https://www.hindustantimes.com/india-news/terms-of-trade-india-s-democracy-needs-a-bonfire-of-the-alibis-101780557675170.html,"04 Jun 2026, 12:51"
Strategic Signals,Hindustan Times India,"Congress stands by BK Hariprasad; Karnataka CM to decide portfolios, says minister Priyank Kharge","Karnataka Minister Priyank Kharge said that the Congress party stands by leader BK Hariprasad, and that the Chief Minister will decide on cabinet portfolios.",https://www.hindustantimes.com/india-news/congress-stands-by-bk-hariprasad-karnataka-cm-to-decide-portfolios-says-minister-priyank-kharge-101780552770454.html,"04 Jun 2026, 12:47"
Strategic Signals,Hindustan Times India,Bengal minister backs NIA action against ex-Trinamool MLA Saokat Molla,An NIA team on Thursday carried out search and questioning operations at the residence of former Trinamool Congress (TMC) MLA Saokat Molla.,https://www.hindustantimes.com/india-news/bengal-minister-backs-nia-action-against-ex-trinamool-mla-saokat-molla-101780552527164.html,"04 Jun 2026, 12:46"
Geopolitics,Indian Express Latest,Donald Trump’s new definition of ‘ceasefire’ amid latest Iran flare-up,,https://indianexpress.com/article/world/donald-trump-iran-ceasefire-middle-east-truce-10723198/,"04 Jun 2026, 09:04"
Strategic Signals,Indian Express Latest,At least 11 killed in massive fire at elderly care home in Sri Lanka,,https://indianexpress.com/article/world/fire-elderly-care-home-sri-lanka-killed-injured-10723563/,"04 Jun 2026, 09:03"
Geopolitics,Indian Express Latest,Palak Tiwari’s workout hack is to ‘clock’ 10K steps daily: ‘I don’t sleep until…’,,https://indianexpress.com/article/lifestyle/fitness/palak-tiwari-workout-10k-steps-everyday-sleep-expert-10697477/,"04 Jun 2026, 09:00"
Strategic Signals,Indian Express Latest,Content creation vs legal etiquette: Kerala High Court cracks down on reels by lawyers,,https://indianexpress.com/article/legal-news/content-creation-legal-etiquette-kerala-high-court-cracks-on-reels-lawyers-10723690/,"04 Jun 2026, 08:52"
Strategic Signals,Indian Express Latest,Pahlaj Nihalani launched Govinda despite not ‘liking his face’: ‘I hired him for his dance’,,https://indianexpress.com/article/entertainment/bollywood/pahlaj-nihalani-cast-govinda-not-liking-his-face-hired-for-his-dance-10723639/,"04 Jun 2026, 08:50"
Strategic Signals,Indian Express Latest,"In an era of wedding aesthetics and algorithms, the missing conversation is dowry",,https://indianexpress.com/article/opinion/columns/wedding-aesthetics-algorithms-missing-conversation-is-dowry-10723696/,"04 Jun 2026, 08:49"
Strategic Signals,Indian Express Latest,Why court refused to clear Madurai cop over Rs 1.45 crore counterfeit notes at abandoned quarters,,https://indianexpress.com/article/legal-news/court-refused-clear-madurai-cop-rs-1-45-crore-counterfeit-notes-10723429/,"04 Jun 2026, 08:48"
Strategic Signals,Indian Express Latest,Cab driver killed after BEST bus crashes into parked vehicle in Mumbai’s Malad East,,https://indianexpress.com/article/cities/mumbai/mumbai-malad-east-best-bus-accident-ola-cab-driver-killed-wet-lease-safety-10723632/,"04 Jun 2026, 08:45"
Strategic Signals,SCMP Asia,World champion swimmer Siobhan Haughey reflects on life outside the pool,"Siobhan Haughey, one of Hong Kong’s most successful athletes with four Olympic swimming medals, has her sights set on more success in the pool at this September’s Asian Games in Nagoya and Aichi prefecture in Japan. The 28 year-old, who won silver medals in both the women’s 100m and 200m freestyle a",https://www.scmp.com/native/business/topics/planning-fulfilling-future/article/3354458/world-champion-swimmer-siobhan-haughey-reflects-life-outside-pool?utm_source=rss_feed,"04 Jun 2026, 08:17"
Geopolitics,SCMP Asia,More US firms turn to China’s DeepSeek over pricey Silicon Valley AI,"Chinese artificial intelligence start-up DeepSeek took the top spot on a major US business spending index in June, surging as more companies swap out expensive American options like OpenAI and Anthropic in favour of more affordable alternatives. According to a “trending software vendors” list from N",https://www.scmp.com/tech/tech-trends/article/3355927/more-us-firms-turn-chinas-deepseek-over-pricey-silicon-valley-ai?utm_source=rss_feed,"04 Jun 2026, 07:00"
Markets & Macro,SCMP Asia,"IPOs, expansion plans give China’s US$16 billion pet food sector paws for thought","Home-grown and foreign pet business operators are bullish on China’s booming pet market this year, eyeing initial public offerings and localising supply chains, fuelled by young consumers’ growing interest in their animals’ health and wellness. Fubei, a major domestic pet food maker based in Shangha",https://www.scmp.com/business/article/3355902/ipos-and-expansion-plans-give-chinas-us16-billion-pet-food-sector-paws-thought?utm_source=rss_feed,"04 Jun 2026, 04:05"
Markets & Macro,SCMP Asia,Why China’s tighter grip on outbound capital may test Hong Kong’s housing rebound,"Beijing’s latest efforts to tighten oversight of cross-border capital flows have sparked concerns that a reduction in mainland demand for Hong Kong homes could impact the city’s recovering property market. The debate follows a series of measures unveiled in recent weeks, including tighter scrutiny o",https://www.scmp.com/property/article/3355863/why-chinas-tighter-grip-outbound-capital-may-test-hong-kongs-housing-rebound?utm_source=rss_feed,"03 Jun 2026, 23:00"
Strategic Signals,SCMP Asia,Growth Conversation: Chris Kyme on the local pioneers of the HK advertising industry,"A favourite topic which often comes up in conversations with advertising friends concerns the history, emergence and creative heyday of the industry in Hong Kong. A story I usually speak about with some authority, seeing as I have been privileged enough to play a part in it over the years, as well a",https://www.scmp.com/presented/business/topics/remarketing/article/3355640/growth-conversation-chris-kyme-local-pioneers-hk-advertising-industry?utm_source=rss_feed,"03 Jun 2026, 16:00"
Geopolitics,SCMP Asia,China’s fund managers face new rules to curb risky investment strategies,"With mutual fund companies having to adhere to investment mandates as part of the regulatory revamp of the 40 trillion yuan (US$5.9 trillion) industry, Chinese money managers may find it difficult to improve fund performance. China Asset Management and E Fund Management, the industry’s biggest playe",https://www.scmp.com/business/china-business/article/3355830/chinas-fund-managers-face-new-rules-curb-risky-investment-strategies?utm_source=rss_feed,"03 Jun 2026, 09:30"
Geopolitics,SCMP Asia,Jiangsu 11.5b yuan brokerage merger marks new phase of consolidation,"China’s second-largest provincial economy is accelerating the integration of its financial sector, with a proposed merger between two state-owned brokerages in Jiangsu highlighting a new phase of regional consolidation. In a filing on Tuesday, Shanghai-listed Soochow Securities disclosed plans to ac",https://www.scmp.com/business/banking-finance/article/3355809/jiangsu-115b-yuan-brokerage-merger-marks-new-phase-consolidation?utm_source=rss_feed,"03 Jun 2026, 08:30"
Geopolitics,SCMP Asia,"Tesla’s China sales surge to 2026 high, but rivals crowd the rear-view mirror","Tesla’s Shanghai Gigafactory recorded its strongest monthly deliveries of the year in May as a broader recovery in China’s electric vehicle market gathered pace, although the US carmaker is likely to face intensifying competition from domestic rivals launching a wave of new models. The factory in Sh",https://www.scmp.com/business/china-business/article/3355810/teslas-china-sales-surge-2026-high-rivals-crowd-rear-view-mirror?utm_source=rss_feed,"03 Jun 2026, 08:05"
Energy & Infrastructure,Foreign Policy,The Threat of Unrest Is Decarbonizing the Global South,Oil and gas price spikes are doing what decades of climate diplomacy struggled to achieve.,https://foreignpolicy.com/2026/06/04/iran-war-decarbonizing-global-south/,"04 Jun 2026, 04:17"
Strategic Signals,Foreign Policy,The Afghanistan-Pakistan Border Is Still Unstable,"There is a brief lull in violence, but the root causes of the conflict haven’t been addressed.",https://foreignpolicy.com/2026/06/03/afghanistan-pakistan-border-violence-pause-taliban-ttp/,"03 Jun 2026, 23:03"
Strategic Signals,Foreign Policy,India’s Cockroach Movement Gains Momentum,A satirical political party has tapped into the discontent among unemployed youth.,https://foreignpolicy.com/2026/06/03/india-cockroach-janta-party-youth-unemployment-protest/,"03 Jun 2026, 20:39"
Geopolitics,Foreign Policy,Iran Launches Deadly Attack on Kuwait’s Main Airport,Experts warn that continued strikes could jeopardize peace talks.,https://foreignpolicy.com/2026/06/03/iran-attack-kuwait-airport-us-war-cease-fire-talks-oecd/,"03 Jun 2026, 20:38"
Strategic Signals,Foreign Policy,What to Know About Ethiopia’s Election,Abiy’s all-but-certain victory threatens to destabilize the African nation.,https://foreignpolicy.com/2026/06/03/ethiopia-election-abiy-ahmed-tigray-eritrea/,"03 Jun 2026, 19:46"
Strategic Signals,Foreign Policy,Why Is Trump Targeting Brazilian Gangs?,The U.S. designation of two Brazilian crime groups as terrorist organizations scrambles already tense bilateral relations.,https://foreignpolicy.com/2026/06/03/us-brazil-gangs-first-command-capital-red-fto/,"03 Jun 2026, 19:33"
Geopolitics,Foreign Policy,The New Weapon Behind Ukraine’s Battlefield Success,Mid-range drones that can hit targets almost 100 miles behind Russian lines have changed the game.,https://foreignpolicy.com/2026/06/03/ukraine-mid-range-drones-russia-war-success/,"03 Jun 2026, 17:42"
Energy & Infrastructure,Foreign Policy,Congress Prepares for a Pair of Consequential Iran Votes,Tehran may feel empowered to wait out U.S. demands for concessions in face of war-weary American public.,https://foreignpolicy.com/2026/06/03/congress-iran-war-powers-house-vote-concurrent-resolution-trump/,"03 Jun 2026, 16:28"
Strategic Signals,The Diplomat,Nature and Concrete: The Eco-Brutalist Resistance in Central Asia,"Eco-brutalism is an aesthetic appeal to a healthier, greener future, and one that can be built atop existing realities.",https://thediplomat.com/2026/06/nature-and-concrete-the-eco-brutalist-resistance-in-central-asia/,"04 Jun 2026, 02:06"
Strategic Signals,The Diplomat,Uzbekistan’s New Migration Destination? America.,"From irregular border crossings to bilateral training agreements, Uzbekistan is working to carve out a formal pathway to U.S. employment.",https://thediplomat.com/2026/06/uzbekistans-new-migration-destination-america/,"04 Jun 2026, 01:58"
