section,source,title,summary,link,published_at
Geopolitics,The Diplomat,"China and Maritime Chokepoints: Hormuz, Malacca, and Indo-Pacific Vulnerability","Disruptions in Hormuz immediately generate concern regarding Malacca, another vital maritime chokepoint.",https://thediplomat.com/2026/05/china-and-maritime-chokepoints-hormuz-malacca-and-indo-pacific-vulnerability/,"29 May 2026, 21:48"
Strategic Signals,The Diplomat,Strategic Implications of Myanmar’s Offensive in Chin State,"The Tatmadaw’s advances will have implications not only for Myanmar’s internal conflict, but for neighboring India and Bangladesh.",https://thediplomat.com/2026/05/strategic-implications-of-myanmars-offensive-in-chin-state/,"29 May 2026, 21:17"
Geopolitics,War on the Rocks,How America Lost Its Most Important Defense Tech Habit,"On April 15, technology podcaster Dwarkesh Patel published a two-hour interview with Nvidia CEO Jensen Huang. For roughly forty minutes, Patel asked one question six different ways. The question was this: If American-made compute trains AI models with the serious cyber-offensive capabilities Anthrop",https://warontherocks.com/cogs-of-war/how-america-lost-its-most-important-defense-tech-habit/,"29 May 2026, 08:00"
Geopolitics,War on the Rocks,Contriving Imaginary Gaps in Nuclear Deterrence,"Among some nuclear strategists, military officers, and lawmakers, a belief bordering on the canonical has taken root that the United States is on the short end of a “deterrence gap” with Russia and China. Both countries, and especially Russia, possess theater-range nuclear weapons, whose comparative",https://warontherocks.com/contriving-imaginary-gaps-in-nuclear-deterrence/,"29 May 2026, 07:30"
Energy & Infrastructure,War on the Rocks,Glass Jaw? The New Economic Fragility Recasting American Power,"A pair of children’s shoes is an odd place to look for the changing dynamics of American power. But stick with me because, after the past year, it is one of the clearest places to see them.Long before those shoes reach a store shelf, tariffs have raised the cost of materials, components, and importa",https://warontherocks.com/glass-jaw-the-new-economic-fragility-recasting-american-power/,"29 May 2026, 07:15"
Geopolitics,War on the Rocks,"Hollow Deals, Tricky Negotiations, and State Visits","Welcome to The Adversarial. Every other week, we’ll provide you with expert analysis on America’s greatest challengers: China, Russia, Iran, North Korea, and jihadists. Read more below.***IranThere has been increasing chatter that Washington and Tehran are nearing an agreement that might wind down t",https://warontherocks.com/hollow-deals-tricky-negotiations-and-state-visits/,"28 May 2026, 18:30"
Geopolitics,War on the Rocks,What Would Relations with Post-War Russia Look Like?,"Rose Gottemoeller joined Ryan in Washington. They discussed how the West might think about relations with Russia once the war with Ukraine ends, as well as nuclear diplomacy and other critical issues. Gottemoeller was the deputy secretary general of NATO and, before that, served as a senior State De",https://warontherocks.com/what-would-relations-with-post-war-russia-look-like/,"28 May 2026, 16:00"
Geopolitics,War on the Rocks,Control Without Ownership: How China’s Party-Business Networks Dominate Indonesia’s Mineral Supply Chains,"In 2024, when Jiangsu Delong, the world’s second-largest stainless-steel producer, filed for bankruptcy, several Chinese firms and state-owned enterprises quietly absorbed its Indonesian assets. Among them was China First Heavy Industries, a state-owned enterprise founded in 1954 as one of China’s e",https://warontherocks.com/cogs-of-war/control-without-ownership-how-chinas-party-business-networks-dominate-indonesias-mineral-supply-chains/,"28 May 2026, 08:00"
Strategic Signals,War on the Rocks,A Sea Control Revolution?,"Sea control has changed. In recent years, there has been a quiet revolution in maritime strategy that has seen navies increasingly expected to exert greater levels of control over more of the world’s oceans, more of the time. Whether it is NATO forces protecting critical maritime infrastructure in t",https://warontherocks.com/a-sea-control-revolution/,"28 May 2026, 07:30"
Policy & Regulation,War on the Rocks,What Everyone is Missing About North Korea’s Reunification Strategy,"When news broke that North Korea had revised its constitution, analysts in the West and across the Korean Peninsula rushed to declare it the formal death of Korean reunification as a policy objective. The changes were hard to ignore. Pyongyang stripped all references to a unified Korean nation, codi",https://warontherocks.com/what-everyone-is-missing-about-north-koreas-reunification-strategy/,"28 May 2026, 07:15"
Policy & Regulation,CSIS,The Bio-Pharma Industry and Society,"The Bio-Pharma Industry and Society Listing Summary Please join the CSIS Global Health Policy Center on March 17, from 10:00am – 11:30am, for an exploration of how private bio-pharmaceutical firms can better support the critically important societal goals of improved affordability, access, quality, ",https://www.csis.org/events/bio-pharma-industry-and-society,"03 Mar 2016, 20:36"
Policy & Regulation,CSIS,The FY2017 Defense Budget and Strategic Outlook,"The FY2017 Defense Budget and Strategic Outlook Listing Summary Please join the CSIS International Security Program for a half-day Defense360 conference on the recently released FY2017 defense budget request and strategic priorities. Drupal Admin Mon, 02/29/2016 - 13:48 Featured Image Image Contribu",https://www.csis.org/events/fy2017-defense-budget-and-strategic-outlook,"29 Feb 2016, 18:48"
Policy & Regulation,CSIS,2016 U.S.-Japan Security Seminar,"2016 U.S.-Japan Security Seminar Listing Summary Michael J. Green interviews JIIA President Yoshiji Nogami Drupal Admin Fri, 02/26/2016 - 12:54 Featured Image Image Contributors Michael J. Green Programs & Projects Japan Chair Parent Geopolitics and Foreign Policy Featured Image AdobeStock_179685887",https://www.csis.org/events/2016-us-japan-security-seminar,"26 Feb 2016, 17:54"
Energy & Infrastructure,CSIS,The Future of the Grid—A View from ARPA-E,"The Future of the Grid—A View from ARPA-E Listing Summary The CSIS Energy and National Security Program is pleased to invite you to a discussion with Ellen Williams, Director of ARPA-E, the Advanced Research Projects Agency-Energy. Drupal Admin Thu, 02/25/2016 - 14:15 Featured Image Image Contributo",https://www.csis.org/events/future-grid-view-arpa-e,"25 Feb 2016, 19:15"
Geopolitics,CSIS,"Statesmen's Forum: Wang Yi, Minister of Foreign Affairs, PRC","Statesmen's Forum: Wang Yi, Minister of Foreign Affairs, PRC Listing Summary Please watch the live webcast of a discussion on Chinese foreign policy and US-China Relations Drupal Admin Fri, 02/19/2016 - 17:13 Featured Image Image Contributors John J. Hamre Christopher K. Johnson Downloads Download T",https://www.csis.org/events/statesmens-forum-wang-yi-minister-foreign-affairs-prc,"19 Feb 2016, 22:13"
Geopolitics,CSIS,"China Reality Check: China's ""Internet Sovereignty"" Initiative: Origins and Consequences","China Reality Check: China's ""Internet Sovereignty"" Initiative: Origins and Consequences Listing Summary Please join us for a discussion on China’s initiative to promote Internet sovereignty as a key governing concept of the global Internet. Drupal Admin Tue, 02/16/2016 - 11:49 Featured Image Image ",https://www.csis.org/events/china-reality-check-chinas-internet-sovereignty-initiative-origins-and-consequences,"16 Feb 2016, 16:49"
Policy & Regulation,CSIS,"Statesmen's Forum: The Right Honourable Theresa May, MP, Home Secretary, United Kingdom","Statesmen's Forum: The Right Honourable Theresa May, MP, Home Secretary, United Kingdom Listing Summary Please join the CSIS International Security Program for a discussion with UK Home Secretary Theresa May on counter-terrorism policy. Drupal Admin Fri, 02/12/2016 - 16:08 Featured Image Image Contr",https://www.csis.org/events/statesmens-forum-right-honourable-theresa-may-mp-home-secretary-united-kingdom,"12 Feb 2016, 21:08"
Strategic Signals,CSIS,Strategic Opportunities in the Indo-Asia-Pacific with Admiral Harry B. Harris,"Strategic Opportunities in the Indo-Asia-Pacific with Admiral Harry B. Harris Listing Summary Please join us for a discussion with Admiral Harry B. Harris, Commander, U.S. Pacific Command, on the Strategic Opportunities in the Indo-Asia-Pacific. Drupal Admin Tue, 01/26/2016 - 11:20 Featured Image Im",https://www.csis.org/events/strategic-opportunities-indo-asia-pacific-admiral-harry-b-harris,"26 Jan 2016, 16:20"
Energy & Infrastructure,Al Jazeera,Police fire tear gas during protest outside New Jersey ICE facility,Police fired tear gas and used horses to push back protesters outside the Delaney Hall immigration detention facility.,https://www.aljazeera.com/video/newsfeed/2026/5/30/police-fire-tear-gas-during-protest-outside-new-jersey-ice-facility?traffic_source=rss,"30 May 2026, 09:28"
Strategic Signals,Al Jazeera,Officer accuses disabled driver of holding phone with missing hand,A traffic stop in Florida has gone viral after an officer accused a disabled driver of holding a phone in her right hand,https://www.aljazeera.com/video/newsfeed/2026/5/30/officer-accuses-disabled-driver-of-holding-phone-with-missing-hand?traffic_source=rss,"30 May 2026, 09:11"
Energy & Infrastructure,Al Jazeera,"Ukraine drones strike Russian oil facility, as Kyiv and Moscow trade blows","Strikes have seen 13,000 residents without power in Zaporizhzhia as Russia and Ukraine trade drone attacks.",https://www.aljazeera.com/news/2026/5/30/ukraine-drones-strike-russian-oil-facility-as-kyiv-and-moscow-trade-blows?traffic_source=rss,"30 May 2026, 08:54"
Strategic Signals,Al Jazeera,"Voting ongoing in snap elections in Malta, governing party expected to win","Malta's economy to dominate this year’s election, with rising rents and infrastructure at the forefront of debates.",https://www.aljazeera.com/news/2026/5/30/voting-ongoing-in-snap-elections-in-malta-governing-party-expected-to-win?traffic_source=rss,"30 May 2026, 08:22"
Strategic Signals,Al Jazeera,"Senegal’s World Cup 2026 team preview: Players to watch, group, squad list",Senegal arrive for their third consecutive World Cup as arguably the best side in Africa - and aim to lift the trophy.,https://www.aljazeera.com/sports/2026/5/30/senegals-world-cup-2026-team-preview-players-to-watch-group-squad-list?traffic_source=rss,"30 May 2026, 08:05"
Geopolitics,Al Jazeera,Iran war: What is happening on day 92 as Trump weighs Iran deal,Trump weighs next steps on Iran deal as Tehran insists negotiations are continuing and no final agreement exists.,https://www.aljazeera.com/news/2026/5/30/iran-war-what-is-happening-on-day-92-as-trump-weighs-iran-deal?traffic_source=rss,"30 May 2026, 07:30"
Energy & Infrastructure,Al Jazeera,"Satire, social media and India’s Gen Z revolt",A satirical online movement challenges power and propaganda in India.,https://www.aljazeera.com/video/the-listening-post/2026/5/30/satire-social-media-and-indias-gen-z-revolt?traffic_source=rss,"30 May 2026, 07:05"
Strategic Signals,Al Jazeera,Barcelona sign England winger Anthony Gordon from Newcastle,"Gordon netted 17 goals for Newcastle in all competitions this season, including 10 in 12 Champions League games.",https://www.aljazeera.com/sports/2026/5/30/barcelona-sign-england-winger-anthony-gordon-from-newcastle?traffic_source=rss,"30 May 2026, 06:52"
Strategic Signals,ETCFO Top Stories,Govt amends CSR norms; provides more leeway for companies,Companies can now invest up to ten percent of their Corporate Social Responsibility funds into special instruments. These instruments are called zero coupon zero principal instruments. They are issued by not-for-profit organizations. This investment will happen through a Social Stock Exchange. This ,https://cfo.economictimes.indiatimes.com/news/governance-risk-compliance/govt-amends-csr-norms-provides-more-leeway-for-companies/131403729,"30 May 2026, 09:44"
Geopolitics,ETCFO Top Stories,India’s Emerging Businesses Thrive on Rising Consumption,"As the world moves forward and digital ecosystems grow rapidly, consumption habits are changing dramatically. Quick snacks, coffees, medicines, gifts, groceries and even fashion are available almost instantly as delivery riders steer through crowded lanes to fulfil impulse demand.",https://cfo.economictimes.indiatimes.com/news/economy/indias-consumption-shift-navigating-opportunities-and-risks/131381198,"29 May 2026, 08:57"
Geopolitics,ETCFO Top Stories,Supreme Court upholds retrospective GST on online gaming; experts warn of Rs 1 lakh crore ‘balance sheet event’,Apex court validates 28% GST levy on real money gaming platforms; tax experts say ruling could trigger massive financial and regulatory reset for industry.,https://cfo.economictimes.indiatimes.com/news/tax-legal-accounting/supreme-court-rules-on-retrospective-gst-for-online-gaming-industry-faces-major-tax-hit/131362756,"28 May 2026, 09:44"
Geopolitics,ETCFO Top Stories,Greenwashing in ESG reporting in India : with impunity and without accountability,"Can India’s ESG regime remain credible if companies disclose sustainability claims without verifiable data or accountability? Seasoned finance expert Ashok Haldia warns that despite near-total compliance under the Business Responsibility and Sustainability Reporting framework, weak enforcement, poor",https://cfo.economictimes.indiatimes.com/news/esg/unveiling-greenwashing-in-indias-esg-reporting-a-call-for-accountability/131362846,"28 May 2026, 10:05"
Markets & Macro,ETCFO Top Stories,"AI, purpose-led careers and salary pressures redefine India’s finance workforce: ACCA","81% of finance professionals aspire for social-impact roles while AI adoption surges amid rising inflation concerns, says ACCA India Talent Trends 2026 report.",https://cfo.economictimes.indiatimes.com/news/tax-legal-accounting/ai-transforming-career-aspirations-in-indias-finance-sector-acca-report/131345596,"27 May 2026, 14:35"
Strategic Signals,ETCFO Top Stories,"Allcargo Logistics targets ₹3,000 cr revenue by FY30, CFO bets on pricing and service quality","Allcargo Logistics aims for over ₹3,000 crore revenue by FY30, driven by service quality and disciplined pricing, said CFO Deepak Pareek. Pareek also spoke on how the company is navigating fuel cost volatility, the pricing actions built into FY27 assumptions, segment-wise growth outlook within consu",https://cfo.economictimes.indiatimes.com/news/strategy-operations/allcargo-logistics-aims-for-3000-crore-revenue-by-fy30-through-enhanced-pricing-and-service-quality/131337208,"27 May 2026, 07:00"
Geopolitics,ETCFO Top Stories,BJP CA Cell writes to Centre as delay in 57th GST Council meet keeps key reforms pending,"Haryana BJP CA Cell seeks relief on legacy GST disputes, refund bottlenecks and procedural lapses; experts warn prolonged gap in GST Council meetings is delaying critical reforms and increasing compliance uncertainty for businesses.",https://cfo.economictimes.indiatimes.com/news/tax-legal-accounting/urgent-call-for-gst-council-meeting-bjp-ca-cell-pressures-centre-for-tax-reforms/131305782,"25 May 2026, 14:55"
Markets & Macro,ETCFO Top Stories,Indian firms opt for confidential IPO route amid West Asia-led market volatility,"Rising geopolitical tensions, volatile equity markets and weak investor sentiment are pushing more companies towards SEBI’s confidential filing route, allowing them to keep listing plans flexible while protecting sensitive business information.",https://cfo.economictimes.indiatimes.com/news/corporate-finance/rising-trend-indian-firms-embrace-confidential-ipos-amid-global-market-turbulence/131320928,"26 May 2026, 09:00"
Policy & Regulation,ETCFO Policy,PLI 2.0: India bets big on making more of the smartphone at home,India is updating its mobile phone production incentive scheme. The new plan targets over 55% domestic value addition. It will also link with component manufacturing schemes. This aims to boost local sourcing of crucial parts. The government wants to reduce reliance on imports for high-value compone,https://cfo.economictimes.indiatimes.com/news/policy/indias-ambitious-pli-20-boosting-local-smartphone-manufacturing/131381599,"29 May 2026, 09:32"
Markets & Macro,ETCFO Policy,RBI panel to evaluate impact of quantum tech in finance,"The Reserve Bank of India has formed an eight-member committee to explore quantum technology's role in finance. Headed by an IIT Madras professor, the panel will assess opportunities, risks, and challenges. It will also review the financial sector's readiness for quantum-related threats. The committ",https://cfo.economictimes.indiatimes.com/news/policy/rbi-panel-to-evaluate-impact-of-quantum-tech-in-finance/131340879,"27 May 2026, 08:55"
Geopolitics,ETCFO Policy,"Trump says any Iran deal will involve 'no cash', differ from Obama-era agreement","Donald Trump outlined his vision for a future Iran deal. He emphasized no financial concessions would be made, contrasting it with the Obama administration's agreement. Trump asserted his proposed deal would prevent Iran from acquiring nuclear weapons. Senator Lindsey Graham supported Trump's strate",https://cfo.economictimes.indiatimes.com/news/policy/trump-promises-new-iran-deal-without-cash-critiques-obama-agreement/131300168,"25 May 2026, 09:05"
Markets & Macro,ETCFO Policy,RBI MPC: Bank economists back a rate hike in H2 of FY27,Bank economists have advised the Reserve Bank of India that interest rate increases will be necessary later this financial year. This is to manage the effects of the West Asia conflict and ensure economic stability. Most economists do not expect a rate hike in the upcoming June policy meeting.,https://cfo.economictimes.indiatimes.com/news/policy/rbi-mpc-bank-economists-back-a-rate-hike-in-h2-of-fy27/131271435,"23 May 2026, 08:39"
Geopolitics,ETCFO Policy,"""Confident"" US-India trade deal will be finalised in ""coming weeks"": Ambassador Gor","A pivotal trade agreement between India and the United States is soon to be concluded, promising a new chapter in their bilateral relations. US Ambassador Sergio Gor is confident that we will see a resolution in the upcoming weeks. High-ranking officials from both sides are preparing to engage in di",https://cfo.economictimes.indiatimes.com/news/policy/confident-us-india-trade-deal-will-be-finalised-in-coming-weeks-ambassador-gor/131248149,"21 May 2026, 19:47"
Geopolitics,ETCFO Policy,"PM Modi, Italy's Meloni script new chapter with ‘Special Strategic Partnership’; push defence, trade cooperation","India and Italy have elevated their relationship to a Special Strategic Partnership. Prime Minister Narendra Modi and Italian Prime Minister Giorgia Meloni announced a roadmap for cooperation. This includes defence, innovation, manufacturing, logistics, and maritime sectors. The leaders emphasized g",https://cfo.economictimes.indiatimes.com/news/policy/pm-modi-italys-meloni-script-new-chapter-with-special-strategic-partnership-push-defence-trade-cooperation/131238924,"21 May 2026, 08:42"
Energy & Infrastructure,ETCFO Policy,"As India's R&D faces funding & talent crunch, Niti panel suggests 50+ fixes",India's research and development spending lags behind global leaders. A Niti Aayog report highlights funding issues and bureaucratic delays. The report suggests increasing R&D investment to 2% of GDP. It also calls for streamlining processes and boosting manpower. Reforms aim to enhance India's rese,https://cfo.economictimes.indiatimes.com/news/policy/as-indias-rd-faces-funding-talent-crunch-niti-panel-suggests-50-fixes/131238905,"21 May 2026, 08:40"
Geopolitics,ETCFO Policy,"China's new supply chain curbs threaten India's electronics hub ambitions, industry seeks relief",New Chinese regulations are impacting India's goal to become a global electronics manufacturing center. These curbs aim to control supply chains and can lead to penalties for companies shifting production. India's electronics industry is seeking urgent government help. The measures could affect supp,https://cfo.economictimes.indiatimes.com/news/policy/chinas-new-supply-chain-curbs-threaten-indias-electronics-hub-ambitions-industry-seeks-relief/131238873,"21 May 2026, 08:37"
