section,source,title,summary,link,published_at
Energy & Infrastructure,The Diplomat,Is Japan a Model Middle Power?,"Japan has earned rising acclaim from U.S. observers as a middle power that complements, rather than threatens, the United States. Yet Japan is not deepening its ties with Washington out of charity.",https://thediplomat.com/2026/07/is-japan-a-model-middle-power/,"01 Jul 2026, 21:38"
Geopolitics,War on the Rocks,"From Shin Bet to Mossad, Netanyahu Reshapes Israeli Intelligence","Editor’s Note: Rewind and Reconnoiter is one of our weekly members-only newsletters. To access the full archive of Rewind and Reconnoiter as well as our other members-only content, including podcasts, newsletters, and exclusive access to the War on the Rocks app, sign up using the link in the graphi",https://warontherocks.com/from-shin-bet-to-mossad-netanyahu-reshapes-israeli-intelligence/,"01 Jul 2026, 17:30"
Strategic Signals,War on the Rocks,How a Team of Marines Built the Corps’ FPV Drone Training Program from a Cold Start,"Last fall, the U.S. Marine Corps had virtually no first-person view attack drones. That’s changed quickly. This episode is about how a team of marines at Weapons Training Battalion at Quantico went from a cold start to building a Marine Corps-wide first-person view drone training system. Ryan was pl",https://warontherocks.com/how-a-team-of-marines-built-the-corps-fpv-drone-training-program-from-a-cold-start/,"01 Jul 2026, 15:15"
Strategic Signals,War on the Rocks,"Trojan Spirit, the Army’s Intelligence Backbone, Needs a Successor","In 1990, the idea that deployed commanders could access the latest intelligence from three-letter agencies in the middle of nowhere was radical. But the Army was starting to make this idea real through a program called Trojan Spirit, so they could address a major strategic barrier: There were too ma",https://warontherocks.com/cogs-of-war/trojan-spirit-the-armys-intelligence-backbone-needs-a-successor/,"01 Jul 2026, 08:00"
Strategic Signals,War on the Rocks,The Hizballah Predicament: Why An Integrated Approach Is Necessary,"What can leaders do about a transnational organization that is a militia, a political party, a social services network, and a smuggling operation at the same time — and one that has resisted various dialogues and survived repeated attacks?American, Lebanese, and other leaders should recognize Hizbal",https://warontherocks.com/the-hizballah-predicament-why-an-integrated-approach-is-necessary/,"01 Jul 2026, 07:30"
Geopolitics,War on the Rocks,"The Three Nevers: To Invade Taiwan, China Would Have to Make Military History Thrice","The amphibious invasion of Normandy on June 6, 1944, remains the largest and most complex amphibious operation in history. On the first day alone, Allied forces landed eight divisions, including five amphibious assault and three airborne, totaling roughly 160,000 personnel. That force more than doub",https://warontherocks.com/the-three-nevers-to-invade-taiwan-china-would-have-to-make-military-history-thrice/,"01 Jul 2026, 07:15"
Geopolitics,War on the Rocks,The Shifting Fortunes of the Kurds,"The Kurds’ fortunes have ebbed and flowed in recent years, but the fall of the Assad regime in Syria in December 2024, the 2025 decision by the Kurdistan Workers’ Party (PKK) to dissolve and engage in talks with the Turkish government, and the 2026 U.S.-Israeli war with Iran had enormous ripple effe",https://warontherocks.com/the-shifting-fortunes-of-the-kurds/,"30 Jun 2026, 17:45"
Geopolitics,War on the Rocks,Mapping America’s Domestic Drone Supply Chain,"The extent of China’s drone dominance — and how to decouple from it — has long been a source of debate and anxiety in Washington. Last month, the Wall Street Journal reignited controversy by publishing a visual analysis of military quadcopter components, exploring China’s advantages in parts manufac",https://warontherocks.com/cogs-of-war/at-a-glance-american-quadcopter-component-manufacturing/,"30 Jun 2026, 08:00"
Geopolitics,War on the Rocks,Lost in Translation: How A Premier Chinese Think Tank Views U.S.-Chinese Competition,"On May 13, 2026, Air Force One landed in Beijing for President Donald Trump’s first state visit to China in nearly a decade. That same morning, the China Institutes of Contemporary International Relations published a report titled The Evolving World and the Right Way to China-US Coexistence. The sum",https://warontherocks.com/lost-in-translation-how-a-premier-chinese-think-tank-views-u-s-chinese-competition/,"30 Jun 2026, 07:30"
Policy & Regulation,CSIS,The Bio-Pharma Industry and Society,"The Bio-Pharma Industry and Society Listing Summary Please join the CSIS Global Health Policy Center on March 17, from 10:00am – 11:30am, for an exploration of how private bio-pharmaceutical firms can better support the critically important societal goals of improved affordability, access, quality, ",https://www.csis.org/events/bio-pharma-industry-and-society,"03 Mar 2016, 20:36"
Policy & Regulation,CSIS,The FY2017 Defense Budget and Strategic Outlook,"The FY2017 Defense Budget and Strategic Outlook Listing Summary Please join the CSIS International Security Program for a half-day Defense360 conference on the recently released FY2017 defense budget request and strategic priorities. Drupal Admin Mon, 02/29/2016 - 13:48 Featured Image Image Contribu",https://www.csis.org/events/fy2017-defense-budget-and-strategic-outlook,"29 Feb 2016, 18:48"
Policy & Regulation,CSIS,2016 U.S.-Japan Security Seminar,"2016 U.S.-Japan Security Seminar Listing Summary Michael J. Green interviews JIIA President Yoshiji Nogami Drupal Admin Fri, 02/26/2016 - 12:54 Featured Image Image Contributors Michael J. Green Programs & Projects Japan Chair Parent Geopolitics and Foreign Policy Featured Image AdobeStock_179685887",https://www.csis.org/events/2016-us-japan-security-seminar,"26 Feb 2016, 17:54"
Energy & Infrastructure,CSIS,The Future of the Grid—A View from ARPA-E,"The Future of the Grid—A View from ARPA-E Listing Summary The CSIS Energy and National Security Program is pleased to invite you to a discussion with Ellen Williams, Director of ARPA-E, the Advanced Research Projects Agency-Energy. Drupal Admin Thu, 02/25/2016 - 14:15 Featured Image Image Contributo",https://www.csis.org/events/future-grid-view-arpa-e,"25 Feb 2016, 19:15"
Geopolitics,CSIS,"Statesmen's Forum: Wang Yi, Minister of Foreign Affairs, PRC","Statesmen's Forum: Wang Yi, Minister of Foreign Affairs, PRC Listing Summary Please watch the live webcast of a discussion on Chinese foreign policy and US-China Relations Drupal Admin Fri, 02/19/2016 - 17:13 Featured Image Image Contributors John J. Hamre Christopher K. Johnson Downloads Download T",https://www.csis.org/events/statesmens-forum-wang-yi-minister-foreign-affairs-prc,"19 Feb 2016, 22:13"
Geopolitics,CSIS,"China Reality Check: China's ""Internet Sovereignty"" Initiative: Origins and Consequences","China Reality Check: China's ""Internet Sovereignty"" Initiative: Origins and Consequences Listing Summary Please join us for a discussion on China’s initiative to promote Internet sovereignty as a key governing concept of the global Internet. Drupal Admin Tue, 02/16/2016 - 11:49 Featured Image Image ",https://www.csis.org/events/china-reality-check-chinas-internet-sovereignty-initiative-origins-and-consequences,"16 Feb 2016, 16:49"
Policy & Regulation,CSIS,"Statesmen's Forum: The Right Honourable Theresa May, MP, Home Secretary, United Kingdom","Statesmen's Forum: The Right Honourable Theresa May, MP, Home Secretary, United Kingdom Listing Summary Please join the CSIS International Security Program for a discussion with UK Home Secretary Theresa May on counter-terrorism policy. Drupal Admin Fri, 02/12/2016 - 16:08 Featured Image Image Contr",https://www.csis.org/events/statesmens-forum-right-honourable-theresa-may-mp-home-secretary-united-kingdom,"12 Feb 2016, 21:08"
Strategic Signals,CSIS,Strategic Opportunities in the Indo-Asia-Pacific with Admiral Harry B. Harris,"Strategic Opportunities in the Indo-Asia-Pacific with Admiral Harry B. Harris Listing Summary Please join us for a discussion with Admiral Harry B. Harris, Commander, U.S. Pacific Command, on the Strategic Opportunities in the Indo-Asia-Pacific. Drupal Admin Tue, 01/26/2016 - 11:20 Featured Image Im",https://www.csis.org/events/strategic-opportunities-indo-asia-pacific-admiral-harry-b-harris,"26 Jan 2016, 16:20"
Strategic Signals,Al Jazeera,"Taiwan needs to become a ‘hornet’s nest’ of drones, US diplomat says",De ​facto US ambassador Raymond Greene says drones represent a 'game-changing opportunity' to enhance Taiwan's security.,https://www.aljazeera.com/news/2026/7/2/taiwan-needs-to-become-a-hornets-nest-of-drones-us-diplomat-says?traffic_source=rss,"02 Jul 2026, 05:40"
Strategic Signals,Al Jazeera,Belgium fans erupt after latest-ever goal seals place in last 16,Belgium fans celebrate a dramatic 3-2 victory over Senegal in extra time.,https://www.aljazeera.com/video/newsfeed/2026/7/2/belgium-fans-erupt-after-latest-ever-goal-seals-place-in-last-16?traffic_source=rss,"02 Jul 2026, 05:21"
Energy & Infrastructure,Al Jazeera,Oil prices fall to levels not seen since start of US-Israel war on Iran,Brent falls below $71 a barrel amid reports of progress in talks to end the war.,https://www.aljazeera.com/economy/2026/7/2/oil-prices-fall-to-levels-not-seen-since-start-of-us-israel-war-on-iran?traffic_source=rss,"02 Jul 2026, 05:17"
Strategic Signals,Al Jazeera,Survivors look to foreign aid after the earthquakes in Venezuela,Al Jazeera’s Teresa Bo reports from a golf course turned relief centre in Venezuela.,https://www.aljazeera.com/video/newsfeed/2026/7/2/survivors-look-to-foreign-aid-after-the-earthquakes-in-venezuela?traffic_source=rss,"02 Jul 2026, 04:54"
Strategic Signals,Al Jazeera,California gets Bruce Lee Day in a first for US state’s Chinese Americans,Bruce Lee Day aims to honour the San Francisco-born martial arts legend as a cultural bridge and Asian-American icon.,https://www.aljazeera.com/news/2026/7/2/california-gets-bruce-lee-day-in-a-first-for-us-states-chinese-americans?traffic_source=rss,"02 Jul 2026, 04:41"
Policy & Regulation,Al Jazeera,US designates Ecuador’s Chone Killers gang as ‘terrorist’ organisation,Ecuador's government praises the US for backing President Noboa's campaign to dismantle gang-crime networks.,https://www.aljazeera.com/news/2026/7/2/us-designates-ecuadors-chone-killers-gang-as-terrorist-organisation?traffic_source=rss,"02 Jul 2026, 03:58"
Strategic Signals,Al Jazeera,German prosecutors charge Ukrainian suspect over Nord Stream explosions,"Prosecutors allege a yacht was used in the sabotage of pipelines, with the suspect leading the operation.",https://www.aljazeera.com/news/2026/7/2/german-prosecutors-charge-ukrainian-suspect-over-nord-stream-explosions?traffic_source=rss,"02 Jul 2026, 03:31"
Energy & Infrastructure,Al Jazeera,Lawyer takes Trump to task over unchecked presidential powers,Constitutional lawyer Bruce Fein says the US was founded on the principle that governments exist to protect rights.,https://www.aljazeera.com/video/newsfeed/2026/7/2/lawyer-takes-trump-to-task-over-unchecked-presidential-powers?traffic_source=rss,"02 Jul 2026, 03:16"
Policy & Regulation,ETCFO Top Stories,"ICAI, ICSI, ICoAI must truly collaborate to make Corporate Mitra Scheme a success, say experts","The Ministry of Corporate Affairs has launched the Corporate Mitra scheme to address the skill gap in MSMEs, offering compliance and financial guidance. Accounting bodies like ICAI, ICSI, and ICoAI are involved in training and implementation. Experts, while lauding the initiative, emphasize the need",https://cfo.economictimes.indiatimes.com/news/tax-legal-accounting/icai-icsi-icoai-must-truly-collaborate-to-make-corporate-mitra-scheme-a-success-say-experts/132127864,"02 Jul 2026, 08:40"
Strategic Signals,ETCFO Top Stories,"GST at 9: India Inc seeks GST 2.0 with faster ITC refunds, AI-led compliance and lower litigation","Finance chiefs say the indirect tax reform has transformed business over the past nine years, but call for quicker input tax credit refunds, simpler compliance, consistent tax interpretation and technology-driven administration as GST enters its next phase.",https://cfo.economictimes.indiatimes.com/news/tax-legal-accounting/celebrating-nine-years-of-gst-a-call-for-reform-and-innovation-in-indias-tax-landscape/132105350,"01 Jul 2026, 09:45"
Strategic Signals,ETCFO Top Stories,India’s top 10 States by GST collections in FY26 — and who lagged behind,"India's GST collections for FY2025-26 reached ₹22.27 lakh crore, a slight 0.8% rise, driven by an 11.7% surge in import-related taxes. Domestic collections saw a 2.6% dip. Maharashtra led state contributions with over ₹3.61 lakh crore. The composition of GST revenue shifted, with IGST, SGST, and CGS",https://cfo.economictimes.indiatimes.com/news/tax-legal-accounting/indias-gst-revenue-breakdown-for-fy26-top-performers-and-laggards-revealed/132093571,"30 Jun 2026, 19:54"
Strategic Signals,ETCFO Top Stories,"ICICI Prudential Life plans 10-15% premium growth, bets on protection to outpace savings, CFO Dhiren Salian says","ICICI Prudential Life Insurance aims for 10-15% premium growth, with protection products like term and annuity plans leading the charge. CFO Dhiren Salian highlighted that protection, currently 17% of premiums, is a key focus due to its underpenetration and higher profitability. The company is also ",https://cfo.economictimes.indiatimes.com/news/strategy-operations/icici-prudential-life-insurance-targets-10-15-premium-growth-focusing-on-protection-business/132087048,"30 Jun 2026, 15:06"
Policy & Regulation,ETCFO Top Stories,"Exclusive: MCA set to notify SA 600, 40 revised audit standards by August","The notification will conclude one of the most significant regulatory exercises in India's audit landscape in recent years, aimed at strengthening audit quality and updating the country's auditing framework in line with evolving international standards.",https://cfo.economictimes.indiatimes.com/news/tax-legal-accounting/mca-to-revise-40-audit-standards-including-sa-600-by-august-2024/132087362,"30 Jun 2026, 13:02"
Strategic Signals,ETCFO Top Stories,HDFC Bank appoints Puneet Sharma as CFO,"HDFC Bank has appointed Puneet Sharma as its new Chief Financial Officer, effective December 1, 2026, bringing over 26 years of financial expertise from Axis Bank. Jigar Shah will join as General Counsel from October 1, 2026. Additionally, former Finance Secretary Rajiv Kumar is set to become the ba",https://cfo.economictimes.indiatimes.com/news/leadership/hdfc-bank-appoints-puneet-sharma-as-cfo-rajiv-kumar-as-part-time-chairman/132082709,"30 Jun 2026, 08:32"
Policy & Regulation,ETCFO Top Stories,Portal glitches put thousands of GST appeals at risk; experts seek deadline extension,"Tax professionals, industry bodies and bar association urge Finance Ministry to defer June 30 cut-off, citing technical issues on GSTAT portal and nearly nine years of pending litigation.",https://cfo.economictimes.indiatimes.com/news/tax-legal-accounting/urgent-call-for-gst-appeal-deadline-extension-amid-portal-glitches/132070202,"29 Jun 2026, 16:34"
Strategic Signals,ETCFO Top Stories,"CEAT targets one-third export revenue share, eyes double-digit volume growth over next five years: CFO Kumar Subbiah","CEAT aims to boost international revenue to one-third of its total within five years, up from 25%, while maintaining double-digit volume growth. In the near term, however, the tyre maker plans further price hikes to offset rising raw material costs, particularly natural rubber. Significant capacity ",https://cfo.economictimes.indiatimes.com/news/strategy-operations/ceat-plans-double-digit-growth-despite-rising-input-costs-cfo-confirms/132056586,"29 Jun 2026, 07:01"
Energy & Infrastructure,ETCFO Policy,Indian rupee weakness to persist despite RBI measures to bring in dollars,"Despite the Reserve Bank of India's efforts to attract foreign capital, the Indian rupee is expected to remain weak against the U.S. dollar in the coming months. While recent measures and falling oil prices have offered some support, analysts predict the rupee will trade around current levels. Expec",https://cfo.economictimes.indiatimes.com/news/policy/indian-rupee-weakness-to-persist-despite-rbi-measures-to-bring-in-dollars/132111368,"01 Jul 2026, 15:03"
Energy & Infrastructure,ETCFO Policy,RBI warns unwinding of leveraged hedge fund positions during stress could roil bond markets,"The Reserve Bank of India has issued a stark warning regarding the increasing influence of large, leveraged hedge funds in global sovereign bond markets. Their rapid exit during market turmoil could trigger significant sell-offs and widespread financial instability. This concern is amplified by risi",https://cfo.economictimes.indiatimes.com/news/policy/rbi-warns-unwinding-of-leveraged-hedge-fund-positions-during-stress-could-roil-bond-markets/132108988,"01 Jul 2026, 14:30"
Energy & Infrastructure,ETCFO Policy,India plans to add strategic fuel reserves after Iran war shock,"This ambitious move follows a review of existing, limited stockpiles and includes expanding underground crude storage and addressing the challenges of storing gas.",https://cfo.economictimes.indiatimes.com/news/policy/india-to-strengthen-energy-security-with-strategic-fuel-reserves-post-iran-conflict/132104646,"01 Jul 2026, 08:25"
Markets & Macro,ETCFO Policy,RBI compounds FEMA violations in Touras India case,"The Reserve Bank of India (RBI) has issued a compounding order under Section 15 of the Foreign Exchange Management Act (FEMA), in the case of Touras India Private Limited, which has resulted in the termination of proceedings against the company for contraventions of the law's provisions with a one-t",https://cfo.economictimes.indiatimes.com/news/policy/rbi-compounds-fema-violations-in-touras-india-case/132090409,"30 Jun 2026, 16:00"
Geopolitics,ETCFO Policy,"""It's in last 1 or 2%"": US envoy Sergio Gor declares India-US trade pact nears finish line","Dismissing rumours of diplomatic friction, United States Ambassador to India Sergio Gor on Monday (local time) announced that the highly anticipated India-US bilateral trade agreement is on the verge of completion, with negotiators hammering out the final ""1 or 2 per cent"" of the legal text.",https://cfo.economictimes.indiatimes.com/news/policy/its-in-last-1-or-2-us-envoy-sergio-gor-declares-india-us-trade-pact-nears-finish-line/132082933,"30 Jun 2026, 08:39"
Policy & Regulation,ETCFO Policy,"Delhi Cabinet approves EV Policy 2026 with tax waivers, purchase incentives and scrappage benefits to boost clean mobility","The policy provides 100 per cent exemption on road tax and registration fees for electric vehicles, with the benefit applicable to four-wheelers priced up to Rs 30 lakh (ex-showroom). Purchase incentives include up to Rs 30,000 for electric two-wheelers, up to Rs 50,000 for electric three-wheelers a",https://cfo.economictimes.indiatimes.com/news/policy/delhi-cabinet-approves-ev-policy-2026-with-tax-waivers-purchase-incentives-and-scrappage-benefits-to-boost-clean-mobility/132082657,"30 Jun 2026, 08:24"
Markets & Macro,ETCFO Policy,"RBI's dollar inflow measures buy time, but external risks remain","The Reserve Bank of India's recent measures to boost dollar inflows are a temporary fix, economists warn. While these steps aim to stabilize the rupee now, the country must strengthen its balance of payments over the next three to five years. Otherwise, as foreign currency borrowings and deposits ma",https://cfo.economictimes.indiatimes.com/news/policy/rbis-dollar-inflow-measures-buy-time-but-external-risks-remain/132061461,"29 Jun 2026, 08:07"
Policy & Regulation,ETCFO Policy,"Corporate Mitra scheme to commence with 2,000 participants","Corporate Mitras will provide affordable support to Micro, Small and Medium Enterprises (MSMEs) in various areas, including regulatory compliance, GST, accounting, financial guidance, cost accounting and secretarial services.",https://cfo.economictimes.indiatimes.com/news/policy/launch-of-corporate-mitra-scheme-empowering-2000-young-participants-across-india/132027726,"27 Jun 2026, 08:16"
