section,source,title,summary,link,published_at
Strategic Signals,Financial Times World,SpaceX leapfrogs Amazon to become world’s fifth-most valuable company,"Elon Musk’s AI, rocket and satellite group also announces $60bn deal for AI coding app Cursor",https://www.ft.com/content/17153f13-b0c8-4331-8f97-32a19a5e966e,"16 Jun 2026, 20:26"
Strategic Signals,Financial Times World,Ex-Citi executive says bank sacked her after raising Trump concerns,Former employee claims in lawsuit that she identified issues with risk-management practices,https://www.ft.com/content/b780e03d-02b7-452f-944c-a71b8f237c7e,"16 Jun 2026, 20:08"
Strategic Signals,Financial Times World,Yum Brands sells struggling Pizza Hut in bet on faster-growing businesses,KFC and Taco Bell owner to offload bulk of fast-food chain to private equity group as part of $2.7bn sale,https://www.ft.com/content/f0100928-2a0d-45ad-8422-acb2563576df,"16 Jun 2026, 20:06"
Energy & Infrastructure,Financial Times World,Russian warship fires warning shots towards yacht in English Channel,UK says incident is not linked to Britain’s interception of an oil tanker that is part of Moscow’s shadow fleet,https://www.ft.com/content/ddbc8071-3d83-4c44-8ab4-13ac39e46636,"16 Jun 2026, 20:01"
Strategic Signals,Financial Times World,Notes from the FT Global Bond Summit,"The reordering is happening in the asset class, too",https://www.ft.com/content/d3eee303-c6a7-4eca-bb76-aefef934d8dd,"16 Jun 2026, 20:00"
Energy & Infrastructure,Financial Times World,Oil sinks below $80 as traders bet Strait of Hormuz flows will return,Brent crude has tumbled to three-month low following agreement to extend US-Iran ceasefire,https://www.ft.com/content/45340e55-aa6a-4302-a606-a869f5cb6189,"16 Jun 2026, 19:58"
Geopolitics,Financial Times World,BMW cuts profit guidance as Iran war adds to challenges in Chinese market,"Carmaker expects operating margin in its automotive division to be 1-3% in 2026, a sharp fall from previous projections",https://www.ft.com/content/33bcea46-f8cf-4001-b092-aae742387c3c,"16 Jun 2026, 19:01"
Geopolitics,Financial Times World,"Australia-style approaches to social media ban may not work, Ofcom warns",Government considers putting age limits on virtual private networks to help enforce social media restrictions,https://www.ft.com/content/28807e71-b15d-4897-a3fe-0ff47c4abadc,"16 Jun 2026, 17:43"
Policy & Regulation,Financial Times Companies,The White House’s capricious controls on Anthropic,An opaque approach to US policy risks hampering AI development,https://www.ft.com/content/53e946f6-e9b5-4583-a1dd-df89b784c642,"16 Jun 2026, 17:44"
Strategic Signals,The Hindu BusinessLine,Tamil Nadu pollution board drops scrutiny of Tata Electronics iPhone plant,"Tata said independent tests and official analysis found no contamination, leading to closure of the case",https://www.thehindubusinessline.com/info-tech/tamil-nadu-pollution-board-drops-scrutiny-of-tata-electronics-iphone-plant/article71110716.ece,"17 Jun 2026, 00:20"
Strategic Signals,The Hindu BusinessLine,"Google rolls out Android 17, major AI features to follow later this year","The update brings a strong focus on multitasking improvements, featuring floating “Bubbles,” enhanced split-screen tools and “Screen Reactions” for recording overlays.",https://www.thehindubusinessline.com/info-tech/google-rolls-out-android-17-major-ai-features-to-follow-later-this-year/article71110745.ece,"17 Jun 2026, 00:16"
Energy & Infrastructure,The Hindu BusinessLine,US uses Iranian-style ship-to-ship tactic to move oil out of Gulf,"The operation, which uses drones, helicopters and monitoring systems, has facilitated over 100 tanker-to-tanker transfers since May, according to sources and satellite data.",https://www.thehindubusinessline.com/markets/commodities/us-uses-iranian-style-ship-to-ship-tactic-to-move-oil-out-of-gulf/article71110732.ece,"17 Jun 2026, 00:06"
Geopolitics,The Hindu BusinessLine,"Iran deal includes $300 billion fund, over half already committed","The fund, which has already secured more than half of its commitments, is designed as an economic incentive to support a broader peace deal, including reopening key trade routes like the Strait of Hormuz",https://www.thehindubusinessline.com/news/world/iran-deal-includes-300-billion-fund-over-half-already-committed/article71110683.ece,"16 Jun 2026, 23:46"
Markets & Macro,The Hindu BusinessLine,"RBI eases capital norms for ECLGS 5.0 loans, cuts risk weight","As per the revised framework, 75% of the guaranteed portion will attract a zero risk weight, while the remaining exposure will carry a 20% risk weight under existing norms",https://www.thehindubusinessline.com/money-and-banking/rbi-eases-capital-norms-for-eclgs-50-loans-cuts-risk-weight/article71110532.ece,"16 Jun 2026, 23:36"
Strategic Signals,The Hindu BusinessLine,Banks dangle mega returns to lure NRIs to FCNR(B) deposits,"Besides high interest, lenders are offering significant leverage on the deposits",https://www.thehindubusinessline.com/money-and-banking/banks-dangle-mega-returns-to-lurenristofcnrb-deposits/article71110058.ece,"16 Jun 2026, 22:20"
Policy & Regulation,The Hindu BusinessLine,Centre’s foodgrain reserves at record high as El Nino threatens kharif production,"Despite the “below normal” monsoon forecast, at 90 per cent of long period average, the government is targeting the kharif foodgrains production during 2026-27 of 176.16 mt",https://www.thehindubusinessline.com/economy/agri-business/centres-foodgrain-reserves-at-record-high-as-elninothreatenskharifproduction/article71109866.ece,"16 Jun 2026, 22:08"
Strategic Signals,The Hindu BusinessLine,"In a first, US pips Qatar as India’s largest LNG supplier during March-May","Washington supplies 1.5 million tonnes of LNG to India, compared to a mere 0.1 mt by Qatar",https://www.thehindubusinessline.com/economy/in-a-first-us-pips-qatar-as-indias-largest-lng-supplier-during-march-may/article71109738.ece,"16 Jun 2026, 22:06"
Geopolitics,Times of India Business,India in talks with Russia-linked Siberian deposit to source rare earth Samples: Report,India is seeking rare earth samples from Russia. This move aims to diversify critical mineral supplies away from China. State miner IREL is in talks with Rosneft for samples from Siberia's Tomtor deposit. India will study the mineral composition before further engagement. This effort supports India',https://timesofindia.indiatimes.com/business/international-business/india-in-talks-with-russia-linked-siberian-deposit-to-source-rare-earth-samples-report/articleshow/131778713.cms,"16 Jun 2026, 23:11"
Energy & Infrastructure,Times of India Business,"Rupee snaps two-day rally, settles 2 paise lower at 94.60 against US dollar","The rupee dipped slightly to 94.60 against the dollar on Tuesday, ending a two-day gain. Despite falling crude oil prices and hopes for a US-Iran peace deal, foreign investors selling Indian equities pressured the currency. Analysts anticipate a near-term downward trend for the rupee, with support f",https://timesofindia.indiatimes.com/business/india-business/rupee-snaps-two-day-rally-settles-2-paise-lower-at-94-60-against-us-dollar/articleshow/131777091.cms,"16 Jun 2026, 22:22"
Energy & Infrastructure,Times of India Business,US stocks today: Dow hits record high as easing oil prices boost Wall Street,"Indian markets mirrored global optimism as US stocks neared record highs, fueled by falling oil prices and hopes for a US-Iran peace deal. SpaceX's impressive market debut and gains in financial and chip stocks also boosted investor confidence. All eyes are now on the Federal Reserve's upcoming poli",https://timesofindia.indiatimes.com/business/international-business/us-stocks-today-16-june-2026-dow-hits-record-high-as-easing-oil-prices-boost-wall-street-spacex-climbs-further/articleshow/131776058.cms,"16 Jun 2026, 21:13"
Strategic Signals,Times of India Business,Air India launches 'basic fare' option without complimentary meals on select domestic flights,"Air India has introduced an optional 'Basic fare' on select domestic routes, excluding complimentary meals to cater to price-sensitive travelers. This new option offers a more unbundled travel choice, while existing fare categories with meals and bundled benefits remain available. The airline will e",https://timesofindia.indiatimes.com/business/india-business/air-india-launches-basic-fare-option-without-complimentary-meals-on-select-domestic-flights/articleshow/131775030.cms,"16 Jun 2026, 20:43"
Markets & Macro,Times of India Business,SpaceX soars past Amazon in market value after IPO frenzy; options trading begins,"SpaceX shares soared over 14% Tuesday, briefly surpassing Amazon and nearing Microsoft's valuation, reaching $2.85 trillion. Investor excitement surged with new options trading, despite analysts warning of extreme volatility and questioning the lofty valuation. The company also plans a $60 billion a",https://timesofindia.indiatimes.com/business/international-business/spacex-soars-past-amazon-in-market-value-after-ipo-frenzy-options-trading-begins/articleshow/131775586.cms,"16 Jun 2026, 20:42"
Energy & Infrastructure,Times of India Business,Stock market: Which are top 10 gainers and losers on NSE & BSE today? Check list,"Indian equities surged for a third day, with Sensex and Nifty climbing on positive global cues, foreign investment, and easing crude oil prices following a reported US-Iran peace deal. IT stocks led the gains, with HCL Tech announcing a significant investment. Broader markets also participated in th",https://timesofindia.indiatimes.com/business/india-business/stock-market-today-which-are-top-10-gainers-and-losers-on-nse-bse-on-june-16-2026-check-list/articleshow/131774779.cms,"16 Jun 2026, 20:08"
Energy & Infrastructure,Times of India Business,Trump says US can ‘soon’ reimpose Russian crude sanctions after Hormuz reopening,"US President Donald Trump indicated that sanctions on Russian oil could be reimposed soon, following the resumption of crude flows through the Strait of Hormuz after an Iran deal. Speaking at the G7 summit, Trump stated that with oil now moving freely, Washington can shift focus to ending the Ukrain",https://timesofindia.indiatimes.com/business/international-business/oil-now-flowing-donald-trump-says-us-can-soon-reimpose-russian-crude-sanctions-after-hormuz-reopening/articleshow/131773971.cms,"16 Jun 2026, 19:32"
Markets & Macro,Times of India Business,India builds record grain reserves as El Nino returns,"India's grain reserves have reached unprecedented levels, with rice stocks soaring 15% year-on-year to a record high and wheat inventories hitting a five-year peak. This robust buffer strengthens national food security and offers flexibility for exports, even amidst El Niño concerns. Strong farmer p",https://timesofindia.indiatimes.com/business/india-business/india-builds-record-grain-reserves-as-el-nino-returns-rice-stocks-hit-new-peak-wheat-stores-at-five-year-high/articleshow/131771809.cms,"16 Jun 2026, 17:41"
Strategic Signals,Hindustan Times India,'Several Indians have also lost their lives': PM Modi flags maritime concerns at G7 summit,"Addressing an outreach session of the G7 summit, PM Modi said India firmly believes that lasting solutions to conflicts.",https://www.hindustantimes.com/india-news/several-indians-have-lost-their-lives-pm-narendra-modi-g7-raises-maritime-security-concerns-secure-trade-france-101781636001382.html,"17 Jun 2026, 00:51"
Strategic Signals,Hindustan Times India,"Kennedy orders American exposed to hantavirus to stay quarantined against her will, WSJ reports","CRUISESHIP-HANTAVIRUS/:Kennedy orders American exposed to hantavirus to stay quarantined against her will, WSJ reports",https://www.hindustantimes.com/india-news/kennedy-orders-american-exposed-to-hantavirus-to-stay-quarantined-against-her-will-wsj-reports-101781635439707.html,"17 Jun 2026, 00:13"
Geopolitics,Hindustan Times India,"G7 margins: Modi, UAE President call for free navigation in Strait of Hormuz",Modi also held a bilateral meeting with UK Prime Minister Keir Starmer and discussed steps being taken to implement Comprehensive Economic and Trade Agreement,https://www.hindustantimes.com/india-news/g7-margins-modi-uae-president-call-for-free-navigation-in-strait-of-hormuz-101781634500854.html,"17 Jun 2026, 00:01"
Strategic Signals,Hindustan Times India,"Seated next to Trump, PM Modi raises ship attacks, says must protect seafarers","Modi welcomed progress in the peace efforts in West Asia, and noted the conflict had claimed the lives of “many Indian civilians”",https://www.hindustantimes.com/india-news/seated-next-to-trump-pm-modi-raises-ship-attacks-says-must-protect-seafarers-101781633532213.html,"16 Jun 2026, 23:47"
Geopolitics,Hindustan Times India,"Jewar to Navi Mumbai flight begins; flyers cheer shorter, cheaper travel","Tuesday’s Akasa Air’s flight was the first direct air link between NIA and the Navi Mumbai International Airport, which started operations in December 2025",https://www.hindustantimes.com/india-news/jewar-to-navi-mumbai-flight-begins-flyers-cheer-shorter-cheaper-travel-101781629913036.html,"16 Jun 2026, 22:41"
Strategic Signals,Hindustan Times India,"PM Modi, Meloni share laugh, discuss ‘Instagram’, days after viral ‘Melodi’ post gets 13M likes | Watch",A video from the event shows PM Modi interacting with Giogia Meloni.,https://www.hindustantimes.com/india-news/pm-modi-meloni-share-laugh-discuss-instagram-days-after-melodi-melody-post-gets-13m-likes-watch-video-g7-france-italy-101781623592244.html,"16 Jun 2026, 22:15"
Strategic Signals,Hindustan Times India,"Bhopal Court extends judicial custody of Twisha Sharma's husband, mother-in-law till June 30",The accused were produced before the court through video conferencing after the completion of their 14-day judicial custody today.,https://www.hindustantimes.com/india-news/bhopal-court-extends-judicial-custody-of-twisha-sharmas-husband-mother-in-law-till-june-30-101781623061187.html,"16 Jun 2026, 22:11"
Strategic Signals,Hindustan Times India,‘Leaks moved to other apps’: Telegram CEO Pavel Durov criticises temporary ban ahead of NEET-UG re-exam,Pavel Durov said that the ban affects and “punishes” 150M+ ordinary users in India and not those who leaked the papers.,https://www.hindustantimes.com/india-news/leaks-moved-to-other-apps-telegram-ceo-pavel-durov-criticises-temporary-ban-ahead-of-neet-ug-re-exam-101781624950863.html,"16 Jun 2026, 21:30"
Strategic Signals,Indian Express Latest,"At G7 meet, Mark Carney invites PM Narendra Modi to visit Canada; both vow to strengthen relations",,https://indianexpress.com/article/india/at-g7-meet-mark-carney-invites-pm-narendra-modi-to-visit-canada-both-vow-to-strengthen-relations-10743244/,"16 Jun 2026, 20:56"
Strategic Signals,Indian Express Latest,"Citizen lounge by day, study hub by evening: New Delhi DM office opens doors to students",,https://indianexpress.com/article/cities/delhi/citizen-lounge-by-day-study-hub-by-evening-new-delhi-dm-office-opens-doors-to-students-10743249/,"16 Jun 2026, 20:29"
Strategic Signals,Indian Express Latest,"Schools start without Class 6 textbooks, state’s new curriculum causes delay",,https://indianexpress.com/article/cities/pune/schools-start-without-class-6-textbooks-states-new-curriculum-causes-delay-10743248/,"16 Jun 2026, 20:26"
Strategic Signals,Indian Express Latest,NIA arrests key accused in Shambhu DFC blast case; gets 8-day custody,,https://indianexpress.com/article/cities/chandigarh/nia-arrests-key-accused-in-shambhu-dfc-blast-case-gets-8-day-custody-10743205/,"16 Jun 2026, 20:24"
Strategic Signals,Indian Express Latest,Panchkula police arrests Delhi-based man in Rs 4-lakh online trading fraud,,https://indianexpress.com/article/cities/chandigarh/panchkula-police-arrests-delhi-based-man-in-rs-4-lakh-online-trading-fraud-10743204/,"16 Jun 2026, 20:20"
Strategic Signals,Indian Express Latest,Maharashtra bureaucratic shake-up: Vijay Singhal appointed OSD for Dharavi redevelopment project,,https://indianexpress.com/article/cities/mumbai/maharashtra-bureaucratic-shake-up-vijay-singhal-appointed-osd-for-dharavi-redevelopment-project-10743203/,"16 Jun 2026, 20:17"
Strategic Signals,Indian Express Latest,Tughlakabad ‘arson’ : One more death takes toll to four,,https://indianexpress.com/article/cities/delhi/tughlakabad-arson-one-more-death-takes-toll-to-four-10743206/,"16 Jun 2026, 20:14"
Strategic Signals,Indian Express Latest,‘His ego couldn’t…’: When Rhea Pillai spoke of dealing with conflict after leaving Leander Paes,,https://indianexpress.com/article/lifestyle/feelings/rhea-pillai-conflict-after-leaving-leander-paes-separation-fragile-egos-9995891/,"16 Jun 2026, 19:30"
Markets & Macro,SCMP Asia,"Hong Kong’s financial revival: trading, tokenisation and governance in focus","[The content of this article has been produced by our advertising partner.] For a while and not so long ago, confidence in Hong Kong’s financial markets appeared fragile. Trading volumes softened, and geopolitical tensions weighed on sentiment. The city’s status as Asia’s leading international finan",https://www.scmp.com/presented/business/topics/broadridge/article/3356577/hong-kongs-financial-revival-trading-tokenisation-and-governance-focus?utm_source=rss_feed,"16 Jun 2026, 16:00"
Geopolitics,SCMP Asia,Yum China takes full slice of Pizza Hut China in US$1.2 billion deal,"Yum China, the operator of KFC and Pizza Hut in mainland China, will pay US$1.2 billion to acquire ownership of the Pizza Hut business in the market, deepening its separation from US restaurant giant Yum! Brands and gaining full control of the brand in China. The consideration will be paid entirely ",https://www.scmp.com/business/china-business/article/3357339/yum-china-takes-full-slice-pizza-hut-china-us12-billion-deal?utm_source=rss_feed,"16 Jun 2026, 14:18"
Strategic Signals,SCMP Asia,Hong Kong property tycoon Mico Chung cashes out of US$13.4 million home on The Peak,"A company linked to CSI Properties chairman and founder Mico Chung and his wife has sold a luxury house on The Peak for HK$105 million (US$13.4 million), according to official records. Aqua Sole Company sold the property at 27 Plantation Road to Hu Hanyang in a transaction completed on June 12, acco",https://www.scmp.com/business/article/3357325/hong-kong-property-tycoon-mico-chung-cashes-out-us134-million-peak-home?utm_source=rss_feed,"16 Jun 2026, 12:19"
Geopolitics,SCMP Asia,"Chinese shoppers prefer domestic brands, but not when it comes to these few categories","Domestic brands in China dominate segments from electric vehicles to electronic products to various everyday goods, but more shoppers are reaching for foreign competitors in specific categories including chocolate, infant formula, diapers and instant noodles. In chocolate, Japanese brand Meiji gaine",https://www.scmp.com/business/china-business/article/3357317/chinese-shoppers-prefer-domestic-brands-not-when-it-comes-these-few-categories?utm_source=rss_feed,"16 Jun 2026, 11:15"
Markets & Macro,SCMP Asia,Motorsport new battleground for Chinese carmakers as Geely and BYD rev up global drive,"Billionaire Li Shufu, owner and chairman of Geely Auto, China’s second-largest carmaker, plans to bring the Superbike World Championship (WSBK) to the country, banking on the success of a home-grown motorcycle brand in competition. The move marked Geely’s latest step to sharpen its image as an inter",https://www.scmp.com/business/china-business/article/3357313/motorsport-new-battleground-chinese-carmakers-geely-and-byd-rev-global-drive?utm_source=rss_feed,"16 Jun 2026, 10:37"
Geopolitics,SCMP Asia,"‘Ni hao, Ah Bao’: China’s Alipay gets AI-agent overhaul to challenge big tech rivals","Ant Group has unveiled the biggest overhaul of Alipay in two decades, transforming its ubiquitous mobile-payment app into a native AI platform with autonomous agents, as it strives to dominate China’s next-generation internet gateway. A trial version of the flagship app now features an interactive a",https://www.scmp.com/tech/big-tech/article/3357307/ni-hao-ah-bao-chinas-alipay-gets-ai-agent-overhaul-challenge-big-tech-rivals?utm_source=rss_feed,"16 Jun 2026, 10:05"
Strategic Signals,SCMP Asia,Young tech elites drive rise in Shenzhen luxury home sales after purchase curbs ease,"Several luxury residential projects in Shenzhen sold out quickly in May, with young elites from the semiconductor and artificial intelligence sectors replacing traditional tycoons as the most avid buyers. Post-90s buyers, mainly technology professionals, accounted for 31 per cent of transactions for",https://www.scmp.com/business/article/3357247/young-tech-elites-drive-rise-shenzhen-luxury-home-sales-after-purchase-curbs-ease?utm_source=rss_feed,"16 Jun 2026, 07:00"
Strategic Signals,SCMP Asia,Going for gold: central banks expand bullion holdings as US dollar’s dominance wavers,"Central banks are expected to expand their gold holdings, while the US dollar’s dominance in global reserves will fade in five years, according to the World Gold Council. The push to accumulate gold reflects a broad de-dollarisation trend in recent years. About nine in 10 central banks expect global",https://www.scmp.com/business/banking-finance/article/3357257/going-gold-central-banks-expand-bullion-holdings-us-dollars-world-dominance-falls?utm_source=rss_feed,"16 Jun 2026, 06:00"
Geopolitics,Foreign Policy,Trump Puts Russia-Ukraine War on the Back Burner,A lackluster attitude highlights divisions between the United States and its G-7 allies.,https://foreignpolicy.com/2026/06/16/trump-g7-summit-russia-ukraine-zelensky-iran-war/,"16 Jun 2026, 21:12"
Strategic Signals,Foreign Policy,‘It’s Not Competitive in Nature’,India’s ambassador to Washington insists “Make in India” doesn’t conflict with “America First.”,https://foreignpolicy.com/2026/06/16/india-ambassador-us-kwatra-modi-trump/,"16 Jun 2026, 19:35"
Strategic Signals,Foreign Policy,Taiwan Bet Too Big on Washington,Trump’s willingness to sell out allies should cause a rethink in Taipei.,https://foreignpolicy.com/2026/06/16/taiwan-trump-xi-china-invasion/,"16 Jun 2026, 19:26"
Geopolitics,Foreign Policy,Iran Is a Bigger Defeat Than Vietnam,A war of choice has turned into a strategic disaster for Washington.,https://foreignpolicy.com/2026/06/16/iran-vietnam-strategy-defeat/,"16 Jun 2026, 19:04"
Geopolitics,Foreign Policy,Trump’s Drug War Tactics Don’t Work,Development aid remains the best way to reduce drug production.,https://foreignpolicy.com/2026/06/16/colombia-cocaine-usaid-drugs-trump/,"16 Jun 2026, 18:33"
Geopolitics,Foreign Policy,It’s Time for the United States to Leave the Middle East,The Iran war is only the latest in a string of U.S. failures.,https://foreignpolicy.com/2026/06/16/iran-united-states-war-middle-east-israel/,"16 Jun 2026, 17:07"
Policy & Regulation,Foreign Policy,It’s Time to Stop Hunting Monsters,Foreign intervention is a policy with a long history of disaster.,https://foreignpolicy.com/2026/06/16/us-intervention-regime-change-hunting-monsters-debate/,"16 Jun 2026, 13:45"
Geopolitics,Foreign Policy,Everyone Lost the War With Iran,"Months of fighting revealed that multiple countries can impose costs, but none can impose order.",https://foreignpolicy.com/2026/06/16/iran-war-trump-gulf-china-russia-israel-ceasefire-deal/,"16 Jun 2026, 11:12"
Policy & Regulation,The Diplomat,Japan Eyes a Homegrown FMS System as Defense Exports Become a Strategic Tool,The government is considering establishing a new organization – to manage a Japanese-style Foreign Military Sales system and promote defense exports.,https://thediplomat.com/2026/06/japan-eyes-a-homegrown-fms-system-as-defense-exports-become-a-strategic-tool/,"16 Jun 2026, 23:13"
Energy & Infrastructure,The Diplomat,Kazakhstan Admitted to Corruption. Nothing Changed.,"While the state recovers billions in London and The Hague, oil workers in Kazakhstan still receive a fraction of what they are owed.",https://thediplomat.com/2026/06/kazakhstan-admitted-to-corruption-nothing-changed/,"16 Jun 2026, 21:11"
Strategic Signals,The Diplomat,South Korea’s Students Speak Out About the Local Election Ballot Shortage,"South Korean university students framed the issue as one of democratic accountability, while avoiding getting caught in the partisan fight that has ensued.",https://thediplomat.com/2026/06/south-koreas-students-speak-out-about-the-local-election-ballot-shortage/,"16 Jun 2026, 22:11"
Geopolitics,The Diplomat,China’s Limited Advance in El Salvador,"In the context of El Salvador’s transformation under Bukele, its relationship with China continues to be both limited and contradictory.",https://thediplomat.com/2026/06/chinas-limited-advance-in-el-salvador/,"16 Jun 2026, 21:50"
Strategic Signals,The Diplomat,India’s Strongest Regional Party Collapses Thanks to Modi’s BJP,"Legislators of the Trinamool Congress, which ruled West Bengal for three straight terms, have left the party in droves, leaving it a mere shadow of its former self.",https://thediplomat.com/2026/06/indias-strongest-regional-party-collapses-thanks-to-modis-bjp/,"16 Jun 2026, 18:04"
Strategic Signals,The Diplomat,Why the US Should Back Pakistan in Blacklisting BLA in the UNSC,The U.S. and Pakistan engage in substantial intelligence-sharing and counterterrorism cooperation. These could be at risk.,https://thediplomat.com/2026/06/why-the-us-should-back-pakistan-in-blacklisting-bla-in-the-unsc/,"16 Jun 2026, 18:53"
Geopolitics,The Diplomat,Why India Does Not Interest China,The Chinese see Indians as not having absorbed the lessons that China did from its humiliation at the hands of the West.,https://thediplomat.com/2026/06/why-india-does-not-interest-china/,"16 Jun 2026, 17:48"
