section,source,title,summary,link,published_at
Energy & Infrastructure,Financial Times World,Ukraine striking Russian energy infrastructure at unprecedented rate,Kyiv’s intensified drone campaign is spurring Russia’s worst fuel crisis in decades,https://www.ft.com/content/13687b48-9e54-44a1-bd4d-600bbc052baf,"05 Jul 2026, 07:09"
Strategic Signals,Financial Times World,French push to exclude UK from EU defence spending backfires,Paris loses out on cheap loans due to strict eligibility criteria it had championed,https://www.ft.com/content/9077074a-b01d-4890-a938-403befccb21c,"05 Jul 2026, 04:00"
Strategic Signals,Financial Times World,Returning to pre-Trumpian politics won’t save America,The opening of the Obama presidential library set off a wave of nostalgia for an era that is not coming back,https://www.ft.com/content/5e7ca535-90a8-4f6d-934b-0a0d9b36e62d,"05 Jul 2026, 04:00"
Energy & Infrastructure,Financial Times World,Octopus Energy set for showdown with workers over union recognition,Fast-growing energy supplier says employee share ownership means it’s not a ‘them and us’ company,https://www.ft.com/content/2f5339b0-89db-4579-9dd2-f8c20aa9964f,"05 Jul 2026, 04:00"
Strategic Signals,Financial Times World,High share prices are becoming a status symbol,Decline in stock splits suggests dividing share count no longer rules corporate orthodoxy,https://www.ft.com/content/35bc6f34-bb3b-434a-9ce3-37a9d4fc3aa4,"05 Jul 2026, 04:00"
Markets & Macro,Financial Times World,Uber stalls European food delivery push as it pursues Delivery Hero takeover,Ride-hailing company will no longer launch in five of its seven planned new markets this year,https://www.ft.com/content/53f631ef-98e4-4eec-92e4-3dd023ed25f5,"05 Jul 2026, 04:00"
Geopolitics,Financial Times World,China cools on overseas publication of scientific research,Policymakers discuss reducing incentives for academics to submit papers to international journals over leak concerns,https://www.ft.com/content/64a811f1-b132-4211-8a8c-2252cf964039,"05 Jul 2026, 04:00"
Energy & Infrastructure,Financial Times World,Burnham faces tricky electoral test as Starmer pushes through local government shake-up,Existing ministers argue major overhaul of city boundaries will be vital for his goal of devolving power,https://www.ft.com/content/08a0ea1f-3748-4ccd-a35b-9c3afabed25d,"05 Jul 2026, 04:00"
Strategic Signals,Financial Times Companies,How Bending Spoons built a $23bn tech empire from struggling brands,Nasdaq listing caps more than a decade of deals that transformed an Italian start-up into a global internet company,https://www.ft.com/content/040aac86-f458-400b-a353-7ff2ee5aa34f,"05 Jul 2026, 04:00"
Geopolitics,Financial Times Companies,European space deal to create SpaceX rival draws antitrust claims,"Germany’s OHB warns three-way merger would hurt competition, ultimately increasing costs for taxpayers",https://www.ft.com/content/d39157f7-6c3f-4d1a-be85-0c61e6cdbe8a,"05 Jul 2026, 04:00"
Geopolitics,Financial Times Companies,Wall Street banks recover in China amid trading boom,"China securities units of Goldman Sachs, Morgan Stanley and JPMorgan posted record profits last year",https://www.ft.com/content/90c1934a-505f-4c9d-9bdf-a28db14eb9f2,"05 Jul 2026, 04:00"
Geopolitics,Financial Times Companies,Cider wars brew in the EU as Nordic makers fight relabelling proposal,"Sweden, Denmark and Finland resist plan to label flavoured versions ‘cider-based beverages’",https://www.ft.com/content/b2b7cbeb-511e-41ce-982b-a08b070f0171,"05 Jul 2026, 04:00"
Energy & Infrastructure,Financial Times Companies,US clean power prices set to soar as AI demand coincides with subsidy cuts,"Clean power purchase agreements, favoured by companies like Google and Meta, expected to rise sharply as Biden-era support ends",https://www.ft.com/content/911ad6e1-154d-4d10-a7dc-2bd0fd6fbdc2,"04 Jul 2026, 10:00"
Strategic Signals,The Hindu BusinessLine,Sugar industry renews push for dedicated E100 fuel pumps,Experts say allowing ethanol-only dispensing stations would eliminate the need to transport ethanol to fuel depots for blending with petrol,https://www.thehindubusinessline.com/economy/agri-business/sugar-industry-renews-push-for-dedicated-e100-fuel-pumps/article71185365.ece,"05 Jul 2026, 14:53"
Strategic Signals,The Hindu BusinessLine,"Centre releases ₹25,863 crore first instalment under VB-G RAM G Yojana",Shivraj Singh Chouhan launches funds for new 125-day rural employment guarantee scheme,https://www.thehindubusinessline.com/economy/agri-business/centre-releases-25863-crore-first-instalment-under-vb-g-ram-g-yojana/article71185376.ece,"05 Jul 2026, 14:49"
Strategic Signals,The Hindu BusinessLine,"Flight operations at Delhi, Mumbai airports hit due to rain, 28 flights diverted to other cities","Thirteen flights from Mumbai were diverted from to Ahmedabad, Indore, Surat, Bengaluru, Hyderabad airports",https://www.thehindubusinessline.com/economy/logistics/flight-operations-at-delhi-mumbai-airports-hit-due-to-rain-28-flights-divert-to-other-cities/article71185417.ece,"05 Jul 2026, 14:38"
Geopolitics,The Hindu BusinessLine,"OPEC+ agrees in principle on 188K B/D hike, delegates say","It would be in keeping with the group’s plan to finish reversing output curbs made a few years ago, and mean that, since the war began, they’ve added 940,000 barrels a day to quotas",https://www.thehindubusinessline.com/markets/commodities/opec-agrees-in-principle-on-188k-bd-hike-delegates-say/article71185408.ece,"05 Jul 2026, 14:36"
Geopolitics,The Hindu BusinessLine,India hopeful of sanctions relief for Chabahar after Iran-US peace deal,New Delhi says project activities not possible without restoration of US waiver or easing of sanctions; issue has been taken up with Washington,https://www.thehindubusinessline.com/news/india-hopeful-of-sanctions-relief-for-chabahar-after-iran-us-peace-deal/article71185272.ece,"05 Jul 2026, 14:04"
Energy & Infrastructure,The Hindu BusinessLine,"CAFE-2 penalties: Bailing out carmakers is against national interest, say industry veterans","This decision could also prompt foreign automakers to import or assemble more gas-guzzling vehicles in India, rather than producing fuel-efficient or low-emission models",https://www.thehindubusinessline.com/economy/cafe-2-penalties-bailing-out-carmakers-is-against-national-interest-say-industry-veterans/article71185337.ece,"05 Jul 2026, 14:02"
Policy & Regulation,The Hindu BusinessLine,Indian government issues notice to Meta over child sexual abuse materials on Instagram,Government demands explanation within seven days after BBC report on child sexual abuse content,https://www.thehindubusinessline.com/news/indian-government-issues-notice-to-meta-over-child-sexual-abuse-materials-on-instagram/article71185382.ece,"05 Jul 2026, 13:52"
Energy & Infrastructure,The Hindu BusinessLine,"Stock markets to track crude oil prices, global trends, TCS earnings this week: Analysts","The progress of the southwest monsoon and kharif sowing will remain important indicators for rural demand, inflation expectations, and overall economic growth",https://www.thehindubusinessline.com/markets/stock-markets-to-track-crude-oil-prices-global-trends-tcs-earnings-this-week-analysts/article71185372.ece,"05 Jul 2026, 13:44"
Markets & Macro,Times of India Business,"Market recap: Top-10 firms add Rs 1 lakh crore in market capitalisation; Airtel, Bajaj Finance lead gains","Dalal Street concluded the past week on a high note, with top companies collectively adding over Rs 1 lakh crore to their market cap. Bharti Airtel and Bajaj Finance led the gains, buoyed by strong domestic economic data and positive global sentiment. While most of the top 10 firms saw their valuati",https://timesofindia.indiatimes.com/business/india-business/market-recap-top-10-firms-add-rs-1-lakh-crore-in-market-capitalisation-airtel-bajaj-finance-lead-gains/articleshow/132192430.cms,"05 Jul 2026, 13:21"
Strategic Signals,Times of India Business,"India's passport ranking slips, remains outside top 100: Which nations are in top 10?",,https://timesofindia.indiatimes.com/business/india-business/indias-passport-ranking-slips-remains-outside-top-100-which-nations-are-in-top-10/articleshow/132190117.cms,"05 Jul 2026, 08:51"
Markets & Macro,Times of India Business,"Ex-CFO of RCap, Amit Bapna, held in connection with ADAG probe","The Central Bureau of Investigation (CBI) has apprehended Amit Bapna, former CFO of Reliance Capital Ltd, as part of its probe into Reliance ADA Group matters. Authorities allege Bapna, a key financial decision-maker, approved loans to intermediary firms despite knowing it violated RBI guidelines. F",https://timesofindia.indiatimes.com/business/india-business/ex-cfo-of-rcap-amit-bapna-held-in-connection-with-adag-probe/articleshow/132187371.cms,"05 Jul 2026, 02:02"
Geopolitics,Times of India Business,India-UK trade pact: Centre notifies rules for determination of origin of goods,"India's Finance Ministry has finalized rules for goods eligible for benefits under the India-UK trade pact, set to begin July 15. This Comprehensive Economic and Trade Agreement (CETA) will grant duty-free access to 99% of Indian exports, boosting sectors like textiles and engineering. Exporters mus",https://timesofindia.indiatimes.com/business/india-business/india-uk-trade-pact-centre-notifies-rules-for-determination-of-origin-of-goods/articleshow/132183607.cms,"04 Jul 2026, 21:18"
Strategic Signals,Times of India Business,Chip by chip: India now world's second largest phone maker; PM Modi lays out 'Make in India' electronics roadmap,"India has ascended to become the world's second-largest mobile phone manufacturer and exporter, Prime Minister Narendra Modi announced, underscoring the nation's commitment to building a comprehensive electronics and semiconductor ecosystem. This strategic push, encompassing chip design, fabrication",https://timesofindia.indiatimes.com/business/india-business/chip-by-chip-india-now-worlds-second-largest-phone-maker-pm-modi-lays-out-make-in-india-electronics-roadmap/articleshow/132182929.cms,"04 Jul 2026, 19:57"
Policy & Regulation,Times of India Business,"'Criticism is welcome, rumours are not': Puri on E20 fuel buzz, engine damage claims","Union Minister Hardeep Singh Puri has addressed social media concerns regarding ethanol-blended fuel, dismissing claims of pest attraction and engine damage. He emphasized that ethanol usage is a century-old concept and highlighted past government efforts. Recent tests by ARAI and OEMs indicate a mi",https://timesofindia.indiatimes.com/business/india-business/criticism-is-welcome-rumours-are-not-puri-on-e20-fuel-buzz-engine-damage-claims/articleshow/132183548.cms,"04 Jul 2026, 20:59"
Strategic Signals,Times of India Business,Is E20 fuel safe for your vehicle? Here's what experts say,"Concerns surrounding E20 ethanol-blended petrol are being addressed by industry experts, who assure its safety for all vehicles, including older models. Years of rigorous scientific testing and consultations with automakers have confirmed its efficacy. This nationwide rollout aims to significantly r",https://timesofindia.indiatimes.com/business/india-business/is-e20-fuel-safe-for-your-vehicle-heres-what-experts-say/articleshow/132182624.cms,"04 Jul 2026, 19:23"
Energy & Infrastructure,Times of India Business,Beyond Hormuz: What HPCL Rajasthan Refinery Limited means for India's energy future,"India is bolstering its energy security following the Strait of Hormuz disruption. Prime Minister Modi inaugurated the HPCL Rajasthan Refinery, a crucial step towards self-reliance for a nation heavily reliant on oil imports. This project, alongside other development initiatives, aims to strengthen ",https://timesofindia.indiatimes.com/business/india-business/beyond-hormuz-what-hpcl-rajasthan-refinery-limited-inaugurated-by-pm-modi-means-for-indias-energy-future/articleshow/132179666.cms,"04 Jul 2026, 16:25"
Strategic Signals,Hindustan Times India,"Unnao link road to Ganga Expressway damaged in UP's first rain, 2 months after inauguration",The seven-metre approach road on the Meerut-Prayagraj carriageway near kilometre 421 developed a washout after rain on Friday.,https://www.hindustantimes.com/india-news/unnao-link-road-to-ganga-expressway-damaged-in-ups-first-rain-2-months-after-inauguration-101783239811979.html,"05 Jul 2026, 14:01"
Strategic Signals,Hindustan Times India,"VHP asks Ayodhya police to question Arvind Kejriwal, Priyanka Gandhi in Ram Temple donation case",The RSS affiliate asked investigators to examine the claims made by the Opposition leaders and take action if they were found to be baseless.,https://www.hindustantimes.com/india-news/vhp-asks-ayodhya-police-to-question-kejriwal-priyanka-gandhi-in-ram-temple-donation-embezzlement-case-rss-champat-rai-101783235512460.html,"05 Jul 2026, 13:29"
Strategic Signals,Hindustan Times India,"Noida woman ‘takes e-rickshaw’ to Sector 18 multi-level parking facility, dies by suicide","According to the preliminary investigation, the woman was suffering from depression. Police said further investigation is underway.",https://www.hindustantimes.com/india-news/noida-woman-takes-e-rickshaw-to-sector-18-multi-level-parking-facility-dies-by-suicide-101783236492054.html,"05 Jul 2026, 13:25"
Strategic Signals,Hindustan Times India,‘Govt presence can’t be ignored’: CPI(M)’s Brittas on Ram Mandir Trust RTI stand,"The letter comes months after the Central Information Commission (CIC) ruled on June 6, 2025, that the Trust is not a “public authority”",https://www.hindustantimes.com/india-news/govt-presence-can-t-be-ignored-cpi-m-s-brittas-on-ram-mandir-trust-rti-stand-101783236174330.html,"05 Jul 2026, 12:52"
Policy & Regulation,Hindustan Times India,'Stop them immediately': Centre orders Meta to remove Instagram ads promoting child sex abuse content,"The notice, issued by the ministry of electronics and information technology (MeitY) on Saturday, also gives Meta seven days to submit a detailed explanation.",https://www.hindustantimes.com/india-news/stop-them-immediately-centre-orders-meta-to-remove-instagram-ads-promoting-child-sex-abuse-content-101783233199133.html,"05 Jul 2026, 12:08"
Strategic Signals,Hindustan Times India,"Amid Ram Temple donation row, VHP to hold crucial meeting in Delhi on July 18-19",The Vishva Hindu Parishad (VHP) is a Hindu nationalist organization founded in 1964.,https://www.hindustantimes.com/india-news/amid-ram-temple-donation-row-vhp-to-hold-crucial-meeting-in-delhi-on-july-18-19-101783232575082.html,"05 Jul 2026, 12:06"
Strategic Signals,Hindustan Times India,Book Box: Building a bookshelf that tells your story,"A family debates bookshelf designs: preferences for aesthetics, organization, and practicality as they seek to store their beloved books creatively.",https://www.hindustantimes.com/india-news/book-box-building-a-bookshelf-that-tells-your-story-101783233355088.html,"05 Jul 2026, 12:05"
Strategic Signals,Hindustan Times India,Report on Justice Varma to be tabled during Parliament's monsoon session from July 20,"According to two officials, the House can take up the impeachment proceedings against justice Varma if there is a political consensus among the parties.",https://www.hindustantimes.com/india-news/report-on-justice-varma-on-agenda-during-parliament-monsoon-session-from-july-20-101783231980639.html,"05 Jul 2026, 12:00"
Strategic Signals,Indian Express Latest,Is Mbappé a dictator in France team? Deschamps speaks on criticism of captain’s leadership,,https://indianexpress.com/article/sports/football/mbappe-dictator-memes-deschamps-response-france-world-cup-10772350/,"05 Jul 2026, 09:25"
Geopolitics,Indian Express Latest,Alibaba to ban employees using Claude Code from July 10 as US-China AI rivalry escalates,,https://indianexpress.com/article/technology/artificial-intelligence/alibaba-ban-claude-code-us-china-ai-10772429/,"05 Jul 2026, 09:14"
Strategic Signals,Indian Express Latest,UPSC Ethics Simplified | How to decode ethical quotes in Mains exam: An example,,https://indianexpress.com/article/upsc-current-affairs/upsc-essentials/upsc-ethics-how-to-decode-philosophical-quotes-aristotle-10772200/,"05 Jul 2026, 09:03"
Strategic Signals,Indian Express Latest,What BBC’s investigation into Instagram showing child sex abuse ads in India reveals,,https://indianexpress.com/article/explained/bbc-investigation-instagram-child-sex-abuse-india-reveal-10772389/,"05 Jul 2026, 09:01"
Strategic Signals,Indian Express Latest,Bengaluru swimming pools and car washes face fines for using drinking water,,https://indianexpress.com/article/cities/bangalore/bengaluru-water-restrictions-bwssb-drinking-water-ban-swimming-pools-10772290/,"05 Jul 2026, 09:01"
Strategic Signals,Indian Express Latest,"Peter Shilton, 40 years after Hand of God: ‘Put the beef to bed’",,https://indianexpress.com/article/sports/football/peter-shilton-40-years-after-hand-of-god-put-the-beef-to-bed-10772385/,"05 Jul 2026, 09:00"
Strategic Signals,Indian Express Latest,Odisha SIR: 20 lakh deletions in draft voter list; Oppn flags exclusion over ‘minor anomalies’,,https://indianexpress.com/article/india/odisha-sir-deletions-draft-voter-list-opp-minor-anomalies-10772392/,"05 Jul 2026, 08:58"
Strategic Signals,Indian Express Latest,Maharashtra road accident data: Wrong side driving remains a major highway menace; 460 killed in 2025,,https://indianexpress.com/article/cities/mumbai/maharashtra-road-accident-data-wrong-side-highway-killed-10772309/,"05 Jul 2026, 08:58"
Strategic Signals,SCMP Asia,Citi CEO says 2 AI races are shaping future of banking,"The global financial sector is engaged in two simultaneous and critical races as AI evolves at an unprecedented rate, according to Jane Fraser, the CEO of Citi, the third-largest bank in the United States. While artificial intelligence was likely to cause some job dislocations, new positions would b",https://www.scmp.com/business/banking-finance/article/3359455/citi-ceo-says-2-ai-races-are-shaping-future-banking?utm_source=rss_feed,"05 Jul 2026, 08:00"
Energy & Infrastructure,SCMP Asia,Why has China lowered its own ranking in global financial competitiveness?,"A Beijing-based governmental think tank has taken the rare step of lowering China’s global financial competitiveness ranking by one place, despite top leaders of the world’s second-largest economy vowing to build it into a financial superpower. China ranks fifth globally in financial competitiveness",https://www.scmp.com/business/banking-finance/article/3359418/why-has-china-lowered-its-own-ranking-global-financial-competitiveness?utm_source=rss_feed,"05 Jul 2026, 06:00"
Policy & Regulation,SCMP Asia,Why Hong Kong’s major developers stayed out of Northern Metropolis’ first pilot tender,"Hong Kong’s first Northern Metropolis pilot tender drew only two confirmed bidders on Friday, underscoring the challenge facing the government’s effort to enlist private developers in delivering not only homes but also its broader technology and industrial ambitions. Henderson Land Development submi",https://www.scmp.com/business/china-business/article/3359400/why-hong-kongs-major-developers-stayed-out-northern-metropolis-first-pilot-tender?utm_source=rss_feed,"05 Jul 2026, 03:00"
Markets & Macro,SCMP Asia,"After hooking China on coffee, Starbucks ramps up consumer strategy","When Anne walked into a Starbucks branch in Seattle more than a decade ago, she knew exactly what to expect: a latte, a comfortable chair and a place to work. Now, after living in the technology hub of Hangzhou, the capital of the eastern province of Zhejiang, and working as an English teacher for t",https://www.scmp.com/business/china-business/article/3359294/after-hooking-china-coffee-starbucks-ramps-consumer-strategy?utm_source=rss_feed,"05 Jul 2026, 01:00"
Geopolitics,SCMP Asia,Caution on land tenders key to Hong Kong’s property recovery: analysts,"As Hong Kong moves forward with its huge new Northern Metropolis development zone, analysts argue the government should take a cautious approach to land sales to help sustain the recent recovery in the residential property market. The large-scale project near the border with the Chinese mainland con",https://www.scmp.com/business/article/3359372/caution-land-tenders-key-hong-kongs-property-recovery-analysts?utm_source=rss_feed,"04 Jul 2026, 03:00"
Geopolitics,SCMP Asia,Why Citigroup CEO Jane Fraser left the US-China summit feeling optimistic,"For Citigroup’s global CEO Jane Fraser, her time in Beijing last month meant far more than a handshake and photograph with heads of state. Fraser was among 17 business leaders US President Donald Trump invited to China as part of his three-day visit to Beijing from May 13 to May 15. Standing on the ",https://www.scmp.com/business/banking-finance/article/3359326/why-citigroup-ceo-jane-fraser-left-us-china-summit-feeling-optimistic?utm_source=rss_feed,"04 Jul 2026, 03:00"
Markets & Macro,SCMP Asia,China’s Momenta IPO oversubscribed 414 times as Hong Kong listings pack calendar,"Chinese autonomous-driving start-up Momenta drew massive subscription numbers for its HK$5.89 billion (US$751 million) initial public offering in Hong Kong, even as it competed against five other issuers launching their IPOs at the same time. The Suzhou-based company’s bookbuilding closed on Friday.",https://www.scmp.com/business/article/3359360/chinas-momenta-ipo-oversubscribed-414-times-hong-kong-listings-pack-calendar?utm_source=rss_feed,"03 Jul 2026, 12:01"
Energy & Infrastructure,SCMP Asia,China’s BYD surpasses Tesla to regain lead in global EV race,"China’s electric vehicle (EV) king BYD has leapfrogged once more over Tesla to become the world’s largest battery-powered car manufacturer, spurred by its surging overseas shipments, despite posting an 8.2 per cent year-on-year drop in deliveries. As BYD gained the upper hand in the race against the",https://www.scmp.com/business/china-business/article/3359287/chinas-byd-surpasses-tesla-regain-lead-global-ev-race?utm_source=rss_feed,"03 Jul 2026, 10:00"
Strategic Signals,Foreign Policy,Venezuela’s Bungled Earthquake Response,Natural disasters have accelerated political change elsewhere in the region.,https://foreignpolicy.com/2026/07/03/venezuela-earthquakes-rodriguez-machado-politics/,"03 Jul 2026, 12:00"
Strategic Signals,Foreign Policy,Angsty in Ankara,Can NATO move past a need to keep Trump happy?,https://foreignpolicy.com/2026/07/02/nato-summit-ankara-trump-rutte-erdogan-ukraine-iran/,"02 Jul 2026, 22:03"
Energy & Infrastructure,Foreign Policy,Is Sports Diplomacy Still Possible?,Hard power has left its mark on this year’s World Cup.,https://foreignpolicy.com/2026/07/02/sports-diplomacy-politics-world-cup-sportswashing-immigration-war/,"02 Jul 2026, 21:31"
Geopolitics,Foreign Policy,Russia’s 11-Hour Assault on Kyiv,The deadly missile and drone bombardment was retaliation for recent Ukrainian attacks on critical Russian infrastructure.,https://foreignpolicy.com/2026/07/02/russia-ukraine-missiles-drones-kyiv-oil-energy-critical-infrastructure-strikes/,"02 Jul 2026, 20:49"
Strategic Signals,Foreign Policy,Gen Z Goes to Hollywood,Three summer movies reflect a generation’s sensibilities.,https://foreignpolicy.com/2026/07/02/obsession-backrooms-amazing-digital-circus-movie-review-gen-z-hollywood/,"02 Jul 2026, 19:00"
Strategic Signals,Foreign Policy,A Short Economic History of the United States,From a slave economy to a global empire in 250 years.,https://foreignpolicy.com/2026/07/02/united-states-economy-slavery-empire-immigration-socialism/,"02 Jul 2026, 17:23"
Strategic Signals,Foreign Policy,"America, the Once Global Nation","At 250, the country is struggling to come to terms with the world it created.",https://foreignpolicy.com/2026/07/02/america-the-once-global-nation/,"02 Jul 2026, 16:30"
Geopolitics,Foreign Policy,The MOU Is Paying Off Early for Iran,Washington and Tehran are grappling over a “memorandum of misunderstanding.”,https://foreignpolicy.com/2026/07/02/mou-iran-us-talks-doha-strait-hormuz-oil-sanctions-profits-exports/,"02 Jul 2026, 15:56"
Policy & Regulation,The Diplomat,The Prabowo Administration’s Hostility to Expertise is Degrading Indonesian Governance,"The government needs to involve more academic institutions, think-tanks, and technical bodies in policymaking.",https://thediplomat.com/2026/07/the-prabowo-administrations-hostility-to-expertise-is-degrading-indonesian-governance/,"03 Jul 2026, 15:32"
Strategic Signals,The Diplomat,"With Laos Trip, Min Aung Hlaing Drives a Wedge Into ASEAN",Myanmar’s “president” is embarking on his first official visit to an ASEAN country since his appointment in April.,https://thediplomat.com/2026/07/with-laos-trip-min-aung-hlaing-drives-a-wedge-into-asean/,"03 Jul 2026, 13:34"
Strategic Signals,The Diplomat,Indonesia Recovers Body of American Pilot Killed by Papuan Separatists,The West Papua National Liberation Army has a history of targeting aircraft servicing remote parts of the Papuan highlands.,https://thediplomat.com/2026/07/indonesia-recovers-body-of-american-pilot-killed-by-papuan-separatists/,"03 Jul 2026, 13:20"
Geopolitics,The Diplomat,Understanding China’s Party-State Intelligence System,It’s not “whole of society” – and calling it that risks discrimination against ethnic Chinese.,https://thediplomat.com/2026/07/understanding-chinas-party-state-intelligence-system/,"03 Jul 2026, 01:47"
Geopolitics,The Diplomat,"Myanmar to Push Ahead With Suspended Myitsone Dam Project, Officials Say","China's government is pushing hard for the resumption of the $3.6 billion project, which was suspended in 2011 amid widespread public opposition.",https://thediplomat.com/2026/07/myanmar-to-push-ahead-with-suspended-myitsone-dam-project-officials-say/,"03 Jul 2026, 11:00"
