section,source,title,summary,link,published_at
Strategic Signals,The Diplomat,Why the Heart of India’s Indigenous Fighter Ecosystem Will be American for Several Decades to Come,"While negotiations for the licensed manufacture of F414 jet engines in India continue, the off-the-shelf procurement cost of some F414 engines for the AMCA prototype has tripled.",https://thediplomat.com/2026/06/why-the-heart-of-indias-indigenous-fighter-ecosystem-will-be-american-for-several-decades-to-come/,"29 Jun 2026, 18:20"
Strategic Signals,The Diplomat,Why Pakistan Struggles With Violence Against Women,There are no official statistics on acid attacks on women in Pakistan. But an estimated 200 cases are reported each year.,https://thediplomat.com/2026/06/why-pakistan-struggles-with-violence-against-women/,"29 Jun 2026, 12:07"
Geopolitics,The Diplomat,"3 Governments, 1 China Policy? Dhaka’s Evolving Engagement With Beijing","While Bangladesh's domestic politics have undergone huge change over the past two years, its relations with China have displayed greater continuity than rupture.",https://thediplomat.com/2026/06/3-governments-1-china-policy-dhakas-evolving-engagement-with-beijing/,"29 Jun 2026, 18:31"
Strategic Signals,War on the Rocks,The Defense Industrial Alliance Washington Is Throwing Away,"As the relationship between the United States and Canada continues to degrade, it now comes at the expense of each country’s industrial security.Last month, the Pentagon announced the unilateral suspension of the 86-year-old Canadian Permanent Joint Board on Defense in response to what the White Hou",https://warontherocks.com/cogs-of-war/the-defense-industrial-alliance-washington-is-throwing-away/,"29 Jun 2026, 08:00"
Geopolitics,War on the Rocks,A New Force Posture Concept for Europeanizing Extended Nuclear Deterrence,"During the Cold War, Europe kept asking whether Washington would risk an American city to save a European one. It was an impolite question, but a useful one, which is why it never quite left the room. It has now packed its bags and moved east. Earlier this year, French President Emmanuel Macron crea",https://warontherocks.com/a-new-force-posture-concept-for-europeanizing-extended-nuclear-deterrence/,"29 Jun 2026, 07:30"
Energy & Infrastructure,War on the Rocks,The Art of Statecraft in an Age of Strategic Failure,"Jack Watling, Statecraft: The New Rules of Power in a Divided World (Macmillan, 2026)The war against Iran exposed a multitude of forced errors and own goals in the conduct of statecraft. The purpose of sound statecraft is the integrated application of a state’s tools and its repertoire of government",https://warontherocks.com/the-art-of-statecraft-in-an-age-of-strategic-failure/,"29 Jun 2026, 07:15"
Policy & Regulation,War on the Rocks,Not Imaginary: The Deterrence Gap is Real and America Needs Low-Yield Nukes,"Nuclear policy debates are at their best when they force hard questions about risk, deterrence, and military necessity. They are at their worst when disagreement is recast as bad faith. In 2018, as an outgrowth of a rigorous policy review process, the Trump administration’s Nuclear Posture Review id",https://warontherocks.com/not-imaginary-the-deterrence-gap-is-real-and-america-needs-low-yield-nukes/,"26 Jun 2026, 14:15"
Energy & Infrastructure,War on the Rocks,Misreading Myanmar’s War: Why the Junta’s Recent Gains Don’t Mean Imminent Victory,"To understand how close Myanmar’s pro-democracy resistance came to victory last year — and how far it has slipped since — there is no sharper microcosm than the story of a Gen Z sniper. In April 2025, a female teenager, Anina, enraptured the world, her youth-driven “Spring Revolution” a vivid foil t",https://warontherocks.com/misreading-myanmars-war-why-the-juntas-recent-gains-dont-mean-imminent-victory/,"26 Jun 2026, 07:30"
Geopolitics,War on the Rocks,The 2026 War on the Rocks Summer Fiction Reading List,"You can tell a lot about a person from what fiction they keep on their nightstand. Once a year, we make the staff, contributing editors, and show hosts of War on the Rocks tell on themselves.Kerry AndersonThe Midnight Library, Matt Haig (2020). Drawing on evergreen themes from books and movies such ",https://warontherocks.com/the-2026-war-on-the-rocks-summer-fiction-reading-list/,"26 Jun 2026, 07:15"
Geopolitics,War on the Rocks,"Open Strait, Unsettled Waters","Welcome to The Adversarial. Every other week, we’ll provide you with expert analysis on America’s greatest challengers: China, Russia, Iran, North Korea, and jihadists. Read more below.***IranOn June 17, U.S. President Donald Trump and Iranian President Masoud Pezeshkian separately signed a memorand",https://warontherocks.com/open-strait-unsettled-waters/,"25 Jun 2026, 19:45"
Strategic Signals,War on the Rocks,The U.S. Navy’s Subsea Rare Earth Vulnerability,"The Columbia-class ballistic missile submarine is the next generation of American nuclear deterrence. Twelve of these boats will replace the aging Ohio-class fleet, entering service over the 2030s and 2040s, each carrying 16 Trident IIs and driven by a ghost-quiet electric motor that renders them ac",https://warontherocks.com/cogs-of-war/the-u-s-navys-subsea-rare-earth-vulnerability/,"25 Jun 2026, 08:00"
Policy & Regulation,CSIS,The Bio-Pharma Industry and Society,"The Bio-Pharma Industry and Society Listing Summary Please join the CSIS Global Health Policy Center on March 17, from 10:00am – 11:30am, for an exploration of how private bio-pharmaceutical firms can better support the critically important societal goals of improved affordability, access, quality, ",https://www.csis.org/events/bio-pharma-industry-and-society,"03 Mar 2016, 20:36"
Policy & Regulation,CSIS,The FY2017 Defense Budget and Strategic Outlook,"The FY2017 Defense Budget and Strategic Outlook Listing Summary Please join the CSIS International Security Program for a half-day Defense360 conference on the recently released FY2017 defense budget request and strategic priorities. Drupal Admin Mon, 02/29/2016 - 13:48 Featured Image Image Contribu",https://www.csis.org/events/fy2017-defense-budget-and-strategic-outlook,"29 Feb 2016, 18:48"
Policy & Regulation,CSIS,2016 U.S.-Japan Security Seminar,"2016 U.S.-Japan Security Seminar Listing Summary Michael J. Green interviews JIIA President Yoshiji Nogami Drupal Admin Fri, 02/26/2016 - 12:54 Featured Image Image Contributors Michael J. Green Programs & Projects Japan Chair Parent Geopolitics and Foreign Policy Featured Image AdobeStock_179685887",https://www.csis.org/events/2016-us-japan-security-seminar,"26 Feb 2016, 17:54"
Energy & Infrastructure,CSIS,The Future of the Grid—A View from ARPA-E,"The Future of the Grid—A View from ARPA-E Listing Summary The CSIS Energy and National Security Program is pleased to invite you to a discussion with Ellen Williams, Director of ARPA-E, the Advanced Research Projects Agency-Energy. Drupal Admin Thu, 02/25/2016 - 14:15 Featured Image Image Contributo",https://www.csis.org/events/future-grid-view-arpa-e,"25 Feb 2016, 19:15"
Geopolitics,CSIS,"Statesmen's Forum: Wang Yi, Minister of Foreign Affairs, PRC","Statesmen's Forum: Wang Yi, Minister of Foreign Affairs, PRC Listing Summary Please watch the live webcast of a discussion on Chinese foreign policy and US-China Relations Drupal Admin Fri, 02/19/2016 - 17:13 Featured Image Image Contributors John J. Hamre Christopher K. Johnson Downloads Download T",https://www.csis.org/events/statesmens-forum-wang-yi-minister-foreign-affairs-prc,"19 Feb 2016, 22:13"
Geopolitics,CSIS,"China Reality Check: China's ""Internet Sovereignty"" Initiative: Origins and Consequences","China Reality Check: China's ""Internet Sovereignty"" Initiative: Origins and Consequences Listing Summary Please join us for a discussion on China’s initiative to promote Internet sovereignty as a key governing concept of the global Internet. Drupal Admin Tue, 02/16/2016 - 11:49 Featured Image Image ",https://www.csis.org/events/china-reality-check-chinas-internet-sovereignty-initiative-origins-and-consequences,"16 Feb 2016, 16:49"
Policy & Regulation,CSIS,"Statesmen's Forum: The Right Honourable Theresa May, MP, Home Secretary, United Kingdom","Statesmen's Forum: The Right Honourable Theresa May, MP, Home Secretary, United Kingdom Listing Summary Please join the CSIS International Security Program for a discussion with UK Home Secretary Theresa May on counter-terrorism policy. Drupal Admin Fri, 02/12/2016 - 16:08 Featured Image Image Contr",https://www.csis.org/events/statesmens-forum-right-honourable-theresa-may-mp-home-secretary-united-kingdom,"12 Feb 2016, 21:08"
Strategic Signals,CSIS,Strategic Opportunities in the Indo-Asia-Pacific with Admiral Harry B. Harris,"Strategic Opportunities in the Indo-Asia-Pacific with Admiral Harry B. Harris Listing Summary Please join us for a discussion with Admiral Harry B. Harris, Commander, U.S. Pacific Command, on the Strategic Opportunities in the Indo-Asia-Pacific. Drupal Admin Tue, 01/26/2016 - 11:20 Featured Image Im",https://www.csis.org/events/strategic-opportunities-indo-asia-pacific-admiral-harry-b-harris,"26 Jan 2016, 16:20"
Geopolitics,Al Jazeera,JD Vance’s 2028 strategy is starting to take shape,The vice president’s decision to criticise Israel and distance himself from rival Rubio means he is reading the base.,https://www.aljazeera.com/opinions/2026/6/29/jd-vances-2028-strategy-is-starting-to-take-shape?traffic_source=rss,"29 Jun 2026, 15:08"
Strategic Signals,Al Jazeera,Five killed in shooting at German youth centre,"Five people were killed in a shooting at a youth welfare centre in Stade, northern Germany.",https://www.aljazeera.com/video/newsfeed/2026/6/29/five-killed-in-shooting-at-german-youth-centre?traffic_source=rss,"29 Jun 2026, 15:03"
Strategic Signals,Al Jazeera,Enzo Maresca appointed Man City manager to succeed Pep Guardiola,"Former Blues manager inks a three-year deal at Manchester City and succeeds Pep Guardiola, who stepped down in May.",https://www.aljazeera.com/sports/2026/6/29/enzo-maresca-appointed-man-city-manager-to-succeed-pep-guardiola?traffic_source=rss,"29 Jun 2026, 14:57"
Energy & Infrastructure,Al Jazeera,Why the Arab League could not stop Israel’s genocide,"Arab governments are constrained by dependency, regime survival and fear of empowering Iran-aligned rivals.",https://www.aljazeera.com/opinions/2026/6/29/why-the-arab-league-could-not-stop-israels-genocide?traffic_source=rss,"29 Jun 2026, 14:43"
Geopolitics,Al Jazeera,Sudan’s el-Obeid: Life on the edge of collapse,"Sudan's el-Obeid faces mass atrocities, like el-Fasher in 2025, the UN warns.",https://www.aljazeera.com/video/newsfeed/2026/6/29/sudans-el-obeid-life-on-the-edge-of-collapse?traffic_source=rss,"29 Jun 2026, 14:18"
Geopolitics,Al Jazeera,Trump announces meeting with Iran in Qatar despite military skirmishes,"US president says talks will take place on Tuesday, but Tehran has not confirmed the negotiations in Doha.",https://www.aljazeera.com/news/2026/6/29/trump-announces-meeting-with-iran-in-qatar-despite-military-skirmishes?traffic_source=rss,"29 Jun 2026, 14:12"
Strategic Signals,Al Jazeera,Brazil vs Japan LIVE: FIFA World Cup 2026,"Follow updates as Brazil face Japan in the last 32, as we bring you the build-up, analysis and text commentary.",https://www.aljazeera.com/sports/liveblog/2026/6/29/brazil-vs-japan-live-fifa-world-cup-2026?traffic_source=rss,"29 Jun 2026, 14:10"
Geopolitics,Al Jazeera,Is the Israeli military deliberately targeting children in Gaza?,A UN inquiry found that children in Gaza are being shot with a single bullet.,https://www.aljazeera.com/video/by-the-numbers-3/2026/6/29/is-the-israeli-military-deliberately-targeting-children-in-gaza?traffic_source=rss,"29 Jun 2026, 13:55"
Policy & Regulation,ETCFO Top Stories,Portal glitches put thousands of GST appeals at risk; experts seek deadline extension,"Tax professionals, industry bodies and bar association urge Finance Ministry to defer June 30 cut-off, citing technical issues on GSTAT portal and nearly nine years of pending litigation.",https://cfo.economictimes.indiatimes.com/news/tax-legal-accounting/urgent-call-for-gst-appeal-deadline-extension-amid-portal-glitches/132070202,"29 Jun 2026, 16:34"
Strategic Signals,ETCFO Top Stories,"CEAT targets one-third export revenue share, eyes double-digit volume growth over next five years: CFO Kumar Subbiah","CEAT aims to boost international revenue to one-third of its total within five years, up from 25%, while maintaining double-digit volume growth. In the near term, however, the tyre maker plans further price hikes to offset rising raw material costs, particularly natural rubber. Significant capacity ",https://cfo.economictimes.indiatimes.com/news/strategy-operations/ceat-plans-double-digit-growth-despite-rising-input-costs-cfo-confirms/132056586,"29 Jun 2026, 07:01"
Geopolitics,ETCFO Top Stories,"India-UK trade pact opens new prospects, but industry readiness will decide gains, say experts","The India-UK Comprehensive Economic and Trade Agreement (CETA) is set to come into force on July 15, 2026, unlocking lower tariffs and wider market access across sectors. However, economists and trade experts say the long-term benefits will depend on how effectively businesses adapt supply chains, m",https://cfo.economictimes.indiatimes.com/news/economy/india-uk-trade-deal-unlocking-new-opportunities-for-businesses-by-2026/132063972,"29 Jun 2026, 11:07"
Strategic Signals,ETCFO Top Stories,Big Four rethink partnership as AI changes the game,"India's Big Four accounting firms, Deloitte, PwC, and EY, have surpassed 1,000 partners each, driven by rapid expansion, especially in technology consulting. This growth strains the traditional partnership model, demanding leaders adept at managing diverse businesses, embracing AI, and navigating co",https://cfo.economictimes.indiatimes.com/news/cfo-tech/big-four-rethink-partnership-as-ai-changes-the-game/132061209,"29 Jun 2026, 07:45"
Policy & Regulation,ETCFO Top Stories,Plan afoot to create index for unincorporated enterprises,"The index, proposed by the ministry of statistics and programme implementation (MoSPI), will provide insights into the health of the large yet often difficult-to-measure informal sector.",https://cfo.economictimes.indiatimes.com/news/plan-afoot-to-create-index-for-unincorporated-enterprises/132061279,"29 Jun 2026, 07:55"
Geopolitics,ETCFO Top Stories,"Syrma SGS eyes 5x growth in five years, targets $2 billion revenue: CFO Bijay Agrawal","Syrma SGS Technology aims for a five-fold revenue increase to over $2 billion in five years, driven by backward integration into PCB manufacturing with a Rs 1,700 crore investment and expansion into defence and healthcare. The company, already seeing strong growth, leverages customer order visibilit",https://cfo.economictimes.indiatimes.com/news/strategy-operations/syrma-sgs-aims-for-2-billion-revenue-growth-driven-by-ma-and-innovation/131969464,"25 Jun 2026, 07:01"
Markets & Macro,ETCFO Top Stories,"China, India see top firms lose market cap share in AI lag","Major stock markets in China, India, and Hong Kong are lagging in the global AI race, with top companies now holding a smaller market share. This contrasts with Taiwan and South Korea, where AI leaders have significantly boosted their benchmarks. While diversification can offer stability, the absenc",https://cfo.economictimes.indiatimes.com/news/cfo-tech/china-india-see-top-firms-lose-market-cap-share-in-ai-lag/132061198,"29 Jun 2026, 07:44"
Markets & Macro,ETCFO Top Stories,Indian CFO Guide: Navigating in a Multipolar World,"As geopolitical tensions intensify, a key question for India Inc CFOs is how to navigate through uncertainties. Based on my interactions with leading CFOs, here are practical insights into how India Inc is managing risks and adapting to an increasingly multipolar world.",https://cfo.economictimes.indiatimes.com/news/strategy-operations/navigating-indias-cfo-landscape-in-a-multipolar-world/132005853,"26 Jun 2026, 08:21"
Markets & Macro,ETCFO Policy,"RBI's dollar inflow measures buy time, but external risks remain","The Reserve Bank of India's recent measures to boost dollar inflows are a temporary fix, economists warn. While these steps aim to stabilize the rupee now, the country must strengthen its balance of payments over the next three to five years. Otherwise, as foreign currency borrowings and deposits ma",https://cfo.economictimes.indiatimes.com/news/policy/rbis-dollar-inflow-measures-buy-time-but-external-risks-remain/132061461,"29 Jun 2026, 08:07"
Policy & Regulation,ETCFO Policy,"Corporate Mitra scheme to commence with 2,000 participants","Corporate Mitras will provide affordable support to Micro, Small and Medium Enterprises (MSMEs) in various areas, including regulatory compliance, GST, accounting, financial guidance, cost accounting and secretarial services.",https://cfo.economictimes.indiatimes.com/news/policy/launch-of-corporate-mitra-scheme-empowering-2000-young-participants-across-india/132027726,"27 Jun 2026, 08:16"
Strategic Signals,ETCFO Policy,Eighth Pay Panel may stay cautious on fitment factor,"While the Commission hasn't yet finalised its recommendations, early discussions suggest that the fitment factor could remain close to the 2.57 multiplier adopted by the Seventh Pay Commission, even as employee unions continue to push for a higher revision.",https://cfo.economictimes.indiatimes.com/news/policy/eighth-pay-panel-may-stay-cautious-on-fitment-factor/132014655,"26 Jun 2026, 17:00"
Markets & Macro,ETCFO Policy,"RBI issues final norms to expand credit derivatives market, allows wider CDS use","The Reserve Bank of India (RBI) has issued the final directions for expanding the country's credit derivatives market, paving the way for wider use of instruments such as Credit Default Swaps (CDS) and total return swaps, as per a statement by the apex bank on Thursday.",https://cfo.economictimes.indiatimes.com/news/policy/rbi-issues-final-norms-to-expand-credit-derivatives-market-allows-wider-cds-use/132013318,"26 Jun 2026, 15:52"
Markets & Macro,ETCFO Policy,"RBI opens term money market to AIFIs, housing finance companies","The Reserve Bank of India has opened the term money market to All India Financial Institutions and housing finance companies, allowing them to borrow and lend. Prudential borrowing limits for primary dealers have also been significantly increased. These moves aim to deepen market participation and i",https://cfo.economictimes.indiatimes.com/news/policy/rbi-opens-term-money-market-to-aifis-housing-finance-companies/132009081,"26 Jun 2026, 12:03"
Markets & Macro,ETCFO Policy,"RBI draft directions open term money market to NBFCs, AIFIs and corporates to deepen liquidity","RBI has proposed opening the term money market to NBFCs, AIFIs and corporates and raising borrowing flexibility for primary dealers, as the central bank seeks to deepen liquidity and broaden participation in India's short-term funding markets.",https://cfo.economictimes.indiatimes.com/news/policy/rbi-draft-directions-open-term-money-market-to-nbfcs-aifis-and-corporates-to-deepen-liquidity/132006534,"26 Jun 2026, 09:07"
Markets & Macro,ETCFO Policy,RBI's dollar push puts bank treasury desks at the centre of funding strategy,"The Reserve Bank of India's recent measures to attract foreign currency inflows are placing treasury functions at the centre of banks' funding and balance sheet decisions, with lenders relying on treasury teams to manage foreign currency mobilisation, hedging, liquidity and deployment under the temp",https://cfo.economictimes.indiatimes.com/news/policy/rbis-dollar-push-puts-bank-treasury-desks-at-the-centre-of-funding-strategy/131991174,"25 Jun 2026, 16:30"
Markets & Macro,ETCFO Policy,RBI to raise large exposure limit for upper layer NBFC-IFCs to 45% from 35% of eligible capital base,"The Reserve Bank of India has boosted lending limits for top infrastructure finance firms, allowing them to extend up to 45% of their capital to connected borrowers, a significant increase from 35%. This move aims to support the crucial infrastructure sector.",https://cfo.economictimes.indiatimes.com/news/policy/rbi-to-raise-large-exposure-limit-for-upper-layer-nbfc-ifcs-to-45-from-35-of-eligible-capital-base/131984859,"25 Jun 2026, 11:46"
