section,source,title,summary,link,published_at
Strategic Signals,The Diplomat,"Amid the Afghanistan-Pakistan Conflict, India-Taliban Diplomatic Ties Are Strengthening",India’s diplomatic outreach to the Taliban has increased tremendously over the last year.,https://thediplomat.com/2026/07/amid-the-afghanistan-pakistan-conflict-india-taliban-diplomatic-ties-are-strengthening/,"15 Jul 2026, 22:08"
Geopolitics,The Diplomat,China Can’t Talk About Birth Rates Without Talking About Rural Pensions,"The need to support elderly parents, particularly in rural areas, is an underappreciated factor in China's declining birth rate.",https://thediplomat.com/2026/07/china-cant-talk-about-birth-rates-without-talking-about-rural-pensions/,"15 Jul 2026, 21:13"
Strategic Signals,The Diplomat,The Film ‘Satluj’ Revisits a Turbulent Chapter in India’s Counterinsurgency History,A biopic on human rights activist Jaswant Singh Khalra puts the spotlight on thousands of enforced disappearances and secret cremations carried out by the Punjab Police.,https://thediplomat.com/2026/07/the-film-satluj-revisits-a-turbulent-chapter-in-indias-counterinsurgency-history/,"15 Jul 2026, 18:52"
Strategic Signals,The Diplomat,Pakistan’s Operation Shaban Targets Both the TTP and BLA in Balochistan,"Operation Shaban is in response to a deadly terrorist attack on July 7 in the Mangi Dam area, which claimed the lives of 27 police personnel.",https://thediplomat.com/2026/07/pakistans-operation-shaban-targets-both-the-ttp-and-bla-in-balochistan/,"15 Jul 2026, 14:28"
Geopolitics,War on the Rocks,Reading through the Lines of the FY2027 NDAA,"The relationship between Congress and the Pentagon over the past year has been marked by public disagreements and frustrations over lawmakers’ concerns about the Iran War, and by what some lawmakers view as politically motivated firings of top military leaders. In many ways, the House and Senate ver",https://warontherocks.com/cogs-of-war/reading-through-the-lines-of-the-fy2027-ndaa/,"16 Jul 2026, 08:00"
Geopolitics,War on the Rocks,The Peace That Redistributes War: What Camp David Reveals About Lebanon and Iran,"Nothing reveals truths more effectively than patterns. If you can identify a pattern, you can see what actions conceal, what statements leave unsaid, and what agreements postpone. Peace treaties and the negotiations surrounding them are rarely analyzed in this way, even though they may exhibit patte",https://warontherocks.com/the-peace-that-redistributes-war-what-camp-david-reveals-about-lebanon-and-iran/,"16 Jul 2026, 07:30"
Strategic Signals,War on the Rocks,Academia’s Critical Role in Developing an Economic Security Workforce,"Editor’s note: This is the tenth article in an 11-part series examining how the United States should organize, lead, and integrate economic statecraft into strategy, defense practice, and the broader national security ecosystem. The special series is brought to you by the Potomac Institute for Polic",https://warontherocks.com/academias-critical-role-in-developing-an-economic-security-workforce/,"16 Jul 2026, 07:15"
Strategic Signals,War on the Rocks,One Size Doesn’t Fit All: The Many Faces of Africa’s Foreign Fighters,"In 2020, Austin Doctor wrote, “The Looming Influx of Foreign Fighters in Sub-Saharan Africa,” in which he predicted the region would see an influx of foreign fighters to aid Islamist extremist groups. Six years later, we asked Austin to revisit his arguments.Image: African Union Mission in Somalia (",https://warontherocks.com/one-size-doesnt-fit-all-the-many-faces-of-africas-foreign-fighters/,"15 Jul 2026, 17:30"
Geopolitics,War on the Rocks,"MOLLE, PALS, and the Empty Loops of America’s Civil-Military Divide","Editor’s note: This is the third article in a limited series celebrating American defense technologies born from wartime and their effects on broader national security, politics, and society. This series will run for several weeks to commemorate America’s 250th anniversary, and winners will be selec",https://warontherocks.com/cogs-of-war/molle-pals-and-the-empty-loops-of-americas-civil-military-divide/,"15 Jul 2026, 08:00"
Strategic Signals,War on the Rocks,Before the Next Mythos Moment: The Case for an AI Threat Fusion Center,"Earlier this spring, Claude’s developers found the cyber potential of Anthropic’s model, Mythos 5, hazardous enough to pump the brakes on model release, creating the Project Glasswing collaboration to give cyber defenders the upper hand through controlled access to the model. Despite these efforts, ",https://warontherocks.com/before-the-next-mythos-moment-the-case-for-an-ai-threat-fusion-center/,"15 Jul 2026, 07:30"
Energy & Infrastructure,War on the Rocks,Breaking America’s Promise to Pacific Island Veterans,"In January, Robson Henry died at the age of 66. Chances are, you have never heard of Henry. He was not famous, rich, or powerful. In many ways, Henry was no different from the thousands of young men and women who, at the age of 18, chose to serve by enlisting in the U.S. Army. Nor does the fact that",https://warontherocks.com/breaking-americas-promise-to-pacific-island-veterans/,"15 Jul 2026, 07:15"
Geopolitics,War on the Rocks,NATO’s Unity on Paper and Fractures Beneath the Surface,"On July 7-8, NATO held its 36th official summit in Ankara, Turkey. There were several consequential topics to discuss at this year’s meeting, chief among them the wars in Ukraine and Iran and the uncertain future of European defense and security. We asked five experts to assess the outcomes of the s",https://warontherocks.com/natos-unity-on-paper-and-fractures-beneath-the-surface/,"14 Jul 2026, 18:00"
Policy & Regulation,CSIS,The Bio-Pharma Industry and Society,"The Bio-Pharma Industry and Society Listing Summary Please join the CSIS Global Health Policy Center on March 17, from 10:00am – 11:30am, for an exploration of how private bio-pharmaceutical firms can better support the critically important societal goals of improved affordability, access, quality, ",https://www.csis.org/events/bio-pharma-industry-and-society,"03 Mar 2016, 20:36"
Policy & Regulation,CSIS,The FY2017 Defense Budget and Strategic Outlook,"The FY2017 Defense Budget and Strategic Outlook Listing Summary Please join the CSIS International Security Program for a half-day Defense360 conference on the recently released FY2017 defense budget request and strategic priorities. Drupal Admin Mon, 02/29/2016 - 13:48 Featured Image Image Contribu",https://www.csis.org/events/fy2017-defense-budget-and-strategic-outlook,"29 Feb 2016, 18:48"
Policy & Regulation,CSIS,2016 U.S.-Japan Security Seminar,"2016 U.S.-Japan Security Seminar Listing Summary Michael J. Green interviews JIIA President Yoshiji Nogami Drupal Admin Fri, 02/26/2016 - 12:54 Featured Image Image Contributors Michael J. Green Programs & Projects Japan Chair Parent Geopolitics and Foreign Policy Featured Image AdobeStock_179685887",https://www.csis.org/events/2016-us-japan-security-seminar,"26 Feb 2016, 17:54"
Energy & Infrastructure,CSIS,The Future of the Grid—A View from ARPA-E,"The Future of the Grid—A View from ARPA-E Listing Summary The CSIS Energy and National Security Program is pleased to invite you to a discussion with Ellen Williams, Director of ARPA-E, the Advanced Research Projects Agency-Energy. Drupal Admin Thu, 02/25/2016 - 14:15 Featured Image Image Contributo",https://www.csis.org/events/future-grid-view-arpa-e,"25 Feb 2016, 19:15"
Geopolitics,CSIS,"Statesmen's Forum: Wang Yi, Minister of Foreign Affairs, PRC","Statesmen's Forum: Wang Yi, Minister of Foreign Affairs, PRC Listing Summary Please watch the live webcast of a discussion on Chinese foreign policy and US-China Relations Drupal Admin Fri, 02/19/2016 - 17:13 Featured Image Image Contributors John J. Hamre Christopher K. Johnson Downloads Download T",https://www.csis.org/events/statesmens-forum-wang-yi-minister-foreign-affairs-prc,"19 Feb 2016, 22:13"
Geopolitics,CSIS,"China Reality Check: China's ""Internet Sovereignty"" Initiative: Origins and Consequences","China Reality Check: China's ""Internet Sovereignty"" Initiative: Origins and Consequences Listing Summary Please join us for a discussion on China’s initiative to promote Internet sovereignty as a key governing concept of the global Internet. Drupal Admin Tue, 02/16/2016 - 11:49 Featured Image Image ",https://www.csis.org/events/china-reality-check-chinas-internet-sovereignty-initiative-origins-and-consequences,"16 Feb 2016, 16:49"
Policy & Regulation,CSIS,"Statesmen's Forum: The Right Honourable Theresa May, MP, Home Secretary, United Kingdom","Statesmen's Forum: The Right Honourable Theresa May, MP, Home Secretary, United Kingdom Listing Summary Please join the CSIS International Security Program for a discussion with UK Home Secretary Theresa May on counter-terrorism policy. Drupal Admin Fri, 02/12/2016 - 16:08 Featured Image Image Contr",https://www.csis.org/events/statesmens-forum-right-honourable-theresa-may-mp-home-secretary-united-kingdom,"12 Feb 2016, 21:08"
Strategic Signals,CSIS,Strategic Opportunities in the Indo-Asia-Pacific with Admiral Harry B. Harris,"Strategic Opportunities in the Indo-Asia-Pacific with Admiral Harry B. Harris Listing Summary Please join us for a discussion with Admiral Harry B. Harris, Commander, U.S. Pacific Command, on the Strategic Opportunities in the Indo-Asia-Pacific. Drupal Admin Tue, 01/26/2016 - 11:20 Featured Image Im",https://www.csis.org/events/strategic-opportunities-indo-asia-pacific-admiral-harry-b-harris,"26 Jan 2016, 16:20"
Geopolitics,Al Jazeera,"Vance says Epstein had connections to US, Israeli intelligence",The US vice president says Epstein 'seemed' to be connected to elements of the 'Israeli deep state'.,https://www.aljazeera.com/news/2026/7/16/vance-says-epstein-had-connections-to-us-israeli-intelligence?traffic_source=rss,"16 Jul 2026, 08:37"
Geopolitics,Al Jazeera,US releases video of strikes on Iran,US releases video of strikes on Iran,https://www.aljazeera.com/video/newsfeed/2026/7/16/us-releases-video-of-strikes-on-iran?traffic_source=rss,"16 Jul 2026, 08:26"
Geopolitics,Al Jazeera,"US strikes Iran, tanker, as Tehran hits Kuwait, Jordan: What’s the latest",Strikes have hit closer to Tehran for the first time since the latest wave of attacks started.,https://www.aljazeera.com/news/2026/7/16/us-strikes-iran-tanker-as-tehran-hits-kuwait-jordan-whats-the-latest?traffic_source=rss,"16 Jul 2026, 08:23"
Strategic Signals,Al Jazeera,Greece pins hopes on heat-seeking satellites to predict wildfires,"The country, which suffers each summer, builds an arsenal of high-tech surveillance to help pre-position firefighters.",https://www.aljazeera.com/news/2026/7/16/greece-pins-hopes-on-heat-seeking-satellites-to-predict-wildfires?traffic_source=rss,"16 Jul 2026, 08:21"
Geopolitics,Al Jazeera,US launches new attacks on Iran as Tehran targets Gulf sites,Iran's Health Ministry has said at least 35 people have been killed and more than 300 injured since fighting resumed.,https://www.aljazeera.com/news/2026/7/16/us-launches-new-attacks-on-iran-as-tehran-targets-gulf-sites?traffic_source=rss,"16 Jul 2026, 08:18"
Strategic Signals,Al Jazeera,Watch FIFA World Cup: Argentina rallies past England to reach final,"Latest match highlights, reaction and previews from the FIFA World Cup 2026 in North America.",https://www.aljazeera.com/video/2026/7/16/video-world-cup-2026-highlights?traffic_source=rss,"16 Jul 2026, 08:15"
Markets & Macro,Al Jazeera,‘Escaping Beijing’: Why some young Chinese are quitting the capital,A slowing economy and rising prices are making it harder for young Chinese to thrive in the city.,https://www.aljazeera.com/news/2026/7/16/escaping-beijing-why-some-young-chinese-are-quitting-the-capital?traffic_source=rss,"16 Jul 2026, 08:10"
Strategic Signals,Al Jazeera,Pete Hegseth says US military to start testosterone screening for over 30s,US Defense Secretary says plan is 'about restoring and optimising ... natural capabilities' of troops.,https://www.aljazeera.com/news/2026/7/16/pete-hegseth-says-us-military-to-start-testosterone-screening-for-over-30s?traffic_source=rss,"16 Jul 2026, 07:57"
Strategic Signals,ETCFO Top Stories,"NCLAT upholds NFRA order, says 'statutory audit is not a ceremonial exercise'","Tribunal dismisses appeal against NFRA's disciplinary action, holding that auditors cannot rely solely on management representations or anticipated settlements. Ruling underscores the mandatory nature of auditing standards, professional scepticism and robust audit documentation.",https://cfo.economictimes.indiatimes.com/news/tax-legal-accounting/nclat-ruling-reinforces-importance-of-statutory-audits-not-a-ceremonial-exercise/132430968,"16 Jul 2026, 11:33"
Policy & Regulation,ETCFO Top Stories,State Bank of India appoints former LIC finance head Sunil Agrawal as CFO,"State Bank of India has named Sunil Agrawal its new Chief Financial Officer, bringing with him a wealth of experience from his 27 years at LIC. His role as key managerial personnel highlights his expertise in financial planning and regulatory matters. This significant appointment aligns with ongoing",https://cfo.economictimes.indiatimes.com/news/leadership/state-bank-of-india-appoints-former-lic-cfo-sunil-agrawal-as-new-finance-chief/132428225,"16 Jul 2026, 08:15"
Strategic Signals,ETCFO Top Stories,Infosys CFO Jayesh Sanghrajka tops IT sector CFO pay in FY26; Tech Mahindra's Rohit Anand next,"An ETCFO analysis of annual reports of the country's largest IT companies shows Infosys CFO Jayesh Sanghrajka emerged as the highest-paid finance chief among companies that have disclosed remuneration details, followed by Tech Mahindra's Rohit Anand and Wipro's Aparna Iyer.",https://cfo.economictimes.indiatimes.com/news/leadership/infosys-cfo-jayesh-sanghrajka-tops-it-sector-cfo-pay-in-fy26-wipros-aparna-iyer-next/132413241,"15 Jul 2026, 16:18"
Geopolitics,ETCFO Top Stories,"GSTAT token mechanism safeguards appeal rights, but experts warn legal ambiguity could trigger fresh litigation","Tax experts say GSTAT's token-based appeal mechanism is a pragmatic safeguard against portal-related disruptions, but caution that its long-term success will depend on statutory clarity, robust digital safeguards and a resilient e-filing system to prevent fresh litigation.",https://cfo.economictimes.indiatimes.com/news/tax-legal-accounting/gstat-token-system-safeguards-for-taxpayer-appeal-rights-amid-concerns-over-legal-clarity/132406374,"15 Jul 2026, 10:14"
Policy & Regulation,ETCFO Top Stories,Exclusive: MCA flags jurisdiction issue over ICAI's Global Networking Guidelines,Ministry's observations centre on who should issue the framework; ICAI pauses rollout and president is likely to discuss the matter with MCA officials.,https://cfo.economictimes.indiatimes.com/news/tax-legal-accounting/icai-halts-global-networking-guidelines-amid-concerns-from-mca/132369718,"14 Jul 2026, 07:00"
Strategic Signals,ETCFO Top Stories,"AI, automation redraw finance jobs: FP&A leads hiring as routine accounting roles continue to shrink",The finance function has seen a continued transformation over the last couple of years and much of that is being driven by automation rather than artificial intelligence (AI). Organisations are either no longer hiring or are actively cutting repetitive job roles that are now handed over to automatio,https://cfo.economictimes.indiatimes.com/news/strategy-operations/ai-automation-redraw-finance-jobs-fpa-leads-hiring-as-routine-accounting-roles-continue-to-shrink/132379031,"14 Jul 2026, 07:38"
Geopolitics,ETCFO Top Stories,CBIC allows self-certification for origin declarations under India-UK CETA,"The Central Board of Indirect Taxes and Customs (CBIC) has issued a circular operationalising the self-certification framework for origin declarations under the India-UK Comprehensive Economic and Trade Agreement (CETA), which comes into force on July 15, 2026. The move replaces the conventional sys",https://cfo.economictimes.indiatimes.com/news/tax-legal-accounting/cbic-notifies-self-certification-framework-for-origin-declarations-under-india-uk-ceta/132382818,"14 Jul 2026, 12:34"
Policy & Regulation,ETCFO Top Stories,GST law panel clears proposal to shield buyers' input tax credit from supplier defaults,A GST Council proposal will protect buyers from losing input tax credit. This protection applies if suppliers fail to deposit taxes with the government.,https://cfo.economictimes.indiatimes.com/news/tax-legal-accounting/gst-law-committee-proposes-safeguards-for-buyers-input-tax-credit/132354815,"13 Jul 2026, 07:56"
Policy & Regulation,ETCFO Policy,NSE got SEBI's nod to launch derivatives on Nifty India FPI 150 Index from August 12,"The National Stock Exchange of India (NSE) has received SEBI's approval to launch derivatives on the Nifty India FPI 150 Index (NIFTYFPI) from August 12, as per a statement by the stock exchange.",https://cfo.economictimes.indiatimes.com/news/policy/nse-got-sebis-nod-to-launch-derivatives-on-nifty-india-fpi-150-index-from-august-12/132433658,"16 Jul 2026, 14:25"
Markets & Macro,ETCFO Policy,"The Rs 1.5 lakh crore bank guarantee link that could rattle NSE, BSE and MCX","Revised RBI norms on bank guarantees could squeeze proprietary traders by sharply reducing leverage and raising funding costs, potentially hurting derivatives trading volumes. Analysts say the move, along with higher STT, may weigh on the valuations of exchange operators such as NSE, BSE and MCX.",https://cfo.economictimes.indiatimes.com/news/policy/the-rs-1-5-lakh-crore-bank-guarantee-link-that-could-rattle-nse-bse-and-mcx/132431966,"16 Jul 2026, 12:24"
Strategic Signals,ETCFO Policy,"India, Brazil agree to cooperate on digital labour platforms, skills, social protection: Union minister Shobha Karandlaje","During the meeting, the Indian side shared details of the country's Digital Public Infrastructure for labour, including the National Career Service Portal and the e-Shram Portal, described as the world's largest database of informal sector workers.",https://cfo.economictimes.indiatimes.com/news/policy/india-brazil-agree-to-cooperate-on-digital-labour-platforms-skills-social-protection-union-minister-shobha-karandlaje/132428152,"16 Jul 2026, 08:07"
Markets & Macro,ETCFO Policy,"RBI governor meets bank CEOs to discuss AI, geopolitics and ECL guidelines",Central bank governor Sanjay Malhotra met bank chief executives on Tuesday. Geopolitical complexities and artificial intelligence were key discussion points. New expected credit loss guidelines also featured in the important talks. Some banks shared their FCNR(B) scheme inflow estimates with the gov,https://cfo.economictimes.indiatimes.com/news/policy/rbi-governor-meets-bank-ceos-to-discuss-ai-geopolitics-and-ecl-guidelines/132409289,"15 Jul 2026, 13:00"
Strategic Signals,ETCFO Policy,Raising bank stakes gets easier for DIIs,"The Reserve Bank of India announces proposed amendments to bank shareholding regulations, designed to more effectively facilitate investments from domestic institutional investors. Additionally, the central bank emphasizes stronger disclosure and monitoring protocols. The new directives will provide",https://cfo.economictimes.indiatimes.com/news/policy/raising-bank-stakes-gets-easier-for-diis/132408797,"15 Jul 2026, 12:30"
Policy & Regulation,ETCFO Policy,Sebi exempts Mehta Family Trust from Saurashtra Cement open offer,Sebi exempted Mehta Family Trust from an open offer for Saurashtra Cement shares. This exemption allows internal family reorganisation and succession planning. Jay Mahendra Mehta and Juhi Chawla Mehta are trustees of the family trust. The transaction involves indirect acquisition of shares and votin,https://cfo.economictimes.indiatimes.com/news/policy/sebi-exempts-mehta-family-trust-from-saurashtra-cement-open-offer/132407936,"15 Jul 2026, 11:48"
Markets & Macro,ETCFO Policy,India Inc's overseas fundraise picks up pace in May to $4.7 bn: RBI data,"Indian companies' external commercial borrowings proposals saw a significant jump in May. Total filings reached USD 4.74 billion, a notable increase from April's figures. Prominent firms like Indian Railway Finance Corporation and NTPC filed substantial borrowing intentions. Kisetsu Saison Finance a",https://cfo.economictimes.indiatimes.com/news/policy/india-incs-overseas-fundraise-picks-up-pace-in-may-to-4-7-bn-rbi-data/132407714,"15 Jul 2026, 11:35"
Policy & Regulation,ETCFO Policy,"SEBI introduces stricter service rules, investment norms for employees","The Securities and Exchange Board of India (SEBI) has tightened its employee conduct framework by notifying sweeping changes to its service regulations, introducing stricter conflict-of-interest safeguards, tighter investment restrictions and enhanced disclosure requirements.",https://cfo.economictimes.indiatimes.com/news/policy/sebi-introduces-stricter-service-rules-investment-norms-for-employees/132366263,"13 Jul 2026, 17:32"
