section,source,title,summary,link,published_at
Strategic Signals,Financial Times World,Bank boss contests FCA fine for not revealing Venezuela and US penalties,BancTrust’s Carlos Fuenmayor accuses watchdog of impinging on freedom of expression,https://www.ft.com/content/b9e8bf9e-85c3-426b-81a0-2c3d5f2260b8,"07 Jun 2026, 11:00"
Markets & Macro,Financial Times World,How high will the Iran war push US inflation?,Market Questions is the FT’s guide to the week ahead,https://www.ft.com/content/994938d4-c97f-448e-a0b9-fdc55b9697cb,"07 Jun 2026, 11:00"
Strategic Signals,Financial Times World,The coming rise of anti-AI populism,Anxiety about the technology is set to generate a political backlash,https://www.ft.com/content/b4429ea0-4a0a-4a28-96f5-debf4f3eb339,"07 Jun 2026, 11:00"
Geopolitics,Financial Times World,Russian drone hits nuclear fuel site near Chernobyl,"Radiation levels remain ‘within normal limits’, says Ukraine’s state nuclear company",https://www.ft.com/content/3c109ff1-e1cd-42c9-86b2-5e5bfb4671e5,"07 Jun 2026, 10:37"
Strategic Signals,Financial Times World,"Walmart tells workers that AI will improve their jobs, not steal them",Retailer’s embrace of artificial intelligence comes amid anxiety that the technology will create mass redundancies,https://www.ft.com/content/d2155669-cead-4716-8d70-91df69b82977,"07 Jun 2026, 10:00"
Markets & Macro,Financial Times World,Voters sour on Trump’s handling of inflation and grocery prices — FT poll,US president blamed for high cost of living as Iran war deepens discontent,https://www.ft.com/content/e8a0a845-c812-4158-ba1b-85613719f861,"07 Jun 2026, 10:00"
Strategic Signals,Financial Times World,US universities boost market risk as financial pressures mount,Trump administration funding cuts and weak private equity performance prompt a search for higher endowment returns,https://www.ft.com/content/da7ce472-44d8-4b7e-8bed-c007df3e1b92,"07 Jun 2026, 10:00"
Geopolitics,Financial Times World,Britain’s questionable reliance on Palantir,"Government should use the best technology for any task, but be wary of ‘lock-ins’",https://www.ft.com/content/e54519ad-9f88-45b3-a4e8-dd64cefceb8f,"07 Jun 2026, 09:09"
Strategic Signals,Financial Times Companies,Incyte nears up to $2bn deal for blood disorder biotech Star,Midsized drug manufacturers are supplementing pipelines and scaling up in competition with Big Pharma,https://www.ft.com/content/a438f9c6-22bd-4dd3-967e-007c95d64d37,"07 Jun 2026, 10:00"
Policy & Regulation,Financial Times Companies,Bouygues Telecom consortium agrees to buy Patrick Drahi’s SFR for €20.35bn,Bid from group including Orange and Free-Iliad faces showdown with antitrust regulators in Paris and Brussels,https://www.ft.com/content/64686829-95e6-4af2-8568-579684606403,"07 Jun 2026, 09:13"
Strategic Signals,The Hindu BusinessLine,NTA releases NEET-UG 2026 re-exam city intimation slip; test on June 21,Re-examination will be conducted in pen-and-paper mode from 2 pm to 5:15 pm across 551 cities in India and 14 cities abroad,https://www.thehindubusinessline.com/news/national/nta-releases-neet-ug-2026-re-exam-city-intimation-slip-test-on-june-21/article71073008.ece,"07 Jun 2026, 17:32"
Policy & Regulation,The Hindu BusinessLine,A pragmatic monetary policy,The policy keeps in mind the West Asian crisis and its impact on the Indian economy,https://www.thehindubusinessline.com/opinion/a-pragmatic-monetary-policy/article71073011.ece,"07 Jun 2026, 17:31"
Strategic Signals,The Hindu BusinessLine,India emerges as a new force in global dry bulk shipping as iron ore imports surge,"Greece-based shipping analytics firm Signal Ocean reports that India imported a record 5 million tonnes of iron ore in Q1 2026, the highest quarterly volume in three years",https://www.thehindubusinessline.com/economy/india-emerges-as-a-new-force-in-global-dry-bulk-shipping-as-iron-ore-imports-surge/article71059548.ece,"07 Jun 2026, 17:31"
Strategic Signals,The Hindu BusinessLine,Nepal backs bilateral path with India to resolve border row; calls for partnership unconstrained by anxieties of past,Three-day trip to New Delhi from Friday came against the backdrop of a raging controversy triggered by Nepalese Prime Minister Balendra Shah's recent remarks on the boundary row between the two sides,https://www.thehindubusinessline.com/news/nepal-backs-bilateral-path-with-india-to-resolve-border-row-calls-for-partnership-unconstrained-by-anxieties-of-past/article71072974.ece,"07 Jun 2026, 17:21"
Markets & Macro,The Hindu BusinessLine,Professional forecasters’ FY27 real GDP estimate of 6.5% a shade lower than RBI,"For FY28, the SPF projected real GDP growth and CPI inflation at 6.9% and 4.5%, respectively",https://www.thehindubusinessline.com/economy/professional-forecasters-fy27-real-gdp-estimate-of-65-a-shade-lower-than-rbi/article71072953.ece,"07 Jun 2026, 17:11"
Geopolitics,The Hindu BusinessLine,Tata Motors CV redraws strategy to reduce dependence on truck cycle: Chandrasekaran,"Tata Motors is revamping its commercial vehicle strategy to mitigate trucking cycle volatility, focusing on software, services, exports, and clean mobility amid global geopolitical disruptions",https://www.thehindubusinessline.com/companies/tata-motors-cv-redraws-strategy-to-reduce-dependence-on-truck-cycle-chandrasekaran/article71072841.ece,"07 Jun 2026, 16:51"
Geopolitics,The Hindu BusinessLine,India must not let US Section 301 threats push it into a lopsided trade deal: Experts,"While Washington may be ready to ‘lock-in’ additional tariffs on India at around 18%, trade experts warn it won’t buy immunity from future American protectionism",https://www.thehindubusinessline.com/economy/india-must-not-let-us-section-301-threats-push-it-into-a-lopsided-trade-deal-experts/article71072860.ece,"07 Jun 2026, 16:51"
Strategic Signals,The Hindu BusinessLine,Sustainable aviation fuel production volumes still disappointing: IATA DG Willie Walsh,The EU and the UK have mandated e-SAF production of around 0.6 million tonne by 2030,https://www.thehindubusinessline.com/economy/logistics/sustainable-aviation-fuel-production-volumes-still-disappointing-iata-dg-willie-walsh/article71072857.ece,"07 Jun 2026, 16:41"
Strategic Signals,Times of India Business,Dharavi redevelopment project: Why analyst calls it one of India's biggest real estate execution challenges,"The Adani Group faces a massive execution challenge with the Dharavi Redevelopment Project, aiming to rehabilitate over one million residents and build 125,000 housing units in seven to eight years. This ambitious urban regeneration program, one of the world's largest, also includes significant infr",https://timesofindia.indiatimes.com/real-estate/news/dharavi-redevelopment-project-why-analyst-calls-it-one-of-indias-biggest-real-estate-execution-challenges/articleshow/131565892.cms,"07 Jun 2026, 16:51"
Energy & Infrastructure,Times of India Business,"Oil shock fears overdone, India can grow above 8%: Neelkanth Mishra","India's economic growth is robust, with concerns over high crude oil prices being exaggerated, according to World Bank Executive Director Neelkanth Mishra. He highlighted strong domestic demand and refining margins as buffers, suggesting growth could exceed 8% and remain in the 7.5-8% range even wit",https://timesofindia.indiatimes.com/business/india-business/oil-shock-fears-overdone-india-can-grow-above-8-neelkanth-mishra/articleshow/131564566.cms,"07 Jun 2026, 15:10"
Strategic Signals,Times of India Business,"Maharashtra onion farmers demand Rs 3,000/quintal, say relief measures fall short","Maharashtra farmers welcomed relaxed onion procurement rules but demand a minimum support price of Rs 3,000 per quintal, stating current rates of Rs 1,580 are below production costs. They seek transparent procurement and compensation for past losses, arguing that rule changes alone won't resolve the",https://timesofindia.indiatimes.com/business/india-business/maharashtra-onion-farmers-demand-rs-3000/quintal-say-relief-measures-fall-short/articleshow/131563922.cms,"07 Jun 2026, 14:24"
Strategic Signals,Times of India Business,Mango Mayday: Dark spots on produce threaten Himsagar export shipments,"West Bengal's Himsagar mango exports face a setback due to dark spots, a weather-induced disease affecting fruit quality. Continuous rain followed by high temperatures during the bagging stage led to the issue, potentially impacting overseas shipments. Despite this, exporters remain hopeful about fu",https://timesofindia.indiatimes.com/business/india-business/mango-mayday-dark-spots-on-produce-threaten-himsagar-export-shipments/articleshow/131563162.cms,"07 Jun 2026, 12:37"
Energy & Infrastructure,Times of India Business,Saved by the barrel: Why crude hasn't hit the $200 mark,"Despite fears of $200 oil following Strait of Hormuz disruptions, prices remain below $100. This resilience is attributed to increased US exports, weaker Chinese demand, and alternative supply routes. While some shipping through the strait continues, overall transits are down. Emergency measures and",https://timesofindia.indiatimes.com/business/international-business/saved-by-the-barrel-why-crude-hasnt-hit-the-200-mark/articleshow/131562306.cms,"07 Jun 2026, 11:08"
Energy & Infrastructure,Times of India Business,"LPG gets Rs 29 costlier: Check the latest cylinder rates in Delhi, Mumbai and other cities","Domestic cooking gas prices have increased by Rs 29 per cylinder, reaching Rs 942 in Delhi, marking the second revision in three months due to soaring global energy costs. This rise follows a previous Rs 60 hike and is part of a broader trend of fuel price increases, with petrol and diesel also seei",https://timesofindia.indiatimes.com/business/india-business/lpg-gets-rs-29-costlier-check-the-latest-cylinder-rates-in-delhi-mumbai-and-other-cities/articleshow/131561042.cms,"07 Jun 2026, 07:21"
Strategic Signals,Times of India Business,5 ways IBC transformed India's corporate rescue system over the past decade,,https://timesofindia.indiatimes.com/business/india-business/5-ways-ibc-transformed-indias-corporate-rescue-system-over-the-past-decade/articleshow/131550100.cms,"06 Jun 2026, 16:55"
Energy & Infrastructure,Times of India Business,'US firms benefit from Hormuz closure': Russian oil company chief's big claim amid Iran war,"Rosneft CEO Igor Sechin stated American energy firms are the primary beneficiaries of a Strait of Hormuz closure, warning of long-term damage to oil demand and a boost for alternatives. He also highlighted global resource shortages and questioned OPEC+'s effectiveness, noting Russia's production dec",https://timesofindia.indiatimes.com/business/international-business/gained-non-competitive-advantages-rosneft-chief-says-us-energy-companies-were-biggest-winners-from-hormuz-disruption/articleshow/131550432.cms,"06 Jun 2026, 16:51"
Strategic Signals,Hindustan Times India,28-year-old Indian man from Telangana shot dead in US during pizza delivery: Cop,"Preliminary findings suggest that the pizza order may have been placed for a vacant apartment, prompting investigators to examine further",https://www.hindustantimes.com/india-news/28yearold-indian-man-from-telangana-shot-dead-in-us-during-pizza-delivery-cop-101780832328817.html,"07 Jun 2026, 17:08"
Strategic Signals,Hindustan Times India,"Indicators 'missing' in NFHS factsheet being monitored via national surveys, databases: Govt sources","Indicators 'missing' in NFHS factsheet being monitored via national surveys, databases: Govt sources",https://www.hindustantimes.com/india-news/indicators-missing-in-nfhs-factsheet-being-monitored-via-national-surveys-databases-govt-sources-101780830878914.html,"07 Jun 2026, 16:44"
Strategic Signals,Hindustan Times India,'Was busy exposing you': Teen investigator Sarthak Sidhant to CBSE for re-evaluation deadline extension,"“Can u please extend the deadline please because i was busy this week exposing you,” Sarthak Sidhant posted as a reply to the CBSE's post.",https://www.hindustantimes.com/india-news/was-busy-exposing-you-teen-investigator-sarthak-sidhant-to-cbse-on-re-evaluation-deadline-101780829642255.html,"07 Jun 2026, 16:39"
Strategic Signals,Hindustan Times India,"Anshul Kuncha, Hyderabad man shot dead in US, was a data expert: How weekend pizza delivery turned fatal",Anshul Kuncha earned a Master’s degree in Business Analytics from Drexel University’s LeBow College of Business in United States in March 2024.,https://www.hindustantimes.com/india-news/who-was-anshul-kuncha-indian-hyderabad-man-shot-dead-in-united-states-philadelphia-pizza-delivery-101780825323729.html,"07 Jun 2026, 16:15"
Energy & Infrastructure,Hindustan Times India,DMK's Stalin says Vijay's TVK government may not last even three months,Stalin had earlier said that TVK rode to power largely through social media platforms such as Instagram and lacked a strong organisational structure.,https://www.hindustantimes.com/india-news/dmk-mk-stalin-doubts-vijay-tvk-government-may-not-last-even-three-months-paniyur-babu-tamil-nadu-101780826945870.html,"07 Jun 2026, 15:57"
Strategic Signals,Hindustan Times India,Let us build partnership not constrained by anxieties of past: Nepal foreign minister on India ties,Let us build partnership not constrained by anxieties of past: Nepal foreign minister on India ties,https://www.hindustantimes.com/india-news/let-us-build-partnership-not-constrained-by-anxieties-of-past-nepal-foreign-minister-on-india-ties-101780827409788.html,"07 Jun 2026, 15:46"
Strategic Signals,Hindustan Times India,"'Modi wants youth to make reels instead': Rahul Gandhi at meeting with Sarthak Sidhant, teen who probed CBSE","Sharing a video of his recent meeting with Sarthak Sidhant, Rahul Gandhi lauded the 18-year-old student for questioning the system and pursuing answers.",https://www.hindustantimes.com/india-news/modi-wants-youth-to-make-reels-instead-rahul-gandhi-hails-sarthak-sidhant-teen-who-probed-cbse-101780826330286.html,"07 Jun 2026, 15:43"
Geopolitics,Hindustan Times India,"With latest hike, LPG up by ₹89 in 3 months, Oppn recalls PM Modi's claims of ‘diversification’ amid West Asia war","Kharge said Modi government has increased domestic LPG prices by ₹530 in its 12 years: ""So why aren't BJP leaders sitting on the streets with cylinders now?""",https://www.hindustantimes.com/india-news/with-latest-hike-lpg-up-by-rs-89-in-3-months-oppn-recalls-pm-modis-claims-of-diversification-amid-west-asia-war-101780822747445.html,"07 Jun 2026, 15:32"
Strategic Signals,Indian Express Latest,Rafael Nadal on life after retirement: ‘I’m in a new phase’,,https://indianexpress.com/article/sports/tennis/rafael-nadal-life-after-retirement-new-phase-10728489/,"07 Jun 2026, 12:05"
Strategic Signals,Indian Express Latest,"Unidentified attackers hurl petrol bomb at car in Ludhiana, flee",,https://indianexpress.com/article/cities/chandigarh/ludhiana-petrol-bomb-attack-car-set-ablaze-haibowal-cctv-investigation-10728483/,"07 Jun 2026, 11:57"
Strategic Signals,Indian Express Latest,Praggnanandhaa even more dangerous than Magnus Carlsen: Pravin Thipsay,,https://indianexpress.com/article/sports/chess/praggnanandhaa-dangerous-magnus-carlsen-pravin-thipsay-norway-10728430/,"07 Jun 2026, 11:53"
Strategic Signals,Indian Express Latest,"Success Story | From Tapa Mandi to Chandigarh tech trailblazer, the growth of Beesolver",,https://indianexpress.com/article/cities/chandigarh/sumit-singh-beesolver-founderentrepreneur-chandigarh-success-story-10728470/,"07 Jun 2026, 11:52"
Strategic Signals,Indian Express Latest,I don’t have to change my personality: Shreyas on getting India captaincy gig,,https://indianexpress.com/article/sports/cricket/shreyas-iyer-india-t20-captain-personality-someone-else-shadow-10728436/,"07 Jun 2026, 11:46"
Strategic Signals,Indian Express Latest,Blood collection drops 43% at Mumbai’s Shatabdi Hospital; KEM gets notice over neonatal transfusion complaints,,https://indianexpress.com/article/cities/mumbai/blood-collection-drops-43-at-mumbais-shatabdi-hospital-kem-gets-notice-over-neonatal-transfusion-complaints-10728450/,"07 Jun 2026, 11:39"
Geopolitics,Indian Express Latest,"‘Extremist breeding ground’: Attacks in Israel leave 1 dead, minister lambasts country’s Arabs",,https://indianexpress.com/article/world/israel-west-bank-border-shooting-attacks-kokhav-yair-casualties-10728299/,"07 Jun 2026, 11:34"
Strategic Signals,Indian Express Latest,Why do sad songs feel heavier and more overwhelming when you’re already upset?,,https://indianexpress.com/article/lifestyle/feelings/why-do-sad-songs-feel-heavier-and-more-overwhelming-when-youre-already-upset-10545835/,"07 Jun 2026, 11:30"
Geopolitics,SCMP Asia,Which company could become the Chinese Pfizer? Here are analysts’ top picks,"A handful of Chinese biotechnology companies are expected to bring medications to consumers in Europe and the US under their own brand names within the next 10 to 15 years, according to policy and industry analysts. Amid China’s early-stage drug outlicensing boom, discussions have arisen among inves",https://www.scmp.com/business/china-business/article/3356232/which-company-could-become-chinese-pfizer-here-are-analysts-top-picks?utm_source=rss_feed,"07 Jun 2026, 11:00"
Geopolitics,SCMP Asia,"Park life: why China’s malls are building forests, waterfalls and sky walkways","Property developers are focusing on building shopping centres featuring lush greenery, gardens and water features in mainland China, as such spaces have become more attractive to shoppers and retailers than conventional high-density malls. “Consumers increasingly view retail destinations as places t",https://www.scmp.com/business/article/3356214/park-life-why-chinas-malls-are-building-forests-waterfalls-and-sky-walkways?utm_source=rss_feed,"07 Jun 2026, 02:30"
Markets & Macro,SCMP Asia,Why can’t investors buy the mainland’s hottest AI stocks via Stock Connect?,"Since 2014, the Stock Connect scheme has become a major channel for Hong Kong and international investors to buy stocks on the Chinese mainland. But cross-border traders have grown frustrated in recent months, as they have been unable to access a wave of blockbuster listings by AI companies on the m",https://www.scmp.com/business/markets/article/3356193/why-cant-investors-buy-mainlands-hottest-ai-stocks-stock-connect?utm_source=rss_feed,"07 Jun 2026, 02:30"
Markets & Macro,SCMP Asia,"‘It’s the wealth effect’: Hong Kong luxury malls thrive amid IPO gains, housing recovery","Hong Kong’s new status as the world’s top cross-border wealth hub, overtaking Switzerland, alongside a recovering local housing market and strong initial public offerings (IPOs), is translating into a boom for high-end malls, with landlords enjoying improved revenues and rents. Hard luxury and jewel",https://www.scmp.com/business/companies/article/3355967/its-wealth-effect-hong-kong-luxury-malls-thrive-amid-ipo-gains-housing-recovery?utm_source=rss_feed,"07 Jun 2026, 01:30"
Geopolitics,SCMP Asia,China will enhance regulation of programme trading: CSRC chairman,"Chinese authorities plan to enhance regulation of programme trading to clamp down on market misconduct, the head of the China Securities Regulatory Commission (CSRC) said on Saturday. Hedge funds and institutional investors are increasingly managing their portfolios in China via programme trading, w",https://www.scmp.com/business/banking-finance/article/3356217/china-will-enhance-regulation-programme-trading-csrc-chairman?utm_source=rss_feed,"06 Jun 2026, 11:51"
Policy & Regulation,SCMP Asia,Mainlanders can still open bank accounts in Hong Kong despite new rules: HKMA,"Mainland customers can still open bank accounts in Hong Kong, but banks must adopt stringent new checks to ensure their processes are “compliant and orderly”, the Hong Kong Monetary Authority (HKMA) said in a statement on Saturday. “The banking industry has implemented the new regulatory requirement",https://www.scmp.com/business/banking-finance/article/3356201/mainlanders-can-still-open-bank-accounts-hong-kong-despite-new-rules-hkma?utm_source=rss_feed,"06 Jun 2026, 07:24"
Strategic Signals,SCMP Asia,Chinese carriers seize two-thirds share of post-pandemic air routes,"Chinese carriers have captured an expanding slice of the international air travel market for routes connecting Chinese and overseas cities since the Covid-19 pandemic, according to data presented at an industry summit in Beijing on Friday. Local carriers currently held a 66.5 per cent market share c",https://www.scmp.com/business/china-business/article/3356169/chinese-carriers-seize-two-thirds-share-post-pandemic-air-routes?utm_source=rss_feed,"06 Jun 2026, 01:00"
Geopolitics,SCMP Asia,"Targeting US$610 billion longevity market, biotech firms race to reverse ageing","For Beijing-based METiS TechBio CEO Lai Tsai-ta, ageing is comparable to bugs building up in a complex software system – it happens once errors begin to accumulate in the genetic code of human cells, such as their DNA sequences. “Those errors can be reprogrammed. It becomes possible to use AI to rea",https://www.scmp.com/business/china-business/article/3356154/targeting-us610-billion-longevity-market-biotech-firms-race-reverse-ageing?utm_source=rss_feed,"06 Jun 2026, 00:00"
Geopolitics,Foreign Policy,Armenians Vote Under Russia’s Shadow,Trump and Putin are backing different players in a contested country.,https://foreignpolicy.com/2026/06/05/armenia-trump-russia-election-pashinyan-europe/,"06 Jun 2026, 01:44"
Energy & Infrastructure,Foreign Policy,The U.S. Economy Is Proving Remarkably Resilient,"Even in the face of tariffs and an energy crisis, the jobs report shows an economy that’s still humming.",https://foreignpolicy.com/2026/06/05/us-jobs-report-trump-economy-iran-energy-tariffs/,"05 Jun 2026, 20:50"
Strategic Signals,Foreign Policy,Zelensky’s Pen Pal Diplomacy,Zelensky offers in-person peace talks in a rare open letter to Putin. Moscow isn’t interested.,https://foreignpolicy.com/2026/06/05/russia-ukraine-zelensky-open-letter-putin-peace-talks-st-petersburg/,"05 Jun 2026, 20:23"
Strategic Signals,Foreign Policy,Maggie O’Farrell’s Most Ambitious Novel Yet,"Plus, a Venezuelan thriller in translation.",https://foreignpolicy.com/2026/06/05/international-fiction-releases-land-maggie-ofarrell-adventures-juan-planchard-jonathan-jakubowicz/,"05 Jun 2026, 19:30"
Geopolitics,Foreign Policy,How Ukraine Has Turned the Tide,"Resilience, technology, and European support have put Russia on the back foot.",https://foreignpolicy.com/2026/06/05/ukraine-russia-war-putin-zelensky-winning-drones-front-battlefield-peace/,"05 Jun 2026, 19:00"
Energy & Infrastructure,Foreign Policy,"Contain, Consolidate, and Co-Opt",How Europe has learned to live with great-power politics.,https://foreignpolicy.com/2026/06/05/europe-strategy-turkey-russia-china-putin-erdogan-brussels/,"05 Jun 2026, 18:40"
Strategic Signals,Foreign Policy,Romania Has Perfected the Art of Forgetting,"In a new memoir, Nobel laureate Herta Müller condemns her homeland for failing to reconcile with history.",https://foreignpolicy.com/2026/06/05/herta-muller-memoir-romania-ceausescu-communist-history/,"05 Jun 2026, 18:20"
Geopolitics,Foreign Policy,What in the World?,"Test yourself on the week of May 30: Malta votes, Japan responds to militarism accusations, and Iran pauses talks with the U.S.",https://foreignpolicy.com/2026/06/05/news-quiz-malta-election-japan-militarism-iran-peace-negotiations/,"05 Jun 2026, 16:26"
Strategic Signals,The Diplomat,Oh Se-hoon Becomes Seoul’s Mayor for the 5th Time,"Why Seoul picked the PPP incumbent yet again, and what it means for the city.",https://thediplomat.com/2026/06/oh-se-hoon-becomes-seouls-mayor-for-the-5th-time/,"06 Jun 2026, 01:28"
Strategic Signals,The Diplomat,India’s Eye in the Sky: The Rise of a State-Deep Tech Startup Space Partnership,"India’s deep tech space startups are transforming the country’s space ambitions, as the state increasingly supports private innovation to strengthen India’s strategic and economic position in the global space race.",https://thediplomat.com/2026/06/indias-eye-in-the-sky-the-rise-of-a-state-deep-tech-startup-space-partnership/,"05 Jun 2026, 23:01"
Markets & Macro,The Diplomat,The Bipolar Trap: The Real Danger in the Trump-Xi Era,The challenge is not just preventing war between China and the U.S. It’s how to prevent their rivalry from becoming the sole organizing principle of international politics.,https://thediplomat.com/2026/06/the-bipolar-trap-the-real-danger-in-the-trump-xi-era/,"06 Jun 2026, 00:04"
Strategic Signals,The Diplomat,Why Did Nepali PM Balendra Shah Call on UK to ‘Take an Interest’ in an India-Nepal Dispute?,The controversial comment was made on the eve of ruling party chief Ravi Lamichhane’s visit to India.,https://thediplomat.com/2026/06/why-did-nepali-pm-balendra-shah-call-on-uk-to-take-an-interest-in-an-india-nepal-dispute/,"05 Jun 2026, 23:56"
Energy & Infrastructure,The Diplomat,"Uzbekistan, Russia Celebrate Start of Nuclear Power Plant Construction… Again",Tashkent and Moscow celebrated the start of construction on the plant – two months after the companies involved celebrated the same thing.,https://thediplomat.com/2026/06/uzbekistan-russia-celebrate-start-of-nuclear-power-plant-construction-again/,"06 Jun 2026, 00:07"
Strategic Signals,The Diplomat,Pete Hegseth’s Missed Chance to Reassure – and Deter – on Taiwan,The U.S. defense secretary failed to mention Taiwan once during his closely-watched speech at the Shangri-La Dialogue.,https://thediplomat.com/2026/06/pete-hegseths-missed-chance-to-reassure-and-deter-on-taiwan/,"05 Jun 2026, 22:17"
