section,source,title,summary,link,published_at
Geopolitics,Financial Times World,US weighs using Iranian assets to compensate Gulf allies for war damage,Proposal comes as relations between Trump administration and regional partners have been strained by conflict,https://www.ft.com/content/d19bd87f-2673-40e8-9216-8529d80b42aa,"07 Jun 2026, 02:50"
Strategic Signals,Financial Times World,Tokio Marine boss to use Berkshire deal for global growth drive,Masahiro Koike aims to turn Japanese group into top five global insurer within a decade,https://www.ft.com/content/20449d8d-90e4-461c-b3de-f9f30fcd474d,"07 Jun 2026, 01:08"
Policy & Regulation,Financial Times World,"UK nuclear weapons spending not transparent enough, says watchdog",Public Accounts Committee also criticises lengthy delay to government’s defence investment plan,https://www.ft.com/content/6226859c-5858-468d-982b-7a7d3d6c53c0,"06 Jun 2026, 23:01"
Geopolitics,Financial Times World,Abu Dhabi’s Etihad to surpass pre-Iran war capacity without price cuts,Airline had its planes grounded when fighting began but demand for transit through region has recovered,https://www.ft.com/content/07b1eaa6-725a-406e-aa8b-020dbe53aaea,"06 Jun 2026, 21:56"
Strategic Signals,Financial Times World,What we know about the plan to give Americans an equity stake in AI,OpenAI has proposed a sovereign-wealth-style fund to ease public anxiety about the impact of artificial intelligence,https://www.ft.com/content/8559a3f9-86de-4a1c-8a75-6623e83e6a00,"06 Jun 2026, 21:18"
Geopolitics,Financial Times World,The teenagers enlisted as agents of mayhem by Russia and Iran,Minors are being targeted to carry out hostile acts from Ukraine to western Europe and Israel,https://www.ft.com/content/58dabb01-41f6-4440-8a5f-69947d8afe06,"06 Jun 2026, 20:35"
Geopolitics,Financial Times World,Irish government under pressure over alumina exports to Russia,Lawmakers call for EU sanctions on Oleg Deripaska-linked plant in Ireland if raw material is used in Russian weapons,https://www.ft.com/content/4f271639-cf23-4c36-bfda-9c739eaa0797,"06 Jun 2026, 18:30"
Geopolitics,Financial Times World,US and Iran exchange strikes in new threat to shaky ceasefire,Kuwait and Bahrain are attacked as American forces intercept drones launched over Strait of Hormuz,https://www.ft.com/content/ea62e338-1730-4fdd-996c-efcfe36561bf,"06 Jun 2026, 14:16"
Strategic Signals,Financial Times Companies,We should be getting better at AI by now,"From cancelled novels to legal fines, the scale of blunders only halfway through the year suggests the opposite",https://www.ft.com/content/9753a44c-bec8-4d89-bac6-3416713c3166,"07 Jun 2026, 03:00"
Policy & Regulation,Financial Times Companies,Bouygues Telecom consortium agrees to buy Patrick Drahi’s SFR for €20.35bn,Bid from group including Orange and Free-Iliad faces showdown with antitrust regulators in Paris and Brussels,https://www.ft.com/content/64686829-95e6-4af2-8568-579684606403,"06 Jun 2026, 22:16"
Strategic Signals,Financial Times Companies,West Ham co-chair quits ahead of ‘publication of serious historic allegations’,David Sullivan departs just two weeks after club was relegated from Premier League,https://www.ft.com/content/f99cb19b-cea8-4908-9b3d-afb2e0d83632,"06 Jun 2026, 16:27"
Strategic Signals,The Hindu BusinessLine,How geopolitical flashpoints are spurring global supply chain diversification,"India has formed various partnerships to build diversified, trusted production ecosystems in key geographies",https://www.thehindubusinessline.com/economy/agri-business/how-geopolitical-flashpoints-are-spurring-global-supply-chain-diversification/article71070403.ece,"07 Jun 2026, 09:05"
Geopolitics,The Hindu BusinessLine,"India’s fertility rate drops below replacement level, says Elon Musk","India’s population has crossed 1.46 billion, but experts warn that falling fertility rates may eventually reverse growth and trigger a long-term population decline",https://www.thehindubusinessline.com/news/indias-fertility-rate-drops-below-replacement-level-says-elon-musk/article71072178.ece,"07 Jun 2026, 08:14"
Policy & Regulation,The Hindu BusinessLine,Sriram Krishnan to leave White House as Trump advances AI agenda,"The exit of Sriram Krishnan coincides with growing White House efforts to shape the future of artificial intelligence, including exploring unprecedented government investments in AI firms.",https://www.thehindubusinessline.com/info-tech/sriram-krishnan-to-leave-white-house-as-trump-advances-ai-agenda/article71072182.ece,"07 Jun 2026, 08:13"
Strategic Signals,The Hindu BusinessLine,"A new name, a new champion: Andreeva conquers Roland Garros","The 19-year-old became the youngest Roland Garros women’s champion since Monica Seles in 1992, cementing her status as one of tennis’s brightest stars",https://www.thehindubusinessline.com/news/sports/a-new-name-a-new-champion-andreeva-conquers-roland-garros/article71072190.ece,"07 Jun 2026, 08:13"
Strategic Signals,The Hindu BusinessLine,"Nestle India’s royalty payment to parent rises nearly 14% to ₹1,024 crore in FY26",The rise came despite shareholders rejecting a proposal last year to gradually increase royalty payments,https://www.thehindubusinessline.com/companies/nestle-indias-royalty-payment-to-parent-rises-nearly-14-to-1024-crore-in-fy26/article71072179.ece,"07 Jun 2026, 08:01"
Energy & Infrastructure,The Hindu BusinessLine,LPG price raised by ₹29 per 14.2-kg cylinder,This is the second increase in three months as state-owned fuel retailers continue to grapple with elevated global energy costs,https://www.thehindubusinessline.com/news/lpg-price-raised-by-29-per-142-kg-cylinder/article71072170.ece,"07 Jun 2026, 07:52"
Energy & Infrastructure,The Hindu BusinessLine,US weighs using Iranian assets to fund Gulf reconstruction amid escalating tensions,"The latest round of US and Iranian strikes has deepened uncertainty in the Gulf, threatening regional stability and adding to concerns over oil shipments, energy prices, and the prospects for a lasting peace deal.",https://www.thehindubusinessline.com/news/world/us-weighs-using-iranian-assets-to-fund-gulf-reconstruction-amid-escalating-tensions/article71072185.ece,"07 Jun 2026, 07:51"
Markets & Macro,The Hindu BusinessLine,The day all hedges fell in the US markets,"Markets grapple with the aftershocks of the AI sell-off, rising yields and mounting tensions in West Asia",https://www.thehindubusinessline.com/portfolio/the-day-all-hedges-fell/article71070622.ece,"07 Jun 2026, 01:22"
Energy & Infrastructure,Times of India Business,"LPG gets Rs 29 costlier: Check the latest cylinder rates in Delhi, Mumbai and other cities","Domestic cooking gas prices have increased by Rs 29 per cylinder, reaching Rs 942 in Delhi, marking the second revision in three months due to soaring global energy costs. This rise follows a previous Rs 60 hike and is part of a broader trend of fuel price increases, with petrol and diesel also seei",https://timesofindia.indiatimes.com/business/india-business/lpg-gets-rs-29-costlier-check-the-latest-cylinder-rates-in-delhi-mumbai-and-other-cities/articleshow/131561042.cms,"07 Jun 2026, 07:21"
Strategic Signals,Times of India Business,5 ways IBC transformed India's corporate rescue system over the past decade,,https://timesofindia.indiatimes.com/business/india-business/5-ways-ibc-transformed-indias-corporate-rescue-system-over-the-past-decade/articleshow/131550100.cms,"06 Jun 2026, 16:55"
Energy & Infrastructure,Times of India Business,'US firms benefit from Hormuz closure': Russian oil company chief's big claim amid Iran war,"Rosneft CEO Igor Sechin stated American energy firms are the primary beneficiaries of a Strait of Hormuz closure, warning of long-term damage to oil demand and a boost for alternatives. He also highlighted global resource shortages and questioned OPEC+'s effectiveness, noting Russia's production dec",https://timesofindia.indiatimes.com/business/international-business/gained-non-competitive-advantages-rosneft-chief-says-us-energy-companies-were-biggest-winners-from-hormuz-disruption/articleshow/131550432.cms,"06 Jun 2026, 16:51"
Markets & Macro,Times of India Business,Can RBI shield rupee from further fall? Analysts expect up to $75 billion in fresh inflows,"The Reserve Bank of India's recent monetary policy measures aim to bolster the rupee by attracting significant capital inflows, estimated between $40-75 billion. Despite rising inflation and revised growth forecasts, the Monetary Policy Committee is expected to maintain the repo rate at 5.25% with a",https://timesofindia.indiatimes.com/business/india-business/can-rbi-shield-rupees-from-falling-more-analysts-expect-up-to-75-billion-in-fresh-inflows/articleshow/131548972.cms,"06 Jun 2026, 15:32"
Energy & Infrastructure,Times of India Business,"PM Modi chairs EAC meeting, discusses measures to boost India’s economic growth amid global turmoil","Prime Minister Narendra Modi met with the Economic Advisory Council to discuss strengthening India's economic growth amidst global uncertainty. The Reserve Bank of India kept the repo rate unchanged at 5.25%, citing geopolitical tensions and inflation concerns, while revising GDP growth and inflatio",https://timesofindia.indiatimes.com/business/india-business/pm-modi-chairs-eac-meeting-discusses-measures-to-boost-indias-economic-growth-amid-global-turmoil/articleshow/131547759.cms,"06 Jun 2026, 14:11"
Strategic Signals,Times of India Business,India's stock market mania hits milestone: NSE logs 26 crore trading accounts and counting,"India's investor base has reached a new peak with over 26 crore unique trading accounts on the NSE. The exchange added the latest crore accounts in under four months, highlighting rapid growth beyond major financial hubs. This surge is fueled by digitalization, simpler KYC, and positive market perfo",https://timesofindia.indiatimes.com/business/india-business/indias-stock-market-mania-hits-milestone-nse-logs-26-crore-trading-accounts-and-counting/articleshow/131545468.cms,"06 Jun 2026, 11:27"
Policy & Regulation,Times of India Business,E85 fuel to get Rs 20/litre cheaper as India ramps up ethanol push,"India is launching E85 petrol, an 85% ethanol blend, at discounted prices. This move aims to boost clean fuel adoption and cut reliance on imported fossil fuels. The government plans a phased rollout of E85 dispensing stations nationwide. Vehicle manufacturers are introducing E85 compatible models. ",https://timesofindia.indiatimes.com/business/india-business/e85-fuel-to-get-rs-20/litre-cheaper-as-india-ramps-up-ethanol-push/articleshow/131544721.cms,"06 Jun 2026, 10:19"
Markets & Macro,Times of India Business,$1.3 trillion erased from Wall Street: Here's what slowed down AI rally,"Tech stocks, particularly semiconductors, experienced a significant downturn Friday, driven by investor caution over AI valuations and robust US jobs data. The PHLX Semiconductor Index saw its steepest drop since March 2020, erasing billions in market value. This retreat follows a period of record h",https://timesofindia.indiatimes.com/business/international-business/1-3-trillion-wiped-off-wall-street-as-ai-rally-slows-nvidia-slips-6-micron-falls-13/articleshow/131544133.cms,"06 Jun 2026, 09:33"
Strategic Signals,Hindustan Times India,Indian Air Force roped in to transport NEET papers as NTA tightens guard for June 21 re-exam,"The NEET-UG 2026 re-examination is expected to be conducted for more than 2.2 million students across the country, with enhanced security protocols.",https://www.hindustantimes.com/india-news/indian-air-force-roped-in-to-transport-neet-papers-as-nta-tightens-guard-for-june-21-re-exam-paper-leak-row-101780800796621.html,"07 Jun 2026, 08:47"
Strategic Signals,Hindustan Times India,Cockroach Janta Party draws BJP chief's 'puppet' jibe after first offline protest in Delhi,"Abhijeet Dipke said that right before landing at the Delhi airport on Saturday morning, he felt as though these were last few moments of freedom.",https://www.hindustantimes.com/india-news/cjps-not-scared-remark-gets-bjp-nitin-nabin-puppet-jibe-after-outfit-abhijeet-dipke-protest-in-delhi-jantar-mantar-101780796346416.html,"07 Jun 2026, 07:49"
Energy & Infrastructure,Hindustan Times India,"LPG prices hiked: Check how rates in Delhi, Mumbai, Kolkata and Chennai have changed","The latest revision comes after a ₹60-per-cylinder hike on March 7, which came after the disruptions to global energy supplies caused by West Asia conflict.",https://www.hindustantimes.com/india-news/domestic-lpg-price-hiked-check-latest-rates-across-delhi-mumbai-kolkata-and-chennai-101780796822011.html,"07 Jun 2026, 07:44"
Strategic Signals,Hindustan Times India,CPI (M) chief slams Rahul Gandhi for BJP-left nexus charge,"The meeting, scheduled to be held in Delhi on June 8, is being closely watched because it is the first meeting of the grouping since December 2023.",https://www.hindustantimes.com/india-news/cpi-m-chief-slams-rahul-gandhi-for-bjp-left-nexus-charge-101780797492688.html,"07 Jun 2026, 07:37"
Policy & Regulation,Hindustan Times India,PM Modi pushes growth agenda at EAC meet amid economic pressure,"The meeting came in the backdrop of criticism from opposition, which have cited the rupee’s deterioration and rising fuel prices as evidence of policy failure.",https://www.hindustantimes.com/india-news/pm-narendra-modi-pushes-growth-agenda-at-eac-meet-amid-economic-pressure-us-iran-war-west-asia-101780795228661.html,"07 Jun 2026, 07:00"
Strategic Signals,Hindustan Times India,"Cook arrested in deadly Delhi hotel fire case, claims blaze ‘began after spark in fryer’","Negi, who lives in Shahdara’s Dilshad Garden, had been working at Flourish Stay B&B in Malviya Nagar’s Hauz Rani for over a year, police said.",https://www.hindustantimes.com/india-news/cook-arrested-in-deadly-delhi-hauz-rani-hotel-fire-case-claims-blaze-began-after-spark-in-fryer-101780793647311.html,"07 Jun 2026, 06:39"
Policy & Regulation,Hindustan Times India,HYDRAA reclaims land worth ₹1L-cr in T’gana,"HYDRAA reclaimed encroached government lands worth ₹1 lakh crore in Hyderabad, securing 200 acres valued at ₹30,000 crore in a recent operation.",https://www.hindustantimes.com/india-news/hydraa-reclaims-land-worth-1l-cr-in-tgana-101780772856538.html,"07 Jun 2026, 06:22"
Energy & Infrastructure,Hindustan Times India,"India, Nepal discuss ways to take forward bilateral ties, development cooperation","EAM Jaishankar met Khanal to review bilateral ties, including development cooperation, connectivity, trade and transit, energy and people-to-people ties.",https://www.hindustantimes.com/india-news/india-nepal-jaishankar-shisir-khanal-discuss-ways-to-take-forward-bilateral-ties-development-cooperation-101780792747879.html,"07 Jun 2026, 06:21"
Strategic Signals,Indian Express Latest,"Mohali Mayor, Senior Deputy Mayor polls on May 9 following councillors’ oath",,https://indianexpress.com/article/cities/chandigarh/mohali-municipal-corporation-mayor-election-june-9-councillors-oath-resort-politics-10727846/,"07 Jun 2026, 03:36"
Geopolitics,Indian Express Latest,"Salim Kumar Death News Live Updates: Mammootty, Prithviraj, Manju Warrier mourn demise of actor",,https://indianexpress.com/article/entertainment/malayalam/actor-salim-kumar-death-news-funeral-tributes-live-updates-10727822/,"07 Jun 2026, 03:25"
Strategic Signals,Indian Express Latest,"SBI heist ‘mastermind’ sent to Surat jail, police say will seek custody",,https://indianexpress.com/article/cities/ahmedabad/sbi-heist-mastermind-surat-jail-police-custody-10727833/,"07 Jun 2026, 03:24"
Policy & Regulation,Indian Express Latest,UP government forms committee to probe KGMU drugs distribution ‘irregularities’,,https://indianexpress.com/article/cities/lucknow/up-government-kgmu-lucknow-medicine-procurement-scam-probe-committee-10727815/,"07 Jun 2026, 03:23"
Strategic Signals,Indian Express Latest,IDFC First Bank ‘fraud’: CBI raids Haryana IAS officers in Rs 645-cr embezzlement case,,https://indianexpress.com/article/cities/chandigarh/idfc-first-bank-fraud-cbi-raids-haryana-ias-officers-embezzlement-case-10727828/,"07 Jun 2026, 03:18"
Strategic Signals,Indian Express Latest,Seven of 37 illegal houses near Asaram Ashram demolished,,https://indianexpress.com/article/cities/ahmedabad/asaram-ashram-illegal-houses-demolition-ahmedabad-amc-10727827/,"07 Jun 2026, 03:14"
Strategic Signals,Indian Express Latest,"Came to spend vacation, teen dies after drowning at Juhu beach",,https://indianexpress.com/article/cities/mumbai/juhu-beach-drowning-up-teen-dies-mumbai-vacation-10727817/,"07 Jun 2026, 03:06"
Energy & Infrastructure,Indian Express Latest,Cooking gas gets costlier: Domestic LPG price hiked by Rs 29 per cylinder,,https://indianexpress.com/article/business/lpg-price-hike-cylinder-2nd-increase-west-asia-conflict-10727809/,"07 Jun 2026, 02:37"
Geopolitics,SCMP Asia,"Park life: why China’s malls are building forests, waterfalls and sky walkways","Property developers are focusing on building shopping centres featuring lush greenery, gardens and water features in mainland China, as such spaces have become more attractive to shoppers and retailers than conventional high-density malls. “Consumers increasingly view retail destinations as places t",https://www.scmp.com/business/article/3356214/park-life-why-chinas-malls-are-building-forests-waterfalls-and-sky-walkways?utm_source=rss_feed,"07 Jun 2026, 02:30"
Markets & Macro,SCMP Asia,Why can’t investors buy the mainland’s hottest AI stocks via Stock Connect?,"Since 2014, the Stock Connect scheme has become a major channel for Hong Kong and international investors to buy stocks on the Chinese mainland. But cross-border traders have grown frustrated in recent months, as they have been unable to access a wave of blockbuster listings by AI companies on the m",https://www.scmp.com/business/markets/article/3356193/why-cant-investors-buy-mainlands-hottest-ai-stocks-stock-connect?utm_source=rss_feed,"07 Jun 2026, 02:30"
Markets & Macro,SCMP Asia,"‘It’s the wealth effect’: Hong Kong luxury malls thrive amid IPO gains, housing recovery","Hong Kong’s new status as the world’s top cross-border wealth hub, overtaking Switzerland, alongside a recovering local housing market and strong initial public offerings (IPOs), is translating into a boom for high-end malls, with landlords enjoying improved revenues and rents. Hard luxury and jewel",https://www.scmp.com/business/companies/article/3355967/its-wealth-effect-hong-kong-luxury-malls-thrive-amid-ipo-gains-housing-recovery?utm_source=rss_feed,"07 Jun 2026, 01:30"
Geopolitics,SCMP Asia,China will enhance regulation of programme trading: CSRC chairman,"Chinese authorities plan to enhance regulation of programme trading to clamp down on market misconduct, the head of the China Securities Regulatory Commission (CSRC) said on Saturday. Hedge funds and institutional investors are increasingly managing their portfolios in China via programme trading, w",https://www.scmp.com/business/banking-finance/article/3356217/china-will-enhance-regulation-programme-trading-csrc-chairman?utm_source=rss_feed,"06 Jun 2026, 11:51"
Policy & Regulation,SCMP Asia,Mainlanders can still open bank accounts in Hong Kong despite new rules: HKMA,"Mainland customers can still open bank accounts in Hong Kong, but banks must adopt stringent new checks to ensure their processes are “compliant and orderly”, the Hong Kong Monetary Authority (HKMA) said in a statement on Saturday. “The banking industry has implemented the new regulatory requirement",https://www.scmp.com/business/banking-finance/article/3356201/mainlanders-can-still-open-bank-accounts-hong-kong-despite-new-rules-hkma?utm_source=rss_feed,"06 Jun 2026, 07:24"
Strategic Signals,SCMP Asia,Chinese carriers seize two-thirds share of post-pandemic air routes,"Chinese carriers have captured an expanding slice of the international air travel market for routes connecting Chinese and overseas cities since the Covid-19 pandemic, according to data presented at an industry summit in Beijing on Friday. Local carriers currently held a 66.5 per cent market share c",https://www.scmp.com/business/china-business/article/3356169/chinese-carriers-seize-two-thirds-share-post-pandemic-air-routes?utm_source=rss_feed,"06 Jun 2026, 01:00"
Geopolitics,SCMP Asia,"Targeting US$610 billion longevity market, biotech firms race to reverse ageing","For Beijing-based METiS TechBio CEO Lai Tsai-ta, ageing is comparable to bugs building up in a complex software system – it happens once errors begin to accumulate in the genetic code of human cells, such as their DNA sequences. “Those errors can be reprogrammed. It becomes possible to use AI to rea",https://www.scmp.com/business/china-business/article/3356154/targeting-us610-billion-longevity-market-biotech-firms-race-reverse-ageing?utm_source=rss_feed,"06 Jun 2026, 00:00"
Strategic Signals,SCMP Asia,"AI infrastructure is multi-tiered, and HDDs are central to scaling AI, WD shares","[The content of this article has been produced by our advertising partner.] AI has long been caught in a paradox: AI workloads demand high performance storage, long associated with flash, but scaling at AI levels with all-flash is prohibitively expensive. Hard disk drives (HDDs), on the other hand, ",https://www.scmp.com/presented/business/topics/wd-computex-2026/article/3355936/ai-infrastructure-multi-tiered-and-hdds-are-central-scaling-ai-wd-shares?utm_source=rss_feed,"05 Jun 2026, 16:00"
Geopolitics,Foreign Policy,Armenians Vote Under Russia’s Shadow,Trump and Putin are backing different players in a contested country.,https://foreignpolicy.com/2026/06/05/armenia-trump-russia-election-pashinyan-europe/,"06 Jun 2026, 01:44"
Energy & Infrastructure,Foreign Policy,The U.S. Economy Is Proving Remarkably Resilient,"Even in the face of tariffs and an energy crisis, the jobs report shows an economy that’s still humming.",https://foreignpolicy.com/2026/06/05/us-jobs-report-trump-economy-iran-energy-tariffs/,"05 Jun 2026, 20:50"
Strategic Signals,Foreign Policy,Zelensky’s Pen Pal Diplomacy,Zelensky offers in-person peace talks in a rare open letter to Putin. Moscow isn’t interested.,https://foreignpolicy.com/2026/06/05/russia-ukraine-zelensky-open-letter-putin-peace-talks-st-petersburg/,"05 Jun 2026, 20:23"
Strategic Signals,Foreign Policy,Maggie O’Farrell’s Most Ambitious Novel Yet,"Plus, a Venezuelan thriller in translation.",https://foreignpolicy.com/2026/06/05/international-fiction-releases-land-maggie-ofarrell-adventures-juan-planchard-jonathan-jakubowicz/,"05 Jun 2026, 19:30"
Geopolitics,Foreign Policy,How Ukraine Has Turned the Tide,"Resilience, technology, and European support have put Russia on the back foot.",https://foreignpolicy.com/2026/06/05/ukraine-russia-war-putin-zelensky-winning-drones-front-battlefield-peace/,"05 Jun 2026, 19:00"
Energy & Infrastructure,Foreign Policy,"Contain, Consolidate, and Co-Opt",How Europe has learned to live with great-power politics.,https://foreignpolicy.com/2026/06/05/europe-strategy-turkey-russia-china-putin-erdogan-brussels/,"05 Jun 2026, 18:40"
Strategic Signals,Foreign Policy,Romania Has Perfected the Art of Forgetting,"In a new memoir, Nobel laureate Herta Müller condemns her homeland for failing to reconcile with history.",https://foreignpolicy.com/2026/06/05/herta-muller-memoir-romania-ceausescu-communist-history/,"05 Jun 2026, 18:20"
Geopolitics,Foreign Policy,What in the World?,"Test yourself on the week of May 30: Malta votes, Japan responds to militarism accusations, and Iran pauses talks with the U.S.",https://foreignpolicy.com/2026/06/05/news-quiz-malta-election-japan-militarism-iran-peace-negotiations/,"05 Jun 2026, 16:26"
Strategic Signals,The Diplomat,Oh Se-hoon Becomes Seoul’s Mayor for the 5th Time,"Why Seoul picked the PPP incumbent yet again, and what it means for the city.",https://thediplomat.com/2026/06/oh-se-hoon-becomes-seouls-mayor-for-the-5th-time/,"06 Jun 2026, 01:28"
Strategic Signals,The Diplomat,India’s Eye in the Sky: The Rise of a State-Deep Tech Startup Space Partnership,"India’s deep tech space startups are transforming the country’s space ambitions, as the state increasingly supports private innovation to strengthen India’s strategic and economic position in the global space race.",https://thediplomat.com/2026/06/indias-eye-in-the-sky-the-rise-of-a-state-deep-tech-startup-space-partnership/,"05 Jun 2026, 23:01"
Markets & Macro,The Diplomat,The Bipolar Trap: The Real Danger in the Trump-Xi Era,The challenge is not just preventing war between China and the U.S. It’s how to prevent their rivalry from becoming the sole organizing principle of international politics.,https://thediplomat.com/2026/06/the-bipolar-trap-the-real-danger-in-the-trump-xi-era/,"06 Jun 2026, 00:04"
Strategic Signals,The Diplomat,Why Did Nepali PM Balendra Shah Call on UK to ‘Take an Interest’ in an India-Nepal Dispute?,The controversial comment was made on the eve of ruling party chief Ravi Lamichhane’s visit to India.,https://thediplomat.com/2026/06/why-did-nepali-pm-balendra-shah-call-on-uk-to-take-an-interest-in-an-india-nepal-dispute/,"05 Jun 2026, 23:56"
Energy & Infrastructure,The Diplomat,"Uzbekistan, Russia Celebrate Start of Nuclear Power Plant Construction… Again",Tashkent and Moscow celebrated the start of construction on the plant – two months after the companies involved celebrated the same thing.,https://thediplomat.com/2026/06/uzbekistan-russia-celebrate-start-of-nuclear-power-plant-construction-again/,"06 Jun 2026, 00:07"
