section,source,title,summary,link,published_at
Geopolitics,War on the Rocks,Mapping America’s Domestic Drone Supply Chain,"The extent of China’s drone dominance — and how to decouple from it — has long been a source of debate and anxiety in Washington. Last month, the Wall Street Journal reignited controversy by publishing a visual analysis of military quadcopter components, exploring China’s advantages in parts manufac",https://warontherocks.com/cogs-of-war/at-a-glance-american-quadcopter-component-manufacturing/,"30 Jun 2026, 08:00"
Geopolitics,War on the Rocks,Lost in Translation: How A Premier Chinese Think Tank Views U.S.-Chinese Competition,"On May 13, 2026, Air Force One landed in Beijing for President Donald Trump’s first state visit to China in nearly a decade. That same morning, the China Institutes of Contemporary International Relations published a report titled The Evolving World and the Right Way to China-US Coexistence. The sum",https://warontherocks.com/lost-in-translation-how-a-premier-chinese-think-tank-views-u-s-chinese-competition/,"30 Jun 2026, 07:30"
Geopolitics,War on the Rocks,The Ukrainian Push for Long-Term Strategic Planning,"Welcome to The Ukraine Compass, a weekly digest of Ukrainian commentary and analysis from across the political spectrum only for War on the Rocks members. Each Monday, we bring you a curated selection of articles from Ukrainian media offering insight into how Ukrainians themselves debate the issues ",https://warontherocks.com/the-ukrainian-push-for-long-term-strategic-planning/,"29 Jun 2026, 16:00"
Strategic Signals,War on the Rocks,The Defense Industrial Alliance Washington Is Throwing Away,"As the relationship between the United States and Canada continues to degrade, it now comes at the expense of each country’s industrial security.Last month, the Pentagon announced the unilateral suspension of the 86-year-old Canadian Permanent Joint Board on Defense in response to what the White Hou",https://warontherocks.com/cogs-of-war/the-defense-industrial-alliance-washington-is-throwing-away/,"29 Jun 2026, 08:00"
Geopolitics,War on the Rocks,A New Force Posture Concept for Europeanizing Extended Nuclear Deterrence,"During the Cold War, Europe kept asking whether Washington would risk an American city to save a European one. It was an impolite question, but a useful one, which is why it never quite left the room. It has now packed its bags and moved east. Earlier this year, French President Emmanuel Macron crea",https://warontherocks.com/a-new-force-posture-concept-for-europeanizing-extended-nuclear-deterrence/,"29 Jun 2026, 07:30"
Energy & Infrastructure,War on the Rocks,The Art of Statecraft in an Age of Strategic Failure,"Jack Watling, Statecraft: The New Rules of Power in a Divided World (Macmillan, 2026)The war against Iran exposed a multitude of forced errors and own goals in the conduct of statecraft. The purpose of sound statecraft is the integrated application of a state’s tools and its repertoire of government",https://warontherocks.com/the-art-of-statecraft-in-an-age-of-strategic-failure/,"29 Jun 2026, 07:15"
Policy & Regulation,War on the Rocks,Not Imaginary: The Deterrence Gap is Real and America Needs Low-Yield Nukes,"Nuclear policy debates are at their best when they force hard questions about risk, deterrence, and military necessity. They are at their worst when disagreement is recast as bad faith. In 2018, as an outgrowth of a rigorous policy review process, the Trump administration’s Nuclear Posture Review id",https://warontherocks.com/not-imaginary-the-deterrence-gap-is-real-and-america-needs-low-yield-nukes/,"26 Jun 2026, 14:15"
Policy & Regulation,CSIS,The Bio-Pharma Industry and Society,"The Bio-Pharma Industry and Society Listing Summary Please join the CSIS Global Health Policy Center on March 17, from 10:00am – 11:30am, for an exploration of how private bio-pharmaceutical firms can better support the critically important societal goals of improved affordability, access, quality, ",https://www.csis.org/events/bio-pharma-industry-and-society,"03 Mar 2016, 20:36"
Policy & Regulation,CSIS,The FY2017 Defense Budget and Strategic Outlook,"The FY2017 Defense Budget and Strategic Outlook Listing Summary Please join the CSIS International Security Program for a half-day Defense360 conference on the recently released FY2017 defense budget request and strategic priorities. Drupal Admin Mon, 02/29/2016 - 13:48 Featured Image Image Contribu",https://www.csis.org/events/fy2017-defense-budget-and-strategic-outlook,"29 Feb 2016, 18:48"
Policy & Regulation,CSIS,2016 U.S.-Japan Security Seminar,"2016 U.S.-Japan Security Seminar Listing Summary Michael J. Green interviews JIIA President Yoshiji Nogami Drupal Admin Fri, 02/26/2016 - 12:54 Featured Image Image Contributors Michael J. Green Programs & Projects Japan Chair Parent Geopolitics and Foreign Policy Featured Image AdobeStock_179685887",https://www.csis.org/events/2016-us-japan-security-seminar,"26 Feb 2016, 17:54"
Energy & Infrastructure,CSIS,The Future of the Grid—A View from ARPA-E,"The Future of the Grid—A View from ARPA-E Listing Summary The CSIS Energy and National Security Program is pleased to invite you to a discussion with Ellen Williams, Director of ARPA-E, the Advanced Research Projects Agency-Energy. Drupal Admin Thu, 02/25/2016 - 14:15 Featured Image Image Contributo",https://www.csis.org/events/future-grid-view-arpa-e,"25 Feb 2016, 19:15"
Geopolitics,CSIS,"Statesmen's Forum: Wang Yi, Minister of Foreign Affairs, PRC","Statesmen's Forum: Wang Yi, Minister of Foreign Affairs, PRC Listing Summary Please watch the live webcast of a discussion on Chinese foreign policy and US-China Relations Drupal Admin Fri, 02/19/2016 - 17:13 Featured Image Image Contributors John J. Hamre Christopher K. Johnson Downloads Download T",https://www.csis.org/events/statesmens-forum-wang-yi-minister-foreign-affairs-prc,"19 Feb 2016, 22:13"
Geopolitics,CSIS,"China Reality Check: China's ""Internet Sovereignty"" Initiative: Origins and Consequences","China Reality Check: China's ""Internet Sovereignty"" Initiative: Origins and Consequences Listing Summary Please join us for a discussion on China’s initiative to promote Internet sovereignty as a key governing concept of the global Internet. Drupal Admin Tue, 02/16/2016 - 11:49 Featured Image Image ",https://www.csis.org/events/china-reality-check-chinas-internet-sovereignty-initiative-origins-and-consequences,"16 Feb 2016, 16:49"
Policy & Regulation,CSIS,"Statesmen's Forum: The Right Honourable Theresa May, MP, Home Secretary, United Kingdom","Statesmen's Forum: The Right Honourable Theresa May, MP, Home Secretary, United Kingdom Listing Summary Please join the CSIS International Security Program for a discussion with UK Home Secretary Theresa May on counter-terrorism policy. Drupal Admin Fri, 02/12/2016 - 16:08 Featured Image Image Contr",https://www.csis.org/events/statesmens-forum-right-honourable-theresa-may-mp-home-secretary-united-kingdom,"12 Feb 2016, 21:08"
Strategic Signals,CSIS,Strategic Opportunities in the Indo-Asia-Pacific with Admiral Harry B. Harris,"Strategic Opportunities in the Indo-Asia-Pacific with Admiral Harry B. Harris Listing Summary Please join us for a discussion with Admiral Harry B. Harris, Commander, U.S. Pacific Command, on the Strategic Opportunities in the Indo-Asia-Pacific. Drupal Admin Tue, 01/26/2016 - 11:20 Featured Image Im",https://www.csis.org/events/strategic-opportunities-indo-asia-pacific-admiral-harry-b-harris,"26 Jan 2016, 16:20"
Strategic Signals,Al Jazeera,“WhatsApp Privacy Changes”,WhatsApp is rolling out usernames to keep phone numbers private.,https://www.aljazeera.com/video/newsfeed/2026/6/30/whatsapp-privacy?traffic_source=rss,"30 Jun 2026, 22:33"
Strategic Signals,Al Jazeera,Mexico fans blast horns outside Ecuador hotel the night before World Cup clash,Ecuadorian Football Federation says it has filed a formal complaint with organisers after the incident in Mexico City.,https://www.aljazeera.com/sports/2026/6/30/mexico-fans-blast-horns-outside-ecuador-hotel-the-night-before-world-cup-clash?traffic_source=rss,"30 Jun 2026, 22:15"
Strategic Signals,Al Jazeera,Why India’s viral youth party is still protesting,"India's viral Cockroach Janta Party spends nearly two weeks protesting, demanding the education minister resign.",https://www.aljazeera.com/video/newsfeed/2026/6/30/why-indias-viral-youth-party-is-still-protesting?traffic_source=rss,"30 Jun 2026, 22:14"
Strategic Signals,Al Jazeera,"Valiant Serena beaten on Wimbledon return, Swiatek survives scare",Ben Shelton dumped out by Finland's Otto Virtanen as Taylor Fritz and Alex de Minaur progress in straight sets.,https://www.aljazeera.com/sports/2026/6/30/valiant-serena-beaten-on-wimbledon-return-swiatek-survives-scare?traffic_source=rss,"30 Jun 2026, 22:12"
Strategic Signals,Al Jazeera,"What is birthright citizenship, and what does the Supreme Court ruling say?",Nation's highest court strikes down executive order that would have restricted right established in US Constitution.,https://www.aljazeera.com/news/2026/6/30/what-is-birthright-citizenship-and-what-does-the-supreme-court-ruling-say?traffic_source=rss,"30 Jun 2026, 21:30"
Strategic Signals,Al Jazeera,Emergency crews search rubble after Athens building collapse,Rescue teams in Greece are combing through the rubble for survivors after a four-story apartment building in Athens.,https://www.aljazeera.com/video/newsfeed/2026/6/30/emergency-crews-search-rubble-after-athens-building-collapse?traffic_source=rss,"30 Jun 2026, 21:07"
Strategic Signals,Al Jazeera,More than 30 students remain missing after Nigeria school attack,"The attacks targeted a secondary school in the northeastern town of Lassa, in Borno State.",https://www.aljazeera.com/news/2026/6/30/more-than-30-students-remain-missing-after-nigeria-school-attack?traffic_source=rss,"30 Jun 2026, 20:55"
Strategic Signals,Al Jazeera,Rescuers find more bodies under rubble as Venezuela death toll rises,International and local emergency teams are continuing to recover the bodies of victims under the rubble,https://www.aljazeera.com/video/newsfeed/2026/6/30/rescuers-find-more-bodies-under-rubble-as-venezuela-death-toll-rises?traffic_source=rss,"30 Jun 2026, 20:50"
Strategic Signals,ETCFO Top Stories,India’s top 10 States by GST collections in FY26 — and who lagged behind,"India's GST collections for FY2025-26 reached ₹22.27 lakh crore, a slight 0.8% rise, driven by an 11.7% surge in import-related taxes. Domestic collections saw a 2.6% dip. Maharashtra led state contributions with over ₹3.61 lakh crore. The composition of GST revenue shifted, with IGST, SGST, and CGS",https://cfo.economictimes.indiatimes.com/news/tax-legal-accounting/indias-gst-revenue-breakdown-for-fy26-top-performers-and-laggards-revealed/132093571,"30 Jun 2026, 19:54"
Strategic Signals,ETCFO Top Stories,"ICICI Prudential Life plans 10-15% premium growth, bets on protection to outpace savings, CFO Dhiren Salian says","ICICI Prudential Life Insurance aims for 10-15% premium growth, with protection products like term and annuity plans leading the charge. CFO Dhiren Salian highlighted that protection, currently 17% of premiums, is a key focus due to its underpenetration and higher profitability. The company is also ",https://cfo.economictimes.indiatimes.com/news/strategy-operations/icici-prudential-life-insurance-targets-10-15-premium-growth-focusing-on-protection-business/132087048,"30 Jun 2026, 15:06"
Policy & Regulation,ETCFO Top Stories,"Exclusive: MCA set to notify SA 600, 40 revised audit standards by August","The notification will conclude one of the most significant regulatory exercises in India's audit landscape in recent years, aimed at strengthening audit quality and updating the country's auditing framework in line with evolving international standards.",https://cfo.economictimes.indiatimes.com/news/tax-legal-accounting/mca-to-revise-40-audit-standards-including-sa-600-by-august-2024/132087362,"30 Jun 2026, 13:02"
Strategic Signals,ETCFO Top Stories,HDFC Bank appoints Puneet Sharma as CFO,"HDFC Bank has appointed Puneet Sharma as its new Chief Financial Officer, effective December 1, 2026, bringing over 26 years of financial expertise from Axis Bank. Jigar Shah will join as General Counsel from October 1, 2026. Additionally, former Finance Secretary Rajiv Kumar is set to become the ba",https://cfo.economictimes.indiatimes.com/news/leadership/hdfc-bank-appoints-puneet-sharma-as-cfo-rajiv-kumar-as-part-time-chairman/132082709,"30 Jun 2026, 08:32"
Policy & Regulation,ETCFO Top Stories,Portal glitches put thousands of GST appeals at risk; experts seek deadline extension,"Tax professionals, industry bodies and bar association urge Finance Ministry to defer June 30 cut-off, citing technical issues on GSTAT portal and nearly nine years of pending litigation.",https://cfo.economictimes.indiatimes.com/news/tax-legal-accounting/urgent-call-for-gst-appeal-deadline-extension-amid-portal-glitches/132070202,"29 Jun 2026, 16:34"
Strategic Signals,ETCFO Top Stories,"CEAT targets one-third export revenue share, eyes double-digit volume growth over next five years: CFO Kumar Subbiah","CEAT aims to boost international revenue to one-third of its total within five years, up from 25%, while maintaining double-digit volume growth. In the near term, however, the tyre maker plans further price hikes to offset rising raw material costs, particularly natural rubber. Significant capacity ",https://cfo.economictimes.indiatimes.com/news/strategy-operations/ceat-plans-double-digit-growth-despite-rising-input-costs-cfo-confirms/132056586,"29 Jun 2026, 07:01"
Geopolitics,ETCFO Top Stories,"India-UK trade pact opens new prospects, but industry readiness will decide gains, say experts","The India-UK Comprehensive Economic and Trade Agreement (CETA) is set to come into force on July 15, 2026, unlocking lower tariffs and wider market access across sectors. However, economists and trade experts say the long-term benefits will depend on how effectively businesses adapt supply chains, m",https://cfo.economictimes.indiatimes.com/news/economy/india-uk-trade-deal-unlocking-new-opportunities-for-businesses-by-2026/132063972,"29 Jun 2026, 11:07"
Policy & Regulation,ETCFO Top Stories,"Government extends GSTAT appeal filing deadline to July 31 amid portal rush, technical issues","The extension applies to appeals filed under Section 112(1) read with Section 112(3) of the Central Goods and Services Tax (CGST) Act. The earlier deadline notified by the government on September 17, 2025, was June 30, 2026.",https://cfo.economictimes.indiatimes.com/news/tax-legal-accounting/government-extends-gstat-appeal-filing-deadline-to-july-31-amid-portal-rush-technical-issues/132087469,"30 Jun 2026, 13:00"
Markets & Macro,ETCFO Policy,RBI compounds FEMA violations in Touras India case,"The Reserve Bank of India (RBI) has issued a compounding order under Section 15 of the Foreign Exchange Management Act (FEMA), in the case of Touras India Private Limited, which has resulted in the termination of proceedings against the company for contraventions of the law's provisions with a one-t",https://cfo.economictimes.indiatimes.com/news/policy/rbi-compounds-fema-violations-in-touras-india-case/132090409,"30 Jun 2026, 16:00"
Geopolitics,ETCFO Policy,"""It's in last 1 or 2%"": US envoy Sergio Gor declares India-US trade pact nears finish line","Dismissing rumours of diplomatic friction, United States Ambassador to India Sergio Gor on Monday (local time) announced that the highly anticipated India-US bilateral trade agreement is on the verge of completion, with negotiators hammering out the final ""1 or 2 per cent"" of the legal text.",https://cfo.economictimes.indiatimes.com/news/policy/its-in-last-1-or-2-us-envoy-sergio-gor-declares-india-us-trade-pact-nears-finish-line/132082933,"30 Jun 2026, 08:39"
Policy & Regulation,ETCFO Policy,"Delhi Cabinet approves EV Policy 2026 with tax waivers, purchase incentives and scrappage benefits to boost clean mobility","The policy provides 100 per cent exemption on road tax and registration fees for electric vehicles, with the benefit applicable to four-wheelers priced up to Rs 30 lakh (ex-showroom). Purchase incentives include up to Rs 30,000 for electric two-wheelers, up to Rs 50,000 for electric three-wheelers a",https://cfo.economictimes.indiatimes.com/news/policy/delhi-cabinet-approves-ev-policy-2026-with-tax-waivers-purchase-incentives-and-scrappage-benefits-to-boost-clean-mobility/132082657,"30 Jun 2026, 08:24"
Markets & Macro,ETCFO Policy,"RBI's dollar inflow measures buy time, but external risks remain","The Reserve Bank of India's recent measures to boost dollar inflows are a temporary fix, economists warn. While these steps aim to stabilize the rupee now, the country must strengthen its balance of payments over the next three to five years. Otherwise, as foreign currency borrowings and deposits ma",https://cfo.economictimes.indiatimes.com/news/policy/rbis-dollar-inflow-measures-buy-time-but-external-risks-remain/132061461,"29 Jun 2026, 08:07"
Policy & Regulation,ETCFO Policy,"Corporate Mitra scheme to commence with 2,000 participants","Corporate Mitras will provide affordable support to Micro, Small and Medium Enterprises (MSMEs) in various areas, including regulatory compliance, GST, accounting, financial guidance, cost accounting and secretarial services.",https://cfo.economictimes.indiatimes.com/news/policy/launch-of-corporate-mitra-scheme-empowering-2000-young-participants-across-india/132027726,"27 Jun 2026, 08:16"
Strategic Signals,ETCFO Policy,Eighth Pay Panel may stay cautious on fitment factor,"While the Commission hasn't yet finalised its recommendations, early discussions suggest that the fitment factor could remain close to the 2.57 multiplier adopted by the Seventh Pay Commission, even as employee unions continue to push for a higher revision.",https://cfo.economictimes.indiatimes.com/news/policy/eighth-pay-panel-may-stay-cautious-on-fitment-factor/132014655,"26 Jun 2026, 17:00"
Markets & Macro,ETCFO Policy,"RBI issues final norms to expand credit derivatives market, allows wider CDS use","The Reserve Bank of India (RBI) has issued the final directions for expanding the country's credit derivatives market, paving the way for wider use of instruments such as Credit Default Swaps (CDS) and total return swaps, as per a statement by the apex bank on Thursday.",https://cfo.economictimes.indiatimes.com/news/policy/rbi-issues-final-norms-to-expand-credit-derivatives-market-allows-wider-cds-use/132013318,"26 Jun 2026, 15:52"
Markets & Macro,ETCFO Policy,"RBI opens term money market to AIFIs, housing finance companies","The Reserve Bank of India has opened the term money market to All India Financial Institutions and housing finance companies, allowing them to borrow and lend. Prudential borrowing limits for primary dealers have also been significantly increased. These moves aim to deepen market participation and i",https://cfo.economictimes.indiatimes.com/news/policy/rbi-opens-term-money-market-to-aifis-housing-finance-companies/132009081,"26 Jun 2026, 12:03"
