section,source,title,summary,link,published_at
Strategic Signals,Financial Times World,Intel shares rally after chipmaker posts fastest growth in 15 years,Chipmaker’s revenue jumped 25% in the second quarter,https://www.ft.com/content/48f0a410-daae-420b-93fc-216c3a2f1184?syn-25a6b1a6=1,"23 Jul 2026, 21:28"
Geopolitics,Financial Times World,FirstFT: China’s Xi Jinping pursues AI diplomacy to woo developing countries,Also in today’s newsletter: US hits 60 countries with new tariffs and Modi vows ‘swift’ justice for India exam leaks,https://www.ft.com/content/1e18ad77-8ef1-4ed8-891d-a43a901febf7?syn-25a6b1a6=1,"23 Jul 2026, 21:19"
Geopolitics,Financial Times World,US hits 60 countries with new duties as Donald Trump rebuilds tariff wall,Administration pins new measures on forced labour probe after Supreme Court struck down blanket levies,https://www.ft.com/content/078269b4-5518-4289-b90a-dd722fd7e703,"23 Jul 2026, 21:01"
Geopolitics,Financial Times World,China’s Xi pursues AI diplomacy to woo global south,Beijing makes most ambitious offer yet to build alternative global order,https://www.ft.com/content/fd3e703e-7ff7-4561-b039-54b280e4952d?syn-25a6b1a6=1,"23 Jul 2026, 21:00"
Strategic Signals,Financial Times World,Dangote secures record $2.5bn investment to expand Lagos refinery,"Billionaire Nigerian businessman is planning to grow capacity from about 650,000 barrels per day to 1.4mn b/d by 2028",https://www.ft.com/content/35b73caa-b173-480c-a00c-bfd5f820ce2d?syn-25a6b1a6=1,"23 Jul 2026, 20:45"
Energy & Infrastructure,Financial Times World,Oil hits $100 for first time since May while US stocks slide,Donald Trump warns US is weighing ‘massive attack’ on Iran as Middle East tensions ratchet higher,https://www.ft.com/content/3fd494d1-ee74-4c0f-9cd6-34e2283961df?syn-25a6b1a6=1,"23 Jul 2026, 20:05"
Energy & Infrastructure,Financial Times World,How Andy Burnham’s rise to PM was helped by those axed by Starmer,"List of people sacked or cast aside includes Louise Haigh, Lucy Powell and Anneliese Midgley, some of new premier’s most powerful allies",https://www.ft.com/content/f46bb42d-b61d-4932-a07b-09172b15509f?syn-25a6b1a6=1,"23 Jul 2026, 18:35"
Strategic Signals,Financial Times World,EU fines Google €890mn in test of Trump’s threats to protect Big Tech,EU competition chief says it is bloc’s ‘duty to defend rule of law’ while delivering ‘strong message’ to search giant,https://www.ft.com/content/c836e73b-66bb-4aa1-b85b-dd5b6eb89af0?syn-25a6b1a6=1,"23 Jul 2026, 17:58"
Strategic Signals,Financial Times Companies,"Chinese AI models will slash adoption costs, says Singapore’s GIC",Sovereign wealth fund expects strong growth in Chinese AI companies but is cautious about start-ups,https://www.ft.com/content/a8fee922-0b86-4716-bf16-42e81a57bb0b?syn-25a6b1a6=1,"23 Jul 2026, 21:00"
Geopolitics,Financial Times Companies,FDA panel supports access to peptides over scientist objections,Vote is first step in broadening public access to so-called Wolverine peptide despite warnings about risks,https://www.ft.com/content/a48eca75-6fb0-49ae-96f0-a256149a0f2e?syn-25a6b1a6=1,"23 Jul 2026, 20:12"
Strategic Signals,Financial Times Companies,US justice department to streamline company merger reviews,Change entails focusing on top competition concerns in a deal rather than expansive probes and fact-finding missions,https://www.ft.com/content/a5c66044-8999-48a5-b9cc-51341f177930?syn-25a6b1a6=1,"23 Jul 2026, 17:56"
Energy & Infrastructure,Financial Times Companies,North Sea oil and gas industry looks for answers from new energy secretary,Miatta Fahnbulleh’s visit to Aberdeen comes as companies hope to sway Burnham’s government on new drilling licences,https://www.ft.com/content/58a7b441-938c-4c05-9615-40ceaf17882b?syn-25a6b1a6=1,"23 Jul 2026, 17:49"
Policy & Regulation,The Hindu BusinessLine,Sonam Wangchuk ends hunger strike after Centre assures action on key demands,"A late-night meeting with Union Ministers JP Nadda and Jitendra Singh led to government assurances on protesters, exam reforms and the NEET paper leak issue",https://www.thehindubusinessline.com/news/sonam-wangchuk-ends-26-day-hunger-strike-after-negotiations/article71259649.ece,"24 Jul 2026, 02:14"
Strategic Signals,The Hindu BusinessLine,Google introduces selfie video verification for account recovery,The feature verifies users by matching a new selfie video with an encrypted reference recording and uses liveness detection to prevent spoofing,https://www.thehindubusinessline.com/info-tech/google-introduces-selfie-video-verification-for-account-recovery/article71259641.ece,"24 Jul 2026, 01:33"
Geopolitics,The Hindu BusinessLine,"Education Ministry reshuffle: Naresh Pal Gangwar named Higher Education Secretary, Vineet Joshi moved",The reshuffle also appoints Sushil Kumar Lohani to head the Animal Husbandry Department and T K Anil Kumar as School Education Secretary.,https://www.thehindubusinessline.com/news/education/education-ministry-reshuffle-naresh-pal-gangwar-named-higher-education-secretary-vineet-joshi-moved/article71259629.ece,"24 Jul 2026, 01:21"
Strategic Signals,The Hindu BusinessLine,"Weichai Group: 40 years in Vietnam, working together to create a new green and intelligent future","Weichai Group: 40 years in Vietnam, working together to create a new green and intelligent future",https://www.thehindubusinessline.com/brandhub/pr-release/weichai-group-40-years-in-vietnam-working-together-to-create-a-new-green-and-intelligent-future/article71259426.ece,"23 Jul 2026, 22:30"
Strategic Signals,The Hindu BusinessLine,"Flooding in South Gujarat disrupts rail traffic to Mumbai; 14 trains, including Vande Bharat and Shatabdi, cancelled","Flooding in South Gujarat forced Western Railway to suspend operations on a key rail bridge between Gholvad and Umargam Road, disrupting train services between Gujarat and Mumbai",https://www.thehindubusinessline.com/economy/logistics/flooding-in-south-gujarat-disrupts-rail-traffic-to-mumbai-14-trains-including-vande-bharat-and-shatabdi-cancelled/article71259363.ece,"23 Jul 2026, 22:24"
Energy & Infrastructure,The Hindu BusinessLine,Regular payments from Bangladesh help in reducing its dues to Adani Power,"Adani Power seeks to reduce ₹3,863 crore receivables from Bangladesh as monthly payments stabilise, enhancing liquidity.",https://www.thehindubusinessline.com/companies/adani-power-seeks-reduction-in-3863-cr-receivables-from-bangladesh-as-monthly-payments-continue/article71257383.ece,"23 Jul 2026, 22:22"
Strategic Signals,The Hindu BusinessLine,Ramco Systems Q1 revenue down 3% at $18.6 million,"Annual recurring revenue stood at $12.15 million while the unexecuted order book was at $152.3 million, the company said in an exchange filing",https://www.thehindubusinessline.com/companies/ramco-systems-q1-revenue-down-3-at-186-million/article71258651.ece,"23 Jul 2026, 22:19"
Markets & Macro,The Hindu BusinessLine,Primary market shows signs of revival even as uncertainty looms,"SEBI, in April, extended the one year validity of IPO observation letters expiring between April 1 and September 30 to uniformly until September-end",https://www.thehindubusinessline.com/markets/primary-market-shows-signs-of-revival-even-as-uncertainty-looms/article71257959.ece,"23 Jul 2026, 22:14"
Geopolitics,Times of India Business,US unveils fresh tariffs of up to 12.5% on 60 economies amid 'forced labour' probe; India gets lower 10% rate,,https://timesofindia.indiatimes.com/business/india-business/us-unveils-fresh-tariffs-of-up-to-12-5-on-60-economies-amid-forced-labour-probe-india-gets-lower-10-rate/articleshow/132591713.cms,"24 Jul 2026, 03:07"
Strategic Signals,Times of India Business,IndiGo offers crisis management plan to settle CCI probe into flight disruption case,IndiGo has proposed commitments to the Competition Commission of India. These proposals aim to address concerns over past flight disruptions and unfair practices. The airline will establish a crisis management group and a passenger grievance mechanism. IndiGo also offered to temporarily hand over ai,https://timesofindia.indiatimes.com/business/india-business/indigo-offers-crisis-management-plan-to-settle-cci-probe-into-flight-disruption-case/articleshow/132587625.cms,"23 Jul 2026, 22:24"
Energy & Infrastructure,Times of India Business,"US stocks today: Wall Street trades in red as oil tops $100 per barrel; Nasdaq tumbles over 2%, Dow slips over 600 points",Major stock markets opened lower as Big Tech's AI spending raised investor concerns. Alphabet and Tesla shares fell significantly after their latest quarterly earnings reports. Oil prices surged past one hundred dollars per barrel amid Middle East tensions. This geopolitical situation also increased,https://timesofindia.indiatimes.com/business/international-business/us-stocks-today-wall-street-trades-in-red-as-oil-tops-100-per-barrel-nasdaq-tumbles-over-2-dow-slips-over-600-points/articleshow/132586537.cms,"23 Jul 2026, 21:16"
Policy & Regulation,Times of India Business,Premium petrol to remain ethanol-free; no plan to blend beyond 20% as of now: Govt to Parliament,Premium petrol grades will continue to be ethanol-free for consumers. The government has no plans to reintroduce lower ethanol blends like E0 or E10. Current ethanol blending in regular petrol will remain at twenty percent. No widespread adverse impacts have been reported from E20 fuel usage. Future,https://timesofindia.indiatimes.com/business/india-business/premium-petrol-to-remain-ethanol-free-no-plan-to-blend-beyond-20-as-of-now-govt-to-parliament/articleshow/132586246.cms,"23 Jul 2026, 21:03"
Energy & Infrastructure,Times of India Business,Oil's $100 comeback: Brent hits a three-month high as Red Sea tensions escalate,"Crude oil prices surged past one hundred dollars per barrel amid Middle East tensions. Houthi attacks on Saudi oil tankers in the Red Sea caused market concern. This escalation has heightened fears over global energy supply safety and stability. Domestic crude futures also climbed significantly, mir",https://timesofindia.indiatimes.com/business/international-business/oils-100-comeback-brent-hits-a-three-month-high-as-red-sea-tensions-escalate/articleshow/132585678.cms,"23 Jul 2026, 20:36"
Geopolitics,Times of India Business,"Longer routes, higher costs, 26,000 cancellations: US-Iran conflict hits Indian airlines","Indian airlines have cancelled approximately 26,000 international flights due to Middle East airspace restrictions. These disruptions have led to flight diversions and delays, impacting airline operations significantly. Longer flight routes are increasing fuel consumption and raising overall operati",https://timesofindia.indiatimes.com/business/india-business/longer-routes-higher-costs-26000-cancellations-us-iran-conflict-hits-indian-airlines/articleshow/132579967.cms,"23 Jul 2026, 17:27"
Strategic Signals,Times of India Business,Will employees finally get paid faster after resignation? Understanding labour codes and full & final settlement,"For an employee, the last salary from the previous organisation is not just a payroll entry. It may be needed for rent, relocation expenses, family commitments, education fees, loan repayments or simply to manage the gap before the first salary from the new employer",https://timesofindia.indiatimes.com/business/india-business/will-employees-finally-get-paid-faster-after-resignation-understanding-labour-codes-and-full-final-settlement/articleshow/132579645.cms,"23 Jul 2026, 17:14"
Energy & Infrastructure,Times of India Business,India's first hydrogen-powered train clocks around 900 km in five days,"India's first hydrogen fuel cell train has covered 900 kilometers on its initial operational route. This new train runs on hydrogen fuel cells, producing only water vapor and heat. Passenger fares remain consistent with ordinary diesel services on this pilot project. The train operates on the Jind-S",https://timesofindia.indiatimes.com/business/india-business/indias-first-hydrogen-powered-train-clocks-around-900-km-in-five-days/articleshow/132578816.cms,"23 Jul 2026, 16:45"
Strategic Signals,Hindustan Times India,"Sonam Wangchuk ends hunger strike after 26 days; PM Modi, Abhijeet Dipke react",The development came after Prime Minister Narendra Modi announced that stricter action against paper leaks would be discussed at the Cabinet meeting on Friday.,https://www.hindustantimes.com/india-news/sonam-wangchuk-ends-hunger-strike-after-26-days-pm-modi-abhijeet-dipke-react-101784835485334.html,"24 Jul 2026, 01:40"
Strategic Signals,Hindustan Times India,Delhi HC notifies fast-track courts hours after PM Modi's announcement against paper leak cases,Delhi High Court has created a fast-track court led by Judge Anu Grover Baliga to hear paper leak and exam cheating cases swiftly. Check more details.,https://www.hindustantimes.com/india-news/delhi-high-court-notifies-fast-track-court-paper-leak-cases-pm-modi-vow-cjp-neet-protests-news-101784831698432.html,"24 Jul 2026, 00:20"
Policy & Regulation,Hindustan Times India,'More strict actions': PM Modi vows tougher measures against paper leaks in Friday's Cabinet meet,"In a post on X, PM Modi said that the government has already taken several strict measures since the leaks came to light.",https://www.hindustantimes.com/india-news/more-strict-actions-pm-modi-vows-tougher-measures-against-paper-leaks-in-fridays-cabinet-meet-cjp-protests-neet-101784831178831.html,"24 Jul 2026, 00:09"
Geopolitics,Hindustan Times India,'Baseless': India rejects Pakistan minister Ishaq Dar's remarks on Kashmir at ASEAN meet,External affairs ministry spokesperson Randhir Jaiswal said that India “categorically rejects the baseless and unwarranted comments” by Dar.,https://www.hindustantimes.com/india-news/baseless-india-rejects-pakistan-minister-ishaq-dars-remarks-on-kashmir-at-asean-meet-101784827031532.html,"23 Jul 2026, 22:52"
Strategic Signals,Hindustan Times India,Delhi school announces hybrid mode classes amid protests,The advisory comes amid heightened security arrangements across Central Delhi following recent protests .,https://www.hindustantimes.com/cities/delhi-news/delhi-rs-junior-modern-school-announces-hybrid-mode-classes-amid-protests-101784824425548.html,"23 Jul 2026, 22:31"
Strategic Signals,Hindustan Times India,'May invite legal action': Delhi University asks students to stay away from protest at Jantar Mantar,"The University of Delhi, in a social media post, urged students to prioritise their well-being and stay away from any unlawful gatherings.",https://www.hindustantimes.com/india-news/may-invite-legal-action-delhi-university-students-stay-away-cjp-protest-jantar-mantar-police-abhijeet-dipke-101784823301292.html,"23 Jul 2026, 22:30"
Strategic Signals,Hindustan Times India,Infosys to roll out salary hikes in two phases; most employees to get raises in October,The IT major said the majority salary increases for senior employees would be implemented in January.,https://www.hindustantimes.com/india-news/infosys-to-roll-out-salary-hikes-in-two-phases-most-employees-to-get-raises-in-october-101784809622810.html,"23 Jul 2026, 22:21"
Geopolitics,Hindustan Times India,480 Pak-based handles blocked: Delhi Police's big warning on 'fake news' amid student protests,Delhi Police blocks 480 Pakistan-based social media accounts for spreading misleading content during student protests.,https://www.hindustantimes.com/india-news/480-pak-handles-blocked-for-spreading-fake-news-delhi-police-amid-student-protests-101784824790639.html,"23 Jul 2026, 22:12"
Policy & Regulation,Indian Express Latest,‘Please talk to the children’: Physicswallah CEO appeals to government,,https://indianexpress.com/article/cities/delhi/please-talk-to-the-children-physicswallah-ceo-appeals-to-government-10800877/,"23 Jul 2026, 22:26"
Strategic Signals,Indian Express Latest,"Opposition MPs visit Gandhi Smriti, pay tribute to students who died by suicide over NEET leak",,https://indianexpress.com/article/india/opposition-mps-visit-gandhi-smriti-pay-tribute-to-students-who-died-by-suicide-over-neet-leak-10800838/,"23 Jul 2026, 21:08"
Strategic Signals,Indian Express Latest,"CJP seeks police nod for rally, extends support to SFI protest today",,https://indianexpress.com/article/cities/kolkata/cjp-seeks-police-nod-for-rally-extends-support-to-sfi-protest-today-10800836/,"23 Jul 2026, 21:05"
Strategic Signals,Indian Express Latest,"Vadodara gets drinking water relief as rain fills Ajwa Lake, schools to remain shut on Friday",,https://indianexpress.com/article/cities/ahmedabad/vadodara-gets-drinking-water-relief-as-rain-fills-ajwa-lake-schools-to-remain-shut-on-friday-10800832/,"23 Jul 2026, 21:02"
Strategic Signals,Indian Express Latest,"Ravindra Dhangekar, wife get anticipatory bail in businessman suicide case",,https://indianexpress.com/article/cities/pune/ravindra-dhangekar-wife-get-anticipatory-bail-in-businessman-suicide-case-10800806/,"23 Jul 2026, 21:01"
Strategic Signals,Indian Express Latest,"Sonam Wangchuk ends 26-day fast, cites ‘long negotiation’ on conditions, ‘possible violence’ in country",,https://indianexpress.com/article/india/sonam-wangchuk-ends-hunger-strike-after-26-days-in-presence-of-union-ministers-after-pms-announcement-10800743/,"23 Jul 2026, 19:31"
Strategic Signals,Indian Express Latest,Six inches of rain in 3 hours floods Ahmedabad; several rescued,,https://indianexpress.com/article/cities/ahmedabad/six-inches-of-rain-in-3-hours-floods-ahmedabad-several-rescued-10800758/,"23 Jul 2026, 19:12"
Strategic Signals,Indian Express Latest,"In midnight video message, PM promises tough new law for exam leaks",,https://indianexpress.com/article/india/pm-narendra-modi-promises-more-steps-to-address-exam-paper-leaks-after-cabinet-meeting-today-in-new-video-message-10800720/,"23 Jul 2026, 18:38"
Energy & Infrastructure,SCMP Asia,China’s Geely partners with Ford to revive Spain plant and deepen European EV drive,"Geely Auto, China’s second-largest carmaker, has struck a deal with Ford Motor to use the US company’s redundant capacity in Spain to build electric vehicles (EVs) amid its stepped-up push to expand globally. Multi-energy cars would be assembled at an idle factory in Almussafes, near Valencia, after",https://www.scmp.com/business/china-business/article/3361615/chinas-geely-partners-ford-revive-spain-plant-and-deepen-european-ev-drive?utm_source=rss_feed,"23 Jul 2026, 11:30"
Geopolitics,SCMP Asia,Path opened for Malaysian firms to pursue secondary share listings in Hong Kong,"Hong Kong is reaping rewards from a charm offensive with Malaysia as it works to enhance its attractiveness to global fundraising activities, with deals reached on Thursday during a visit to the Southeast Asian country by the city’s financial services secretary. Bursa Malaysia will become the 21st s",https://www.scmp.com/business/banking-finance/article/3361613/path-opened-malaysian-firms-pursue-secondary-share-listings-hong-kong?utm_source=rss_feed,"23 Jul 2026, 11:00"
Strategic Signals,SCMP Asia,HSBC summit turns future trends into wealth strategies,"[The content of this article has been produced by our advertising partner.] As AI breaks out of chatbots and into what is now called Physical AI, investors need to rethink how portfolios should be built, protected and put to work. Growth opportunities are being created across tech, mobility, consume",https://www.scmp.com/presented/business/topics/future-ready-wealth-strategies/article/3361194/hsbc-summit-turns-future-trends-wealth-strategies?utm_source=rss_feed,"23 Jul 2026, 09:45"
Markets & Macro,SCMP Asia,Zhongji sets highest subscription threshold in Hong Kong IPO history,"Zhongji Innolight, the largest IPO in Hong Kong in nearly seven years, has set the highest subscription threshold in the city’s history, dampening retail investors’ appetite, though institutional demand remains strong, with multiple oversubscriptions already placed, according to people familiar with",https://www.scmp.com/business/companies/article/3361586/zhongji-sets-highest-subscription-threshold-hong-kong-ipo-history?utm_source=rss_feed,"23 Jul 2026, 09:00"
Markets & Macro,SCMP Asia,AI trade keeps capital – and risks – flowing to emerging markets,"For the most dramatic change in a benchmark index in financial markets in recent years, look no further than the stock markets of developing economies. Just over a year ago, mainland China and India had a combined weight of 50 per cent in the MSCI Emerging Markets Index. Fast forward to today, and i",https://www.scmp.com/opinion/asia-opinion/article/3361547/ai-trade-keeps-capital-and-risks-flowing-emerging-markets?utm_source=rss_feed,"23 Jul 2026, 08:30"
Strategic Signals,SCMP Asia,"Alibaba unit says 5-in-1 AI gives robots unified brain, body and limbs","Alibaba Group Holding’s mapping unit has unveiled an upgrade to what it calls the world’s first technology framework that unites a robot’s “feet, hands, brains, central nerves and motor nerves” into a single system. Amap’s ABot system marks the latest move in Chinese tech players’ race to harness ar",https://www.scmp.com/tech/big-tech/article/3361564/alibaba-unit-says-5-1-ai-gives-robots-unified-brain-body-and-limbs?utm_source=rss_feed,"23 Jul 2026, 08:00"
Markets & Macro,SCMP Asia,Chinese funds cut Hong Kong stock holdings to 2-year low despite strong southbound flow,"Chinese mutual funds have reduced their Hong Kong stock holdings via the southbound Stock Connect to a more than two-year low in the second quarter, despite a lot of money moving southward over the same period. The share of Hong Kong stocks in their portfolios fell to 23.3 per cent in the second qua",https://www.scmp.com/business/banking-finance/article/3361561/chinese-funds-cut-hong-kong-stock-holdings-2-year-low-despite-strong-southbound-flow?utm_source=rss_feed,"23 Jul 2026, 06:01"
Markets & Macro,SCMP Asia,China’s star fund manager dumps long-held consumer bets in pivot to AI trade,"China’s tepid consumer spending prompted one of the country’s biggest fund managers to aggressively cut holdings in consumption-related stocks from liquor distillers to e-commerce platforms while rotating into artificial intelligence-linked names, abandoning years-long bets to align with the evolvin",https://www.scmp.com/business/china-business/article/3361544/chinas-star-fund-manager-dumps-long-held-consumer-bets-pivot-ai-trade?utm_source=rss_feed,"23 Jul 2026, 04:08"
Strategic Signals,Foreign Policy,Is Cuba Trump’s Next Target?,The regime in Havana is increasingly in the Trump administration’s crosshairs.,https://foreignpolicy.com/2026/07/23/cuba-trump-venezuela-iran-ukraine/,"23 Jul 2026, 22:06"
Geopolitics,Foreign Policy,How Iran Gained the Upper Hand,And what that means for Washington’s options to extract itself from this quagmire.,https://foreignpolicy.com/2026/07/23/iran-us-israel-war-hormuz-trump-options/,"23 Jul 2026, 22:02"
Geopolitics,Foreign Policy,Is the Red Sea the New Hormuz Crisis?,Houthi attacks on Saudi shipping risk adding a new front to the Iran war.,https://foreignpolicy.com/2026/07/23/houthi-rebels-saudi-arabia-shipping-red-sea-iran-war/,"23 Jul 2026, 21:30"
Geopolitics,Foreign Policy,China Is AI-Maxxing,Beijing may be closing the gap with Washington in the AI race.,https://foreignpolicy.com/2026/07/23/china-ai-race-moonshot-kimi-k3-alibaba-qwen-deepseek-openai-anthropic/,"23 Jul 2026, 20:12"
Strategic Signals,Foreign Policy,Odysseus at the End of Civilization,Nolan’s film confronts the betrayal of the West’s own values.,https://foreignpolicy.com/2026/07/23/odyssey-civilization-collapse-history/,"23 Jul 2026, 20:05"
Geopolitics,Foreign Policy,There’s Only One Way Out of Trump’s Reckless War,Pay off Iran to open Hormuz and freeze its nuclear program.,https://foreignpolicy.com/2026/07/23/iran-united-states-trump-hormuz-war-nuclear/,"23 Jul 2026, 17:09"
Strategic Signals,Foreign Policy,Xi’s Demands for Loyalty Are Breeding Corruption,Ma Xingrui’s fall shows how deep personnel problems run.,https://foreignpolicy.com/2026/07/23/china-corruption-ma-xingrui/,"23 Jul 2026, 16:55"
Strategic Signals,Foreign Policy,Trump Is Triggering a Middle East Nuclear Arms Race,His deal to provide nuclear technology to Saudi Arabia encourages weaponization.,https://foreignpolicy.com/2026/07/23/trump-us-saudi-nuclear-deal-weapons-iran-israel-arms-race/,"23 Jul 2026, 16:17"
Strategic Signals,The Diplomat,Nepali PM Balendra Shah’s Image as a Change Agent is at Risk,"Shah has shown less concern for the health and wellbeing of the poor, and is preoccupied with appearing as a ruthless executor of public plans.",https://thediplomat.com/2026/07/nepali-pm-balendra-shahs-image-as-a-change-agent-is-at-risk/,"23 Jul 2026, 22:42"
Strategic Signals,The Diplomat,"New Delhi’s Jantar Mantar Is Not Tahrir Square, But It Can Become One","At its heart, this movement is demanding accountability, not upheaval.",https://thediplomat.com/2026/07/new-delhis-jantar-mantar-is-not-tahrir-square-but-it-can-become-one/,"23 Jul 2026, 15:01"
Geopolitics,The Diplomat,Why China Is Investing in Planetary Defense,"For China, planetary defense is about building its international image and strengthening national security. However, the same factors also constrain China's global contribution.",https://thediplomat.com/2026/07/why-china-is-investing-in-planetary-defense/,"23 Jul 2026, 22:43"
Strategic Signals,The Diplomat,India and Japan’s Emerging Shipbuilding Partnership,The future of India-Japan security cooperation lies in shipyards – and maybe with the Mogami-class frigate.,https://thediplomat.com/2026/07/india-and-japans-emerging-shipbuilding-partnership/,"23 Jul 2026, 01:34"
