section,source,title,summary,link,published_at
Energy & Infrastructure,The Diplomat,Trump’s New AI Order Raises the Stakes in China-US Tech Competition,Advanced AI models are no longer treated simply as commercial products; they are increasingly regarded as strategic assets linked to national power.,https://thediplomat.com/2026/06/trumps-new-ai-order-raises-the-stakes-in-china-us-tech-competition/,"04 Jun 2026, 00:36"
Strategic Signals,The Diplomat,"Neutralizing Chokepoints: Lessons From the Hormuz Strait, Malacca, and Baltic Sea",Insights from Pekka Virkki.,https://thediplomat.com/2026/06/neutralizing-chokepoints-lessons-from-the-hormuz-strait-malacca-and-baltic-sea/,"03 Jun 2026, 22:56"
Energy & Infrastructure,The Diplomat,Bangladesh’s Twin Challenges: Economic Revival and Great Power Balancing,"Bangladesh’s security lies not in becoming part of someone else’s strategic rivalry, but in becoming economically strong, diplomatically flexible, and internally legitimate.",https://thediplomat.com/2026/06/bangladeshs-twin-challenges-economic-revival-and-great-power-balancing/,"03 Jun 2026, 20:08"
Geopolitics,The Diplomat,Can a Takaichi Government Stabilize China-Japan Relations?,What Abe's post-2014 rapprochement with Beijing can teach Tokyo today.,https://thediplomat.com/2026/06/can-a-takaichi-government-stabilize-china-japan-relations/,"03 Jun 2026, 22:44"
Markets & Macro,The Diplomat,EBRD Dials Down Kyrgyz GDP Forecast Over Sanctions Worries,"While still growing, Kyrgyzstan’s GDP may slow due to increasing weight of sanctions.",https://thediplomat.com/2026/06/ebrd-dials-down-kyrgyz-gdp-forecast-over-sanctions-worries/,"03 Jun 2026, 22:50"
Strategic Signals,The Diplomat,Exit Polls Suggest Ruling Democratic Party’s Victory in Local Elections,"Exit polls suggest the DP will win 11 of 16 regional posts, with Seoul and Busan producing the night’s most closely watched results.",https://thediplomat.com/2026/06/exit-polls-suggest-ruling-democratic-partys-victory-in-local-elections/,"03 Jun 2026, 22:14"
Markets & Macro,War on the Rocks,Forged in a Knife Fight: China’s Brutal Domestic AI Competition,"China’s plan to become a world leader in AI by 2030 is a fixture of practically every Congressional briefing and expert commentary on Beijing’s AI ambitions. The plan’s logic — introduced in 2017 — was simple and alarming: Beijing would direct capital, mobilize its firms, recruit talent, and execute",https://warontherocks.com/cogs-of-war/forged-in-a-knife-fight-chinas-brutal-domestic-ai-competition/,"04 Jun 2026, 08:00"
Strategic Signals,War on the Rocks,Revisiting The Importance of the Battle of Midway,"The Battle of Midway has assumed a place in American naval lore that has put it on par with other great battles in world naval history. What Salamis was for the Greeks, Trafalgar for the British Royal Navy, and Tsushima for the Japanese, the clash northwest of Midway Island on June 4, 1942, represen",https://warontherocks.com/revisiting-the-importance-of-the-battle-of-midway/,"04 Jun 2026, 07:30"
Geopolitics,War on the Rocks,"Wrong Audience, Wrong Ask: Why Trump’s Abraham Accords Gambit Falls on Deaf Ears",When President Donald Trump repeatedly pressed regional leaders on Abraham Accords expansion late last month — framing Arab-Israeli normalization as a debt owed and a condition for a settlement to end the Iran war — he apparently commented there had been silence on the other end of the line.Arab and,https://warontherocks.com/wrong-audience-wrong-ask-why-trumps-abraham-accords-gambit-falls-on-deaf-ears/,"04 Jun 2026, 07:15"
Geopolitics,War on the Rocks,Will China and the United States Pursue Strategic Stability?,"In 2024, Michael Swaine wrote, “How to Stop the United States and China from Sliding into War,” where he identified areas that could increase the possibility of an armed conflict between the United States and China. Two years later, after recent talks between President Trump and President Xi, we ask",https://warontherocks.com/will-china-and-the-united-states-pursue-strategic-stability/,"03 Jun 2026, 17:30"
Geopolitics,War on the Rocks,The Rain in Spain Falls Harder on Ukraine: Rethinking the Spanish Civil War Analogy,"In 2023, the NATO Baltic Defense College in Tartu, Estonia devoted its entire annual conference to the Interwar Period (1919 to 1939), a theme repeated at subsequent conferences sponsored by national militaries and academic societies throughout the United States and Europe. Western scholars and fore",https://warontherocks.com/the-rain-in-spain-falls-harder-on-ukraine-rethinking-the-spanish-civil-war-analogy/,"03 Jun 2026, 07:30"
Policy & Regulation,War on the Rocks,Does the Quad Still Matter?,"On May 26, India hosted a formal meeting of the foreign ministers of the Quad — comprising the United States, Australia, India, and Japan. Since its initial creation in 2007 and revival in 2017, foreign policy analysts have debated the usefulness of the organization, which was designed as a group of",https://warontherocks.com/does-the-quad-still-matter/,"02 Jun 2026, 18:00"
Policy & Regulation,War on the Rocks,Between Beijing and the Budget: The Domestic Realities of Taiwan’s Defense Spending Drama,"On May 8, Taiwan’s Legislative Yuan broke a grueling six-month stalemate by passing a landmark $25 billion defense budget, catching many observers off guard. The vote brought sudden end to an agonizing legislative deadlock that had pushed U.S.-Taiwanese relations to the edge. For months, long-simmer",https://warontherocks.com/between-beijing-and-the-budget-the-domestic-realities-of-taiwans-defense-spending-drama/,"02 Jun 2026, 07:30"
Geopolitics,War on the Rocks,The Toll Booth at the Throat of World Trade,"In late February 2026, Iran closed the Strait of Hormuz to foreign shipping. What began as a chaotic wartime closure has, in the past few days, hardened into something more consequential: an official sovereign toll regime, codified in Iranian law, and priced in cryptocurrency.On May 18, Iran operati",https://warontherocks.com/the-toll-booth-at-the-throat-of-world-trade/,"02 Jun 2026, 07:15"
Policy & Regulation,CSIS,The Bio-Pharma Industry and Society,"The Bio-Pharma Industry and Society Listing Summary Please join the CSIS Global Health Policy Center on March 17, from 10:00am – 11:30am, for an exploration of how private bio-pharmaceutical firms can better support the critically important societal goals of improved affordability, access, quality, ",https://www.csis.org/events/bio-pharma-industry-and-society,"03 Mar 2016, 20:36"
Policy & Regulation,CSIS,The FY2017 Defense Budget and Strategic Outlook,"The FY2017 Defense Budget and Strategic Outlook Listing Summary Please join the CSIS International Security Program for a half-day Defense360 conference on the recently released FY2017 defense budget request and strategic priorities. Drupal Admin Mon, 02/29/2016 - 13:48 Featured Image Image Contribu",https://www.csis.org/events/fy2017-defense-budget-and-strategic-outlook,"29 Feb 2016, 18:48"
Policy & Regulation,CSIS,2016 U.S.-Japan Security Seminar,"2016 U.S.-Japan Security Seminar Listing Summary Michael J. Green interviews JIIA President Yoshiji Nogami Drupal Admin Fri, 02/26/2016 - 12:54 Featured Image Image Contributors Michael J. Green Programs & Projects Japan Chair Parent Geopolitics and Foreign Policy Featured Image AdobeStock_179685887",https://www.csis.org/events/2016-us-japan-security-seminar,"26 Feb 2016, 17:54"
Energy & Infrastructure,CSIS,The Future of the Grid—A View from ARPA-E,"The Future of the Grid—A View from ARPA-E Listing Summary The CSIS Energy and National Security Program is pleased to invite you to a discussion with Ellen Williams, Director of ARPA-E, the Advanced Research Projects Agency-Energy. Drupal Admin Thu, 02/25/2016 - 14:15 Featured Image Image Contributo",https://www.csis.org/events/future-grid-view-arpa-e,"25 Feb 2016, 19:15"
Geopolitics,CSIS,"Statesmen's Forum: Wang Yi, Minister of Foreign Affairs, PRC","Statesmen's Forum: Wang Yi, Minister of Foreign Affairs, PRC Listing Summary Please watch the live webcast of a discussion on Chinese foreign policy and US-China Relations Drupal Admin Fri, 02/19/2016 - 17:13 Featured Image Image Contributors John J. Hamre Christopher K. Johnson Downloads Download T",https://www.csis.org/events/statesmens-forum-wang-yi-minister-foreign-affairs-prc,"19 Feb 2016, 22:13"
Geopolitics,CSIS,"China Reality Check: China's ""Internet Sovereignty"" Initiative: Origins and Consequences","China Reality Check: China's ""Internet Sovereignty"" Initiative: Origins and Consequences Listing Summary Please join us for a discussion on China’s initiative to promote Internet sovereignty as a key governing concept of the global Internet. Drupal Admin Tue, 02/16/2016 - 11:49 Featured Image Image ",https://www.csis.org/events/china-reality-check-chinas-internet-sovereignty-initiative-origins-and-consequences,"16 Feb 2016, 16:49"
Policy & Regulation,CSIS,"Statesmen's Forum: The Right Honourable Theresa May, MP, Home Secretary, United Kingdom","Statesmen's Forum: The Right Honourable Theresa May, MP, Home Secretary, United Kingdom Listing Summary Please join the CSIS International Security Program for a discussion with UK Home Secretary Theresa May on counter-terrorism policy. Drupal Admin Fri, 02/12/2016 - 16:08 Featured Image Image Contr",https://www.csis.org/events/statesmens-forum-right-honourable-theresa-may-mp-home-secretary-united-kingdom,"12 Feb 2016, 21:08"
Strategic Signals,CSIS,Strategic Opportunities in the Indo-Asia-Pacific with Admiral Harry B. Harris,"Strategic Opportunities in the Indo-Asia-Pacific with Admiral Harry B. Harris Listing Summary Please join us for a discussion with Admiral Harry B. Harris, Commander, U.S. Pacific Command, on the Strategic Opportunities in the Indo-Asia-Pacific. Drupal Admin Tue, 01/26/2016 - 11:20 Featured Image Im",https://www.csis.org/events/strategic-opportunities-indo-asia-pacific-admiral-harry-b-harris,"26 Jan 2016, 16:20"
Geopolitics,Al Jazeera,Video: US House of Representatives votes to block further war on Iran,Republican-led US House of Representatives passed a resolution to halt any further push of the war on Iran.,https://www.aljazeera.com/video/newsfeed/2026/6/4/video-us-house-of-representatives-votes-to-block-further-war-on-iran?traffic_source=rss,"04 Jun 2026, 08:38"
Strategic Signals,Al Jazeera,World Cup 2026: What are the key dates from the opening match to the final?,"From must-watch games to the grand finale, here's a list of all the important dates on the 2026 World Cup schedule.",https://www.aljazeera.com/sports/2026/6/4/world-cup-2026-what-are-the-key-dates-from-the-opening-match-to-the-final?traffic_source=rss,"04 Jun 2026, 08:38"
Geopolitics,Al Jazeera,China bans four New Zealand lawmakers over visit to Taiwan,China says the MPs' visit sends the 'wrong signals' to Taiwan's ruling party.,https://www.aljazeera.com/news/2026/6/4/china-bans-four-new-zealand-lawmakers-over-visit-to-taiwan?traffic_source=rss,"04 Jun 2026, 08:29"
Strategic Signals,Al Jazeera,Brunson scores 30 as Knicks upset Spurs in NBA Finals opener,"Led by Jalen Brunson, the New York Knicks steal a road win against the San Antonio Spurs in game one of the NBA Finals.",https://www.aljazeera.com/sports/2026/6/4/brunson-scores-30-as-knicks-upset-spurs-in-nba-finals-opener?traffic_source=rss,"04 Jun 2026, 08:12"
Strategic Signals,Al Jazeera,Sabalenka ‘mentally off track’ as French Open exit made her want to ‘quit’,World number one Aryna Sabalenka let a two-set lead slip in a French Open quarterfinal defeat by Diana Shnaider.,https://www.aljazeera.com/sports/2026/6/4/sabalenka-mentally-off-track-as-french-open-exit-made-her-want-to-quit?traffic_source=rss,"04 Jun 2026, 08:00"
Strategic Signals,Al Jazeera,How does football influence who we are?,How does football influence who we are?,https://www.aljazeera.com/video/doha-debates/2026/6/4/how-does-football-influence-who-we-are?traffic_source=rss,"04 Jun 2026, 07:47"
Geopolitics,Al Jazeera,Israel and Lebanon agree to conditional ceasefire,"Deal is made through US-brokered talks in Washington, DC, that did not include Hezbollah.",https://www.aljazeera.com/news/2026/6/4/israel-and-lebanon-agree-to-conditional-ceasefire?traffic_source=rss,"04 Jun 2026, 07:37"
Strategic Signals,Al Jazeera,Indonesia arrests officials in crackdown on corruption,Indonesia’s deputy minister for immigration affairs has been arrested after about 10 hours of questioning.,https://www.aljazeera.com/news/2026/6/4/indonesia-arrests-officials-in-crackdown-on-corruption?traffic_source=rss,"04 Jun 2026, 07:09"
Energy & Infrastructure,ETCFO Top Stories,"Price shock: How Middle East conflict has raised inflation risks, squeezed corporate margins","The prolonged conflict in the Middle East has emerged more as a price shock than a growth shock for India, with rising energy costs feeding into wholesale inflation and corporate margins while economic activity remains relatively resilient.",https://cfo.economictimes.indiatimes.com/news/economy/price-shock-how-middle-east-conflict-has-raised-inflation-risks-squeezed-corporate-margins/131495028,"04 Jun 2026, 08:07"
Strategic Signals,ETCFO Top Stories,"ICAI reinforces mandatory forensic audit, sustainability assurance norms in revised Code of Ethics","Updated framework reiterates applicability of forensic investigation, ESG assurance and social impact assessment standards, underscoring the profession's expanding assurance responsibilities.",https://cfo.economictimes.indiatimes.com/news/tax-legal-accounting/icai-enforces-forensic-audit-and-sustainability-assurance-standards-in-revised-code-of-ethics/131497125,"04 Jun 2026, 10:48"
Policy & Regulation,ETCFO Top Stories,"SEBI clears path for promoter-group cousin to serve as independent director, clarifies LODR eligibility norms",Informal guidance to Maithan Alloys says cousin of promoter-group member is not a 'relative' under LODR Regulations; clarification may influence board appointments across listed companies.,https://cfo.economictimes.indiatimes.com/news/governance-risk-compliance/sebi-allows-promoter-cousin-as-independent-director-amidst-governance-clarification/131475482,"03 Jun 2026, 09:43"
Strategic Signals,ETCFO Top Stories,"M3M targets Rs 28,000 crore in sales by FY27, plans to deliver one crore Sq Ft annually, Director Finance Wahaal says","Real estate major M3M is eyeing Rs 28,000 crore in sales by the end of FY27, up from Rs 19,000 to Rs 20,000 crore clocked annually over the last three years, said Yateesh Waahal, Director Finance and Legal at M3M India in an exclusive interview with ETCFO. Wahaal said that the group is backing the g",https://cfo.economictimes.indiatimes.com/news/strategy-operations/m3m-aims-for-rs-28000-crore-in-sales-by-fy27-with-major-expansion-plans/131441450,"02 Jun 2026, 06:11"
Strategic Signals,ETCFO Top Stories,ICAI proposes sustainability assurance framework to bring audit like rigour to ESG disclosures,"Exposure draft lays foundation for sustainability assurance standards, outlining requirements on evidence, independence, quality control and assurance reporting; comments invited till June 19.",https://cfo.economictimes.indiatimes.com/news/esg/icai-unveils-new-framework-for-sustainable-assurance-in-esg-reporting/131433587,"01 Jun 2026, 09:36"
Strategic Signals,ETCFO Top Stories,"MCA brings Social Stock Exchange instruments under CSR ambit, permits 10% allocation",Subscription to zero coupon zero principal instruments recognised as an eligible CSR activity; companies subscribing through the route get impact assessment exemption.,https://cfo.economictimes.indiatimes.com/news/policy/mca-allows-10-csr-fund-allocation-to-social-stock-exchange-instruments/131433921,"01 Jun 2026, 10:05"
Strategic Signals,ETCFO Top Stories,"At Big 4 firms, AI is starting to reshape the tax profession","Major accounting firms in India are embracing artificial intelligence for tax services. AI is automating routine tasks, research, and drafting, allowing consultants to focus on complex interpretations and client strategy. This shift is significantly increasing efficiency and changing traditional con",https://cfo.economictimes.indiatimes.com/news/tax-legal-accounting/at-big-4-firms-ai-is-starting-to-reshape-the-tax-profession/131433078,"01 Jun 2026, 08:42"
Markets & Macro,ETCFO Top Stories,"Corporate India posts 25% profit surge in Q4 FY26, but rising costs squeeze margins","Corporate India's March quarter net profit surged 25.3%, driven by non-operating factors, masking operating challenges like rising input costs that squeezed margins. While FY27 outlook is positive with infrastructure focus, risks include commodity inflation and geopolitical issues. Sector-specific p",https://cfo.economictimes.indiatimes.com/news/corporate-india-posts-25-profit-surge-in-q4-fy26-but-rising-costs-squeeze-margins/131432932,"01 Jun 2026, 08:32"
Markets & Macro,ETCFO Policy,RBI likely to hold rates as West Asia crisis impact on growth remains unclear: Bank of Baroda Report,"The Reserve Bank of India (RBI) is likely to maintain status quo on interest rates in its monetary policy announcement on Friday as the impact of the ongoing crisis in West Asia on economic growth remains difficult to assess, according to a report by Bank of Baroda.",https://cfo.economictimes.indiatimes.com/news/policy/rbi-likely-to-hold-rates-as-west-asia-crisis-impact-on-growth-remains-unclear-bank-of-baroda-report/131495433,"04 Jun 2026, 08:29"
Markets & Macro,ETCFO Policy,SBI chairman Shetty sees MPC’s repo rate pause ‘appropriate’ at this juncture: Report,"SBI Chairman CS Setty anticipates the Monetary Policy Committee will pause interest rates this week. This aligns with market expectations as economic growth and inflation dynamics support the decision. While a pause is expected now, some economists foresee rate hikes later. Investors await the RBI's",https://cfo.economictimes.indiatimes.com/news/policy/sbi-chairman-shetty-sees-mpcs-repo-rate-pause-appropriate-at-this-juncture-report/131478770,"03 Jun 2026, 13:23"
Markets & Macro,ETCFO Policy,"RBI to conduct Rs 50,000 cr 2-day variable rate repo auction on Jun 3","The Reserve Bank of India will conduct a two-day variable rate repo auction worth Rs 50,000 crore on June 3. This move aims to manage liquidity in the banking system. The auction will occur between 9:30 am and 10 am. Funds will be reversed on June 5.",https://cfo.economictimes.indiatimes.com/news/policy/rbi-to-conduct-rs-50000-cr-2-day-variable-rate-repo-auction-on-jun-3/131474612,"03 Jun 2026, 08:19"
Markets & Macro,ETCFO Policy,"Iran war puts RBI in razor-edge policy bind over inflation, growth and rupee","INDIA-ECONOMY-Iran war puts RBI in razor-edge policy bind over inflation, growth and rupee",https://cfo.economictimes.indiatimes.com/news/policy/iran-war-puts-rbi-in-razor-edge-policy-bind-over-inflation-growth-and-rupee/131474595,"03 Jun 2026, 08:18"
Geopolitics,ETCFO Policy,"SBI Chairman, Apple India MD among 29 members appointed to Board of Trade",The government has appointed 29 non-official members to the Board of Trade. This includes prominent figures like SBI Chairman CS Setty and Apple India MD Virat Bhatia. The board will discuss strategies to enhance manufacturing and exports. These industry leaders will help implement export hub events,https://cfo.economictimes.indiatimes.com/news/policy/sbi-chairman-apple-india-md-among-29-members-appointed-to-board-of-trade/131474478,"03 Jun 2026, 08:11"
Markets & Macro,ETCFO Policy,"RBI likely to pause repo rate at 5.25% in June policy, signal caution","The six-member Monetary Policy Committee, headed by Governor Sanjay Malhotra, will meet from June 3 to 5 and announce its decision on June 5. Economists expect the central bank to retain a neutral stance while using the policy statement to signal caution, with greater focus on inflation risks rather",https://cfo.economictimes.indiatimes.com/news/policy/rbi-expected-to-hold-repo-rate-at-525-amid-inflation-concerns/131453436,"02 Jun 2026, 08:24"
Policy & Regulation,ETCFO Policy,Localisation lens on 500 most-imported items: DPIIT analysing data; move aims to reduce country’s import bill,"The Indian government is scrutinizing over 500 imported products, including machinery, fertilizers, and electronics, to identify opportunities for domestic manufacturing and reduce reliance on foreign supply chains. This initiative aims to curb the country's import bill and bolster supply resilience",https://cfo.economictimes.indiatimes.com/news/policy/localisation-lens-on-500-most-imported-items-dpiit-analysing-data-move-aims-to-reduce-countrys-import-bill/131433030,"01 Jun 2026, 08:40"
